answers,creation_date,len,postid,question,ratio,raw,tags,title,uniq,words,probability
try window credenti manag this? store credenti window credenti manag one time powershel access programmat microsoft secur store credenti local instal credenti manag window machin store new credenti use powershel anoth store new password credenti manag &amp retriev store credenti get-storedcredenti unfortun isn’t lot document come credenti manag modul detail follow command,2019-12-28 09:54:56,183,59509807,autom administr task c# program need acquir credenti usernam password domain user requir right exampl administr want store login secur ask everi task want perform know multipl offici way ask credenti exampl powershel return usernam password plaintext securestr secur store kind login token allow stuff remot comput without abl recov password? look window equival kerbero ticket grant ticket - enter password ticket authent network without use password ticket expir time one workaround thought handl credenti window authent directli run sub-process differ user downsid make applic much complic like work within domain clarif variou administr interfac wmi powershel remot psexec prefer work comput even outsid target comput domain lifetim token least runtim program use save token disk reus multipl time day,0.18579234972677597,34,c# powershell windows-authentication,save window login without save password kerbero ticket,7,authentication|login|password|kerberos|credential|username|security,0.7143361568450928
whether email otherwis either enter cred plain text script realli ill-advis approach store secur file better option call need ton exampl thought process web forum well exampl quickli secur store credenti – powershel https://www.jaapbrasser.com/quickly-and-securely-storing-your-credentials-powershel store powershel credenti json https://jdhitsolutions.com/blog/powershell/5396/storing-powershell-credentials-in-json secur store credenti disk http://powershellcookbook.com/recipe/puko/securely-store-credentials-on-disk common question thu post request consid duplic use powershel credenti without prompt password pass credenti send-mailmessag command send email,2018-06-09 18:40:33.543 UTC,104,50777442,1 store credenti script - prompt credenti 2 last two line bottom params? get error - think pass credenti correctli send-mailmessag remot name resolv system.net.mail.smtpcli line:21 char:1 + send-mailmessag @smtpmessag blockquot,0.19230769230769232,20,powershell powershell-2.0 sendmail smtp,power shell script smtp email issu,4,scripting|credential|security|password,0.7141584753990173
build object usernam password pass paramet,2018-04-25 21:10:31.85 UTC,43,50031398,invok command method use powershel need know input credenti script exampl moment need add credenti one need wont ask type credenti take script look someth context tri say name usernam exist current context,0.20930232558139536,9,c# powershell,invoke-command credenti,4,credential|scripting|username|password,0.7140728831291199
top head mayb do. check paramet decid prompt cred save option,2015-08-18 09:28:00.403 UTC,74,32068547,script read statist vcenter server connect vcenter issu connect-viserv cmdlet within script cmdlet accept either -user -password -credential.th connect-viserv cmdlet allow -savecredenti paramet exact behavior script accept -user &amp -password pscredenti object none specifi prompt usernam password -savecredenti specifi save specifi credenti local credenti store idea code snippet realli appreciated! cheer ernst,0.24324324324324326,18,credentials powershell security,powershel param accept either usernam password credenti object,5,credential|security|username|password|scripting,0.7120300531387329
realli sure ask document authent bridg new power cloud authent still keep password on-premi secur valid user password on-premi activ directori without need extra on-premi infrastructur adf azur activ directori azur ad pass-through authent allow user sign on-premi cloud-ba applic password featur provid user better experi - one less password rememb reduc helpdesk cost user less forget sign user sign azur ad featur valid user password directli on-premi activ directori user type user name password offic 365 portal https://portal.office.com offic 365 servic encrypt public key put queue valid one lightweight agent make outbound call network retriev user name password decrypt password organization’ privat key valid local ad local ad send back result success failur goe back azur portal via agent user authent noth standard window kerbero auth request redirect requir test normal window auth note pta commun channel auth type basic integr kerbero kerberosrequir etc target valid specif auth type target configur pta auth type note configur target microsoft pta video user sign-in azur activ directori pass-through authenticat ion azur activ directori pass-through authentication? azur activ directori azur ad pass-through authent allow user sign on-premi cloud-ba applic password featur provid user better experi - one less password rememb reduc helpdesk cost user less forget sign user sign azur ad featur valid user password directli on-premi activ directori,2020-03-02 17:15:48,241,60493669,need test pass authent connect new websit powershel code creat websit test user connect gui,0.1908713692946058,46,powershell iis,test pass authent connect new websit powershel,13,authentication|password|security|validate|signing|forge|user name|encrypt|crypt|public key|private key|kerberos|integrity,0.7098099589347839
pretti solut job decrypt given password compar,2015-04-07 10:06:40.537 UTC,76,29488972,encrypt password store .ps1 script set script new environ user manual configur password begin script switch paramet user run script give user requir hash howev prompt input password twice make sure typo - - cannot password hash match demonstr manual enter powershel twice row differ result enter exact password without paramet prompt user password twice make sure match if/when match output password hash,0.2631578947368421,20,powershell securestring,consecut securestr hash match,6,security|hash|encrypt|crypt|password|scripting,0.7095732092857361
seem selfsignedcertif issu delet old winrm listen winrm delet winrm/config/listener?address=*+transport=http creat new-selfsignedcertif domain name 1.new-selfsignedcertif -dnsname -certstoreloc cert:\localmachine\mi updat selfsignedcertif _thumbprint 2.winrm creat winrm/config/listener?address=*+transport=http @{hostname= certificatethumbprint= 3.add new firewal rule $port=5986netsh advfirewal firewal add rule name=window remot manag https-in dir=in action=allow protocol=tcp localport=$port pleas refer link http://www.visualstudiogeeks.com/devops/how-to-configure-winrm-for-https-manu,2017-04-24 17:54:31.04 UTC,113,43594768,work use hostnam server ip local remot machin domain ps c:\windows\system32> new-pssess -computernam servernam new-pssess [servername] connect remot server servernam fail follow error messag winrm cannot process request follow error occur use kerbero authent cannot find comput servernam verifi comput exist network name provid spell correctli inform see about_remote_troubleshoot help topic tri ping rdp success use server hostnam idea go wrong,0.1415929203539823,16,powershell winrm,powershel remot winrm,6,kerberos|authentication|signing|certificate|transport|firewall,0.7092491388320923
try command login non-interact make sure user account mfa-en,2019-09-10 12:13:35,47,57870573,want run command connect-msolservic powershel without user interact take window authent save password extern text file authent want authent current log window server credenti authenticate.i possibl powershel,0.19148936170212766,9,azure-powershell c# powershell,run connect-msolservic without user-interact take window authent powershel,5,authentication|password|credential|login|user account,0.7088695764541626
cmdlet activ directori modul support pass valu domain control want queri default call valid domain queri check domain current machin option provid doc valu activ directori domain servic want execut queri provid paramet pscredenti object contain login domain requir current login powershel session author authent domain exampl script look someth,2019-08-03 21:27:58.937 UTC,76,57342225,script give distinguish name group spreadsheet issu group locat anoth domain point script domain? issu know log domain run cant,0.13157894736842105,10,active-directory powershell,run script anoth domain,6,scripting|validate|credential|login|authorise|authentication,0.7086341977119446
yes recreat securestr string encrypt de-crypt comput user account encrypt default work around paramet help folk pdq creat aes key creat new securestr object creat pscredenti object anoth comput user anyon get file abl decrypt securestr object mind access,2017-09-01 19:15:38.74 UTC,103,46006674,vm full access access account question run machin differ user account logon run follow powershel gener string output run follow output good logon run follow differ user sinc key provid encrypt question access logon account decrypt secur string? reason mani vm key store registri local administ account remot domain account,0.17475728155339806,18,encryption powershell,convertto-securestr run without key differ user account proper credenti work differ user,6,encrypt|crypt|security|user account|credential|aes,0.7076510787010193
short answer audit failur eventid 4625 error log domain control long answer try log nonsens usernam non domain usernam ex comput log treat local user i.e match current comput domain henc know properli authent pass credenti sent receiv comput see username/password match anyth know fail log audit failur machin tri connect try log domain usernam machin know domain try authent user domain control password wrong fail domain control log audit failur messag log usernam tri authent well client address local machin tri attempt connect littl complic one domain control go one machin current connect inform execut command prompt,2016-01-15 18:30:36.073 UTC,164,34817499,previou question figur login pc.while domain differ comput remot anoth pc attempt fail login follow error [which believ want] howev login pc tri fail login anyth event viewer log show fail login suggest event viewer log read powershel fail login? time event viewer show audit failur actual manual try fail login usernam password remot login,0.16463414634146342,27,event-log login powershell,powershel access deni show audit failur event viewer,6,login|audit|username|password|authentication|credential,0.7069984674453735
see anyth obvious wrong code guess exampl use mention need sever place check realli store secur string fail check use follow prove credenti work persist disk one option pass around credenti rather file securestr use type return call get-credenti store variabl temporarili add call method ensur password decrypt correctli follow show usernam password unencrypt hope help,2013-05-07 11:37:32.78 UTC,78,16418029,need store credenti powershel use sever time stackoverflow lot exampl took one unfortun error find solut,0.16666666666666666,13,credentials powershell,powershel credenti reject server,6,credential|security|password|crypt|username|encrypt,0.705842137336731
script go distribut onto number machin across network everi credenti script go access user around two thing privat per-us data creat new user account databas everi user program restrict permiss allow thing want noth proxi server authent connect databas name websit work data public read-onli either creat user account databas read-onli access credenti distribut copi program proxi server authent user connect databas instead expos public number 2 everi one option gener recommend everi databas secur histori mysql number 1 option recommend databas couchdb never distribut credenti program want user use powershel librari http://lunaticexperiments.wordpress.com/2009/10/23/powershell-string-encryption-and-gpg/ encrypt oracl informix password exampl,2011-03-15 14:39:20.117 UTC,148,5313373,powershel script connect mysql databas - cours connect need password encrypt password oppos store password plain text look securestr method output password file howev think work encrypt password decrypt origin user script go distribut onto number machin across network suggest method useful? thank,0.19594594594594594,29,encryption passwords powershell security,encrypt powershel password,8,encrypt|crypt|password|security|scripting|credential|user account|authentication,0.7048438191413879
fulli tri want address point credenti powershel store credenti encrypt xml file read back file usabl form issu seem decrypt impli think anyon success read decrypt credenti actual case credenti encrypt use key base user comput encrypt user abl read readabl user anoth comput actual fine script alway run user comput break got multipl comput creat encrypt string key suppli use back squar one need store key somewher want try approach look store password disk powershel machine-key encrypt try credenti manag still pre-popul everi machin go well gener store credenti file machin run break workflow bit clearli easier figur safe store credenti,2015-01-12 15:17:03.803 UTC,174,27905195,got script server run everi user comput issu actual got username/password encrypt need get credenti without prompt administr user access sql server usernam password hardcod script usernam activ user string command batch file first part done littl experi safe solut automat entir task.i use cmdlet fetch inform tabl credenti one admin user encrypt password decrypt need use credenti without store .txt code,0.21264367816091953,37,powershell scripting security,script run admin credenti activ user usernam,8,scripting|security|credential|username|password|encrypt|crypt|safe,0.6997876167297363
get-help set-itemproperti -detail -credenti specifi user account permiss perform action default current user type user name user01 domain01\user01 enter pscredenti object one gener get-credentia l cmdlet type user name prompt password paramet support provid instal window powershel get-psprovid | ft -autos filesystem provid credenti capabl sinc ps 3.0 see registri provid support credenti paramet custom provid set-itemproperti univers command potenti add credenti support connect remot comput want achiev goal ps remot wmi remot registri powershel modul jerri lai suggest solut creat reg file desir hklm chang start-process -credenti paramet execut reg.ex,2015-07-20 07:48:21.32 UTC,123,31511230,tri set-itemproperti hklm registri use altern admin credenti get error provid support credenti run script standard end user write access hklm valu want edit,0.12195121951219512,15,powershell registry,powershel edit hklm registri altern credenti,5,credential|scripting|user account|user name|password,0.6997208595275879
none,2020-04-21 10:53:19,84,61341813,comeup powershel script disabl rc4 kerbero encrypt type window 2012 r2 assum similar window 2016 2019 window 2012 r2 check approach1 enabl follow select aes_128_hmac_sha1 aes256_hmac_sha1 futur encrypt type registri someth similar approach2 hexadecim valu 7ffffff8 2147483640 approach3 accord articl microsoft say supportedencryptiontyp disabl rc4 encrypt type approach take take approach1 chang valu select aes_128_hmac_sha1 seem reflect valu registri valu specifi approach2 approach3 follow approach1 write shell script shown seem enabl script,0.23809523809523808,20,windows powershell encryption,disabl rc4 kerbero encrypt type window 2012 r2,6,encrypt|rc4|kerberos|scripting|aes|hmac,0.6991313695907593
solv help follow link site.i decrypt password correctli plink read it… thank prikryl origin attempt connect made wasn’t realli authent correctli wasn’t evident… session hung powershel - decod system.security.securestr readabl password c:\tools\plink.ex -ssh john@192.168.2.100 -w system.security.securestr -t echo -e system.security.securestr | sudo du -ash /opt/* | sort -rh | head -n 20 cannot ever work plink see liter string plink system.security.securestr password real password actual nonsens cannot powershel mask password make sens pass real password plink mask password least specifi command-lin actual xy question,2018-09-21 04:33:41.347 UTC,170,52436648,tri powershel order abl mask password run plink command remot linux machin give top 20 directori /opt. connect password properli mask resultswrite-output show assembl command string correct. appear hang return result write-output result differ plink actual sends? copi write-output cmd prompt directli run work well still request password second time sudo work return expect results. get requir second password sudo definit big win need figur return result note use multipl argument found easier assembl,0.1588235294117647,27,plink powershell securestring sudo,powershel script pass securestr plink account sudo password,7,security|scripting|password|crypt|authentication|decode|ssh,0.6984075307846069
good go store anyth kept secur script easiest assign object return variabl retriev usernam retriev secur password object use powershel command need decod made un-secur sent process cannot accept secur password object retriev password plain-text method script add start script submit username/password form,2017-03-28 12:26:56.187 UTC,95,43069557,log someth enter usernam page1 password page2 click submit page3 make easier wrote ps script doubl check hard-cod password success want hard-cod password use ad read invalid password run script want know pass usernam password specif page appreci advic help right direct toward goal,0.2736842105263158,26,powershell,powershel - mask line secur string caus,7,security|username|password|scripting|validate|signing|decode,0.6947515606880188
try this...i connect openldap instanc work well work ad fit need need updat $basedn variabl host/usernam one credit goe http://mikemstech.blogspot.com/2013/03/searching-non-microsoft-ldap.html,2014-08-27 01:35:28.953 UTC,91,25517631,tri connect independ ldap store adam - activ directori applic mode use specif credenti bind troubl work best exampl hope work tri result tri variat filter etc document find assum connect ldap within directory/am connect correct user queri familiar python ldap modul pointer approach this? definit connect via variou ldap client need explicitli specifi authent sure littl inform queri outsid domain,0.12087912087912088,11,active-directory ldap powershell,bind differ activ directori ldap instanc powershel,4,ldap|credential|authentication|username,0.6937584280967712
"tri -credenti parameter? filter paramet instead where-object get secur event where-object get event log perform filter gwmi win32_ntlogev -filter logfile= secur -comput comp1,comp2 -credenti domain\us .net directli instead go wmi scriptblock give first entri secur log",2009-05-15 20:10:04.847 UTC,108,870648,build script read secur log sever comput read secur log local machin problem use get-eventlog command problem run remot machin script powershel v1 command never return result although logfil work perfectli gwmi -class win32_ntlogev | {$_.logfil -eq security} done research seem imperson issu -imperson option get-wmiobject seem implement anyway around problem? solut run get-eventlog remot machin somehow deal imperson issu secur log accessed.thank,0.12962962962962962,14,powershell security wmi,use powershel wmi read secur log,3,security|scripting|credential,0.6932507753372192
rahul gave answer let avoid password prompt altogeth risk enter user password clear text anoth option allow user fill password popup box save never need re-ent popup prompt usernam password save result file either read variabl combin two command save credenti file password secur encrypt use current logged-on user login credenti yes provid password open,2014-03-31 14:29:03.2 UTC,105,22764288,write project run powershel script creat new pssession follow run open dialog prompt user password howev prefer user abl enter password along rest line instead bother prompt new powershel everyth found doc give way bring prompt password someth possibl accomplish powershell? thank,0.1619047619047619,17,powershell windows,window powershel give password command enter-pssess,7,password|scripting|username|credential|security|encrypt|login,0.6899204850196838
cowork help realiz object tri convert password back plaintext remov modifi email sent successfully! function script,2017-04-04 17:04:55.913 UTC,92,43213462,tri test send email want plaintext password script work work follow advic stackoverflow thread script run without prompt credenti enter plaintext run schedul task secur password creat run replac $smtppassword entri suggest entri email send anymor follow error send-mailmessag smtp server requir secur connect client authent server respons 5.7.57 smtp client authent send anonym mail mail tips? run email script schedul task want password save plaintext,0.18478260869565216,17,credentials powershell smtp,send email via powershel use secur password,5,credential|security|password|scripting|authentication,0.6898929476737976
move comment op thing keep mind savecr thing realli danger depend use note al pass account name never prompt mean anyon even simplest skill walk take machin even delet shortcut start cred alway live creat shortcut properti race henc though savecr realli conveni limit machin absolut control person use exampl anyway cred credman without use runa /savecr yes even powershel mani script onlin show even one directli technet powershel galleri ms powershellgallery.com add credenti window vault powershel powershel script show add credenti specif user download addwindowscredential.zip credentialmanag 2.0 powershellgallery.com via powershel session see manipul credenti window 8/2012 passwordvault use powershel modul demonstr new window 8/2012 passwordvault api powershel download passwordvault.psm1 built-in cmdkey.ex creat list delet store user name password credenti need run user context ms sysintern psexec provid creat scheduledtask runonc / startup fire command ok digress all-in-al way kiosk mode window ms document kiosk mode time say os target - similar articl exit win 10 single-app kiosk provid direct instruct mode powershel snippet step sure read entir document kiosk use window powershel app type uwp os edit window 10 pro ent edu account type local standard user follow powershel cmdlet assign access multipl devic run cmdlet log administr creat user account assign access log assign access user account instal univers window app follow assign access/abov lock guidelin log assign access user account log administr open powershel window 10 search powershel find window powershel desktop app result run powershel administr note assign access use -appnam user account specifi assign access must log least learn aumid learn appnam see paramet,2019-05-13 09:25:55.593 UTC,301,56109401,tri creat shortcut take credenti credenti manag work fine one problem first time run script promt password want never prompt password store credenti manag use mayb script done? thank,0.11960132890365449,36,admin passwords powershell runas windows,make window runas.ex take password credenti manag prompt,8,password|credential|scripting|danger|user name|nonce|signing|user account,0.6892874836921692
seem possibl design sourc 1 sourc 2 sourc 3 imposs remot connect user download stuff internet appear speak window updat mani option connect use psexec tool run wuauclt /detectnow /updatenow use window 10 /server 2016 tool replac usoclient.ex effect,2019-09-10 13:34:36,116,57871988,tri instal window secur patch remot machin use powershel remoting.thi function use updat window run function local host function success instal window secur patch script remot run script get error setup loaclhost remot machin remot abl execut script remot enabl wmi remot machine.what set do? use schedul task use follow script start schedul task copi script target machin path $env:allusersprofil schedul task noth happening.what wrong,0.08620689655172414,10,powershell powershell-remoting windows-security windows-update,updat window secur remot use powershel schedul task,3,security|scripting|signing,0.6881904602050781
add credenti object cmdlet nativ passthrough current log user exampl connect-msolonlin -credenti get-credenti,2016-09-29 00:24:10.5 UTC,29,39759537,error tri command connect-msolservic user tri login global admin,0.20689655172413793,6,azure powershell,error use connect-msolservic usernam password,4,username|password|login|credential,0.6861863732337952
think answer look dave wyatt blog post use secur string credenti . ad -asplaintext switch convertfrom-securestr command case want plain text back two way know map drive plain text credenti run script account permiss network locat authent password,2016-03-23 20:09:34.827 UTC,111,36187792,need map drive encod pw need connect dmz drive use follow code map drive eye catch first variabl - string pw need decod normal string otherwis type mismatch problem need password plain text password mine encod key plain text question possibl encrypt password even better secur string map network drive way? realli want plain text first want map sinc script must work ps 2.0 paramet exist,0.17117117117117117,19,powershell,map networkdr ps 2.0 encod credenti,9,encode|credential|dmz|decode|password|encrypt|security|scripting|authentication,0.6861646175384521
revis version script without loop issu,2012-07-19 18:33:32.16 UTC,68,11567165,goal creat singl object powershel show ad display name password expir date non-dis users.thi rel easi howev date retriev unread format convert date creat two variabl contain data want working.th problem try combin two variabl singl object two header expect two column empti use powershel v2 win 7 pro sp1 idea issu,0.058823529411764705,4,passwords powershell,powershel - password expir non disabl user ad,2,password|scripting,0.6795958876609802
