answers,creation_date,len,postid,question,ratio,raw,tags,title,uniq,words,probability
take securestr see work password secur string credenti window powershel creat securestr powershel need,2013-05-15 08:48:11.263 UTC,35,16560605,creat sql login sql server 2008r2 pass encrypt password? use follow code,0.3142857142857143,11,powershell sql-server,creat new sql login pass encrypt password,5,login|encrypt|password|security|credential,0.5458733439445496
without powershel window data protect api dpapi encrypt/decrypt string mean work user comput key/securekey advanc encrypt standard aes encrypt algorithm use abl store credenti machin user long know aes key use info topic exampl code note secur obscur good practic store key comput encrypt password much secur plain text passwords! powershel wrong solut fix give read/writ access folder registri key qb2017 need access still issu creat shim use microsoft applic compat toolkit https://deployhappiness.com/fixing-applications-that-require-administrator-right,2017-10-03 14:35:58.7 UTC,115,46547174,use follow creat password file call file goal abl run qb2017 admin priv without give user admin priv issu gener password file user follow error user tri one gener anoth user method without gener key per user,0.1565217391304348,18,powershell windows-10,convertfrom-securestr convertto-securestr user,7,security|password|protect|encrypt|crypt|aes|credential,0.5455917119979858
person fail see make function modul need import send-mailmessag cmdlet..thi make thing lot harder kind look switch emailaddress insid function anyway thing go wrong creat credenti split usernam secur password send paramet function recombin credenti object skip modul function simpli make script far readable/maintain found two issu code unescap $ password ad -nonewlin set-cont began work creat encrypt file retriev password credenti sourc issu implement @theo suggest send-mailmessag,2020-03-19 20:07:00,115,60764311,store encrypt password script send email keed error send-mailmessag smtp server requir secur connect client authent server respon 5.7.57 smtp client authent send anonym mail mail [dm6pr66666019.namprd456.prod.outlook.com] follow code creat text file follow import password sendmail function code call function,0.16521739130434782,19,powershell sendmail,encrypt password send mail fail,7,encrypt|password|scripting|security|authentication|credential|username,0.5447549819946289
,2019-07-17 11:30:25.763 UTC,87,57074817,want store eap credenti window registri user put manual reason want autom specif eap configur locat lan access specif domain concaten usernam built simpl gui option user put specif credenti rest work handl script etc alreadi found registri path eap credenti lan wireless lan know data encrypt via dpapi .regard found manual powershel problem know correct format data encrypt someon solv problem anoth question inform peap profil connect without manual enter usernam password someon done someth similar,0.12643678160919541,11,powershell registry,format eap credenti encrypt store registri via powershel,5,credential|encrypt|username|scripting|password,0.5446357727050781
trust deleg permiss store attribut ad bit field mean valu indic sever flag full list ad queri littl tricki requir bitwis comparison see specif flag turn ad allow match rule oid call ldap queri code find comput trust deleg permiss look someth,2019-07-17 16:28:44.83 UTC,77,57080498,tri find server abl find server use see secur polici properti go view filter secur polici properties? btw reason use activ directori modul avail import,0.12987012987012986,10,active-directory penetration-testing powershell sysadmin windows,queri secur polici adsisearch powershel,6,penetration-test|security|availability|trust|delegation|ldap,0.544461190700531
follow creat encrypt string save output file read later convert securestr usabl text,2012-05-21 13:51:49.983 UTC,31,10686578,work but. anyway credenti store? embed cred script clear text,0.16129032258064516,5,powershell vmware,vmware powershel script - autom gmail,4,scripting|credential|encrypt|security,0.543029248714447
check password actual user need enabl allow logon,2020-02-12 08:54:09,73,60184439,mess around basic creat bulk user script made 3 dummi account differ inform securestr password account thing check actual implement passwords? current activ directori user creat black arrow mark icon understand either enabl account password login dummi account test actual ad password? sorri total beginn still learn henc certain doubt im vm win server 2019 practic,0.1232876712328767,9,powershell shell active-directory,powershel question check password implement clarif,4,password|scripting|security|login,0.5427658557891846
whenev run ad group cmdlet logged-in credenti queri activ directori say need domain join comput log ad user permiss queri workgroup comput need authent ad differ user need provid credenti ps cmdlet get-adgroupmemb -ceedenti paramet paramet allow specifi usernam password authent show dialog prompt credenti specifi credenti -credenti $cred,2020-03-25 10:54:55,87,60847372,want export user larg groups.th group fill group member group user trust extern domain run script give error error oper request perform user authent domain request authentication.how achiev script? thank,0.16091954022988506,14,powershell group-membership,powershel export group member extern domain,6,trust|scripting|authentication|credential|username|password,0.5406324863433838
look thing found trick it. refer decrypt powershel secur string password use subscript credenti current creat context use creat instanti password - commandlet help,2013-01-28 18:22:37.093 UTC,100,14568566,option authent powershel azur manag cmdlet ? look need administr user name password explicitli pass wherea need know context context creat use cmdlet manual creat object type pass plain text password wonder way authent manag cmdlet without passing/prompt admin user name password? look someth line publish set certif import deploy server background - look autom sql azur server databas creation use powershel tri without prompt/pass admin password,0.16,16,azure azure-powershell azure-sql-database powershell,credenti powershel azur manag cmdlet,8,credential|authentication|user name|password|certificate|crypt|security|scripting,0.5394340753555298
yes suppress credenti request window creat credenti object run cmdlets/scripts/funct need cours secur consider use store credenti exampl solut sourc way work powershel credenti creat window powershel script accept credenti note usernam need differ formatsdomain\us user@domain.com etc...in situat singl quot import enter password script certain characterslik $ { caus problem doubl quot use,2014-11-20 14:30:41.89 UTC,79,27042064,"run start-job -credenti paramet consol window appear without suppli -credenti consol window suppress consol window use start-job -credential? thanks,donald",0.189873417721519,15,powershell,suppress consol window run start-job -credenti,5,credential|scripting|security|username|password,0.534745991230011
gener decrypt password incorrectli,2018-01-03 18:57:36.65 UTC,36,48083510,script powershel call securetext.ps1 prompt user password convert gibberish password secur securedtext.ps1 try convert plain text command expect password back back gibberish password gibberish,0.3333333333333333,12,powershell,get password secur text file plain text,4,password|security|scripting|crypt,0.5346335768699646
except default credenti current applic domain powershel run least illustr creat persist usernam password alway bummer believ offer plaintext constructor properti read,2012-03-28 18:15:53.597 UTC,42,9913369,possibl convert networkcredenti variant pscredential? want transpar credenti current user want prompt,0.2619047619047619,11,authentication c# networkcredentials powershell security,convert networkcredenti pscredenti,5,authentication|credential|security|username|password,0.5323306918144226
check script technet galleri set-autologon.ps1 initi reboot want login inform user log workstat next boot note store usernam password plaintext within registri shortcom script function work within window script work set three registri key properti specif valu 4 technic case probabl want chang default number login 1 manual without creat miss follow properti string string string dword said note password store plaintext said automat logon time comput reboot decrement 1 exampl 5 count 5 properti reach zero wipe registri back 0,2019-12-27 14:51:56,127,59502407,wonder possibl somewhat new powershel script pretti much made script everi process setup look put togeth make autom right look see possibl automat sign provid password securestr store password domain user account differ last sign possibl point right direct understand thank,0.13385826771653545,17,authentication powershell,automat logon restart,8,authentication|scripting|signing|password|security|user account|login|username,0.532190203666687
script system awar key use encrypt password key differ system gener aes key cmdlet differ system find detail use key,2017-12-19 21:52:34.3 UTC,76,47895719,write powershel script autom ad system domain issu encrypt password use step provid link step work system gener encrypt password https://gallery.technet.microsoft.com/scriptcenter/encrypt-password-and-use-dd07f253 keep get error - convertto-str key valid specifi state use user account add domain built credenti initi believ comput reject credenti sid chang pleas suggest,0.25,19,dns encryption powershell subdomain,encrypt password across differ system powershel,7,encrypt|password|scripting|validate|user account|credential|aes,0.5317009687423706
build briantist &amp graham ask credenti store first run reus subsequ run code case drive h user home directori use tidi secur block code chuck script need problem more-or-less solv possibl check success credenti write applic permit note password chang user must delet file store retriev encrypt credenti easili powershel built-in xml serial clixml re-import import thing rememb default use window data protect api key use encrypt password specif user machin code run result encrypt credenti cannot import differ user user differ comput encrypt sever version credenti differ run user differ comput secret avail multipl user put user comput name file name store encrypt secret allow code without hard code anyth encrypt code use store credenti correct version file run user load automat fail file exist,2016-10-13 19:19:32.363 UTC,147,40029235,know save password file read file creat pscredenti object save $credenti file usernam password kept togeth,0.17006802721088435,25,credentials powershell,save pscredenti file,8,credential|password|username|security|scripting|encrypt|protect|availability,0.5309807658195496
sinc password plaintext credenti object doubt without prompt window api expos inform need powershel intent featur secur subsystem work linux machin trust call machin join activ directori kerbero setup realli asid need store pass inform somehow store rsa key user keystor extract runtim use .net crypto/keystor lib store key around code key protect os avail call user authent one thing instal achiev aim encrypt password use servic account encrypt key? quick exampl run powershel servic account run follow save output text file emb schedul task call follow schedul task order decrypt util password trick cannot reus encrypt password differ comput though whatev reason destroy local key store,2010-10-12 18:26:40.38 UTC,210,3917779,powershel script go run autom tool multipl server work fine window machin remot call tool servic account without need prompt expos credenti code script run linux machin via ssh use sharpssh packag sharpssh automat powershel user credenti requir either usernam password rsa key file pscredenti object prompt credenti use get-credenti run autom tool want expos usernam password code rsa key sit construct pscredenti object current powershel user servic account tri [system.net.credentialcache]::defaultnetworkcredenti show blank [system.security.principal.windowsidentity]::getcurr provid object inform need anyon method creat pscredenti object current user? mayb complet differ altern problem? mani thank,0.19523809523809524,41,credentials powershell remote-access sharpssh,current user credenti object powershel without prompt,14,credential|ssh|scripting|username|password|rsa|security|trust|kerberos|crypt|protect|availability|authentication|encrypt,0.5275129675865173
per document import-pfxcertif paramet password certif user login -password - specifi password import pfx file form secur string,2017-12-05 01:10:11.747 UTC,77,47644518,got pretti simpl code tri troubleshoot environ azur window server 2012 machin log domain admin run powershel consol administr privileg tri import-pfxcertif known locat accept network password code run beauti block code password absolut correct test log use password greet error whyyyy tri escap @ anyth tri cri comput complet unmov tear,0.18181818181818182,14,azure powershell,import-pfxcertif specifi network password correct,5,certificate|password|privilege|login|security,0.5261642932891846
link help accord link need domain control chang password suppli /domain option,2012-03-20 12:35:50.653 UTC,110,9786879,moment build login script powershel basis.thi login script abl chang user password login chang back origin logout problem want chang password domain user user one log obvious found neat stuff old net.ex say right chang password domain realli believ someth imposs caus user chang password otherwis find run login script domain admin. edit ok try explain setup call vmware view environ everi user login problem account gener known password peopl find highli amus steal other session thought make littl script chang reset password neat littl solut hope help^^ realli helpful thought thisthank advanc,0.17272727272727273,19,powershell,powershel chang password login,4,password|login|scripting|steal,0.5246419906616211
probabl pscredenti object provid credenti possibl store file encrypt save pscredenti file look,2017-05-17 08:09:15.373 UTC,51,44019056,need refresh excel use powershel script later schedul task schedul refresh requir credenti enter anyon know pass credenti powershel script? excel hang refreshal user enter credenti,0.2549019607843137,13,credentials excel powershell refresh windows-security,excel refreshal use powershel script along credenti,4,credential|security|scripting|encrypt,0.5243626236915588
yep - total long comfort secur implic pw file somewhere. exampl use approach similar situat certainli perfect make much less nervou hardcod password file read store password first run read dpapi-encrypt file afterward gener run script share locat intern network store encrypt password file privat folder local machin,2012-04-04 13:10:24.337 UTC,75,10011794,script user window environ variabl comput given user possibl hard code password user type everi time run script? script look someth,0.17333333333333334,13,passwords powershell,hardcod password powershel new-pssess,4,password|scripting|security|encrypt,0.5238989591598511
local administr right run powershel administr run without flag run script local need better run script pass argument one topic help similar case section enabl remot non-administr user remot troubleshoot basic tell execut ps command set-pssessionconfigur microsoft.powershel -showsecuritydescriptorui grant execut permiss user tri well wrong understand correctli credenti provid use access localhost need btw script still execut unelev two solut need elev powershel execut script need chang script accept credenti paramet access thing much say show script elev shell problem unless disabl uac prompt unfortun easi around know one sure add script task schedul task run elev run delet task autom ofc consequ unfortun design uac system sudo linux serv purpos cach respons time subsequ command prompt go someth,2016-04-06 13:59:32.96 UTC,218,36453422,okay bug tri mani thing tri run powershel script - user account regular one domain howev local administr comput therefor creat powershel script prompt credenti type credenti domain administr account use invok anoth script need domain administr elevation.thi script look script need domain administr elev execut shown script result prompt credenti follow error tri mess around .bat file look aswel make work - elev script domain administr level lastli howev need mention script want run domain elev work open powershel domain administr elev navig c:\temp\script.ps1 execut .\script.ps1 suggest,0.11926605504587157,26,invoke-command localhost powershell windows,access deni localhost despit administr - powershel,5,scripting|user account|credential|security|signing,0.5227938890457153
,2019-07-25 17:25:23.727 UTC,77,57207285,build script speed renam join process lot imag machin goal prompt twice asset tag domain credenti script goal concat devic prefix shown org-loc- concat domain name credenti enter prompt domain usernam password absurdli long domain name win10pro workstat imag use 1809 build join domain run 2008r2 expect join pc domain pass modifi credenti renam pc reject differ variant script fail adjust name devic and/or fail concat credenti new devic name,0.12987012987012986,10,powershell,add comput domain renam prompt concaten,5,scripting|asset|credential|username|password,0.5227124094963074
ok found solution! registry-key gener tick dont ask again. ad necessari registri key powershel script work without certif notif,2018-09-14 09:29:00.283 UTC,93,52328972,write script connect window 10 client termin server rdp-protocol thought behind thinclient 20 rdp-file 10 password need safe quit lot work alway save password everi new thinclient thought solv problem powershel script open connect 1 time success save credenti credenti save show code first work far alway notif symbol-pictur internet notif german exactli easier understand even instal certif notif keep pop check field powershel say ask connect comput,0.11827956989247312,11,powershell rdp,powershel suppress certif notif,5,certificate|scripting|password|safe|credential,0.5226350426673889
decrypt object string sampl function caution decrypt object bypass protect object provid insist use command option requir plain-text password command line inher insecur instead recommend activ directori cmdlet directli without need convert plain-text,2018-04-03 17:05:18.15 UTC,73,49635574,follow follow guid creat securestr password need log foreign domain control dsqueri option -s server -u user -p password enter password plaintext authenticated.onc use securestr object authenticate.i tri option run idea,0.2328767123287671,17,dsquery powershell securestring,securestr password object dsqueri command authent,7,security|password|authentication|crypt|bypass|protect|insecure,0.521321177482605
down-grad version mysql .net connector use latest 6.9.7 fell back 6.5.7 realiz goe common wisdom fix databas server howev intern far mani resourc use weigh risk set reset known password updat hash find broke buri tool somewher,2013-04-18 18:30:04.653 UTC,105,16090525,attempt connect mysql server powershel howev password seem work authent old password longer support 4.1 style password use mysql ado.net driver connect everyth return error point return except call open 0 argument authent old password longer support 4.1 style password anyon know chang new style password powershell? thank search coupl hour solut peopl util program php sql work,0.11428571428571428,12,mysql passwords powershell,mysql databas connect powershel old style password,3,password|authentication|hash,0.5183979272842407
pass empti string argument -credenti paramet start-process x:\windows\system32\notepad.ex -credenti display credenti dialog noth authent necessari servic instal winp darrick west cannot start process altern credenti winp least expos secur account manag sam sinc winp cannot join activ directori domain cannot launch process domain credenti furthermor winp perhap simpli expos secur account manag sam cannot creat custom user account winp try pass programmat creat credenti e.g,2013-11-04 14:48:56.253 UTC,160,19770299,deploy script start tri run winp 4.0 start-process x:\windows\notepad.ex -credenti get-credenti provid proper credenti credenti popup window receiv error cmdlet get-credenti command pipelin posit 1suppli valu follow parameters:credentialstart-process command cannot run due error specifi servic exist instal service.at line:1 char:1+ start-process x:\windows\system32\notepad.ex -credenti get-credential+ ~~~~~~~~~~~~~~~~~~~~~~~~~~~~~~~~~~~~~~~~~~~~~~~~~~~~~~~~~~~~~~~~~~~~~~~~~~ + categoryinfo invalidoper [start-process] invalidoperationexcept + fullyqualifiederrorid invalidoperationexcept microsoft.powershell.commands.startprocesscommand remov -credenti switch notepad.ex execut properli let know run exact line -credenti window server 2012 work perfectli think powershel 3.0 either .net 4.0 winp 4.0 miss someth thank help pointer,0.15625,25,.net .net-4.0 powershell powershell-3.0 winpe,winp 4.0 use start-process -credenti work,6,credential|scripting|validate|authentication|security|user account,0.5163032412528992
think itsn possibl powershel try dos command hour start process. invoke-tokenmanipulation.ps1 script script requir administr privileg enumer logon token avail creat new process allow anoth user credenti network creat process logon token work even window 8.1 lsass protect copy-past save alongsid script dot-sourc load function exampl,2012-10-03 08:27:30.973 UTC,93,12704579,need execut applic run system user account powershel run standard user account administr right tri start-process cmdlet custom credenti two problem first creat credenti object without blank password system user credenti password error messag password incorrect idea this? btw psexec,0.16129032258064516,15,powershell,start extern applic powershel system account,7,user account|credential|password|scripting|privilege|availability|protect,0.5154991149902344
,2019-08-17 05:53:29.943 UTC,55,57533673,want forc specif ciphersuit window client hello packet done mani effort use window registri key powershel cmdlet disable-tlsciphersuit enable-tlsciphersuit disabl ciphersuit enabl list need try connect http servic applic list ciphersuit sent client hello packet use wireshark possibl this? powershel script use,0.21818181818181817,12,encryption powershell tls1.2 windows,configur window specif tls cipher suit client hello packet,4,encrypt|tls|cipher|scripting,0.5136159062385559
need pass variabl script block otherwis valu empti,2013-06-21 14:47:07.217 UTC,51,17238145,work remot machin desktop follow script invoke-command -computernam $name -authentif default -credenti $creds1 -scriptblock {net \share $password2 /user:otherdomain\otheruser} specifi logon session exist alreadi termin thing frustrat run directli remot machin work perfectli workaround miss someth,0.11764705882352941,6,mapping net-use powershell,map drive remot machin powershel,4,scripting|authentication|credential|password,0.512470006942749
sinc question tag ftp secur recommend never ftp want secur ssh instead telnet scp instead rcp sftp instead ftp otherwis quit pointless try protect password memori send cleartext network understand use ftp nineti even though recommend back now? see excus ftp cannot handl anyth plain text usernam password unless use secur ftp confus,2011-03-14 21:05:29.527 UTC,88,5304521,attempt access ftp site plain text password credenti work fine securestr fail authent exampl work fine follow fail fail authent misunderstanding? btw know want plaintext pw script exampl,0.20454545454545456,18,ftp powershell securestring security,powershel securestr class,9,security|password|credential|authentication|scripting|ssh|sftp|protect|username,0.5094773769378662
,2019-09-06 08:39:11,164,57818547,sever script run queri databas trigger powershel code perfectli work late new server accept integr secur ad script user log machin right run queri newli ad sql server code show queri function normal code work fine run ise right click -> run powershel try run code task schedul work cours ad privileg user run queri detail task run task follow user account test variou option run highest privileg tri run anoth ps1 creat credenti textfil password user store encrypt run code start-process powershell.ex -credenti luck known solut problem? cannot find creat dedic user sql updat test sever scenario result task creat credenti privileg account--> batch run ps1 = fail task creat credenti privileg account--> directli run ps1 = fail task creat credenti privileg account--> batch run ps1 start-process -credenti = fail task creat local account--> runasrob run batch run ps1 = success seem work runasrob workaround must ootb solut without addit tool,0.12195121951219512,20,powershell scheduled-tasks sql-server windows,sql- queri powershel integr secur shedul task work,8,integrity|security|scripting|privilege|user account|credential|password|encrypt,0.5089808702468872
,2013-04-29 13:30:09.47 UTC,63,16279895,save securestr convertfrom-securestr file code extract convert encrypt string back securestr howev use securestr authent queri domain directoryservices.directorysearch queri fail logon error know encrypt string save retriev correctli convert securestr plan text use success queri wrong better accomplish query? thank advance! convert encrypt string plain text i’m abl success queri domain i’m member,0.20634920634920634,13,ldap powershell-2.0 securestring,pass securestr powershel ldap queri member domain,4,ldap|security|encrypt|authentication,0.5082200169563293
