answers,creation_date,len,postid,question,ratio,raw,tags,title,uniq,words,probability
connect visual studio onlin follow instruct buck post shortli enabl altern credenti vso account altern user password code similar follow know use current process credenti vso must explicitli pass constructor take uri default use credenti current user ensureauthent specifi credenti account run process try first run command prompt password save encrypt format chang $usernam variabl,2014-08-22 20:27:24.957 UTC,88,25455085,tri powershel connect vso code reach authent line pop box enter credenti need pop box script schedul keep enter credenti pass current user credenti tfs object,0.17045454545454544,15,authentication azure-devops powershell tfs,powershel connect vso,6,authentication|credential|scripting|password|encrypt|username,0.8966993093490601
first store password secur string store usernam password one variabl use system.management.autom pass variabl authent,2015-12-16 11:12:11.66 UTC,129,34310512,goal run powershel administr requir admin authent environ store credenti variabl use script run session case enough info write script use usernam admin run script variabl logging.i want make admin run script log twice environ one run powershel administr prompt admin credenti want script prompt credenti second time store variabl $env:usernam help want usernam log comput want admin usernam use run script accomplish this? closest come far run follow standard powershel session ...but leav two problem 1 im run ps admin right run administr line reject 2 open new ps window $admincr variabl store seem rel simpl still pretti new ps game.r appreci whatev help,0.17054263565891473,22,credentials elevated-privileges powershell-4.0,store credenti use run powershel administr,7,credential|privilege|authentication|scripting|username|password|security,0.8946689367294312
need includ domain part usernam credenti constructor,2016-10-26 14:40:02.077 UTC,36,40265237,use pscredenti object authent command need run differ user follow powershel cli run command powershel script error get wrong miss,0.2222222222222222,8,authentication powershell windows,use pscredenti object authent command non-interact,4,authentication|credential|scripting|username,0.8918433785438538
ran issu past - think one common gotcha alreadi mention mathia - watch run differ credenti run schedul job sinc decod depend use user session inform one thing quit sure exampl subsequ convert plain text- otherwis though take usernam password export file import credenti later hope help,2017-02-27 16:58:28.21 UTC,162,42491440,found similar thread none solv issu tri send email use smtp server attach via gmail easi bit done main error respons smtp server requir secur connect client authent server respons 5.5.1 authent requir think get password password file credenti want remov first line code never good idea password script chang password variabl follow issu forum post found suggest thing solv problem chang gmail set allow access less secur app solv problem help greatli appreci thank advanc edit gmail access less secur app 2 step verif gmail believ issu read password file case abl accept password file encrypt tri un-encrypt password much better script,0.16049382716049382,26,email powershell security smtp,powershel send email save password secur encrypt file,8,security|password|encrypt|authentication|credential|scripting|decode|username,0.89051353931427
want add loop script want add param util mani differ time foreach loop run code comput .txt file answer first part question give good start point,2015-05-14 14:59:58.447 UTC,138,30240610,"search archiv quit found simpl ie someth understand solut problem chang password servic account use powershel wmi chang servic one time across server see refer whatev server want whatev servic server follow provid list server text file remoteserver1,remoteserver2 someth similar chang password multipl servic machin run credenti abl list mutlipl servic use -filter startnam %\myserviceaccount try run $service.chang updat password error method invoc fail [system.object[]] contain method name chang line:1 char:16 + $service.chang &lt;&lt;&lt;&lt $null,$null,$null,$null,$null,$null,$null,newpasswordher + categoryinfo invalidoper change:str [] runtimeexcept + fullyqualifiederrorid methodnotfound work fine one servic though restart servic alreadi run enhanc script handl 3 addit items? thank",0.07971014492753623,11,credentials passwords powershell remote-server wmi,remot chang servic account password multipl server,4,credential|password|validate|scripting,0.8854579329490662
work updat store credenti run powershel session. sure possible. anyway script run connect exchang success sleep user chang window password script wake connect exchang fail trap error via try/catch creat schedul task run 5 second schedule.servic comobject quit script task fire relaunch powershel script updat credenti connect exchang succe script sleep task autodelet via settings.deleteexpiredtaskaft = pt0 - immedi need .endboundari trigger work fairli neatli bit hack love see eleg solut someon,2019-07-04 10:21:26.087 UTC,186,56885819,long run powershel script kick login via gpo connect exchang user current credenti goe back sleep everi half hour continu user log issu occur user chang password time next time script attempt connect exchang fail assum credenti store within powershel session longer valid refresh/upd script credenti o/s? thought work around restart script new powershel instanc henc grab new credenti sound problemat believ context pass new session initi run script trigger schedul task call script work though tri seem overli convolut thoughts? want get-credenti requir prompt want store password file provid way? quit sure start update:i use ews per https://devblogs.microsoft.com/scripting/learn-to-use-the-exchange-web-services-with-powershell/ credenti store current powershel session per:$exchservice.usedefaultcredenti = $true,0.16129032258064516,30,powershell,refresh credenti powershel script password chang,6,credential|scripting|password|login|validate|hack,0.8801141977310181
thank jon post found workabl solut key store credenti manag use network path store credenti persistenti map drive persist work password prompt see behavior use altern credenti code credenti drive persist even across reboot altern credenti appar design relev detail cmdlet help map network drive specif user account map network drive creat session start use run administr option use credenti anoth user visibl session start without explicit credenti use credenti current user refer https://technet.microsoft.com/en-us/library/hh849829.aspx?f=255&amp;mspperror=-2147217396,2016-08-10 22:49:04.4 UTC,157,38884785,powershel vbs batch script tri write need map network drive persist use altern credenti reason seem credenti persist map fine initi login drive red x tri open prompt password run powershel admin upon re-logon drive even shown anymor guess scope issu thought global flag suppos take care that? tri net method wscript.network method within powershell. result new-ish window script probabl someth realli dumb essenti script use past directli powershel window gone astray,0.1337579617834395,21,batch-file powershell vbscript,powershel persist map drive save credenti next logon,6,scripting|credential|login|password|signing|user account,0.8741378784179688
mayb protect-str unprotect-str carbon modul look time work beauti carbon powershel modul autom configur comput run window 7 8 2008 2012 remov reload pleas read follow care think point decid help op problem encrypt password use ps .net mechan case secur obscur unless one robust method store key usual robust method know biometr obscur level secur op seem ask natur want password store plaintext noth wrong unlik case security-through-obscur obtain code compil case w ps howev secur depend attack consid deal password current user gener current user attack howev deal password entiti need user see current user potenti attack exampl case script join workstat domain need user right domain permiss want user abl join domain part imaging/re-imag desktop want domain user account right join domain script use differ credenti want user know guess op ask case password assign user rest answer address case use ps/.net method encrypt/obtain password secur obscur attack need put breakpoint password use variabl name $password easi find locat breakpoint obscur variabl name eg call password variabl misspel ps auto-vari much 1 script short and/or 2 obviou command requir password instead encrypt password amount fairli transpar easi revers scheme arguabl better secur tricki set whatev call var ultim valu exampl password join-the_domain someth,2016-01-31 13:00:37.547 UTC,233,35114120,need store credenti smtp server script natur want password store plaintext far encrypt password use script howev gener object follow error,0.18454935622317598,43,powershell securestring,store encrypt string script,10,security|encrypt|scripting|credential|password|protect|biometric|attack|user account|signing,0.8687914609909058
yes possibl done need bind ldap server use system.directoryservices.protocols.ldapconnect object let say $c creat system.directoryservices.protocols.addrequest object popul attribut show coupl exampl send request ldap support insert support add ldap client must creat entri transmit entri directori server use add request server return add result ldap client contain inform success failur add request check document inform transmit add request directori server interpret subsequ respons ldap client must permiss add entri user case involv use bind request chang author state connect one permit ad entri design place directori inform tree perhap link help say creat new ldap user creat ad user avail use ldap use script microsoft someth similar look code abl see use code tweak need -jim,2013-07-11 12:04:35.44 UTC,151,17592910,challeng creat new ldap user powershel script.i googl lot found good results. code user ldap. problem know insert new ldap user activ directoryit realli nice someon help me. thank,0.11920529801324503,18,ldap powershell,new ldap user powershel,5,ldap|scripting|authorise|signing|availability,0.8661065101623535
,2019-04-27 11:02:29.007 UTC,35,55879875,tri avoid expos password connect string connect mysql db via powershel get error except call open 0 argument authent host endpoint user my_usernam use method mysql_native_password fail,0.17142857142857143,6,mysql powershell,connect mysql use encrypt password powershel,4,encrypt|password|authentication|username,0.865099310874939
classic kerbero double-hop special thing happen local comput credenti talk remot comput prove credenti without ever send howev remot comput need access someth third comput second hop cannot prove credenti cannot authent kerbero work design use localhost still remot connect still count hop call second hop consid work long powershel remot enabl remot machin otherwis need enabl kerbero deleg credssp best possibl rework whatev requir doubl hop wari credssp deleg gener,2016-04-05 14:24:39.93 UTC,110,36429196,run troubl invoke-command cmdlet log local machin domain ident admin right manual enter credenti invoke-command error cannot open servic control manag comput oper requir privileg someth special built-in credenti make work,0.13636363636363635,15,invoke-command kerberos powershell powershell-4.0 windows-authentication,invoke-command behavior clarif,6,kerberos|authentication|credential|privilege|signing|delegation,0.8616388440132141
answer neroon work unfortun come solut ad user work case anyon els look multipl user,2017-01-17 11:39:51.79 UTC,71,41696182,admin right machin connect ad right domain control powershel possibl authent deleg set ad account admin machine? possibl how? mean deleg set deleg tab ad account use kerbero authent snapshot refer current see servic account present deleg credenti sinc cannot scroll list grey,0.16901408450704225,12,active-directory kerberos-delegation powershell,get authent deleg set ad account non domain control powershel,4,kerberos|delegation|authentication|credential,0.8542511463165283
prefer cmdlet run support option use smo object directli depend exactli class method use requir,2016-06-28 13:34:29.953 UTC,70,38077735,basic script connect sql server instanc use smo powershel obtain requir data use window authent sql server allow account run powershel script want suppos current account access server enter anoth window authent credenti i.e anoth usernam password higher access connect server powershel script command enter anoth credenti,0.14285714285714285,10,powershell sql-server,window authent featur sql server powershel,5,authentication|scripting|credential|username|password,0.8510618805885315
first save credenti check make sure load correctli output look nope store plain text good concern option secur / encrypt file window credman quickli secur store credenti – powershel credenti object either manual creat one get-credenti cmdlet prompt account detail store credenti .cred file load credenti file back variabl secur store credenti disk allow multipl user access credenti store use export-clixml run powershel script multipl activ directori domain differ credenti powershel credenti managercredman.ps1 powershel script provid access win32 credenti manag api use manag store credenti https://gallery.technet.microsoft.com/scriptcenter/powershell-credentials-d44c3cd modul https://powershellgallery.com/packages/bettercredenti https://powershellgallery.com/packages/credentialmanag https://powershellgallery.com/packages/intellitect.credentialmanag,2019-04-15 23:11:11.703 UTC,128,55698407,im use ps next command gener key im save key.txt file want decrypt password use but. supos add this. want add my_password cours add variabl $password come key.txt file exampl then..,0.234375,30,email encryption powershell windows,appli encrypt/decrypt powershel,6,encrypt|crypt|password|credential|security|scripting,0.8510568141937256
minim solut 14 day timespan achiev check variabl els statement send mail user check multipl domain control defin multipl domain control inlcud foreach loop.with option transfer paramet achiev user domain control hint perform script root domain control directoryservic directoryservices.accountmanag part .net framework load .net assembl use system.reflection.assembl creat domain context connect ad searcher object go domain look user object wrote function return user match rang close expir date domain return array directori entri inform prefer quick exampl inform form directori object script send email user password expir,2018-06-22 13:43:35.113 UTC,125,50989367,want determin user sever domain differ password expir date today date less 14 day later want write notif mail user powershel write content surnam variable?her given code,0.048,6,notifications passwords powershell,today date password expirari date less 14 day,2,password|scripting,0.850803554058075
tri this...run whether user log not. run system servic account regular user account potenti run highest privileg set depend tri accomplish around - provid credenti work cours hardcod password script instead read text file use secur string,2018-01-03 22:11:25.307 UTC,93,48085919,schedul task powershel script creat schedul task run servic account creat schedul task current default run user log howev want run whether user log set miss ? fyi cannot suppli password script thank updat last end use user name password retriev script run time,0.12903225806451613,12,powershell scheduled-tasks,schedul task creation option run whether user log use powershel,7,scripting|password|user name|user account|privilege|credential|security,0.84684818983078
powershel icon shortcut hold shift button right click open menu option run applic differ window user note work start menu shortcut taskbar folder .ex,2016-07-02 10:33:30.253 UTC,87,38159131,powershel script use connect string connect sql server instanc executeread get data connect use current window authent system user case want altern window authent credenti note want sql server authent window authent altern credenti current credenti i.e use sql server authent right? want want connectionstr usernam password input use window authent given input,0.16091954022988506,14,authentication powershell sql-server,connect sql server use powershel window authent,5,authentication|scripting|credential|username|password,0.8450767397880554
case turn system tri initi remot powershel session differ workgroup window domain workgroup exchang server instal kerbero cannot establish connect cross-domain kerbero gener littl pain although secur multipl point check actual turn multipl point failur unless cours configur properli time sync domain spn etc websit interest/help someon face similar issu futur http://anexinetisg.blogspot.in/2013/07/kerberosslaying-dragon-in-exchange.html sound alot configur spn correctli target machin wish connect setspn command https://technet.microsoft.com/en-gb/library/cc731241.aspx check duplic appropri one allow kerbero authent unfortun enough inform post tell correct spn account good sourc explain set comput powershel remot includ use kerbero http://www.ravichaganti.com/blog/wp-content/uploads/2010/12/a%20layman s%20guide%20to%20powershell%202.0%20remoting-v2.pdf,2015-09-14 07:35:47.42 UTC,136,32559430,instal exchang server 2013 window server 2012 machin try establish remot powershel connect use command kerbero authent follow error howev try basic authent connect establish success somebodi pleas tell error happen remedi,0.11764705882352941,16,basic-authentication exchange-server exchange-server-2013 kerberos powershell,unknown user name bad password use kerbero authent,5,authentication|kerberos|user name|password|security,0.8448721766471863
instead map drive. run file remot machine? try check remot run,2017-05-09 09:19:51.943 UTC,141,43865918,stuck specif problem infrastructur driver script server organ domain – use deleg credenti base user login target vm – organ domain – differ local credenti need pass share network drive data access 2 – credenti 1 need trigger driver script server domain revert target vm exist snapshot use powercli map drive target vm – use domain relat credenti execut powershel script place share network drive intern access .dat .bin file locat problem unabl connect target vm execut drive map script error tri invoke-command script path scriptblock new-pssess ad drive map startup script logon – howev work unless manual login target vm snapshot revert prerequisit use psremot enabl driver target vms ips ad trust host winrm configur process request executionpolici unrestrict firewal disabl,0.12056737588652482,17,powershell,execut script remot non-domain target server domain,6,scripting|delegation|credential|login|trust|firewall,0.8375776410102844
use function pass user name password plain text sql invok powershel,2016-10-27 03:58:13.563 UTC,46,40275872,work powershel script connect aws sql server databas credenti hard code script without prompt invok script credentials? tri coupl option internet use none work,0.2391304347826087,11,amazon-web-services credentials powershell sql-server,sql server credenti powershel script invok credenti,4,credential|scripting|user name|password,0.8371292352676392
anoth option deleg session server basic creat custom remot session use -runa paramet design credenti session run constrain script cmdlet run session specifi connect session case session run niel account everyth done session account author regardless connect session session make one hop anoth server without need credssp elimin secur risk involv store account password script file client comput http://blogs.technet.com/b/heyscriptingguy/archive/2014/04/03/use-delegated-administration-and-proxy-functions.aspx use default authent mechan need authent mechan allow flow credenti ident kerbero one credssp anoth built window start vista/serv 2008 onward experi set credssp note secur risk target machin access credenti plain text need run two command elev shell one machin run script client anoth target connect via remot server enabl deleg $computernam client note fqdn secur reason avoid use wild card although consid use enabl deleg machin domain target server creat session -authent flag question serverfault set credssp blog post addit explan post troubleshoot tip commonli encount error messag,2014-07-23 07:05:08.247 UTC,187,24903878,client server client call script server run access network drive say access deni command access network drive powershel file remot server? user $usernam $password access network drive think doubl hop issu know solv,0.12834224598930483,24,powershell,powershel server network drive,10,scripting|username|password|delegation|signing|credential|authorise|security|authentication|kerberos,0.8340199589729309
believ experienc classic doubl hop issu resolv credssp deleg see follow link exampl https://blogs.technet.microsoft.com/heyscriptingguy/2013/04/04/enabling-multihop-remoting/ need pssession copi file pssession make complic sinc need configur psremot firewall-rul credssp kerbero deleg past double-hop issu etc copi directli,2016-04-19 13:29:44.53 UTC,57,36719947,tri run script sever remot server get access deni rdp server run script work,0.14035087719298245,8,powershell,copi script work local server done remot,4,scripting|delegation|firewall|kerberos,0.8324039578437805
solved! read troubleshoot help ran follow command add server trust host,2019-05-20 15:19:29.063 UTC,90,56223847,tri write script retriev expir iis certif across domain run script without error domain server list unabl cross domain even though user use admin access across domain tri use new-pssesiion pass invoke-command error windrm cannot process request error messag winrm cannot process request follow error errorcod 0x80090311 occur use kerbero authent sign credenti domain avail make sure devic connect organ network try previous sign devic anoth credenti sign credenti,0.15555555555555556,14,cross-domain invoke-command powershell remote-access,unabl run powershel script across domain,8,scripting|certificate|kerberos|authentication|signing|credential|availability|trust,0.8278215527534485
tri bit found trick machin restor happen ad nt authority\anonym logon user add connect db instanc use ssm -> expand secur -> expand login -> right click login -> creat new login,2013-04-25 18:34:41.473 UTC,79,16222164,powershel script db backup/restor reason execut script remot use backup command succe restor fail error trial/error ad nt authority\anonym logon admin group machin restor happen luck clue wrong solv problem appreci help thank edit switch solv issu,0.12658227848101267,10,database-backups database-restore powershell-2.0 sql-server-2012,restore-sqldatabas login fail nt authority\anonym logon,4,login|authorise|scripting|security,0.8275416493415833
,2019-09-17 18:56:53,75,57980448,azur web server util servic account cach cmdkey credenti access file share password servic account chang cach credenti go invalid sinc user assign deni logon local server secur polici remov assign re-cach key re-add deni logon local assign manag system use powershel cmdlet howev command fail user deni logon privileg besid secedit.ex enabl cmdkey refresh succeed? fear answer simpler altern nice,0.18666666666666668,14,change-password credential-manager powershell,updat cach credenti cmdkey user pw chang account deni login privileg,7,password|credential|login|privilege|validate|signing|security,0.8269132375717163
need creat new remot powershel session it? abl contact one domain control directly? try use .net pass credenti know account tell explicitli connect ldap ldap ssl port assum ldap setup correctli certif comput trust,2019-08-29 09:37:57.333 UTC,72,57707307,need abl allow user remot domain chang password cannot instal rsat tool machin work tri pass domain admin credenti run code domain control howev cannot authent password incorrect btw,0.16666666666666666,12,active-directory powershell windows,chang user password remot domain powershel,7,password|credential|authentication|ldap|ssl|certificate|trust,0.8253626823425293
suggest @vonpryz run script authent remot session probabl best thing regard concern need instanti remot session ask usernam password least two option creat fly read encrypt credenti disk creat fly creat credenti clear text password describ creat ps credenti clear text password powershel basic run read encrypt credenti disk object export encrypt form via import credenti issu credenti store encrypt form opaqu encrypt key current user export credenti mean user later import credenti exampl run script credenti easili run script via regard jenkin environ make sure export encrypt credenti servic account import credenti,2017-02-20 05:53:34.38 UTC,118,42337369,powershel script valid multipl test window imag specif test requir domain credenti use run success script! anyon help fix,0.2711864406779661,32,powershell,authent domain credenti powershel script,7,authentication|credential|scripting|validate|username|password|encrypt,0.8249181509017944
put key encrypt credenti similarli decrypt hope help,2016-12-28 08:00:13.873 UTC,85,41357813,multipl powershel script need credenti technic user good store credenti securely/hash keep avail user permiss run script? tri hash secur string requir user hash credenti secur string tie user profil unsucces tri implement someth run script administr -> click yes dialog -> switch tech user -> unhash credenti -> rehash log user -> save file user administr privilig user enter credenti save user specif hash file presum best practic found yet,0.25882352941176473,22,powershell,save credenti technic user powershel,7,credential|scripting|security|hash|availability|encrypt|crypt,0.8200854659080505
