answers,creation_date,len,postid,question,ratio,raw,tags,title,uniq,words,probability
alway top script script line problem chang correct error script suggest read www::mechan document note mani user suggest type login use tool tos.so pleas check facebook api need send credenti load correct cooki code work see need two cooki,2015-07-12 16:46:43.177 UTC,111,31370173,script scrape score websit websit use facebook account log sinc day script work anymor follow error cooki requir cooki enabl browser pleas enabl cooki browser prefer continu search forum found similar problem:i tri given solut work export facebook login cookies.txt googl chrome plugin https://chrome.google.com/webstore/detail/cookiestxt/njabckikapfpffapmjgojcnbfjonfjfg?hl=en save cookies.txt folder script script agent firefox cooki export chrome mayb issue? tri differ method languag python perl,0.1981981981981982,22,cookies facebook perl,perl facebook login mechan fail cooki error,4,cookie|login|scripting|credential,0.5005611777305603
cloudflar need javascript use www::mechanize::firefox taa daa! took long time ddo protect intercept request set cooki redirect target page submit cooki got intercept next request ddo protect lwp creat cooki jar www::mechan subclass lwp::userag pass argument lwp::userag ua cooki jar automat accept cooki follow redirect submit cooki subsequ request,2015-03-15 04:46:56.723 UTC,103,29057331,edit end use www::mechanize::firefox answer question tri access websit download page cloudflar ddo protect site occasion come make lwp go success detect page cloudflar splash page regex whenev attempt connect splash screen new ray id condens code sampl sinc work need abl anoth,0.1941747572815534,20,cloudflare lwp lwp-useragent perl regex,wait cloudflar ddo protect lwp perl,5,cloudflare|ddos|protect|scripting|cookie,0.495632141828537
"browser uniqu id good level fingerprint possibl eff measur best case inform sent browser includ user agent string http header repres 18.1 bit entropi mean take two browser random 1 chanc 2 18.1 ≈280,000 fingerprint websit estim degre entropi inform sent browser websit bank instanc store inform three browser often connect websit ask addit verif question whenev use one hand inform entir spoofabl someon abl carri man-in-the-middl attack steal cooki abl steal header sent browser reus authent websit true browser actual uniqu ids altern besid use connect encrypt ssl http requir either pay sign certif creat self-sign one display secur warn visitor adopt better practic session highjack one thing standard keep usernam password even encrypt cooki user log websit assign random singl session id store databas along expir time extend everytim user interact websit cooki want even higher degre protect one option chang session id everi time user make send http request store list ip address user use connect websit ip address mask e.g chang often authent connect unusu place good practic ask connect place? browser uniqu id thing thing onlin advertis compani dream! said serv site via http issu client client-sid x.509 certif cryptograph sign organ fairli unforg though obvious somebodi access client comput make copi - true browser id number though! certif instal everi time browser make http request websit websit ask certif use verifi user identifi store uniqu valu e.g user id user browser use html local storag perman expir date store valu info user agent db pass user agent info data local storag match one database. sure much secur approach identifi user html local storag suppos access page one origin domain protocol html session storag store data user browser one session",2014-05-23 10:53:30.687 UTC,473,23827319,web browser uniqu id pass perl scripts? uniqu serial - product buy shop exampl instanc instal web browser web browser provid uniqu identifi id php perl script? reason look someth uniqu follow user databas user name password user name / password encrypt cooki web browser user user log web applic web page load logged-in look cooki grant access cooki user/pass correct hacker manag steal encrypt user name password cooki user abl log stolen encrypt detail browser user uniqu ids pass record ids match time user use encrypt user/pass cooki uniqu id match record previous user log ask manual log event encrypt user/pass stolen hacker abl uniqu browser id match user/pass cooki encrypt hacker cannot see user name password uniqu browser record id match web applic ask user login manual hacker abl login manual user/pass stole encrypt use ip address possibl solut poor solut mani isp assign dynam ips internet connect client use time good solut user stay log comput week time chose make conveni anybodi solut scenario? search someth uniqu browser seem possibl possibl,0.13742071881606766,65,authentication cookies encryption perl,uniqu web browser identif id web control panel login perl,21,authentication|cookie|encrypt|crypt|login|scripting|user name|password|hack|steal|signing|fingerprint|spoof|attack|ssl|certificate|security|username|protect|x.509|forge,0.4741731584072113
,2016-08-13 18:26:03.763 UTC,76,38935724,problem simpl websit run apach static html perl script add login password protect user login extern server http domain server cooki valu sign md5 hook everi request apach execut script middlewar cooki pass valid forward request cooki exist fail md5 verif redirect login server find execut script sure idea inject perl/python interpret apach task seem bit overkil suggestions? thank advanc,0.27631578947368424,21,apache cookies mod-python mod-rewrite perl,hook request apach run script valid session cooki redirect login fail,9,cookie|scripting|validate|login|password|protect|signing|md5|inject,0.47165441513061523
need emul anyth screen trace captcha request imag data download - readi imag file favorit captcha bypass deathbycaptcha api avail languag anoth servic let solv captcha earn credit futur solv rememb name moment,2012-07-31 16:26:29.217 UTC,119,11744771,possibl virtual screen scrape perl python? suppos login page enter usernam password take anoth authent page write captcha read mechan similar tool autom first step howev 2nd step possibl captur screenshot captcha page virtual sinc realli load page browser perl? done perhap autom captcha read tool googl one attempt read captcha page captcha imag fix place within fix size box imagemagick crop part screenshot feed googl tool take trial error run find portion screenshot contain captcha possibl,0.13445378151260504,16,imagemagick mechanize perl python screen-scraping,virtual screen scrape perl,7,login|username|password|authentication|captcha|bypass|availability,0.46390923857688904
ok better late never. it. say valid sure mean check assert verifi signatur check valid assert object creat via accessor assum understand saml semant verifi signatur need access privat key see xml::sig perldoc variat sourc key x509 cert note net::saml2 cover encrypt saml assert ask net::saml2 cpan modul help http://metacpan.org/pod/net::saml2,2011-12-05 15:13:49.453 UTC,72,8387452,need valid saml assert kind find librari cpan take saml argument valid someon help reach goal,0.25,18,perl saml,valid saml assert perl,5,saml|validate|signature|private key|encrypt,0.455055832862854
notic blog entri exampl http://blog.case.edu/jeremy.smith/2009/03/30/using_2legged_oauth_with_google_apps_in_perl perhap start,2010-02-09 05:58:34.463 UTC,56,2227097,look net::googl 90% modul authsub mandatori login/password right web applic interact googl applic behalf custom oauth authent done googl applic know user password support net::google::documentslist exampl awar modul work well picasa blogger exampl use oauth current net::google::picasaweb handl read-onli queri add/remove/upd action,0.14285714285714285,8,api perl,googl api perl work oauth,4,oauth|login|password|authentication,0.4442468285560608
,2014-11-22 18:31:35.873 UTC,76,27080956,tri implement function similar demo http://www.steve.org.uk/security/xss/tutorial/simple.html accept user input textarea use cgi tri use follow code html code snippet test.cgi code snippet believ work display pop messag work insert textarea field simpl user input follow pleas know why? new cgi apolog question trivial furthermor apolog question answer found question cross site script inject pleas know demo display alert box script simple.cgi? wrong refer javascript use code perform,0.13157894736842105,10,cgi forms html perl xss,xss inject html textarea,5,xss|inject|security|cross site|scripting,0.3900194764137268
fact certain client side handl escap comma properly? bug client cooki valu suppos url-escap unescap comma particular forbidden valid cooki http://tools.ietf.org/html/rfc6265#section-4.1.1 cgi::cooki automat escap special charact cooki name valu render cooki string provid method disabl bypass although escap requir cooki specif cooki specif state server send cooki contain unescap comma among charact plu plain good secur practic realli realli need send cooki contain unescap raw data recommend need unescap cooki string print,2013-11-12 01:03:44.167 UTC,124,19919039,"tri send list word separ comma insid valu cooki back browser use cgi perl comma symbol alway convert %2c code follow pass data program developed.how avoid comma escap server side application? want valu cooki equal top,chay,pisi instead top%2cchay%2cpisi.thank advanc",0.13709677419354838,17,cgi comma cookies perl return-value,unescap valu cooki use cgi perl server side,4,cookie|validate|bypass|security,0.3760535717010498
html document need valu charset attribut http header meta element need fail find correct encod charset exist wild encod support encod ever exist surpris encount html page decod simpli case creat alia provid detail us help see encode::support basic encod work &trade work without error,2015-10-14 13:55:34.973 UTC,98,33127314,write perl script fetch variou html document mani differ web site tri extract data problem decod document know read meta tag one read inform http header avail result utf-8 iso-8859-1 shift_ji windows-1252 mani knowledg want decod document perl script fail find correct encod charset exist wild,0.14285714285714285,14,character-encoding html perl,perl encod html charact,4,encode|scripting|decode|availability,0.34564054012298584
