answers,creation_date,len,postid,question,ratio,raw,tags,title,uniq,words,probability
question 1 possibl verifi login+password perl via saml ident provid idp? yes how? answer definit cybersecur perspect question 2 awar usual saml work answer yes correct saml specif defin three role user ident provid idp servic provid sp primari case address saml user request access servic log web applic servic provid servic provid request obtain authent assert ident provid basi assert servic provid make access control decis user decid whether allow user access servic log web applic ii deliv subject-bas assert sp idp request inform user user name password order authent user saml specifi content assert pass idp sp ii.a saml one ident provid provid saml assert mani sps ii.b similarli one sp reli trust assert mani idp saml scenario web applic product manag decid request 4 differ client web applic develop saml idp exampl social websit allow user log web account ident authent provid third-parti idp googl facebook linkedin via oauth 2 protocol openid connect protocol/oauth 2 instead saml question 3 background 4 differ client web applic suppos enabl central password via saml implement complet differ technolog answer 4 differ client web applic suppos enabl central password via saml implement saml idp complet differ technolog program languag java php scala exampl develop former version zero-password authent author system java leverag java-bas shibboleth idp provid saml sso enterpris applic develop current version zero-password authent author system scalabl high avail scala provid saml sso nativ enterpris applic without shibboleth idp ii matter technolog program languag use 4 differ client web applic implement saml idp saml idp need authent user use central password data store/repositori openldap mysql local deliv user info use saml assertion/saml respons web application/saml servic provid web application/saml servic provid need map user info carri saml assert local user info web applic question 4 product manag decid saml connect complex 4 client authent therefor take place central web applic answer user ident authent need take place central web applic instead saml idp 4 differ client need implement saml idp cybersecur perspect instead need creat assign differ sub-domain 4 differ client 4 differ client web applic access differ sub-domain client-org1.your-web-app.com client-org2.your-web-app.com client-org3.your-web-app.com client-org4.your-web-app.com note differ sub-domain web applic display login webpag exampl #1 client-org1.box.com client-org2.box.com client subscrib box account exampl #2 client-org1.my.salesforce.com client-org2.my.salesforce.com client subscrib salesforc account question 5 client transfer login password web applic without sso web applic suppos verifi access data central answer differ sub-domain web applic display login webpage.4 differ client web applic access differ sub-domain web applic user 4 differ client submit login password web applic differ sub-domain url without sso data store/repositori web applic suppos verifi access data i.e login username/password central 4 differ client web applic need saml idp,2019-06-25 12:59:12.377 UTC,513,56754676,possibl verifi login+password perl via saml ident provid idp? yes how? awar usual saml work background 4 differ client web applic suppos enabl central password via saml implement complet differ technolog product manag decid saml connect complex 4 client authent therefor take place central web applic client transfer login password web applic without sso web applic suppos verifi access data central,0.16569200779727095,85,perl saml,verifi login+password perl via saml,17,saml|login|password|authentication|sso|security|access control|user name|trust|oauth|openid|authorise|shibboleth|availability|ldap|signing|username,0.9979205131530762
suspect form valid therefor redirect form special kind script protect abl creat valid request go browser select give list option valid request help past redirect loop,2016-02-24 12:13:21.94 UTC,128,35601912,make script major part login system call feid use perl curl manag actual log make session cooki due fact curl support javascript press button sinc browser support javascript must press button proceed content site want access unfortun form weird run script simpli redirect back site know html mayb someth miss seem submit form proper manner script natur put usernam password feid abl try hope someon see solut regardless post entir html-code output script end case someon interest left someth let know best provid edit turn javascript browser copi curl got,0.1328125,17,curl html perl,script perl/curl past html-form w/ two submit click onload,7,scripting|login|cookie|username|password|validate|protect,0.9918581247329712
cgi::sess independ script default abl forget persist session id client done cooki see session exampl id session object retriev automat save properli see call without argument $dsn default driver:file;serializer:default;id:md5 configur store set prefer basic exampl cgi script use session,2012-06-12 05:50:06.603 UTC,113,10991156,need store login session user login remov login session user log system session timeout code perl know cgi::sess modul perl make sure session creat 1 cgi script remov anoth cgi script page system check session exist display content current use follow code creat new session user login success howev log user session anoth cgi script? doubt follow sinc $session defin cgi script idea,0.1415929203539823,16,cgi login logout perl session,login logout session 2 cgi script,5,login|scripting|forge|cookie|md5,0.9909260869026184
process cooki automat need construct cours want load cooki later anoth script anoth run script . main thing see javascript function believ field form need emul function code submit valu,2013-04-12 13:24:12.45 UTC,104,15972577,nice problem fill login form www::mechan first show part websit unfotunatelli german well. see 1 form fill field usernam id secondli button click confirm login data tri show unluckili abl send correct submit form site.prob problem checkbox activ call setautologin help great updat tri www::mechanize::shel build perl script all...first use fetch login url fillout fill data unfortun throw back login.php probabl store cooki ?,0.1346153846153846,14,fill forms login perl www-mechanize,perl www:mechan form fill work,4,login|username|scripting|cookie,0.9890232682228088
statu 301 perman redirect check see user log give perman redirect give correct username/password? log log someon else? imposs need clear safari cach statu 303 see code vulner sql inject attack try seem someon log app make cooki usernam need password,2013-04-18 18:58:21.03 UTC,94,16091033,"new perl made simpl login script suppos cooki redirect form page tri everyth think cooki safari sever post show slight variat tri code implement seem necessari fro cgi cgi;us cgi::carp...us cg::session;us cgi::cooki script correctli valid redirect cooki ever set.i sure better suggest approach,that great thank look",0.19148936170212766,18,cgi cookies perl,perl cgi::cooki set safari,9,cookie|login|scripting|validate|username|password|vulnerability|sql injection|attack,0.9882183074951172
see cool framework mojolici realli date plu author updat frequent offici mojolici site,2012-07-20 02:18:03.357 UTC,90,11571967,"want authoris team dedicatedli password reset/print queue delet kind l1 task plan via 1 menu use perl script want front end html want user login server black screen login web portal-> see menu-> select item-> task->exit think framework achiev user password transfer secur web portal server?how go encrypt/secur web communication?how go encrypt/secur passwords?even one built-in method encrypt password authent time secur password user input someth password reset function? realli need valuabl suggest thanks,prash",0.2,18,perl,perl framework html,7,authorise|password|scripting|login|security|encrypt|authentication,0.9878882765769958
start read page http://perldoc.perl.org/cgi/cookie.html cgi::cooki object allow store session id browser cooki exampl save read cooki,2013-10-01 01:16:45.033 UTC,75,19106446,tri implement shop site click checkout button tri check whether user alreadi logged-in yes want show payment form els login form provid correct info usernam password login script tri creat session want make session id problem store session id html make display differ form base session id help highli appreci devesh,0.12,9,html jquery perl,store make session id html,5,login|username|password|scripting|cookie,0.9870866537094116
see lot issu code post gete instead use objuect! send cooki target site firefox send somecooki refer header life short www::mechan instead plain lwp. p header emphas text,2013-03-28 00:54:53.95 UTC,83,15672399,tri log one websit use perl http:request lwp:userag ad ali http header found use firebug anyway error crf token defin header found firebug respons header firebug anybodi interest respons execut perl code https:// bla/login websit link perman unavail try www:mechan tomorrow wonder defin csrf header,0.0963855421686747,8,authentication csrf perl,http::request perl use lwp:userag authentif crf issu,5,authentication|csrf|login|availability|cookie,0.9870852828025818
"javascript solut http://jakub.fedyczak.net/post/force-page-refresh-on-back-button/ put html output header suggest quora adam angelo general,y logic page check session active/pres perform either redirect 302 307 etc.. send login/authent page forbidden/authent error 403 401 etc.. addit @mob mention alreadi caus browser expir local cach page",2015-02-19 18:57:20.047 UTC,84,28614635,perl script log user user log abl go back login page press back button prevent user user prompt login log log press back button page redirect login log mandatory.in short user abl access protect page unless author,0.11904761904761904,10,cgi perl session,log log perl,5,scripting|login|protect|authorise|authentication,0.9868730306625366
,2018-05-07 09:43:35.58 UTC,70,50211211,use apach modul implement singl sign-on system sure session/cooki part suppos work instal modul custom authent ldap server success login correctli redirect login page protect web app resourc need modifi default perl script modul log app singl sign-on? tri use perl modul automat login app success login unabl transfer session inform browser look pointer singl sign-on implement modul someon use pleas help,0.2,14,apache perl single-sign-on,apach mod_auth_tkt singl sign-on usag,8,signing|single-sign-on|cookie|authentication|ldap|login|protect|scripting,0.9856840372085571
possibl recaptcha system meant easi plug captcha site side effect help digit book use imag snippet scan visual challeng number display “words” book use alreadi known number void secondari object recaptcha help transcript scan use number make system less secur theori wherea attack ocr softwar difficulti tell apart g 9 becom unambigu,2013-08-26 13:08:24.547 UTC,68,18444933,want custom googl captcha digit option verif code.i possibl yes,0.1323529411764706,9,perl recaptcha,custom googl captcha perl,4,captcha|scripting|security|attack,0.98503178358078
,2014-01-01 09:24:24.52 UTC,66,20867211,"setup bugzilla instal windows7.i installed:1 perl2 sql ran chacksetup.pl...and given admin user password.everyth look fine main page bugzilla try login use admin account,then get error:th usernam password enter valid even check profil tabl sql login name provid correct.but see password look encrypt lengthi password..i problem? pleas help me.i find understand problem. thank advanc happi new year",0.21212121212121213,14,bugzilla perl,first login bugzilla error:th usernam password enter valid,6,login|username|password|validate|hack|encrypt,0.9837212562561035
first need try login site via browser javascript disabl error page mean cooki redirect ad via javascript need add cooki manual code recommend instal httpfox mozilla firefox record login session find wrong target site,2011-11-17 12:43:25.337 UTC,62,8167279,try perl script autom interact websit modul www::mechan realiz design websit [https] show session expir anyon help problem,0.14516129032258066,9,automation html perl www-mechanize,perl mechan modul session cooki issu,4,cookie|scripting|signing|login,0.9834524989128113
interact websit fill form login suggest note websit contain javascript someth,2014-06-11 06:50:00.023 UTC,52,24156376,"tri login url use lwp perl url open ups pop ask usernam password.when try manual log ,it succe lwp,i get 401 error tri thing well error error 401--unauthor kindli help!!ani help appreci",0.1346153846153846,7,lwp-useragent perl,issu author web page use lwp perl,5,authorise|login|username|password|scripting,0.9794710874557495
,2015-06-09 09:48:53.08 UTC,45,30728622,web applic receiv audit issu cross site request forgeri test prevent cross site request forgeri issu need anti-cross-sit request forgeri token captcha pleas suggest implement captcha perl cgi web applic tri instal cpan webservice::captchasdotnet modul fail instal,0.24444444444444444,11,cgi perl,captcha implement perl cgi web applic,5,captcha|audit|cross site|forgery|cross-site,0.9775528311729431
try php-gtk fastest work develop experi php web option quick desktop develop serious limit sinc know sane php desktop app first thought reach framework let javascript mostli declar ui save pain best one qt suppos let almost everyth qml javascript unfortun part almost sinc anyth escap mean c++ develop best c++ environ sure still wide differ web work special php web work option think best adob air realli check let write desktop-lik app use flash without flex framework html+javascript first saw seem pretti much complet db work think embed sqlite librari access http servic local db+php app expos crud method go say perl good though necessarili best option one php develop perl-allerg perl probabl easier php develop pick static type compil languag typic desktop app written perl librari interfac pretti much databas back-end want though 100% sure use excel db directli fairli confid someth exist cpan recommend anyth person experi perl window gui develop - easier web gui use local/embed web server tk win32 gui modul stackoverflow coupl question good refer topic perl window gui option perl fairli complet support md5/sha etc. cpan friend,2010-08-02 03:31:04.707 UTC,396,3384814,ok go easi first question experienc web applic develop need design 2 differ desktop applic work need advic languag php web applic littl experi framework help accomplish easier ide make life easier first applic essenti interfac embed remot db essenti need much crud fulltext search function necessari sort crud tabl includ possibl hide column data prioriti current mysql happi db long support import excel cours support excel spreadsheet databas fantast wish thinking. need support window xp upward chang let know add anyth help answer second applic go complic guess need output sha md5 crc-32 crc-16 signatur entir extern drive on-screen and/or text document user choic new append extern drive compact flash eeprom cd-rom dvd-rom sd etc wherea idea start first applic one need major help idea program languag built-in support algorithm best go code advic welcom edit ok come across titanium wonder best option 2 project first one certain achiev second project go pretti difficult believ unlik hash calcul need check individu file sha/md5/crc-32/crc-16 need check compact flash usb-connect sandisk cf reader eeprom com usb connect well essenti need produc signature/hash entir drive file advic particular help pleas let know go far off-top stackoverflow standard creat new question,0.050505050505050504,20,cryptography database eeprom perl php,desktop softwar develop possibl use web technolog cryptograph check,8,crypt|signing|sha|md5|crc|signature|hash|scripting,0.8876766562461853
1 starter sql inject vulner chang 2 instead client-sid meta-equiv redirect html client-sid redirect http initi server chang 3 recent use cgi::sess directli guess design call default case call directli edit exampl 4 yes ok 5 instanti session script need match cooki storag method use default achiev,2014-01-18 18:39:34.52 UTC,197,21208263,need protect page site login password one entri point hard work moment want improv author system yes work want work correctli code check login password 2 question it:1 correct all? 2 script behaviour end-us user write login password form send login page load redirect login page blank field show 1 second protect data appear remov show login blank form login immediately? input login password send form data show immedi show blank login 1 second think meta redirect think? first 2 question user click anoth link re-visit site short creat new session again? absolut quot document cgi::sess tutori say firstli check user session exist new session creat code code work fine access session variabl 3 explain code works? first code work 2nd code without $sid 2nd paramet work work quesiton access data session 4 correct access session variabl way? 5 need access script? access,0.1218274111675127,24,authorization perl session,correct use cgi::sess perl,9,authorise|protect|login|password|scripting|sql injection|vulnerability|signing|cookie,0.8791525363922119
http term program output 302 303 statu code locat header use cgi.pm redirect method achiev exampl use cgi david dorward mention,2009-11-24 11:44:22.72 UTC,61,1789555,perl cgi script creat login screen i.e user name password want success login user redirect next action within applic anoth perl cgi script command redirect one cgi script html page,0.14754098360655737,9,cgi perl,call anoth perl cgi script within cgi script,4,scripting|login|user name|password,0.8503037095069885
cgi::sess work advantag use http::cryptocooki advantag cryptocooki imposs find cooki contain withiout secreat server key howev cgi::sess cooki contain session id encrypt session id help encrypt session id behav exactli session id attack perspect,2014-01-10 11:50:35.933 UTC,116,21043629,read far everywhere. cgi::sess http://metacpan.org/pod/cgi::sess seem prefer session manag use perl extens tutori avail http::cryptocooki rel less use known abl cooki use cgi::sess simpl code see sourc code cgi::sess strong sign cryptographi bit concern read cpan tutori notic line default cgi::sess use standard cgi pars queri cooki got think http::cryptocooki perhaps? instead standard cgi make login script secur send encrypt cooki instead standard cookies? document http::cryptocooki scarc find anyth googl perhap someon help,0.27586206896551724,32,cgi cookies crypt perl session-cookies,cgi::sess http:cryptocooki login perl,9,cookie|crypt|login|availability|signing|scripting|security|encrypt|attack,0.8213158845901489
,2016-03-31 17:05:18.963 UTC,42,36339530,tri creat php perl script post content googl login page usernam password return googl notif confus method call googl use though method call requir guess wrong method post page tri make call locat https://accounts.google.com/servicelogin?service=mail&amp;passive=true&amp;rm=false&amp;continue=https://mail.google.com/mail/&amp;ss=1&amp;scc=1&amp;ltmpl=default&amp;ltmplcache=2&amp;emr=1&amp;osid=1#identifi,0.11904761904761904,5,curl html perl php,method call html code,4,scripting|login|username|password,0.8070968985557556
need cours forget chang actual field name target page page http authent mech fill form field submit login form,2011-07-15 01:55:56.62 UTC,44,6701934,want search content site use www::mechan abl first must log regist usernam password code must chang submit form success thank updat,0.13636363636363635,6,perl,perl www::mechan credenti,6,credential|username|password|forge|authentication|login,0.7404778599739075
chang login password past got tokenid api token author,2017-11-03 08:37:22.817 UTC,59,47091466,webpag use angularj show form usernam field password field html element next page simpl html form easili autom two field download button know www::mechan autom form stuck login saw python way pythonist prefer perl www:mechan this? cpan modul,0.13559322033898305,8,angularjs javascript perl web-scraping www-mechanize,autom angularj login form perl use www::mechan,5,scripting|login|username|password|authorise,0.7138456106185913
explan secur back end answer question https://metacpan.org/pod/cgi::session::tutorial#secur thing pass back forth cgi::sess session id inform session save server wherev choos -- pleas make somewher web server serve! secur data depend server configur option use cgi::sess etc clear verifi ip anyon get hold session id valid session hijack pretend person trivial fake cooki header field explicitli difficulti fake valid session id cooki sinc use cooki session browser keep track client re-send server everi time visit page open door cross site request forgeri secondari mean identifi client asid cooki even check ip prevent csrf expir cooki point mean server side cooki expir date client delet cooki session stop send sure done cgi::sess look tutori server accept unencrypt connect thing requir authent send password pass session token back forth beg troubl interpret complet list potenti secur issu method,2015-04-03 22:40:33.26 UTC,185,29440640,password match login script apach print cook everi script check session expir empti give access check login usernam code $loggd_us access data relat usernam happen one modifi cook anoth username? possible? one access someon els data? secur issu code ok,0.1891891891891892,35,cgi cookies login perl security,perl cgi::sess cooki login safeti,14,cookie|login|security|safe|password|scripting|username|validate|hijacking|cross site|forgery|csrf|encrypt|authentication,0.694840133190155
method http authent form submit need fill form first one form page need specif method see excel mechan form-handl document,2013-07-13 12:01:21.15 UTC,84,17629988,instal dvwa got try challeng database/config done correctli login cred localhost admin:password work tri login manual write perl script bruteforc bruteforc login challeng howev cannot page follow code login login.php work use mechan previous use userag pm fail move one endless googl search 8th line print content login page wrong code access main page? manual redirect log,0.11904761904761904,10,login mechanize perl,form submiss log perl,4,login|password|scripting|authentication,0.6848821640014648
authldapbinddn must user consult ldap authldapurl must ldap server entir ldap patch activ directori,2016-02-02 10:39:34.8 UTC,46,35151141,tri alway perl .htaccess httppd.conf differ usernam password ldap search recognit usernam password mayb wrong programm what? perl packag function httpd htaccess,0.2608695652173913,12,.htaccess apache httpd.conf perl,first login enter websit usernam passwort,4,login|username|password|ldap,0.6847518682479858
crypt-ssleay net-ssleay two differ cpan distribut want net::ssleay instal net-ssleay ppm distribut,2010-06-26 17:31:38.257 UTC,93,3124823,tri net/ssleay.pm perl code say net::ssleay error messag say follow - locat net/ssleay.pm @inc @inc contain c:/perl/site/lib c:/perl/lib test.pl line 7.begin failed--compil abort test.pl line 7 instal ssleay.pm via perl packag manag verifi - crypt-ssleayopenssl support lwp version 0.57 releas 2008-05-02 author david landgren cpan http://search.cpan.org/dist/crypt-ssleay-0.57/ instal file c:/perl/lib/crypt/ssleay.pm c:/perl/lib/crypt/ssleay/ctx.pm c:/perl/lib/crypt/ssleay/conn.pm c:/perl/lib/crypt/ssleay/err.pm c:/perl/lib/crypt/ssleay/maincontext.pm c:/perl/lib/crypt/ssleay/x509.pm c:/perl/lib/net/ssl.pm c:/perl/lib/auto/crypt/ssleay/.packlist c:/perl/lib/auto/crypt/ssleay/ssleay.b c:/perl/lib/auto/crypt/ssleay/ssleay.dl c:/perl/lib/auto/crypt/ssleay/ssleay.exp c:/perl/lib/auto/crypt/ssleay/ssleay.lib unsur script find help appreci,0.4731182795698925,44,https perl web-services,perl - get error net/ssleay.pm - tri post xml via http web servic,5,ssl|crypt|openssl|authorise|scripting,0.6808609962463379
recommend use someth mechan take care handl session cooki provid use tool identifi fill form log take look method object,2011-11-22 17:35:05.053 UTC,134,8231129,follow work tri download file websit need authent perhap save cooki expir 24 hrs access content provid authent website? un-authent user access urlor websit s/he re-direct authent page put userid password press enterlogin button authent control goe back url origin ask automat far work non-auth need websit need download file url https://myurl.com/file.doc need authent username/password ad problem definit goe normal browser situation:. post url browser https://myurl/files/file.doc logon page url still look enter field name username/password press ok button field name btnsubmit successful login new page https://newurl/pagsuccess/ click ok page go back want go.. browser dialog select radio button save file press ok done!!! file save local,0.11940298507462686,16,lwp perl,perl script download certain url https://.,6,scripting|authentication|cookie|password|login|username,0.6583239436149597
www::mechanize::firefox want thing browser wrote control firefox perl,2014-12-27 17:26:33.53 UTC,47,27669656,tri auto-login websit use script login success evidenc open howev try launch live page browser use give valid error click submit button without enter username/password caus this? someth cooki,0.23404255319148937,11,cookies login mechanize perl,perl www::mechan secur login launch browser,7,cookie|login|security|scripting|validate|username|password,0.6489468812942505
help script post function http::request::common understand correctli part post-request look request creat object look,2013-11-07 17:18:21.323 UTC,32,19842400,wonder anyon see hwy pass usernam password web server? thanksalexi,0.15625,5,authentication http perl post,perl http post authent,4,authentication|username|password|scripting,0.6299132108688354
