answers,creation_date,len,postid,question,ratio,raw,tags,title,uniq,words,probability
complic one modul handl ui element consid well back-end storag user credenti etc handl mani web framework recommend catalyst,2011-03-15 15:09:06.603 UTC,47,5313738,new web develop perl im search perl modul handl user authent web site registr login session password recoveri im work project use html::templat,0.1276595744680851,6,authentication perl,authent modul perl,4,authentication|login|password|credential,0.6243888139724731
put unsanit data header e.g redirect cooki usual trust data receiv user need includ data user header uri_escap appropri mechan escap unsaf data,2013-12-18 07:37:02.963 UTC,51,20652173,prevent http respons split attack? http respons split allow attack manipul respons receiv web browser prevent kind attack perl,0.1568627450980392,8,http perl response,http respons split attack prevent perl,5,attack|sanitise|cookie|trust|unsafe,0.6167139410972595
captur session log browser use firefox firebug check http header - how-to header script includ user agent check cooki end someth,2015-07-08 05:00:25.12 UTC,145,31283839,perl script run strawberri perl login facebook use www::mechan short background script autom occasion leaderboard fun littl game invent play among group friend assign point base upon certain post object earn point simpl script complet work past last ran 4 day ago howev unabl login facebook today dump content form submiss html file appear return back login screen red error box cooki requir cooki enabl browser pleas enabl cooki browser prefer continu understand www::mechan featur automat cooki -- word default constructor bot accept cooki cooki enabl browser see screen right? read experi www:mechan http::cooki matter try fool around cooki jar everi cannot past cooki requir error code without experiment fluff simpl,0.15172413793103448,22,cookies facebook perl www-mechanize,facebook login via perl www::mechan login error cooki requir,4,cookie|login|scripting|signing,0.5983795523643494
try ad cooki jar constructor someth along line want save cooki load later retain session someth load cooki hope help autom altern object use request http://daccess-ods.un.org/access.nsf/get?open&amp;ds=a/hrc/wgad/2015/28&amp;lang= first redirect page give file get https://daccess-ods.un.org/tmp/xxx.xxx.html follow https://documents-dds-ny.un.org/doc/undoc/gen/g15/263/87/pdf/g1526387.pdf?openel still download document give error messag reason examin header browser browser set three cooki www::mechan one citrix_ns_id=xxx citrix_ns_id_.un.org_%2f_wat=xxx ltpatoken=xxx cooki come from? turn tmp html meta refresh html url https://documents-dds-ny.un.org/prod/ods_mother.nsf?login&amp;username=freeods2&amp;password=1234 cooki chang code take account output.txt success includ pdf 404 enter url browser try code detail debug output,2016-03-11 08:57:54.16 UTC,113,35935911,follow code put url assign browser end result download file run code end differ file think mayb abl handl cooki properli work,0.11504424778761062,13,cookies html mechanize perl,mechan deal cooki browser,5,cookie|signing|login|username|password,0.5938500165939331
add class say element contain password initi content mask add bit javascript page add handler element class handl toggl similar garbag show valu gener html use cgi.pm instead templat advic futur assum fix exist codebas btw relev bit cgi.pm document html gener function within longer maintain issu bug patch reject unless relat fundament broken page render rational html gener function obfusc best mainten nightmar worst use templat engin better separ concern see exampl use modul function perldoc consid deprec longer maintain fix featur accept howev continu exist cgi.pm without deprec warn soft deprec continu realli want document function move,2017-05-04 12:19:49.557 UTC,130,43782746,tabl 7 column one contain password pw dont want show password websit kind click expand tabl show part script contain tabl,0.06153846153846154,8,bash linux passwords perl,html button revbeal password input field,3,password|scripting|obfuscate,0.5911598801612854
instal libssh2 sourc packag default instal /usr/loc default packag instal /usr probabl find stock instal version unfortun seem ubuntu fairli old libssh2 version bugfix lot sinc recommend use libssh2-devel mail list in-depth libssh2 question small friendli commun creat patch net::ssh2 allow locat libssh2 lib header command line captur full build process libssh2 + net::ssh2 use abl success log server use pass-phras protect key net::ssh2 ubuntu 11.04 libnet-ssh2-perl packag anyway consid use net::openssh net::openssh::compat::ssh2 instead net::ssh2 updat net::openssh::compat::ssh2 tri replac net::ssh2 need patch applic order try,2011-05-26 13:24:59.67 UTC,270,6139213,simpl perl test script use net::ssh2 troubl get work public key authent note read coupl repli realis mention creat script help narrow problem anoth applic use net::ssh2 therefor possibl switch altern packag net::openssh net::openssh::compat::ssh2 note updat salva point net::openssh::compat::ssh2 use without patch origin applic code gener key pair use ubuntu work correctli - ssh server run perl code follow error use password protect key try non-password protect key work correctli follow librari instal plot thicken remov error expect build sourc unabl reinstal find develop header howev reinstal build instal sourc work mean build libssh2-1-dev ubuntu 10.04 fault? instal sourc correctli instal without requir presum build sourc overwrit overrid ubuntu packag updat note daniel stenberg repli ubuntu 10.04 packag littl date version 1.2.2 compar latest stabl build 1.2.8 instal libssh2 sourc top ubuntu packag solv problem howev feel messi remov ubuntu packag instal libssh2 sourc still build net::ssh2 &mdash tell net::ssh2 find libssh2 develop headers? updat 2 salva came rescu show net::ssh2 instal configur directori use sourc instal libssh2 thank salva! note instead patch possibl overrid variabl top awar look salva patch,0.16296296296296298,44,libssh2 perl,key net::ssh2,7,ssh|scripting|public key|authentication|openssh|password|protect,0.5893096923828125
look http basic authent usual use web server apach httpd come handi question belong serverfault write login page php web script languag password enter read content select page send trick move file outsid document root script print login screen list document radio button print success login one script log set someth session data script check print document,2011-03-05 08:46:20.703 UTC,158,5202700,html document want add login page restrict access html document someon help write server side script ad requir direct apach config file tried:i ad web page login form ad perl script server check usernam password redirect user html document sure direct add config file without direct user load html document directli use direct url html page googl mostli find http authent use browser http authent mean authent use authtyp want login page want redirect author user html page user try access target html page use url page anoth page access deni,0.13924050632911392,22,apache cgi perl web-applications,ad login page authent html document,6,login|authentication|scripting|username|password|authorise,0.5885160565376282
instal modul support smtp sasl? one advantag strawberri perl easili instal modul cpan exampl email::simpl email::send,2010-10-30 20:59:07.383 UTC,78,4060669,write simpl mail client perl use smtp log mail server send mail anoth e-mail address differ host raw smtp command strawberri perl come sasl.pm need order authent howev script tri authent fail tri auth login auth plain mechan luck exampl ywxwage= cgfzc3dvcmq= user password encod base64 whatev submit server alway complain either usernam password wrong wrong,0.1282051282051282,10,authentication perl smtp,smtp authent problem,6,authentication|scripting|login|password|encode|username,0.5879271626472473
problem look mechan pass cooki request debug mechan write cooki disk got file content i.e empti cooki file gangabass suggest chang user agent cooki start appear file pass subsequ request problem solv call fix write cooki disk accord http::cooki modul document provid follow argument constructor order cooki store disk method present order load cooki back disk,2014-05-08 08:32:26.127 UTC,176,23536648,want login via perl script http://www.tennisinsight.com/match_previews.htm download page stuck login site via script 1 site use cooki store login data 2 login form trigger javascript import simpl web page local containt given right usernam pass send need data site redirect main page user log cooki creat short simpl post correct data client side 3.i success tri fetch page need curl correct cooki provid think post myti.php store return cooki open correct page read cooki trick fail save cooki part.. script try cooki print stdout moment edit:i found exampl store cooki problem empti file empti stdout. seem call php redirect cooki store login fail sorri new perl gener seem miss someth,0.16477272727272727,29,cookies mechanize perl,save cooki post method perl mechan redirect,4,cookie|login|scripting|username,0.5878137350082397
fwiw run pcap traffic found new system get block filter problem modul script,2014-01-20 06:05:23.827 UTC,96,21227236,copi work perl script use net::twitt 10.04 ubuntu system 12.04 ubuntu system work anymor get follow error runtime:net::twitter::role::oauth::get_authorization_url https://api.twitter.com/oauth/request_token fail 500 handshakefail ok.pl line 22 try curl url this:curl https://api.twitter.com/oauth/request_token fail valid oauth signatur token seem show get firewal web proxi fine exampl one script twitter script 500 error spent hour look fix though still loss whether ssl issu modul connect issu twitter fwiw net::twitt 12.04 box current net:twitt 10.04 box current help appreci thank,0.16666666666666666,16,oauth perl twitter,oauth net::twitt ssl 500 handshakefail,7,oauth|ssl|scripting|authorise|validate|signature|firewall,0.5825373530387878
,2017-03-26 08:19:09.283 UTC,57,43026571,tri fetch content confluenc page use curl hit within perl script page protect behind sso page.th confluenc page redirect sso page ask username/password sampl output look idea around restriction? although prefer server side - tri use jsonp approach scrape data client side well - howev approach yield much,0.12280701754385964,7,curl perl,use curl fetch sso enabl page content,5,sso|scripting|protect|username|password,0.5590439438819885
http::request modifi provid url url encod must done url assembl &mdash actual url compon encod &mdash http::request expect encod alreadi done,2011-05-16 14:18:22.75 UTC,69,6018741,write small perl tool help speed process blind sql inject attack ethic tool job script manag http request alreadi url-encod hex valu %xx.therefor request encod twice send web browser kind code disabl perl url encod insid request,0.15942028985507245,11,http perl request url urlencode,disabl url encod insid http request,4,encode|sql injection|attack|scripting,0.5550757646560669
cooki sampl googl web analyt cooki via javascript unless crawler write execut javascript cooki simpli never crawler see browser utterli irrelev fix - crawler see get count,2011-10-28 16:56:12.15 UTC,83,7932354,task site php use nginx tri autom abl log subsequ request rest site fail bunch cooki abl captur grab respons header exist miss 5 other although see browser cooki think one use persist authent token ive tri use perl abl sinc burp written java jsoup contain,0.14457831325301204,12,cookies http-headers java perl php,handl secur cooki web crawler,5,cookie|security|authentication|burp|scripting,0.5545102953910828
need propag steam header singl sign-on solutiuon full quirk luck look develop guid steam describ authn/authz system game unlucki bundl binari object lucki tell exactli propag login info,2012-11-18 03:52:59.99 UTC,117,13437317,use www::mechan perl modul try login websit requir steam authent far abl login page success submit form seem work form submit content page chang fail login want try search hour tri lot differ combin set form box submit text noth work reason found littl check mechan see login work perhap search term good code gotten far go tf2wh login form redirect steam login page fill user/pass click button go back tf2wh login session save cooki howev part work initi login redirect,0.1282051282051282,15,login-script perl www-mechanize,login websit requir anoth websit,5,login|scripting|authentication|cookie|signing,0.5533137917518616
final implement @simbabqu use,2017-07-17 08:30:10.22 UTC,31,45139374,run curl request within perl script password user name contain special character&amp break url pleas let know solv,0.16129032258064516,5,curl perl url-encoding,special charact contain password break url,4,encode|password|scripting|user name,0.5513153672218323
websit use csrf token hidden tag defin login page store csrf token token gener script help use www selenium abl log site download file issu resolv,2019-07-15 12:29:16.697 UTC,78,57039795,tri login site use mechan perl script log index page try content page file hyperlink present log assum look content page secondli download file indirect hyperlink file direct action download file pleas guid much help avail particular case code,0.11538461538461539,9,perl www-mechanize,use www:mechan login download file perl script cannot actual page content,4,login|scripting|availability|csrf,0.5506638884544373
invalid cooki must expir follow code expir except protect cooki name necessari cgi::cooki low-level interfac function alreadi expos method,2012-03-11 00:14:50.453 UTC,56,9651349,follow perl script need invalid cooki hash note upper part code rest deal print cooki work sinc right cooki need manual later code atm code invalid cooki anyon see,0.30357142857142855,17,cookies foreach invalidation perl,invalid select perl cooki,5,cookie|validate|scripting|hash|protect,0.545015811920166
accord lwp::userag change-log ad version older/low version lwp::userag change-log 6.00 2011-03-08 - […] lwp::userag got new ssl_opt method control well follow @anfi suggest ran cpan avail firew said relev packag instal date look content packag found system ad script switch @steffen ulrich suggest version relev compon reveal instal script work fine without complain,2020-02-25 16:23:19,102,60399083,perl 5.16.3 rhel 7 fairli gener request howev still return default ssl_verify_mod ssl_verify_non client deprecated! plea ssl_verify_mod ssl_verify_p possibl ssl_ca_file|ssl_ca_path verif realli want verifi certif keep connect open man-in-the-middl attack plea ssl_verify_mod explicitli ssl_verify_non applic version modul return version ignor request verifi peer,0.1568627450980392,16,perl ssl https,lwp::userag ignor ssl_verify_p,5,ssl|certificate|attack|availability|scripting,0.54412442445755
,2018-08-10 20:07:39.653 UTC,34,51793436,real firefox browser authent https://www.briefing.com/login/subscriber.aspx place cooki hard drive afterward start anoth session bypass authent step directli reach data page https://www.briefing.com/investor/calendars/earnings/2018/08/09 code tri duplic avail wrong,0.2647058823529412,9,authentication cookies lwp-useragent perl,wrong usag cooki lwp::userag,5,authentication|cookie|login|bypass|availability,0.5440974235534668
otion 1 - hardcod index.cgi insert valu javascript code index.cgi option 2 - assign $cookies{uid}->valu hidden input testjavascript pick later index.cgi,2014-07-15 12:03:21.953 UTC,46,24757760,want transfer data cgi page javascript/jqueri return back cgi page index.html form content login.cgi index.cgi test_javascript.j,0.1956521739130435,9,cgi html javascript jquery perl,transfer data cgi javascript/jqueri,4,scripting|login|signing|cookie,0.5359100103378296
need put form control insid form call alreadi output form control need submit valu script submit script gener html form avail form submit regular submit button instead gener button attach javascript go attach javascript via need actual javascript perl browser support client side perl,2013-11-26 12:15:53.64 UTC,123,20216838,hi new perl cgi htmli work linux apach correctli configur simpl program ask usernam password input come html file gener perl script use cgi modul perl user click login button event send variabl anoth perl script authentication. problem send variabl use button onclick property.i seen lot answer say submit button work lot answer say javascript dont know work pleas help!thi login perl script login.plx subauthent script authentication.plx pleas help,0.16260162601626016,20,cgi forms perl,run perl script html button onclick event,6,scripting|username|password|login|authentication|availability,0.5268126726150513
http://search.cpan.org seem temporarili broken https://metacpan.org instead certif bypass use,2013-06-15 19:56:45.307 UTC,68,17127374,"anyon notic seriou problem cpan downloads?al download link seem iunabl resolv www.cpan.org,but directori structur insid cpan allow simpl swap search.cpan.org.ha anyon found fix? tri metacpan.org wget http://metacpan.org/cpan/authors/id/m/mp/mpiotr/text-iconv-1.7.tar.gz result --2013-06-15 16:00:17-- https://metacpan.org/cpan/authors/id/m/mp/mpiotr/text-iconv-1.7.tar.gz connect metacpan.org|46.43.35.68|:443. connected.error certif common name “cpan.metacpan.org” doesn’t match request host name “metacpan.org”.to connect metacpan.org insecur ‘--no-check-certificate’ tri without certif page found happen cpan",0.11764705882352941,8,perl,cpan download fail,4,authorise|certificate|insecure|bypass,0.521573543548584
simpl avoid user click button sever time add javascript page ofc work script i.e press f5 write log file/databas server hold ip address user timestamp check whether alreadi submit addit set check cooki probabl go cooki see cooki doc simpl exampl,2012-07-16 12:27:38.583 UTC,99,11504325,"i’m write small perl page receiv post method submit want abl prevent singl person/comput submit form multipl time avoid flood repetit submit can’t find exampl explan perl cgi advis direct examples?i understand data http header token? and/or plant cooki first submit i’m sure help appreciated.best regards,-arseni",0.0707070707070707,7,cgi double-submit-problem http-headers perl security,avoid form submit twice user perl cgi,3,security|cookie|scripting,0.519062340259552
hidden input field assum fill navig download use browser rather use url directli addit set cooki via javascript pick mechan howev plugin www::mechanize::plugin::javascript abl help experi livehttphead see get submit browser replic assum violat tos problem mention well known mechan simplest solut raspo librari,2010-10-06 13:02:35.243 UTC,83,3872676,tri perl www::mechan download file login websit valid form download file thing hour succeed want end script save file zip file html file noth interest script done help find mistak done,0.13253012048192772,11,login-script mechanize perl,login download file perl www::mechan,5,login|scripting|validate|cookie|violate,0.5170760154724121
protect cross-sit request forgeri server side best html escap templat system templat toolkit escap capabl cgi.pm escapehtml sub limit life time session cooki rel short period cgi::sess done $session->expire$tim check refer output vulner page use/accept request modifi data framework specif simpl look cgi::application::plugin::protectcsrf modul cgi::appl framework hard modifi modul frameworks.bas user form hidden html field ad gener token session object get token form submit form-submit token compar token session object server match csrf like occur catalyst plugin catalyst::controller::requesttoken modul attribut handler littl modif requir exist app,2009-05-08 21:44:17.803 UTC,111,841957,transpar librari someth easi prevent cross-sit request forgeri csrf perl apache? gener token form valid server-sid,0.13513513513513514,15,apache csrf perl,prevent cross-sit request forgeri perl apach,7,csrf|cross-site|forgery|validate|protect|cookie|vulnerability,0.5124322772026062
"think md5 good fast enough want add constant charact salt avoid rainbow table/web lookup instanc string 127.0.0.1 md5 f528764d624db129b32c21fbca0cb8d6 quit googl hit szabgab127.0.0.1 hand get search - 501ff2fbdca6ee72247f8c61851f17b9 - match document post answer.. ⚠ md5 sha-1 ⚠ see articl weak salt sha-2 instead crypt::saltedhash provid nice abstract recommend perl bind digest::sha use xs talk expens profil code yet? code yet written? earli think optimis secur must first concern edit exampl code anoth option crypt::eksblowfish::bcrypt reason better howev precis ekspensive—how expens tunable—which make crack attempt anywher somewhat ludicr impract applic cach crypt ips slow duplic seen least build answer @marcog @daxim hmac exampl hmac-sha hard-cod secret key log gener devic secret leak scheme becom weak one given far perhap simpli secret key concept encrypt ip address aes 128 bit block size perfect ensur 1-1 map possibl ip address aes ecb mode hash someon brute forc attack easiest thing bloom filter particular c++ bloom filter implement http://www.afflib.org/ allow add arbitrari string bloom filter probe see present want protect brute forc attack rais fals posit frequenc 1 billion uniqu peopl abl figur ip address seen rabin fingerprint fast easi implement given n-bit messag 0 ,...,m n-1 view polynomi degre n-1 finit field gf2 pick random irreduc polynomi px degre k gf2 defin fingerprint remaind rx divis fx px gf2 view polynomi degre k-1 k-bit number note still perfect hash function seek one like go face issu abl crack function obtain origin ip hash case extrem low chanc collis fingerprint accept note whatev hash function end use trivial find log entri given ip address hash function known want secur encrypt hash",2010-12-29 08:27:33.827 UTC,333,4552566,web applic log data make sure identifi data came differetn time ip address hand privaci concern data releas publicli make sure actual ip cannot retriev need one map ip address string ensur 1-1 map understand correctli md5 sha1 sha256 solut wonder expens term process needed? interest solut though implement perl even better,0.13813813813813813,46,hash ip-address md5 perl privacy,log ip address uniqu without store ip address privaci,16,hash|md5|privacy|sha|salt|rainbow table|crypt|security|crack|hmac|leak|encrypt|aes|attack|protect|fingerprint,0.5090309381484985
innam answer work seem straight forward assum alreadi object document seem use intern default ignor cooki unless attribut someth untest code,2013-05-23 12:45:30.283 UTC,113,16714318,right use rest::client perfectli good job come make request fetch json data howev api question issu post request pass csrf token session id enter right credenti json use post request thing see fetch cooki use rest::client tri lwp abl execut json request cooki set still cooki tri store file tri variabl still noth cookies? p.s sure request execut sinc see right output see cooki third parti rest client edit } code realli dirti sinc tri 50 differ thing output follow,0.10619469026548672,12,cookies csrf lwp perl rest,perl rest::client best csrftoken session id cooki,3,cookie|csrf|credential,0.5082554817199707
,2017-05-30 10:03:02.69 UTC,133,44259186,tri improv jqueri skill develop litt websit contain login system look best practis secur login system far connect databas user valid http-redirect ad param took differ least better look request submit ajax request call return json-st contain statu json-st statu success return true result submit form question form post password believ replac password valu add kind session valu form abl check later user session valid i? done profession secur level? access form data long post try avoid use profession websit ugli url suppos transport usernam + session id? cooki here? realli work cooki far sinc user read cooki still add real password replac password session id understand secur requir chang even http http provid secur connect still save store real password anywher client,0.15789473684210525,21,ajax javascript jquery perl,jqueri login - best practis login,8,scripting|login|security|validate|password|transport|username|cookie,0.5058196783065796
host script access it? want access javascript origin i.e hostnam port page javascript run access it? either forget javascript regular link cgi perform 302 redirect ajax bewar time issu possibl browser go next url get around make ajax request redirect probabl better approach imag object part html dom allow manipul imag html page read http://www.javascriptkit.com/jsref/image.shtml script creat imag object assign url cgi script src attribut make browser perform request content url case go display imag object content return cgi script need real imag want though either side-effect cgi script call paramet desir advantag method violat origin polici sinc imag allow load anywher,2012-01-24 20:13:28.247 UTC,134,8993448,tri make link click goe site suppos run cgi script found differ exampl still fulli understand essenc two question host script access it? access,0.12686567164179105,17,cgi javascript perl,access cgi script via javascript,4,scripting|forge|signing|violate,0.5033780932426453
,2016-10-14 12:50:33.983 UTC,69,40043625,make script automat login webpag start page say log ...but credenti browser everyth work retriev valu cooki sent server locat set-cooki header respons ov3176019645=3inkmpee0r5gpfm41c3iltvda1 put post request send follow time everyth works. question automat valu cooki given server send request ? anoth problem appear server send back cooki follow shape set-cooki header need 1st item cooki ov3176019.. hope clear explan thank,0.15942028985507245,11,mechanize perl,perl mechan make script login webpag,4,scripting|login|credential|cookie,0.5027438998222351
