postid,links,tags,title,question,answers,uniq,raw,words,len,ratio,probability
92,https://api.github.com/repos/xkcoding/spring-boot-demo/issues/92,pr,spring boot demo rbac secur token,spring boot demo rbac secur token readm md token applic yml redi mysql,,2,4,rbac|security,20,0.2,0.44006720185279846
877,https://api.github.com/repos/resilience4j/resilience4j/issues/877,pr,cover report secur issu report grade ou,fix report secur issu grade main project overview user trust report sonar secur vulner,kudo sonarcloud qualiti gate secur review code,3,6,security|trust|vulnerability,29,0.20689655172413793,0.43950986862182617
1629,https://api.github.com/repos/spring-projects/spring-security/issues/1629,issue,sec support custom authenticationdetailssourc form login tag,mauricio migrat said use tag configur custom authenticationdetailssourc workaround reconfigur usernamepasswordauthenticationfilt custom filter reconfigur loginurlauthenticationentrypoint loginformurl properti spring xml becom pollut minor function auto config built form login page lost,luke said duplic sec pleas check open issu open new one issu duplic,4,10,authentication|login|username|password,51,0.19607843137254902,0.43896186351776123
1823,https://api.github.com/repos/Activiti/Activiti/issues/1823,issue,xstream cve vulner brought back spring cloud netflix,see,,2,2,cve|vulnerability,10,0.2,0.4389260411262512
3696,https://api.github.com/repos/eugenp/tutorials/issues/3696,issue,expir url spring secur mvc session,spring direct expiredurl invalidsessionurl project sampl ever work,,2,2,security|validate,15,0.13333333333333333,0.43849289417266846
646,https://api.github.com/repos/mock-server/mockserver/issues/646,issue,depend jackson librari secur vulner,seen depend jackson librari secur vulner plan updat higher version,updat,2,4,security|vulnerability,17,0.23529411764705882,0.43734002113342285
1074,https://api.github.com/repos/spring-projects/spring-security/issues/1074,issue,sec nice sampl ldap show spring bean explicitli,brian said nice anoth sampl ldap exampl show spring bean explicitli see defaultldapauthoritiespopul work role prefix defin,luke said bug luke said ad second provid bean ldap sampl use tradit bean configur ad info manual mention defaultldapauthoritiespopul point javadoc class quit detail,2,7,ldap|authorise,51,0.13725490196078433,0.436458945274353
5851,https://api.github.com/repos/spring-projects/spring-security/issues/5851,issue,oauth autoconfigur take exist userdetailsservic account,summari use potenti exist userdetailsservic bean taken account set userauthenticationconvert defaultuserauthenticationconvert default setuserdetailsservic method actual behavior custom userdetailsservic pick expect behavior pick configur use okta version spring boot releas spring secur org springframework secur oauth boot spring secur oauth autoconfigur releas sampl see spring boot applic applic class main method add okta profil start edit applic yml put okta domain run except show custom user detail servic pick,thank report part spring secur codebas issu realli belong pleas creat ticket thank report true thank put,3,9,oauth|authentication|security,92,0.09782608695652174,0.4348231256008148
801,https://api.github.com/repos/aws/aws-sdk-java/issues/801,issue,jackson known secur vulner,sdk use jackson maven depend version vulner per upgrad depend version order ensur vulner depend use futur strongli recommend check automat fail build vulner depend cvss score found,actual affect jackson dataformat xml use aws sdk detect fals posit dependencycheck per close issu,2,5,security|vulnerability,48,0.10416666666666667,0.4345186948776245
11996,https://api.github.com/repos/wildfly/wildfly/issues/11996,pr,wfli fix weld integr legaci secur,correct securitysubsystemrootresourcedefinit actual regist org wildfli legaci secur server secur manag capabl correct modul import serversecuritymanag secur subsystem modul wildfli core,retest pleas,2,7,integrity|security,30,0.23333333333333334,0.43444374203681946
7899,https://api.github.com/repos/spring-projects/spring-boot/issues/7899,issue,internation one spring boot secur sampl,pleas updat one spring boot secur sampl internation request springsecurityinternation someth spring boot secur n configur automat,explain bit specif favour guid prefer keep sampl pure integr test rais issu submit pull request,2,5,security|integrity,40,0.125,0.432600736618042
2692,https://api.github.com/repos/spring-projects/spring-security/issues/2692,issue,sec last access page login form save csrf disabl,rossen migrat said use jsf spring secur next page login succe one configur default last page user tri access note jsf spring secur csrf support must disabl case appar spring secur java config save post request jsf alway post workaround configur requestcach explicitli e g,rob said resolv,3,7,login|csrf|security,58,0.1206896551724138,0.4317242503166199
2089,https://api.github.com/repos/spring-cloud/spring-cloud-netflix/issues/2089,issue,spring cloud zuul access rout full authent requir access resourc,follow spring cloud offici document write demo spring cloud zuul access microservic zuul access rout result,spring boot secur actoat endpoint default manag secur enabl fals disabl featur add depend spring boot starter secur project,2,4,authentication|security,46,0.08695652173913043,0.4314478933811188
5722,https://api.github.com/repos/spring-projects/spring-security/issues/5722,issue,add org springframework secur oauth lib bom file,hi tri org springframework secur oauth client oauth resttempl class spring secur oauth lib found librari includ bom file look follow bom file org springframework spring framework bom org springframework secur spring secur bom org springframework boot spring boot depend org springframework cloud spring cloud depend none contain inform librari thing manag find librari org springframework cloud spring cloud starter oauth provid much function pull bunch differ librari add org springframework secur oauth lib bom file creat bom file packag,thank report first bom file speak spring secur org springframework cloud spring cloud starter oauth bom spring cloud depend org springframework secur oauth lib bom separ read next gener oauth support spring thank inform oh know understand migrat function old org springframework secur oauth librari new spring secur oauth client spring secur oauth server librari add new spring secur oauth client oauth resttempl client librari use oauth third parti system want continu use old mechan support least year featur parodi old oauth support integr use spring secur ad support use spring secur oauth webclient bit differ prefer go forward close invalid,4,33,security|oauth|integrity|validate,190,0.1736842105263158,0.4305422306060791
8373,https://api.github.com/repos/spring-projects/spring-security/issues/8373,issue,got serializationexcept use oauth login genericjackson jsonredisseri,secur vulner pleas summari pleas provid high level summari issu use spring oauth authent author use spring redi session get serializationexcept chang redi serial genericjackson jsonredisseri actual behavior pleas describ step step behavior observ enabl oauth login websecurityconfigureradapt specifi redi store session work well want inform store json format redi add redisconfigur got except tri add oauth authorizationrequestmixin class got anoth except org springframework secur oauth core authorizationgranttypeorg springframework secur oauth core authorizationgranttypeorg springframework secur oauth core authorizationgranttyp version pleas describ version use problem occur version org springframework boot spring boot starter secur releas org springframework boot spring boot starter oauth client releas org springframework secur oauth spring secur oauth releas org springframework session spring session data redi releas io lettuc lettuc core releas,jackson serial support oauth client recent ad releas via upgrad x resolv issu jackson serial support oauth client recent ad releas via upgrad x resolv issu resolv thank hi team depend updat pleas face issu thank modul contain jackson support,6,29,oauth|login|security|vulnerability|authentication|authorise,172,0.1686046511627907,0.43048906326293945
50,https://api.github.com/repos/apache/shiro/issues/50,pr,shiro includ boolean flag firstsuccessfulstrategi break first success authent,includ boolean short circuit flag indic firstsuccessfulstrategi break first success authent default flag fals continu iter realm,hey thought someon respond alreadi holiday hit coupl comment renam someth els mayb someth name thing hardest part add test agre name everyth done push chang great rebas resolv conflict pleas thank refer link build result access right ci server need refer link build result access right ci server need result failur truncat kb fast archiv compress kb artifact rel jenkin archiv home jenkin jenkin slave workspac shiro pr jdk test coverag pom xml org apach shiro shiro test coverag snapshot shiro test coverag snapshot pom jenkin archiv home jenkin jenkin slave workspac shiro pr jdk crypto pom xml org apach shiro shiro crypto snapshot shiro crypto snapshot pom jenkin archiv home jenkin jenkin slave workspac shiro pr jdk core pom xml org apach shiro shiro core snapshot shiro core snapshot pom jenkin archiv home jenkin jenkin slave workspac shiro pr jdk sampl aspectj pom xml org apach shiro sampl sampl aspectj snapshot sampl aspectj snapshot pom jenkin archiv home jenkin jenkin slave workspac shiro pr jdk sampl spring boot web pom xml org apach shiro sampl sampl spring boot web snapshot sampl spring boot web snapshot pom jenkin archiv home jenkin jenkin slave workspac shiro pr jdk sampl spring client pom xml org apach shiro sampl sampl spring client snapshot sampl spring client snapshot pom jenkin archiv home jenkin jenkin slave workspac shiro pr jdk tool hasher pom xml org apach shiro tool shiro tool hasher snapshot shiro tool hasher snapshot pom jenkin archiv home jenkin jenkin slave workspac shiro pr jdk support spring boot spring boot starter pom xml org apach shiro shiro spring boot starter snapshot shiro spring boot starter snapshot pom jenkin archiv home jenkin jenkin slave workspac shiro pr jdk support jaxr pom xml org apach shiro shiro jaxr snapshot shiro jaxr snapshot pom jenkin archiv home jenkin jenkin slave workspac shiro pr jdk sampl guic pom xml org apach shiro sampl sampl guic snapshot sampl guic snapshot pom jenkin archiv home jenkin jenkin slave workspac shiro pr jdk crypto cipher pom xml org apach shiro shiro crypto cipher snapshot shiro crypto cipher snapshot pom jenkin archiv home jenkin jenkin slave workspac shiro pr jdk crypto cipher target shiro crypto cipher snapshot jar org apach shiro shiro crypto cipher snapshot shiro crypto cipher snapshot jar jenkin archiv home jenkin jenkin slave workspac shiro pr jdk crypto cipher target shiro crypto cipher snapshot javadoc jar org apach shiro shiro crypto cipher snapshot shiro crypto cipher snapshot javadoc jar jenkin archiv home jenkin jenkin slave workspac shiro pr jdk crypto cipher target shiro crypto cipher snapshot sourc jar org apach shiro shiro crypto cipher snapshot shiro crypto cipher snapshot sourc jar fast archiv compress kb artifact rel jenkin archiv home jenkin jenkin slave workspac shiro pr jdk sampl web pom xml org apach shiro sampl sampl web snapshot sampl web snapshot pom jenkin archiv home jenkin jenkin slave workspac shiro pr jdk support servlet plugin pom xml org apach shiro shiro servlet plugin snapshot shiro servlet plugin snapshot pom jenkin archiv home jenkin jenkin slave workspac shiro pr jdk support spring pom xml org apach shiro shiro spring snapshot shiro spring snapshot pom jenkin archiv home jenkin jenkin slave workspac shiro pr jdk support guic pom xml org apach shiro shiro guic snapshot shiro guic snapshot pomchannel stoppedset statu fceb ad e f c e e f c failur url messag failur use context jenkin mvn clean instal refer link build result access right ci server need result failur truncat kb jenkin archiv home jenkin jenkin slave workspac shiro pr config core target shiro config core snapshot javadoc jar org apach shiro shiro config core snapshot shiro config core snapshot javadoc jar jenkin archiv home jenkin jenkin slave workspac shiro pr config core target shiro config core snapshot sourc jar org apach shiro shiro config core snapshot shiro config core snapshot sourc jar jenkin archiv home jenkin jenkin slave workspac shiro pr test coverag pom xml org apach shiro shiro test coverag snapshot shiro test coverag snapshot pom jenkin archiv home jenkin jenkin slave workspac shiro pr crypto pom xml org apach shiro shiro crypto snapshot shiro crypto snapshot pom jenkin archiv home jenkin jenkin slave workspac shiro pr core pom xml org apach shiro shiro core snapshot shiro core snapshot pom jenkin archiv home jenkin jenkin slave workspac shiro pr sampl aspectj pom xml org apach shiro sampl sampl aspectj snapshot sampl aspectj snapshot pom jenkin archiv home jenkin jenkin slave workspac shiro pr sampl spring boot web pom xml org apach shiro sampl sampl spring boot web snapshot sampl spring boot web snapshot pom jenkin archiv home jenkin jenkin slave workspac shiro pr sampl spring client pom xml org apach shiro sampl sampl spring client snapshot sampl spring client snapshot pom jenkin archiv home jenkin jenkin slave workspac shiro pr tool hasher pom xml org apach shiro tool shiro tool hasher snapshot shiro tool hasher snapshot pom jenkin archiv home jenkin jenkin slave workspac shiro pr support spring boot spring boot starter pom xml org apach shiro shiro spring boot starter snapshot shiro spring boot starter snapshot pom jenkin archiv home jenkin jenkin slave workspac shiro pr support jaxr pom xml org apach shiro shiro jaxr snapshot shiro jaxr snapshot pom jenkin archiv home jenkin jenkin slave workspac shiro pr sampl guic pom xml org apach shiro sampl sampl guic snapshot sampl guic snapshot pom jenkin archiv home jenkin jenkin slave workspac shiro pr crypto cipher pom xml org apach shiro shiro crypto cipher snapshot shiro crypto cipher snapshot pom jenkin archiv home jenkin jenkin slave workspac shiro pr crypto cipher target shiro crypto cipher snapshot jar org apach shiro shiro crypto cipher snapshot shiro crypto cipher snapshot jar jenkin archiv home jenkin jenkin slave workspac shiro pr crypto cipher target shiro crypto cipher snapshot javadoc jar org apach shiro shiro crypto cipher snapshot shiro crypto cipher snapshot javadoc jar jenkin archiv home jenkin jenkin slave workspac shiro pr crypto cipher target shiro crypto cipher snapshot sourc jar org apach shiro shiro crypto cipher snapshot shiro crypto cipher snapshot sourc jar jenkin archiv home jenkin jenkin slave workspac shiro pr sampl web pom xml org apach shiro sampl sampl web snapshot sampl web snapshot pom jenkin archiv home jenkin jenkin slave workspac shiro pr support servlet plugin pom xml org apach shiro shiro servlet plugin snapshot shiro servlet plugin snapshot pom jenkin archiv home jenkin jenkin slave workspac shiro pr support spring pom xml org apach shiro shiro spring snapshot shiro spring snapshot pom jenkin archiv home jenkin jenkin slave workspac shiro pr support guic pom xml org apach shiro shiro guic snapshot shiro guic snapshot pomchannel stoppedset statu fceb ad e f c e e f c failur url messag failur use context jenkin mvn clean instal superced,4,74,authentication|crypt|hash|cipher,1161,0.06373815676141258,0.42714256048202515
1179,https://api.github.com/repos/spring-projects/spring-security/issues/1179,issue,sec richfac framework error login,marcelo romulo said applic use work fine spring secur includ richfac jsf framework login page redirect css file problem describ,marcelo romulo said login page written xhtml facelet marcelo romulo said web xml file contain configur richfac facelet jsf spring secur marcelo romulo said spring secur configur file applic luke said evid bug spring secur said applic work without richfac add longer work correspond bug open jboss jira close duplic refer exist fix issu luke said invalid per jboss referenc issu forum,3,8,login|security|validate,88,0.09090909090909091,0.42521870136260986
11383,https://api.github.com/repos/spring-projects/spring-boot/issues/11383,issue,remov manag secur enabl document,remov spring boot doc still mention properti pleas adjust document add sampl altern disabl secur manag endpoint,updat actuat secur addit feedback migrat spring manag endpoint configur spring boot found section littl confus deploy applic behind firewal prefer actuat endpoint access without requir authent chang manag endpoint web expos properti follow experi use actuat togeth spring secur oauth enough expos enabl endpoin thank feedback line refer case spring secur classpath case set flag actuat avail requir authent like case behind firewal spring secur classpath present set flag enabl actuat secur spring boot auto config differ present probabl true case sinc use oauth app spring boot auto config back user full control actuat access rule reason need explicitli add updat doc make explicit want expos actuat endpoint deploy behind firewal similar spring boot replac manag secur enabl fals manag endpoint web expos enough anyth els done said previou comment flag enabl actuat spring secur classpath want actuat access without requir authent need provid defin secur configur provid exampl configur spring secur present set enough access actuat endpoint without requir authent thank work attach exampl method cannot access outsid packag unfortun bug fix,5,21,security|firewall|authentication|oauth|availability,197,0.1065989847715736,0.42365142703056335
7972,https://api.github.com/repos/spring-projects/spring-security/issues/7972,issue,spring secur updat x x break secur configur,summari pleas provid high level summari issu updat spring secur version releas start point releas build start fail code updat actual behavior build break expect behavior work code basic authent configur endpoint anymatch ignor goe exampl code build pass version springbootvers releas org springframework secur spring secur config releas,issu appear doubl post pleas see inform,2,6,security|authentication,65,0.09230769230769231,0.4234752357006073
5775,https://api.github.com/repos/hazelcast/hazelcast/issues/5775,issue,imap getal method bypass interceptor v higher,intercept assign specifi map interceptor expect call bypass behavior actual version higher everyth intercept,,2,3,bypass|signing,22,0.13636363636363635,0.4217737317085266
25104,https://api.github.com/repos/spring-projects/spring-framework/issues/25104,issue,fix sonartyp vulner cve spring web project,fix sonartyp vulner cve spring web project latest version spring web jar,guess refer case secur issu spring framework codebas rather well known insecur setup refer document warn long time underli question applic use java deseri use input untrust sourc thank see answer moment use java deseri see secur vulner build time build break forc jar secur team allow jar sorri hear java deseri untrust sourc broader problem specif spring framework java applic without spring depend expos vulner best practic actual flaw spring framework codebas see noth cve perspect mayb touch secur team secur vulner tool vendor work particular case switch java solv think advic applic secur pleas reach secur team vendor thank,5,18,vulnerability|cve|security|insecure|trust,121,0.1487603305785124,0.42177239060401917
1226,https://api.github.com/repos/Atmosphere/atmosphere/issues/1226,issue,invalid spring secur session tomcat,run tomcat atmospher invalid spring secur session problem run jetti atmospher rc,show us spring config spring secur librari version control code whether use nio bio apr post number exampl integr spring atmospher spring secur anoth person probabl better idea never inject spring secur session alway null explicitli look servletcontext inject suspend method signatur session use spring secur key mon aug pm stalexxx notificationswrot run tomcat atmospher invalid spring secur session problem run jetti repli email directli view tomcat bio connector use tomcat spring secur find problem occur stream transport use chane long poll fix issu find problem securitycontextimpl instanc contain corrupt authent atmospher thread note pattern atmospher requst filter secur bean bean atmospher handler context root project atmospher rpc class name ru befre qiwi server servic gwtrpcatmospherehandl web xml atmosphereservlet atmosphereservlet org atmospher cpr atmosphereservlet org atmospher useblock true,7,19,validate|security|integrity|inject|signature|transport|authentication,146,0.13013698630136986,0.42101922631263733
12018,https://api.github.com/repos/wildfly/wildfly/issues/12018,pr,wfli fix weld integr legaci secur,correct securitysubsystemrootresourcedefinit actual regist org wildfli legaci secur server secur manag capabl correct modul import serversecuritymanag secur subsystem modul wildfli core org jboss core secur add test princip x variant,,2,8,integrity|security,37,0.21621621621621623,0.4207358658313751
2084,https://api.github.com/repos/spring-projects/spring-security/issues/2084,issue,sec allow custom authenticationmanag global method secur,luke migrat said sinc possibl mutipl filter chain namespac conveni differ authenticationmanag configur filter chain even implement authenticationmanag interfac deal authentiationprovid implement make sens provid hook namespac element facilit,agustin said hi luke saw fix recent download compil latest snapshot spring secur order differ authent manag tag document sure handl pleas explain littl current singl creat new one assign tag thank much advanc agustin bruno j said hi problem configur differ authent manag two element try configur authent manag ref element ocurr follow except org xml sax saxparseexcept cvc complex type attribut authent manag ref allow appear element header secur xml use put browser xsd load declar attribut authent manag ref element xsd spring secur config rc jar,3,14,authentication|security|signing,126,0.1111111111111111,0.4202549159526825
52740,https://api.github.com/repos/elastic/elasticsearch/issues/52740,pr,updat idp plugin secur polici,apachexmlsecurityiniti depend opensaml attempt org apach xml secur ignorelinebreak system properti exist,ping secur secur,2,6,security|saml,21,0.2857142857142857,0.419810026884079
2392,https://api.github.com/repos/dropwizard/dropwizard/issues/2392,issue,updat latest secur fix jackson,jackson releas secur fix last week cve good dropwizard updat includ jackson jackson,,2,3,security|cve,19,0.15789473684210525,0.4195243716239929
1551,https://api.github.com/repos/spring-projects/spring-security-oauth/issues/1551,issue,spring secur oauth imposs add multipl secur filter chain,hi normal behavior abl add multipl securityfilterchain type exampl multi modul applic secur spring secur oauth configur sever filter modul surpris see one filterchain regist normal someth wrong use spring secur oauth v releas thank,,2,9,security|oauth,45,0.2,0.4195091426372528
219,https://api.github.com/repos/web3j/web3j/issues/219,issue,cannot find org web j crypto,cannot find org web j crypto packag org web j util org web j crypto find hash java file,try add depend crypto org web j crypto follow modular releas appear need explicitli add depend per comment look fix intent quit granular e core pull crypto pleas tell problem web j appear caus follow gradl process upgrad version issu pull artefact nexu bintray cannot find web j maven releas definit avail see upgrad gradl fix issu web j suffer problem,3,8,crypt|hash|availability,87,0.09195402298850575,0.41864296793937683
18385,https://api.github.com/repos/spring-projects/spring-boot/issues/18385,issue,configur oauth client reactiv oauth client auto configur,spring secur ad webflux configur consist servlet counterpart follow spring boot explicitli configur bean type instead reli one spring secur back presenc oauth need updat bean includ configur,sinc spring secur chang made,2,6,oauth|security,42,0.14285714285714285,0.41845372319221497
5672,https://api.github.com/repos/spring-projects/spring-security/issues/5672,issue,add support featur polici secur header webflux,secur vulner pleas summari see,,2,3,security|vulnerability,13,0.23076923076923078,0.4182785153388977
3924,https://api.github.com/repos/spring-projects/spring-security/issues/3924,issue,spring secur xsd www springframework org schema secur,spring secur xsd file seem valid eclips show error find file fix use spring secur,hit issu pleas upload default schema latest version spring project still default schema thank feedback resolv,2,5,security|validate,40,0.125,0.4178224503993988
2096,https://api.github.com/repos/aws/aws-sdk-java/issues/2096,issue,jackson databind consid secur risk blackduck need upgrad,blackduck identifi certain vulner version jackson data bind use exampl latest one issu discov fasterxml jackson databind jackson default type along gadget class ibati allow exfiltr content fix pleas upgrad latest version,hi thank reach sdk affect recent report vulner secur issu sdk continu jackson databind version x note secur section sdk support java version newer jackson databind x requir least java cannot upgrad howev overrid version jackson databind project latest version announc plan deprec java upgrad jackson hi debora thank triag issu request upgrad jackson databind remov depend replac someth better system manag secur updat jackson databind steadi stream cve vulner mani compani air autom tool scan product artefact known cve servic use jackson databind must upgrad constantli thank marc,3,9,security|vulnerability|cve,130,0.06923076923076923,0.41778361797332764
