postid,links,tags,title,question,answers,uniq,raw,words,len,ratio,probability
5011,https://api.github.com/repos/apache/pulsar/issues/5011,pr,secur upgrad jackson databind,motiv current pulsar distribut secur vulner upgrad latest modif upgrad version howev use pulsar sql cf,,2,3,security|vulnerability,21,0.14285714285714285,0.3387010097503662
1754,https://api.github.com/repos/spring-projects/spring-security-oauth/issues/1754,issue,spring oauth stateless token expiri check,summari configur spring secur stateless spring boot client app okta store token cooki authent success incom request cooki read secur context popul actual behavior notic check token expiri invok expect behavior token expiri valid filter invok configur version releas releas sampl process filter invok need popul memori store cooki,,5,8,oauth|security|cookie|authentication|validate,56,0.14285714285714285,0.3382786810398102
2085,https://api.github.com/repos/dropwizard/dropwizard/issues/2085,issue,updat jackson address deseri secur vulner,jackson deseri secur vulner detail dropwizard x branch dropwizard x branch pr,thank submit think affect dropwizard app unless specif funki thing e g least understand read excel paper refer think nevertheless push bugfix releas updat dropwizard jackson version affect vulner,2,5,security|vulnerability,48,0.10416666666666667,0.33776018023490906
1653,https://api.github.com/repos/Activiti/Activiti/issues/1653,issue,cve drool xxe vulner,see x x x x,,3,3,cve|xxe|vulnerability,10,0.3,0.3375750184059143
1652,https://api.github.com/repos/Activiti/Activiti/issues/1652,issue,cve groovi vulner,see x x x x,,2,2,cve|vulnerability,9,0.2222222222222222,0.3375084698200226
5236,https://api.github.com/repos/spring-projects/spring-security/issues/5236,issue,oauth web express handler identifi unsupport tag,expect behavior report error version,pleas log issu spring secur oauth,2,3,oauth|security,19,0.15789473684210525,0.33659833669662476
13948,https://api.github.com/repos/spring-projects/spring-boot/issues/13948,issue,add webflux autoconfigur support spring secur oauth resourc server,similar webflux support configur jwk uri spring boot need point support public key find sampl,,3,3,security|oauth|public key,25,0.12,0.3354906737804413
2613,https://api.github.com/repos/jeremylong/DependencyCheck/issues/2613,issue,fals posit pkg npm safe eval,fals posit report node modul safe evalreport ossindex vulner see vulner descript recommend updat version later even though alreadi use recommend version packag id pkg npm safe eval confid highest url locat depend pkg npm safe evalcp cpe safe eval cve sandbox breakout,,6,11,safe|vulnerability|scripting|cpe|cve|sandbox,50,0.22,0.334943950176239
1539,https://api.github.com/repos/spring-projects/spring-security/issues/1539,issue,sec concurr session control namespac usag xml spring secur config project seem invalid xml element,ebrahim migrat said check whole sourc code today th nov regard xsd main resourc org springframework secur config spring secur xsd defin src test resourcesamespac usag xml spring secur config project seem xml element invalid valid previou version xsd e g correct join spring commun yesterday sure post correct format place,luke said file actual use test code allow conveni test variou configur option editor issu impact framework user,2,7,security|validate,85,0.08235294117647059,0.33361300826072693
128,https://api.github.com/repos/halo-dev/halo/issues/128,issue,csrf vulner,issu x halo x github wiki x x bug secur csrf vulner discov test chang password demo site admin back vulner url reflect csrf vulner allow remot attack send web page csrf script eg,thank vulner report fix soon someth wrong,6,13,csrf|vulnerability|security|password|attack|scripting,44,0.29545454545454547,0.3334040939807892
7506,https://api.github.com/repos/spring-projects/spring-boot/issues/7506,pr,add spring boot secur kaptcha exampl,thank contribut spring boot pleas provid brief descript pull request refer relat issu number prefix refer add spring boot secur kaptcha exampl add springboot secur exampl kaptcha one cannot recaptcha exampl authenticationfilt exampl ask stackoverflow com complet exampl sign wefin,pleas sign contributor licens manual synchron statu pull request see frequent ask question thank pull request gener speak provid sampl thing auto configur auto configur kaptcha want sampl perhap publish exampl github blog instead see,5,8,security|scripting|captcha|authentication|signing,82,0.0975609756097561,0.3329015076160431
928,https://api.github.com/repos/flowable/flowable-engine/issues/928,pr,align decod cooki method method abstractremembermeservic spring secur,cooki encod differ spring secur pr align encod spring secur,,4,8,decode|cookie|security|encode,19,0.42105263157894735,0.3320065438747406
144,https://api.github.com/repos/spring-cloud/spring-cloud-gateway/issues/144,issue,spring secur integr user authent author gateway,look forward spring secur integr spring cloud gateway common pattern api gateway gateway take respons user authent author current version see warn spring mvc found classpath incompat spring cloud gateway time pleas remov spring boot starter web depend attempt achiev integr spring secur gateway wonder whether abl user authent author spring cloud gateway,spike use follow secur configur conjunct gateway defin rout use routeloc actual rout secur expect access given basic auth provid unfortun gatewayfilt provid serverwebexchang empti princip although actual class serverwebexchang strongli support request spring secur integr hope author via oauth support soon thank share code glad see basic auth work gateway although basic auth decent authent method rest api person hope see usernam password login json format success use spring secur gateway pass header good news believ follow messag suppos remov spring mvc found classpath incompat spring cloud gateway time pleas remov spring boot starter web depend spring mvc need spring secur see need updat latest work pleas give exampl access custom project look log say see onnext wrap deleg type understand problem think princip empti pleas look expect see name user print consol someth wrong bug empti princip anyth gateway spring secur point issu close spring secur work well spring cloud gateway updat demonstr access princip custom filter integr spring secur oauth spring cloud gateway integr break spring cloud gateway spring secur oauth requir spring mvc see close favor,9,33,security|integrity|authentication|authorise|oauth|username|password|login|delegation,241,0.13692946058091288,0.3312785029411316
13049,https://api.github.com/repos/spring-projects/spring-boot/issues/13049,issue,spring config server start encrypt enabl,encrypt enabl follow properti encrypt key store locat classpath config server jks encrypt key store password newpass encrypt key store alia config server key encrypt key store secret newpass spring cloud config server encrypt enabl true start server throw follow error descript field rsaproperti org springframework cloud config server config encryptionautoconfigur keystoreconfigur requir bean type org springframework cloud bootstrap encrypt rsaproperti found action consid defin bean type org springframework cloud bootstrap encrypt rsaproperti configur pom look,spring cloud config issu tracker never mind close issu work move properti bootstrap properti thank,3,12,encrypt|password|scripting,98,0.12244897959183673,0.33109432458877563
1107,https://api.github.com/repos/spring-projects/spring-security/issues/1107,issue,sec pleas provid document configur wespher x use contain manag secur webspher preauth filter,said pleas provid document configur wespher x use contain manag secur webspher preauth filter,luke said basic pre authent document written sec adequ combin javadoc webspher specif class,2,3,security|authentication,43,0.06976744186046512,0.3310445547103882
378,https://api.github.com/repos/codecentric/spring-boot-admin/issues/378,issue,spring boot admin server ui login depend avail maven repositori,hello search maven repositori spring boot admin server ui login depend cannot seem find anywher ad yet timelin ad thank,login modul part releas schedul end januari boot releas snapshot build avail thank quick respons need postpon spring boot admin releas feb sinc depend spring cloud dalston releas,2,5,login|availability,59,0.0847457627118644,0.33093923330307007
941,https://api.github.com/repos/aws/aws-sdk-java/issues/941,pr,add profil owasp enabl depend check maven plugin,check depend known secur vulner,xmlmapper java sdk unaffect vulner depend check though hi andrew thank quick feedback add suppress fals posit send new pull request,3,4,owasp|security|vulnerability,35,0.11428571428571428,0.33059394359588623
7844,https://api.github.com/repos/spring-projects/spring-security/issues/7844,issue,add methodsecuritymetadatasourc whitelist base method secur annot,summari use annot base method secur spring boot provid whitelist control method default blacklist base instead e g annot control method omit author scheme form httpsecur configur appli sampl use custom methodsecuritymetadatasourc provid packag request control method explicitli annot deni default provid better secur situat develop forget annot control method,close request found implement conflict use controlleradvic result unexpect behavior better process request fork pr,5,11,security|whitelist|blacklist|authorise|forge,73,0.1506849315068493,0.3305091857910156
20707,https://api.github.com/repos/spring-projects/spring-framework/issues/20707,issue,alway anonym authent spring secur webflux spr,jos mar sola open comment project war deploy tomcat x servlet contain start context next webappiniti configur spring secur webflux context project configur need http basic authent rest resourc api authent perform databas implement reactiveuserdetailsservic interfac code next code exampl one rest resourc problem http basic authent work debug code never stop entri method findbyusernam class reactiveuserdetailsserviceimpl http request order try find problem debug code method class expressionbasedpreinvocationadvic argument authent anonym user alway due send http request spring framework throw next except help affect refer url,juergen comment afraid issu tracker core framework report case spring secur issu tracker github instead,3,9,authentication|security|username,109,0.08256880733944955,0.3303363621234894
21598,https://api.github.com/repos/spring-projects/spring-framework/issues/21598,issue,spring secur default login page render correctli use ssl spr,georg open comment use ssl access spring secur default login page via render correctli one stylesheet use see refer url onlin exampl link chang reason stylesheet link via link chang fix issu code login page seem gener org springframework secur web server ui loginpagegeneratingwebfilt createpag current possibl fix affect,juergen comment pleas note jira issu tracker core spring framework project pleas report case spring secur project github instead georg,3,10,security|login|ssl,80,0.125,0.3298158347606659
1171,https://api.github.com/repos/redisson/redisson/issues/1171,issue,spring session spring secur error,org redisson client redisexcept unexpect except process command caus com fasterxml jackson databind jsonmappingexcept construct instanc org springframework secur authent usernamepasswordauthenticationtok n suitabl constructor found deseri object valu miss default constructor creator perhap need add enabl type inform sourc io netti buffer bytebufinputstreamlin column refer chain org springframework secur core context securitycontextimpl aut hentic,try anoth codec pleas see,4,8,security|authentication|username|password,65,0.12307692307692308,0.3294972777366638
3148,https://api.github.com/repos/spring-projects/spring-security/issues/3148,issue,sec multipl authent filter,youmoo migrat said secur xml issu access router hello browser clientopenidconnectauthenticationfilt invok instead openidconnectauthenticationfilt think router secur openidconnectauthenticationfilt pleas explain thank,rob said close invalid jira bug enhanc question appropri spring secur tag note seem need provid detail gener provid detail explan happen expect happen feel one filter use anoth,4,11,authentication|security|openid|validate,55,0.2,0.32941046357154846
2273,https://api.github.com/repos/micronaut-projects/micronaut-core/issues/2273,issue,pleas open secur advisori,believ found secur vulner pleas open secur,pleas email infowith inform opportun publish mitig fix along advisori user left vulner said vulner valid thank see collabor privat open draft one close process,3,7,security|vulnerability|validate,37,0.1891891891891892,0.32922905683517456
3304,https://api.github.com/repos/spring-projects/spring-security/issues/3304,issue,sec changesessionidauthenticationstrategi seem swallow except result null authent secur context holder,stephen migrat said hi folk upon upgrad releas releas longer abl authent success web applic use spring boot org springframework boot spring boot starter secur releas org springframework boot spring boot starter secur releas java config spring secur remain unchang upgrad appear changesessionidauthenticationstrategi throw except prevent compositesessionauthenticationstrategi iter deleg releas debug log debug nio exec w usernamepasswordauthenticationfilt request process authent debug nio exec authent providermanag authent attempt use c x user customauthenticationprovid debug nio exec compositesessionauthenticationstrategi deleg org springframework secur web authent session changesessionidauthenticationstrategi debug nio exec w c httpsessionsecuritycontextrepositori securitycontext empti content anonym context store httpsession debug nio exec w c securitycontextpersistencefilt securitycontexthold clear request process complet releas debug log debug nio exec w usernamepasswordauthenticationfilt request process authent debug nio exec authent providermanag authent attempt use c x user customauthenticationprovid debug nio exec compositesessionauthenticationstrategi deleg org springframework secur web authent session changesessionidauthenticationstrategi debug nio exec compositesessionauthenticationstrategi deleg org springframework secur web csrf csrfauthenticationstrategi debug nio exec w usernamepasswordauthenticationfilt authent success updat securitycontexthold contain org springframework secur authent usernamepasswordauthenticationtokenprincip stephen stephen morrison credenti protect authent true detail org springframework secur web authent webauthenticationdetailsremoteipaddress sessionid efcfc f f c c grant author role id group id role id role id role user java config web app follow authenticationprovid authenticationprovid authenticationprovid remembermeauthenticationprovid antmatch admin authorizerequest anyrequest hasauthor role user admin formlogin loginpag login permital defaultsuccessurl home logout logouturl logout permital rememberm remembermeservic remembermeservic userdetailsservic ticket smell impact part releas perhap miss session fixat relat config java config cheer stephen,,11,71,authentication|security|delegation|username|password|csrf|credential|protect|authorise|login|session fixation,259,0.27413127413127414,0.3289933502674103
4297,https://api.github.com/repos/spring-projects/spring-security/issues/4297,issue,revisit oauth modul structur,summari new modul new oauth support includ modul includ openid connect specif implement artifact make sens break modul includ new one call,current depend hierarchi oauth modul follow spring secur oauth core spring secur core spring secur oauth client spring secur oauth core spring secur jwt jose spring secur jwt jose spring secur oauth core feel modul hierarchi correct contempl split oauth openid connect core separ modul give thought feel necessari introduc unnecessari complex oidc core essenti extend oauth core therefor tightli bound one consider decid potenti renam follow modul spring secur oauth core spring secur oauth oidc core spring secur oauth client spring secur oauth oidc client thought renam build new featur oauth oidc envis follow modul featur structur spring secur oauth core oauth author openid connect core spring secur oauth client openid connect core openid connect discoveri futur openid connect dynam client registr futur openid connect session manag futur openid connect back channel logout futur spring secur jwt jose json web token json web signatur futur json web encrypt futur json web key futur discuss good current modul name close leav,6,42,oauth|openid|security|authorise|signature|encrypt,188,0.22340425531914893,0.3280985355377197
4237,https://api.github.com/repos/eclipse/jetty.project/issues/4237,issue,simplifi openid modul configur,current configur openid modul necessari secur handler error page init param good configur simplifi user configur xml discov servic loader error page web xml,,2,3,openid|security,29,0.10344827586206896,0.32762181758880615
1914,https://api.github.com/repos/spring-cloud/spring-cloud-netflix/issues/1914,issue,veracod test identifi ribbonloadbalancinghttpcli java cross site script xss flaw,hi use spring cloud netflix core releas jar got issu ran veracod test code improp neutral script relat html tag web page basic xss cwe id class ribbonloadbalancinghttpcli java line per issu call contain cross site script xss flaw line number ribbonloadbalancinghttpcli java class believ fals posit veracod pleas let us know reason submit mitig issu accordingli thank raja,think fals posit,5,10,cross site|scripting|xss|improper neutralisation|cwe,73,0.136986301369863,0.3265547752380371
1624,https://api.github.com/repos/Activiti/Activiti/issues/1624,pr,cve common mail vulner fix,fix x,,2,2,cve|vulnerability,8,0.25,0.32579612731933594
679,https://api.github.com/repos/jeremylong/DependencyCheck/issues/679,issue,fals posit cpe cpe jcore jcore apach mime j,fals posit cpe org apach jame apach mime j core report cpe jcore jcore base cve cpe jcore jcore php cms,thank suppress rule ad includ next releas thread automat lock sinc recent activ close pleas open new issu relat bug,2,6,cpe|cve,51,0.11764705882352941,0.32533907890319824
6314,https://api.github.com/repos/spring-projects/spring-security/issues/6314,issue,reactivemanagementwebsecurityautoconfigur prevent oauth login default,classpath build configur path result bypass call default actual classpath requir properti configur appli relat,sampl app follow temporarili workaround close favour,4,4,security|oauth|login|bypass,28,0.14285714285714285,0.3246166706085205
6362,https://api.github.com/repos/spring-projects/spring-security/issues/6362,issue,regress unsuccess authent event publish,thank much work put project summari regress event publish unsuccess event think chang certain intend behavior case need configur differ actual behavior far see happen authent manag get instanti parent authent manag authent manag event publish unsuccess event publish twice authent manag parent authent manag expect behavior event get publish configur hope enough otherwis bit complic version spring boot spring secur work spring secur work sampl provid complet sampl e link github repositori give issu higher prioriti issu complet sampl,thank report relat resolv see backport patch schedul go close issu upcom releas resolv issu thank much swift respons sorri abl find referenc issu,2,8,authentication|security,110,0.07272727272727272,0.3238449692726135
316,https://api.github.com/repos/spring-projects/spring-security-oauth/issues/316,pr,fix javadoc issu spring secur oauth modul compil java,fix issu project wide still spring secur oauth least,merg thank,2,4,security|oauth,21,0.19047619047619047,0.32332420349121094
1338,https://api.github.com/repos/springfox/springfox/issues/1338,issue,auth endpoint spring secur detect,hello springfox spring boot spring secur problem auth endpoint display swagger ui display swagger ui p custom implement spring secur support jwt authent,think jwt support swagger ui,2,4,security|authentication,34,0.11764705882352941,0.323241651058197
2194,https://api.github.com/repos/spring-projects/spring-security/issues/2194,issue,sec sec custom authent provid element mention spring secur refer document despit remov,grzegorz migrat said refer manual page request header authent sitemind x x mention element accord remov drop child element,rob said thank submit issu push updat remov mention custom authent provid along small fix,2,4,authentication|security,48,0.08333333333333333,0.3225869834423065
22651,https://api.github.com/repos/elastic/elasticsearch/issues/22651,issue,pom org elasticsearch client x pack transport jar invalid,pom org elasticsearch client x pack transport jar invalid prevent maven use transit depend maven issu warn warn pom org elasticsearch client x pack transport jar invalid transit depend avail enabl debug log detail relat comment duplic xml tag,relat fix,3,7,transport|validate|availability,51,0.13725490196078433,0.32194584608078003
