postid,links,tags,title,question,answers,uniq,raw,words,len,ratio,probability
6899,https://api.github.com/repos/spring-projects/spring-security/issues/6899,issue,spring secur test meta annot attribut work withmockus,summari creat meta annot spring secur test use usernam alias attribut work actual behavior creat follow annot goal annot role preset still allow switch usernam use test usernam default valu user expect behavior usernam foo configur spring boot webflux applic spring secur version spring boot spring secur starter spring boot test starter spring secur test addit info guess use though awar implic,,2,9,security|username,71,0.1267605633802817,0.538908839225769
2022,https://api.github.com/repos/spring-projects/spring-security/issues/2022,issue,sec spring secur config declar mandatori depend openid java,dave migrat said spring secur config declar mandatori depend openid java right look depend lurker,issu duplic,2,4,security|openid,27,0.14814814814814814,0.5371883511543274
1317,https://api.github.com/repos/spring-projects/spring-boot/issues/1317,issue,configur actuat endpoint basic authent caus enpoint secur,use sprint boot releas spring boot starter web secur class path jetti ssl context add actuat endpoint secur mvc endpoint secur enabl spring secur work manag endpoint main mvc endpoint insid websecurityconfigureradapt tri luck exampl great updat think got work spring secur auto configur endpoint secur,default enabl basic authent endpoint spring secur avail sure anyth actuat actual want secur certain endpoint code seem fine,4,14,authentication|security|ssl|availability,74,0.1891891891891892,0.5346600413322449
1258,https://api.github.com/repos/spring-projects/spring-security-oauth/issues/1258,issue,upgrad spring secur bad credenti print trace except,refer project work fine spring sampl code problem util delegatingpasswordencod upgrad spring secur jwt oauth work input incorrect password matter add except handler except translat print trace except log consol idea log info restartedmain c oauth jwt springbootjwtappl start springbootjwtappl lz mrva pid c user git java springboot jwt master target class start c user git java springboot jwt master info restartedmain c oauth jwt springbootjwtappl activ profil fall back default profil default info restartedmain configservletwebserverapplicationcontext refresh org springframework boot web servlet context annotationconfigservletwebserverapplicationcontextstartup date fri dec cst root context hierarchi info restartedmain h v engin validatorfactoryimpl hv tempor valid toler info restartedmain b w embed tomcat tomcatwebserv tomcat initi port info restartedmain apach catalina core standardservic start servic tomcat info restartedmain org apach catalina core standardengin start servlet engin apach tomcat info ost startstop catalina core aprlifecyclelisten apr base apach tomcat nativ librari allow optim perform product environ found java librari path c swdtool eclips x jdk x bin c window sun java bin c window system c window c window system c window c window system wbem c window system windowspowershel v c window system windowspowershel v c program file x microsoft applic virtual client c program file x java jre bin c program file x ibm lotu note c program file x java jre bin c program file x microsoft sql server tool binn c program file microsoft sql server tool binn c program file microsoft sql server dts binn c window system windowspowershel v c swdtool selenium bin c program file x ibm client access emul c program file x ibm client access share c program file x ibm client access c window system windowspowershel v c program file x safecom safecomprintcli c program file safecom safecomappprint c programdata anaconda c programdata anaconda librari mingw w bin c programdata anaconda librari usr bin c programdata anaconda librari bin c programdata anaconda script c user appdata local atom bin c swdtool git bin c emerson command c emerson commandsodej c user appdata roamingpm info ost startstop c c c tomcat localhost initi spring embed webapplicationcontext info ost startstop web context contextload root webapplicationcontext initi complet ms info ost startstop b w servlet filterregistrationbean map filter corsfilt info ost startstop b w servlet filterregistrationbean map filter characterencodingfilt info ost startstop b w servlet filterregistrationbean map filter hiddenhttpmethodfilt info ost startstop b w servlet filterregistrationbean map filter info ost startstop b w servlet filterregistrationbean map filter requestcontextfilt info ost startstop delegatingfilterproxyregistrationbean map filter springsecurityfilterchain info ost startstop b w servlet servletregistrationbean map servlet dispatcherservlet info ost startstop b w servlet servletregistrationbean map servlet webservlet h consol info restartedmain com zaxxer hikari hikaridatasourc testdb start info restartedmain com zaxxer hikari hikaridatasourc testdb start complet info restartedmain jdbc datasourc init scriptutil execut sql script url file c user git java springboot jwt master target class schema h sql info restartedmain jdbc datasourc init scriptutil execut sql script url file c user git java springboot jwt master target class schema h sql ms info restartedmain jdbc datasourc init scriptutil execut sql script url file c user git java springboot jwt master target class data h sql info restartedmain jdbc datasourc init scriptutil execut sql script url file c user git java springboot jwt master target class data h sql ms info restartedmain j localcontainerentitymanagerfactorybean build jpa contain entitymanagerfactori persist unit default info restartedmain hibern jpa intern util loghelp hhh process persistenceunitinfo name default info restartedmain org hibern version hhh hibern core final info restartedmain org hibern cfg environ hhh hibern properti found info restartedmain hibern annot common version hcann hibern common annot final info restartedmain org hibern dialect dialect hhh use dialect org hibern dialect h dialect info restartedmain h v engin validatorfactoryimpl hv tempor valid toler info restartedmain j localcontainerentitymanagerfactorybean initi jpa entitymanagerfactori persist unit default info restartedmain p e frameworkendpointhandlermap map oauth author onto public org springframework web servlet modelandview org springframework secur oauth provid endpoint authorizationendpoint author java util map java util map org springframework web bind support sessionstatu java secur princip info restartedmain p e frameworkendpointhandlermap map oauth author method post param user oauth approv onto public org springframework web servlet view org springframework secur oauth provid endpoint authorizationendpoint approveordeni java util map java util map org springframework web bind support sessionstatu java secur princip info restartedmain p e frameworkendpointhandlermap map oauth token method onto public org springframework secur oauth provid endpoint tokenendpoint getaccesstoken java secur princip java util map throw org springframework web httprequestmethodnotsupportedexcept info restartedmain p e frameworkendpointhandlermap map oauth token method post onto public org springframework secur oauth provid endpoint tokenendpoint postaccesstoken java secur princip java util map throw org springframework web httprequestmethodnotsupportedexcept info restartedmain p e frameworkendpointhandlermap map oauth check token onto public java util map org springframework secur oauth provid endpoint checktokenendpoint checktoken java lang string info restartedmain p e frameworkendpointhandlermap map oauth confirm access onto public org springframework web servlet modelandview throw java lang except info restartedmain p e frameworkendpointhandlermap map oauth error onto public org springframework web servlet modelandview info restartedmain p e frameworkendpointhandlermap map oauth token key method onto public java util map org springframework secur oauth provid endpoint tokenkeyendpoint getkey java secur princip info restartedmain web defaultsecurityfilterchain creat filter chain orrequestmatch requestmatch ant pattern oauth token ant pattern oauth token key ant pattern oauth check token org springframework secur web context request async webasyncmanagerintegrationfilterorg springframework secur web context securitycontextpersistencefilterorg springframework secur web header headerwriterfilterorg springframework secur web authent logout logoutfilterorg springframework secur web authent www basicauthenticationfilterorg springframework secur web savedrequest requestcacheawarefilterorg springframework secur web servletapi securitycontextholderawarerequestfilterorg springframework secur web authent anonymousauthenticationfilterorg springframework secur web session sessionmanagementfilterorg springframework secur web access exceptiontranslationfilterorg springframework secur web access intercept filtersecurityinterceptor info restartedmain web defaultsecurityfilterchain creat filter chain org springframework secur oauth config annot web configur resourceserverconfigur notoauthrequestmatch org springframework secur web context request async webasyncmanagerintegrationfilterorg springframework secur web context securitycontextpersistencefilterorg springframework secur web header headerwriterfilterorg springframework secur web authent logout logoutfilterorg springframework secur oauth provid authent oauth authenticationprocessingfilterorg springframework secur web savedrequest requestcacheawarefilterorg springframework secur web servletapi securitycontextholderawarerequestfilterorg springframework secur web authent anonymousauthenticationfilterorg springframework secur web session sessionmanagementfilterorg springframework secur web access exceptiontranslationfilterorg springframework secur web access intercept filtersecurityinterceptor info restartedmain web defaultsecurityfilterchain creat filter chain org springframework secur web util matcher anyrequestmatch org springframework secur web context request async webasyncmanagerintegrationfilterorg springframework secur web context securitycontextpersistencefilterorg springframework secur web header headerwriterfilterorg springframework secur web authent logout logoutfilterorg springframework secur web authent www basicauthenticationfilterorg springframework secur web savedrequest requestcacheawarefilterorg springframework secur web servletapi securitycontextholderawarerequestfilterorg springframework secur web authent anonymousauthenticationfilterorg springframework secur web session sessionmanagementfilterorg springframework secur web access exceptiontranslationfilt warn restartedmain c web builder websecur secur debug enabl includ sensit inform product system info restartedmain h v engin validatorfactoryimpl hv tempor valid toler info restartedmain w requestmappinghandleradapt look org springframework boot web servlet context annotationconfigservletwebserverapplicationcontextstartup date fri dec cst root context hierarchi warn restartedmain awebconfigur jpawebmvcconfigur spring jpa open view enabl default therefor databas queri perform view render explicitli configur spring jpa open view disabl warn info restartedmain w requestmappinghandlermap map springjwt citi onto public java util list tech comfortheart oauth jwt control resourcecontrol getus info restartedmain w requestmappinghandlermap map springjwt user method onto public java util list tech comfortheart oauth jwt control resourcecontrol getus info restartedmain w requestmappinghandlermap map error onto public info restartedmain w requestmappinghandlermap map error produc text html onto public org springframework web servlet modelandview info restartedmain w handler simpleurlhandlermap map url path webjar onto handler type class org springframework web servlet resourc resourcehttprequesthandl info restartedmain w handler simpleurlhandlermap map url path onto handler type class org springframework web servlet resourc resourcehttprequesthandl info restartedmain w handler simpleurlhandlermap map url path favicon ico onto handler type class org springframework web servlet resourc resourcehttprequesthandl info restartedmain b optionallivereloadserv livereload server run port info restartedmain j e annotationmbeanexport regist bean jmx exposur startup info restartedmain j e annotationmbeanexport bean name datasourc autodetect jmx exposur info restartedmain j e annotationmbeanexport locat mbean datasourc regist jmx server mbean com zaxxer hikari name datasourc type hikaridatasourc info restartedmain b w embed tomcat tomcatwebserv tomcat start port context path info restartedmain c oauth jwt springbootjwtappl start springbootjwtappl second jvm run info nio exec c c c tomcat localhost initi spring frameworkservlet dispatcherservlet info nio exec web servlet dispatcherservlet frameworkservlet dispatcherservlet initi start info nio exec web servlet dispatcherservlet frameworkservlet dispatcherservlet initi complet ms info nio exec spring secur debugg request receiv post oauth token org apach catalina connector requestfacad host localhost author basic dgvzdgp dgnsawvudglkolhzn ttem oemwxmda user agent curl accept content length content type applic x www form urlencod secur filter chain webasyncmanagerintegrationfilt securitycontextpersistencefilt headerwriterfilt logoutfilt basicauthenticationfilt requestcacheawarefilt securitycontextholderawarerequestfilt anonymousauthenticationfilt sessionmanagementfilt exceptiontranslationfilt filtersecurityinterceptor info nio exec h h querytranslatorfactoryiniti hhh use astquerytranslatorfactori error nio exec provid endpoint tokenendpoint handl error invalidgrantexcept bad credenti org springframework secur oauth common except invalidgrantexcept bad credenti org springframework secur oauth provid password resourceownerpasswordtokengrant getoauth authent resourceownerpasswordtokengrant java spring secur oauth releas jar na org springframework secur oauth provid token abstracttokengrant getaccesstoken abstracttokengrant java spring secur oauth releas jar na org springframework secur oauth provid token abstracttokengrant grant abstracttokengrant java spring secur oauth releas jar na org springframework secur oauth provid compositetokengrant grant compositetokengrant java spring secur oauth releas jar na org springframework secur oauth config annot web configur authorizationserverendpointsconfigur grant authorizationserverendpointsconfigur java spring secur oauth releas jar na org springframework secur oauth provid endpoint tokenendpoint postaccesstoken tokenendpoint java spring secur oauth releas jar na sun reflect nativemethodaccessorimpl invok nativ method na sun reflect nativemethodaccessorimpl invok nativemethodaccessorimpl java na sun reflect delegatingmethodaccessorimpl invok delegatingmethodaccessorimpl java na java lang reflect method invok method java na org springframework web method support invocablehandlermethod doinvok invocablehandlermethod java spring web releas jar releas org springframework web method support invocablehandlermethod invokeforrequest invocablehandlermethod java spring web releas jar releas org springframework web servlet mvc method annot servletinvocablehandlermethod invokeandhandl servletinvocablehandlermethod java spring webmvc releas jar releas org springframework web servlet mvc method annot requestmappinghandleradapt invokehandlermethod requestmappinghandleradapt java spring webmvc releas jar releas org springframework web servlet mvc method annot requestmappinghandleradapt handleintern requestmappinghandleradapt java spring webmvc releas jar releas org springframework web servlet mvc method abstracthandlermethodadapt handl abstracthandlermethodadapt java spring webmvc releas jar releas org springframework web servlet dispatcherservlet dodispatch dispatcherservlet java spring webmvc releas jar releas org springframework web servlet dispatcherservlet doservic dispatcherservlet java spring webmvc releas jar releas org springframework web servlet frameworkservlet processrequest frameworkservlet java spring webmvc releas jar releas org springframework web servlet frameworkservlet dopost frameworkservlet java spring webmvc releas jar releas tomcat emb core jar org springframework web servlet frameworkservlet servic frameworkservlet java spring webmvc releas jar releas tomcat emb core jar org apach catalina core applicationfilterchain internaldofilt applicationfilterchain java tomcat emb core jar org apach catalina core applicationfilterchain dofilt applicationfilterchain java tomcat emb core jar org apach tomcat websocket server wsfilter dofilt wsfilter java tomcat emb websocket jar org apach catalina core applicationfilterchain internaldofilt applicationfilterchain java tomcat emb core jar org apach catalina core applicationfilterchain dofilt applicationfilterchain java tomcat emb core jar org springframework secur web filterchainproxi virtualfilterchain dofilt filterchainproxi java spring secur web releas jar releas org springframework secur web access intercept filtersecurityinterceptor invok filtersecurityinterceptor java spring secur web releas jar releas org springframework secur web access intercept filtersecurityinterceptor dofilt filtersecurityinterceptor java spring secur web releas jar releas org springframework secur web filterchainproxi virtualfilterchain dofilt filterchainproxi java spring secur web releas jar releas org springframework secur web access exceptiontranslationfilt dofilt exceptiontranslationfilt java spring secur web releas jar releas org springframework secur web filterchainproxi virtualfilterchain dofilt filterchainproxi java spring secur web releas jar releas org springframework secur web session sessionmanagementfilt dofilt sessionmanagementfilt java spring secur web releas jar releas org springframework secur web filterchainproxi virtualfilterchain dofilt filterchainproxi java spring secur web releas jar releas org springframework secur web authent anonymousauthenticationfilt dofilt anonymousauthenticationfilt java spring secur web releas jar releas org springframework secur web filterchainproxi virtualfilterchain dofilt filterchainproxi java spring secur web releas jar releas org springframework secur web servletapi securitycontextholderawarerequestfilt dofilt securitycontextholderawarerequestfilt java spring secur web releas jar releas org springframework secur web filterchainproxi virtualfilterchain dofilt filterchainproxi java spring secur web releas jar releas org springframework secur web savedrequest requestcacheawarefilt dofilt requestcacheawarefilt java spring secur web releas jar releas org springframework secur web filterchainproxi virtualfilterchain dofilt filterchainproxi java spring secur web releas jar releas org springframework secur web authent www basicauthenticationfilt dofilterintern basicauthenticationfilt java spring secur web releas jar releas org springframework web filter onceperrequestfilt dofilt onceperrequestfilt java spring web releas jar releas org springframework secur web filterchainproxi virtualfilterchain dofilt filterchainproxi java spring secur web releas jar releas org springframework secur web authent logout logoutfilt dofilt logoutfilt java spring secur web releas jar releas org springframework secur web filterchainproxi virtualfilterchain dofilt filterchainproxi java spring secur web releas jar releas org springframework secur web header headerwriterfilt dofilterintern headerwriterfilt java spring secur web releas jar releas org springframework web filter onceperrequestfilt dofilt onceperrequestfilt java spring web releas jar releas org springframework secur web filterchainproxi virtualfilterchain dofilt filterchainproxi java spring secur web releas jar releas org springframework secur web context securitycontextpersistencefilt dofilt securitycontextpersistencefilt java spring secur web releas jar releas org springframework secur web filterchainproxi virtualfilterchain dofilt filterchainproxi java spring secur web releas jar releas org springframework secur web context request async webasyncmanagerintegrationfilt dofilterintern webasyncmanagerintegrationfilt java spring secur web releas jar releas org springframework web filter onceperrequestfilt dofilt onceperrequestfilt java spring web releas jar releas org springframework secur web filterchainproxi virtualfilterchain dofilt filterchainproxi java spring secur web releas jar releas org springframework secur web filterchainproxi dofilterintern filterchainproxi java spring secur web releas jar releas org springframework secur web filterchainproxi dofilt filterchainproxi java spring secur web releas jar releas org springframework secur web debug debugfilt invokewithwrappedrequest debugfilt java spring secur web releas jar releas org springframework secur web debug debugfilt dofilt debugfilt java spring secur web releas jar releas org springframework web filter delegatingfilterproxi invokedeleg delegatingfilterproxi java spring web releas jar releas org springframework web filter delegatingfilterproxi dofilt delegatingfilterproxi java spring web releas jar releas org apach catalina core applicationfilterchain internaldofilt applicationfilterchain java tomcat emb core jar org apach catalina core applicationfilterchain dofilt applicationfilterchain java tomcat emb core jar org springframework web filter requestcontextfilt dofilterintern requestcontextfilt java spring web releas jar releas org springframework web filter onceperrequestfilt dofilt onceperrequestfilt java spring web releas jar releas org apach catalina core applicationfilterchain internaldofilt applicationfilterchain java tomcat emb core jar org apach catalina core applicationfilterchain dofilt applicationfilterchain java tomcat emb core jar org springframework web filter httpputformcontentfilt dofilterintern httpputformcontentfilt java spring web releas jar releas org springframework web filter onceperrequestfilt dofilt onceperrequestfilt java spring web releas jar releas org apach catalina core applicationfilterchain internaldofilt applicationfilterchain java tomcat emb core jar org apach catalina core applicationfilterchain dofilt applicationfilterchain java tomcat emb core jar org springframework web filter hiddenhttpmethodfilt dofilterintern hiddenhttpmethodfilt java spring web releas jar releas org springframework web filter onceperrequestfilt dofilt onceperrequestfilt java spring web releas jar releas org apach catalina core applicationfilterchain internaldofilt applicationfilterchain java tomcat emb core jar org apach catalina core applicationfilterchain dofilt applicationfilterchain java tomcat emb core jar org springframework web filter characterencodingfilt dofilterintern characterencodingfilt java spring web releas jar releas org springframework web filter onceperrequestfilt dofilt onceperrequestfilt java spring web releas jar releas org apach catalina core applicationfilterchain internaldofilt applicationfilterchain java tomcat emb core jar org apach catalina core applicationfilterchain dofilt applicationfilterchain java tomcat emb core jar org springframework web filter corsfilt dofilterintern corsfilt java spring web releas jar releas org springframework web filter onceperrequestfilt dofilt onceperrequestfilt java spring web releas jar releas org apach catalina core applicationfilterchain internaldofilt applicationfilterchain java tomcat emb core jar org apach catalina core applicationfilterchain dofilt applicationfilterchain java tomcat emb core jar org apach catalina core standardwrappervalv invok standardwrappervalv java tomcat emb core jar org apach catalina core standardcontextvalv invok standardcontextvalv java tomcat emb core jar org apach catalina authent authenticatorbas invok authenticatorbas java tomcat emb core jar org apach catalina core standardhostvalv invok standardhostvalv java tomcat emb core jar org apach catalina valv errorreportvalv invok errorreportvalv java tomcat emb core jar org apach catalina core standardenginevalv invok standardenginevalv java tomcat emb core jar org apach catalina connector coyoteadapt servic coyoteadapt java tomcat emb core jar tomcat emb core jar org apach coyot abstractprocessorlight process abstractprocessorlight java tomcat emb core jar org apach coyot abstractprotocol connectionhandl process abstractprotocol java tomcat emb core jar org apach tomcat util net nioendpoint socketprocessor dorun nioendpoint java tomcat emb core jar org apach tomcat util net socketprocessorbas run socketprocessorbas java tomcat emb core jar java util concurr threadpoolexecutor runwork threadpoolexecutor java na java util concurr threadpoolexecutor worker run threadpoolexecutor java na org apach tomcat util thread taskthread wrappingrunn run taskthread java tomcat emb core jar java lang thread run thread java na warn nio exec exceptionhandlerexceptionresolv resolv except caus handler execut error invalid grant error descript bad credenti,pom xml code snippet test sparklr test case springboot version meet problem issu similar configur spring boot oauth except thrown use wrong client credenti think simpl log line contain inform use bad credenti enough otherwis unnecessarili pollut log workaround hide stacktrac fix plan guy solut problem someon found mayb workaround everi project spring boot updat issu love know someon found workaround thank updat current higher prioriti issu work someon submit pr work merg,13,278,security|credential|delegation|password|encode|oauth|validate|safe|scripting|authorise|integrity|authentication|sensitive information,2856,0.09733893557422969,0.5343104004859924
