answers,creation_date,len,postid,question,ratio,raw,tags,title,uniq,words,probability
,2017-09-25 15:04:46.7 UTC,79,46408466,current tri push git via gitpython use http abl success prompt enter usernam password everi fetch push pull oper usernam password enter command line argument script make coupl git interact repo probabl 40+ server method config manag want ssh key especi sinc often use user host anyon know take context shell python script programmat enter usernam password alreadi code variabl command line pass usernam password gitpython shell prompt never even happen,0.13924050632911392,11,git gitlab gitpython python python-2.7,gitpython via http,4,username|password|scripting|ssh,0.5433743596076965
advis put code file call fabfile.pi run command line,2019-04-04 18:17:26.613 UTC,77,55522583,short python script eventu larger remot execut pwd command remot host test connect host use ssh key yes correctli far seem work sort hang idl window...do error check host last login date match execut script output show similar expect see actual even log tri password instead exact behavior basic get idl window > restart /path/to/script/on/windows/laptop/script.pi,0.12987012987012986,10,fabric python python-2.7 ssh ssh-keys,python script use fabric remot execut hang connect,4,ssh|scripting|login|password,0.542865514755249
run command-lin second step? port forward instead see nest ssh use python paramiko,2019-01-09 21:00:37.547 UTC,99,54118291,learn python step must connect ssh retriev inform direct connect server ok direct connect server b ok make work connect ssh via connect ssh b outsid lab secur featur make went far look everyth internet paramiko ssh agent seem work public key authent linux server linux server btw enabl detail log full error messag anonym final_serv login log look fine =/ ! full code anonym adapt dsa key forward use paramiko? feedback welcom ! stuck whole day point,0.12121212121212122,12,paramiko python ssh,python paramiko forward agent ssh,6,ssh|security|public key|authentication|login|dsa,0.5424292087554932
none,2020-01-21 03:21:56,176,59833764,explain situat ask end work comput mac mac command save curli brace let know need execut command initi ssh tunnel need give password bash abl retriev secret rsa key open dbeaver connect exasol databa credenti enter port forward home ip default port given bash command list data given server port = tunnel port comput appar server ip email suppo myuser@serverdomain.sthg key file contain rsa key ip connect exasol databa server port one user databa password user databa want deploy program regularli retriev data dwh two idea everyth python paramiko sshtunnel pyexasol python librari write program life read mani stack overflow post mani combin ssh tunnel variabl help pyexasol new seemingli isol stagnant project ssh deploy docker contain run bash execut command bash python program connect databa retriev data know littl network architectur idk even work question1 help either code open ssh tunnel sshtunnel idea docker question2 even possibl deploy this? ssh tunnel forward need come particular comput server accept it? thank read,0.13636363636363635,24,python docker ssh ssh-tunnel exasol,ssh tunnel forward connect exasol databa python bash,5,ssh|tunnelling|password|rsa|credential,0.5424138903617859
,2018-10-25 12:47:58.327 UTC,49,52989658,find direct answer question ask forum question - use python 2.6.6 version use subprocess.popen command call script argument argument password directli command get execut fine see ps -ef show password clear text handl subprocess api? multipl password pass thank,0.16326530612244897,8,passwords python security subprocess,python subprocess.popen - pass password secur,3,password|security|scripting,0.5412641167640686
malici code free access system root time! want super user privileg need run script root account sudo type password - whole point user account edit worth note run bash command within python script - exampl use subprocess modul essenti creat new bash process run given command user prompt enter password expect privileg appli subprocess creat - script call origin question sudo insid python script run script sudo root,2016-09-18 15:50:59.19 UTC,115,39559568,written python script one function open port listen open port listen need super user want run script root permiss etc saw answer regard sub-process use sub-process want far know function within applic question programmat open port super user permiss,0.13043478260869565,15,permissions python,programmat implement super user privileg script,5,privilege|scripting|malicious|password|user account,0.5411593317985535
compil python code compil python .pyc file distribut file though local machin python environ server howev imposs code decompil https://python-compiler.com/post/how-to-distribute-python-program,2019-11-06 16:52:29,118,58735006,execut python script store remot server local machin keep code script server without user copi possibl use python? basic tri secur code possibl behind usernam and/or password easili updat codebas much use ssh - python script execut local machin instead server edit use curl process substitut achiev execut bash script url execut python script command curl support password protect ideal execut script root path script /dev/fd navig directori list directori contain number use command exampl script downloaded? notic execut script directori desktop download locat work directori,0.1440677966101695,17,local python remote-server scripting,run python script local machin store remot server,6,scripting|security|username|password|ssh|protect,0.5409873127937317
usual connect remot server ad explicit link privat key,2017-11-25 19:26:52.483 UTC,41,47489746,termin follow work fine follow python code give timeouterror idea case? connect use rsa key authent vpn seem miss context need tell paramiko figur,0.14634146341463414,6,paramiko python ssh,paramiko sshclient.connect fail ssh work,4,ssh|rsa|authentication|private key,0.5404907464981079
fyi pxssh.pi modul pexpect project? handl ssh autom http://pexpect.sourceforge.net/pxssh.html make ssh connect python? line option usedboldoptlist arg = getopt.getoptsys.argv[1:] h:u:p [ help ? ] add -x uptim do:optlist arg = getopt.getoptsys.argv[1:] h:u:p:x [ help ? ] part uptim check put one this:if -x option repeat everi option forget add descript,2012-11-05 12:01:31.58 UTC,101,13231717,use pexpect.pi script login hostnam inform basic run see autom run command close abl add line end user pick choos inform see instead command line look someth basic list -x say uptim -z ifconfig -a -b -c lost add argument code,0.1188118811881188,12,pexpect python ssh,python pexpect ssh command line login argument,4,ssh|login|scripting|forge,0.5386990308761597
instead use tri detect password instead avoid prompt look batch mode open ssh design prevent prompt password call script need detect connect although comment bottom suggest use paramiko probabl technic better solut,2018-08-09 08:56:01.65 UTC,72,51762762,loop number host 400 inform system ssh key problem hand ssh key come back password want detect ask password kill ssh process continu next host code ssh part abl paramiko,0.18055555555555555,13,python ssh subprocess,find ask password loop host use subprocess.popen,4,ssh|password|signing|scripting,0.5385631322860718
ssh full rfc titl ssh transport layer protocol typic anoth layer tcp/ip simplifi explan transport function effect creat secur connect machin remot run steel conduit one build next passerbi see conduit sftp sub-protocol ssh behav cabl run ssh steel conduit possibl multipl sftp connect run ssh connect simultan connect remot server machin remot server access put togeth make sftp connect remot server first make ssh transport connect,2017-02-09 03:59:44.327 UTC,102,42127970,use paramiko python sftp file remot machin rest code make sens specif line understand transport? whole code understand make socket wrong pleas someon clarifi simpl term,0.1568627450980392,16,paramiko python python-2.7 python-3.x sftp,line python code mean,4,sftp|transport|ssh|security,0.5382446050643921
store password ssm store credenti glue? read https://medium.com/nordcloud-engineering/ssm-parameter-store-for-keeping-secrets-in-a-structured-way-53a25d48166a usag ssm,2019-02-02 04:48:41.917 UTC,107,54490076,new snowflak creat etl job need access snowflak databas tri connect snowflak two place one ec2 instanc use shell script pyspark aws glue tri connect shell script keep password config file tri connect pyspark give password sfoption = { sfurl xxx sfaccount xxx sfuser xxx sfpassword xxx sfdatabas xxx sfschema xxx } want give password safe want passwordless login key pair authent login shell script pyspark find one doc https://docs.snowflake.net/manuals/user-guide/snowsql-start.html#using-key-pair-authent know whether work pyspark shell script work pass password sfoption shown basic want give sfpassword xxx connect,0.18691588785046728,20,aws-glue pyspark python snowflake snowflake-datawarehouse,password less login snowflak pyspark,6,password|login|scripting|safe|authentication|credential,0.5371206998825073
sinc start shell remot comput task easier solv shell program artifici introduc python script end use shell start python script complic thing unnecessarili best solut actual depend want log c via b surpris sure start command c start command host c necessari login queri password tty okay ask via popup window though transmit file c restrict concern password appli better proper key anyway login without ask password transmit file c password queri interfer rid,2014-02-04 10:40:45.283 UTC,132,21550116,3 host ping ....there direct path want run script start transfer file use abl stuck.i tri send python script start work pythong script make ssh connect use subprocessmodul sinc avail allow instal either someon pleas help understand perform doubl ssh?also connect remot machin execut code code execut machin remot machin,0.12121212121212122,16,paramiko python ssh subprocess,ssh twice use python,5,ssh|scripting|availability|login|password,0.5371184945106506
ssh login home comput setup author key disabl password login setup iptabl linux machin firewal router disabl traffic port except 80 22 ssh internet start,2014-06-09 01:02:07.897 UTC,79,24112422,read post enabl remot login mysql question safe access data remotely? sql db locat home ubuntu 14.04 research purpos run python script macbook work abl remot login old window os use workbench connect dns ip howev os chang got think best/most secur accomplish task,0.1518987341772152,12,mysql python ruby-on-rails,best access data mysql db non-loc machin,8,login|safe|scripting|security|ssh|authorise|password|firewall,0.536372721195221
right problem struggl day two manag solv within 10 minut sign stackoverflow! execut command run tcpdump close ssh connect earli remov ssh.close section appear solv issu function correctli,2019-02-19 15:47:49.72 UTC,78,54770126,tri achiev autom python paramiko basic beginn logic code happi say work add command rm -f testtrace.pcap delet file download via sftp defin login credenti open ssh connect execut command run tcpdump open sftp connect file download execut command delet file,0.15384615384615385,12,paramiko python sftp ssh,paramiko ssh/ sftp multipl command,5,sftp|ssh|login|credential|signing,0.5355992317199707
,2016-07-21 13:04:44.503 UTC,45,38505072,gener privat key paramiko tri connect anoth machin use code save key gener .pub file copi key ~/.ssh/authorised_key file linux machin error authenticationexcept authent fail tri connect get go wrong pleas help code,0.15555555555555556,7,paramiko python ssh,connect linux machin use privat key paramiko python fail,4,ssh|private key|authorise|authentication,0.5349228382110596
quick answer option help insert password ssh command share key-pair ssh without password prompt search internet give ton answer exampl http://www.thegeekstuff.com/2008/11/3-steps-to-perform-ssh-login-without-password-using-ssh-keygen-ssh-copy-id first key-pair normal ssh check whether success final python script add code deal ssh,2017-08-22 23:50:57.993 UTC,91,45828554,want start python script connect raspberri wich act server conect raspberri start script thisto send data arduino anoth pc code work okay kind raw_input simplifi want connect automat raspberri ssh start python script ask input -which code constant-.i thought someth open new shell script alreadi inici someth,0.21978021978021978,20,paramiko python python-2.7 ssh,start python script shell ssh,4,ssh|scripting|password|login,0.5344592332839966
want run make user kerbero ticket prompt password e.g use modul pass input subprocess look someth establish ticket usual pick anyth look kerbero ticket usual code fragment authent ldap connect https://github.com/jeremyroman/pyceo/blob/master/ceo/ldapi.pi,2011-08-24 19:38:53.323 UTC,68,7181263,tri connect remot server via subprocess + ssh list file directori print content file directori need run kinit python subprocess.ani idea that? assum user log use kerbero id password thank,0.14705882352941177,10,python ssh subprocess,kinit use python subprocess,5,ssh|kerberos|password|authentication|ldap,0.533625602722168
,2017-04-11 12:17:02.01 UTC,73,43345680,tri fabric3 automat ssh linux box without enter password window 7 pc use openssl key gener puttygen .ppk file usual log putti python script follow output debug last line prompt password enter want tri fix look similar question paramiko debug output usual say someth along line authent fail howev see best guess public key okay addit set miss python script,0.1506849315068493,11,fabric paramiko python python-3.x ssh,fabric ssh ask password key failur debug output,6,ssh|password|openssl|scripting|authentication|public key,0.5323688387870789
add ssh-daemon port 8443 ssh-agent forwarding? privat key never get written p write maintain program,2017-04-26 11:53:42.973 UTC,64,43633459,"python program run server listen port .some servic send pair pair make ssh connect creat ssh process make protect file even machin crack ? let root user content seem ssh keyfil only? main problem must save id_rsa file disk,so ssh conect ip",0.21875,14,linux python security ssh,design secur demand,7,security|ssh|signing|protect|crack|rsa|private key,0.5322189927101135
https://bugs.launchpad.net/paramiko/+bug/912123 os using?mayb check env variable:ssh_auth_sock connect try ssh agent.in agent.pi spare public key key pass phrase ssh-add list remov abl execut paramiko base script properli list delet re-add replac localhost 127.0.0.1 alreadi password need talk agent look privat key store machin try pass extra paramet,2011-07-26 15:08:26.647 UTC,97,6832248,use python interact shell openssh run local keep get exist session except use paramiko code result abl connect previous tri adjust allow key base author fail sinc abl connect local tri restart openssh connect anoth server success search found mention author except appear case,0.12371134020618557,12,paramiko python ssh,paramiko exist session except,7,ssh|openssh|authorise|public key|scripting|password|private key,0.5317323803901672
approach problem run,2018-06-21 08:23:46.123 UTC,79,50963776,follow script make updat remot system list hundr ips need make updat use follow script ssh key configur everyth work fine deploy machin ssh key configur case ask password time make new ssh connect password devic type password hundr time conveni pass password command line work reason login root thu sudo password work case think happen autom pass password argument fab command? thank advanc,0.16455696202531644,13,fabric python python-2.7,python fabric pass root password command line argument work,4,password|scripting|ssh|login,0.5306177139282227
quit option two think straight away setup key-bas authent mechan avoid password put public key server file howto pexpect want tri,2014-09-07 08:14:58.48 UTC,61,25708296,text file call ip_addresses.txt contain 3 ip address want ssh server execut shell command code snippet ssh make ssh connect server provid provid detail well check success login server thank,0.19672131147540983,12,python ssh,python ssh server usernam password login use subprocess,6,ssh|username|password|login|authentication|public key,0.5305960774421692
run script sudo check see user sudo tri perform command,2012-06-07 10:08:38.057 UTC,46,10929708,written python script switch off/on monitor particular time use follow command .py file work properli need defin password manual need system automat retriev password option avail pleas let know,0.17391304347826086,8,python,read user login password python script,4,login|password|scripting|availability,0.5284211039543152
ask password even though specifi key extra space u ec2-us snippet extra space meant fab tri authent ec2-us instead ec2-us ssh-agent,2014-06-03 21:06:08.73 UTC,76,24024920,python script run fabfil issu ask password whenev run fabfil script howev login work fine specifi key run fabfil manual command line even though use fab paramet content fabfil syntax command line work success bit python code reason prompt password instead use key happen run,0.13157894736842105,10,fabric python ssh,run fabfil ask password although specifi key,5,ssh|password|scripting|login|authentication,0.5280070304870605
help connect pymongo mlab databas python solut work,2017-03-10 12:34:39.92 UTC,52,42718547,mongochef connect remot mongo databas next paramet server server localhost port 27017 ssh tunnel ssh address 10.1.0.90 port 25 ssh usernam usernam ssh password password connect pymongo next code next error pleas help problem? wrong,0.19230769230769232,10,mongodb pymongo python python-3.x ssh,connect remot mongodb pymongo,4,ssh|tunnelling|username|password,0.5278152823448181
,2013-04-22 17:50:34.473 UTC,56,16153504,know win32security.logonus want check credenti enter know whether match user local window machin password grant access window machin via network idea python ssh server made paramiko default window authent want log user time new connect establish authent process fail user alreadi log verifi user window without creat login session,0.14285714285714285,8,python pywin32 windows,verifi user permiss win32secur,6,security|credential|password|ssh|authentication|login,0.5265555381774902
accord document paramiko server tri connect configur properli allow public-key authent user use connect link portion document referenc hope http://www.lag.net/paramiko/docs/paramiko.transport-class.html#auth_publickey recommend check server config make sure everyth properli,2013-06-04 17:18:52.567 UTC,63,16923797,use paramiko establish sftp connect public/priv key exchang key ssh2 rsa key try connect receiv error badauthenticationtyp bad authent type allowed_types=[ ] anyon idea caus,0.19047619047619047,12,paramiko python sftp ssh-keys,authent type error paramiko use sftp,6,sftp|ssh|authentication|rsa|public-key|transport,0.5261127352714539
anoth option spin docker contain sshd servic run docker imag https://github.com/kabirbaidhya/fakeserv https://github.com/panubo/docker-sshd use test deploy script made top fabric pull imag author key server run fakeserv fakeserv ssh client instanc work ssh client script top paramiko fabric test mock server hope help reimplement ssh daemon trivial problem want depend exist configur start new sshd -f specifi specif configur -p run given port os.system make call shell want full control server action e.g order simul variou problem condit therebi realli thorough test recommend twist articl show make realli easi custom ssh server rather exist ssh server pick one list one come system mayb sshwindow window run subprocess python part start test,2010-07-06 12:56:51.823 UTC,154,3186332,write test deploy script upload file ssh depend extern server configur see creat 2 ssh daemon without authent differ port loopback interfac run deploy script two port question run dummi ssh daemon python fabric,0.12987012987012986,20,deployment fabric python ssh testing,emul ssh server test purpos,4,ssh|scripting|authentication|authorise,0.525941014289856
,2019-03-02 01:15:55.097 UTC,54,54954350,network engin goal make python script ask network devic password one time password enter secur cach ubuntu devic ask everi time login devic want store password file secur cach expir 24 hour devic reboot use ubuntu remot login devic tri look solut find one,0.18518518518518517,10,linux passwords python python-3.x ubuntu,creat password cach python linux,4,password|scripting|security|login,0.5257022976875305
first awesom mani gui rsync written truck - rsync gui app mac - use python qt pyqt chosen solv problem gener local keypair save privat key local append public key remot host authorized_key file invok rsync pass someth line configur passwordless ssh login utilis facilit rsync congratul choos python say want user authent next gui consid temporari key session clean authorized_key file appropri built solut use tkl expect recommend rout paramiko secur unless fudg implement pexpect inher insecur consid set paramiko ssh forward server concern inhibit rsync perform bottleneck paramiko think prefer machin nativ ssh implement this? modul remot daemon requir authent receiv password prompt connect avoid password prompt set environ variabl password want use use script rsync warn system environ variabl visibl user system use recommend,2011-08-01 16:45:58.697 UTC,202,6901689,creat backup gui python basic ask user username/password sourc directori rsync remot server troubl come across pass password enter gui server execut command sinc want user authent everytim gui want setup autom ssh key session look bit pexpect paramiko expect seem secur sure configur paramiko rsync local comput remot server basic look pass password server trust host rsync command without sort termin interact purpos gui,0.12871287128712872,26,python rsync ssh user-interface,creat rsync gui backup remot server,12,ssh|username|password|authentication|security|trust|private key|public key|authorise|login|insecure|scripting,0.5241252183914185
affect prompt one enter fabric abort prompt throw built-in except caught case programm want select anoth ssh key usernam login see env document,2016-02-18 08:27:01.343 UTC,58,35476287,fabric connect host wrong ssh key prompt password instead fail output ssh fabric follow file fabric output fabric fail immedi prefer error messag instead prompt password,0.13793103448275862,8,fabric python,fabric fail instead password prompt pubkey deni,4,password|ssh|username|login,0.5237985253334045
quit compon host django applic intern ad need test see everyth pathway correct ad server sit behind firewal firewal ip a.b.c.d traffic firewal ip port 389 forward ad server recommend chang higher random port firewal btw less scan shell access test see reach network firewal admin check firewal log try one follow someth similar python check rout firewal work webfact block otherwis see list host along traffic pass - firewal rout somewher see connect lost drop default firewal tracert a.b.c.d telnet firewal ip port 389 telnet test allow firewal admin see connect attempt come port 389 log arriv mean extern comm work fine telnet a.b.c.d 389 similarli need check ad server receiv request check log well respond perhap ad server talk firewal ? recommend open port firewal directli ldap instead suggest make ssh tunnel put necessari encryptionn around ldap traffic exampl assum ssh server run port 22 ldap server access web host creat tunnel port 389 ldap server port 2222 web host configur django applic web host think ldap server run localhost port 2222,2009-06-13 10:09:05.177 UTC,274,990459,django applic host webfact static/priv ip network offic obvious behind firewal ad server run behind firewal insid network authent use python-ldap ad intern ip address port 389 work well move host webserv chang ip address port openend firewal simplic port open 389 howev request authent alway timeout log webfact run python shell queri ipaddress webfact gener ip address rather static ip what happen try auth django? request come underli ip address python run rather static ip firewal expecting? im fairli clueless network port map help much appreciated! hope make sens,0.12043795620437957,33,active-directory ldap python webserver,python ldap authent remot web server,6,ldap|authentication|firewall|ssh|tunnelling|encrypt,0.5237638354301453
,2019-02-11 16:44:14.99 UTC,27,54635246,linux machin join domain need pass ntlm kerbero machin authent background servic use window integr authent linux prefer use python,0.25925925925925924,7,kerberos linux python windows-integrated-auth,equival httpclienthandler.usedefaultcredenti linux,4,kerberos|integrity|credential|authentication,0.5235109925270081
easi answer simpli tell want support password authent still messag want host key chang ever process hang wait password enter want process prompt suggest set python 3 pass argument ssh prevent stdin pass process,2018-01-26 21:37:33.51 UTC,87,48469916,use python script manag ssh fingerprint problem workstat reimag attempt connect ssh warn deal howev error ask password connect point want termin process howev script hang password request method run termin problem oddli run pycharm hang password request termin shh continu script expect,0.1839080459770115,16,python ssh subprocess,ssh via python subprocess.popen termin password request,5,ssh|password|scripting|fingerprint|authentication,0.5230548977851868
