answers,creation_date,len,postid,question,ratio,raw,tags,title,uniq,words,probability
alway user past script let assum moment actual manag block x-server without block input program user still enter password user alt-f1 x-server consol kill weird app manag block ssh box kill app certainli gener someth login command consol session manag gdm graphic display requir user enter password give form interact session want yet anoth password thing? system design let user without password anoth form authent api let program block system whenev feel sinc thing fun work arond make script log user ignor prompt time close terminal/kil process look gnome user close termin kill process log instantan want equival modal window directli possibl multius multitask environ next best thing prevent user access system exampl creat invis window larg display intercept mous event whatev behind unaccess point problem prevent user use keyboard termin applic switch anoth applic anoth virtual consol last mayb difficult need access lock keyboard standard keyboard low-level key well applic need administr right yet run user environ start look recip disast unless realli know want done pluggabl authent modul pam integr display manag mayb find pam modul outsourc callback extern program i.e python script,2012-08-26 20:57:45.717 UTC,265,12133857,written simpl python script run soon certain user linux system log ask password. howev problem exit termin minim continu use comput basic password authent script curiou make python script stay let exit anyth els enter correct password modul need import command paus system function python script done? thank interest know lot go wrong think fun thing even protect 1 specif system process curiou paus system make user python script anyth els,0.09433962264150944,25,linux passwords python,paus system function python script done,8,password|scripting|authentication|protect|ssh|login|signing|integrity,0.4444369077682495
look briefli sourc @dm03514 referenc believ correct fabric need prompt interact password read memori store durat fabric python process address concern fabric ensur ssh infrastructur use key instead passphras ssh agent forward appropri enrypt ssh key ssh-agent unlock fabric abl util mechan thu avoid ssh password get involv sudo password either allow passwordless sudo accept risk fabric sudo password memori work,2012-11-01 14:02:16.403 UTC,132,13178691,recent stumbl upon python fabric api realli happi help day-to-day sysadmin task start use work security-consci environ wonder fabric handl ssh password provid run tasks? assum plonk memori somewher pull requir login next host ? protect password memory? see go ask lot question along line look nice explain security-mind type peopl fabric nice friendli pose risk least risk anyth els alreadi,0.17424242424242425,23,api fabric password-protection python security,python fabric protect ssh credenti,6,password|protect|security|ssh|credential|login,0.44432327151298523
access entir server i.e host directori common share host setup ssh server safest though easiest option place script server outsid web host folder stop anyon remot access script let connect db without enabl remot connect enabl remot connect host server allow sure host compani disabl prevent though enabl start creat databas select nice strong password script local secur password,2013-01-02 10:50:59.44 UTC,123,14120747,pretti new python run program local use komodo edit upload result manual websit mysql databas look let python understand open mysql databas anyon regardless run script server guess due secur reason know vulner make site? bad idea better run python program server itself? never run python code server python code insecur,0.11382113821138211,14,database mysql python security,possibl safe insert updat mysql databas use python local,7,security|safe|scripting|vulnerability|insecure|ssh|password,0.4442463219165802
,2015-12-10 18:18:21.797 UTC,70,34208993,work webserv provid webpag enter inform detail remot server ip usernam password txt file scriptin python argument push button execut script remot server creat client html server node.j client send data node.j abl receiv howev need server abl take usernam password execut script ssh find invok ssh javascript order execut someth ssh root:password@1.2.3.4 python ./test.pi exempleit first time work javascript depth node.j,0.22857142857142856,16,html javascript node.js python ssh,embed ssh node.j,4,scripting|ssh|username|password,0.4441871643066406
creat special user execut command script user give make sure user lock secur requir dictat say want usernam laugh creat user follow wrap system command command requir script execut behalf script user command run whatev give context whatev user specifi python inject whatev command given method prevent user abl run command context sinc command run context new user sinc it’ config file better make someth non-execut plain ini / yaml etc i’m assum want includ access constant sometim requir littl work ultim code run safeer,2020-04-02 14:26:26,154,60993916,wrote python script access system featur requir root privileg master script configur run anoth python script file config.pi user script write configur state variabl script master script file root-own config file user sinc script user want modifi file obviou ideal sinc user script run root-level command config script run config file user-level even master file run root,0.11688311688311688,18,python linux scripting sudo,run python file sudo config file user space,6,scripting|privilege|security|username|inject|safe,0.44360944628715515
ubuntu keep track authent either login sudo attempt keep track file read log entri written send notif channel entri arriv,2017-05-02 15:06:55.477 UTC,60,43741348,ubuntu server number user login need monitor log think python anyth better need send notif slack meant python script send notif slack user success log write slack integr sure script trigger login,0.13333333333333333,8,python slack ubuntu,run python script see log,4,scripting|login|integrity|authentication,0.44306719303131104
enter command likeshow ip access-list aclnameand pars output empti line none found,2013-07-01 11:10:18.657 UTC,72,17403073,network administr want autom process creation ipsec tunnel cisco router exscript modul establish ssh connect router want execut command creat ipsec tunnel neccessari creat crypto polici access-list transform-set add check paramet alreadi exist exampl want creat access-list name newipsectunnel creation applic check access-list name alreadi exist give advic resolv issue.thank advanc,0.18055555555555555,13,cisco ipsec python,exscript autom cisco ipsec tunnel creation,5,ipsec|scripting|tunnelling|ssh|crypt,0.44293686747550964
good idea keep password store script modifi script take hostnam file write output differ file,2017-08-24 19:42:37.937 UTC,77,45869713,pleas help correct script script check ssh login host display success/failur base result fail give wrong hostnam code work fine correct username/password given work fine wrong password given chang password wrong one script say connect fail expect question chang hostnam someth doenot exist paramiko fail lot error pop messag connect fail ? use python3.5,0.16883116883116883,13,dns paramiko python-3.5 ssh,python3.5 paramiko fail hostnam,5,ssh|scripting|login|username|password,0.4421476721763611
paramet constructor hostnam ip remot machin url addit unless care secur correct solut see verifi host key pysftp,2019-09-22 20:18:34,75,58053075,tri connect server use follow script try access via filezilla similar client credenti work even though display follow warn concern host key algorithm fingerprint howev script run properli report follow error sshexcept unabl connect sftp://my_ip:my_port [errno 60] oper time even try host = my_ip addit cnopt find host key solv,0.13333333333333333,10,paramiko pysftp python sftp,pysftp oper time,5,sftp|scripting|credential|fingerprint|security,0.44163745641708374
run follow command remot linux machin vm host input root password remot machin prevent ad ssh certif good write script ssh login without password make script forget add delay shutdown e.g vm time die peac complet bash script untest depend virtual product use e.g kvm virtualbox vmware etc suitabl interfac suggest search googl name chosen virtualis softwar + api exampl relev result call e.g python virtualbox check link https://blogs.oracle.com/nike/entry/python_api_to_the_virtualbox give soap interfac allow remot control via e.g curl altern remot aspect setup privat key authent server save key passphras local e.g seahors allow secur ssh access without need enter password time hypervisor i.e qm script case qemu/kvm shut vm id 300 wait vm stop see qm manual option call script long run superus privileg mani way turn linux system prefer call window manag shutdown sequenc use probabl use ubuntu want use command way shut comput mostli complet equival requir superus right includ etc etc actual command shut system shutdown specif shut need run superus privileg machin want stop,2012-11-23 19:01:00.36 UTC,200,13534541,want write script shutdown remot ubuntu system actual want vm shutdown safe shutdown main machin vm instal help sh script script written languag python,0.12,24,bash linux python sh ubuntu,script shutdown ubuntu,11,scripting|safe|password|ssh|certificate|login|forge|private key|authentication|security|privilege,0.44117650389671326
temporari workaround found schedul pull server use apschedul pexpect.run along scp less ideal prefer alway run process beaglebon rather server suffic schedul enough time switch ubuntu still anyon suggest blackbear work much hear bit_push,2013-09-17 18:26:33.55 UTC,137,18857206,work apschedul upload data file period use pexepect.run scp . scp command work fine command line without password authent key share howev run python script beaglebon black start remot machin use pexpect scp fail blackbear replac openssh bbb load privat key properli add -i ~/.ssh/id_rsa error /usr/bin/dbcli exit string long dbclient part blackbear appear bug tri convert privat key use >dropbearconvert openssh dropbear id_rsa id_rsa.db error error cipher des-ede3-cbc support tri instal openssh work due conflict blackbear give angstrom go ubuntu suggestions.? alreadi ad lot angstrom chang oper system time pain thank bit_push,0.11678832116788321,16,apscheduler beagleboneblack pexpect python ssh-keys,autom scp upload without password,9,ssh|password|authentication|scripting|openssh|private key|rsa|cipher|cbc,0.4403412342071533
,2009-07-15 11:44:12.893 UTC,49,1130909,current work pyqt4 app requir administr privileg access file follow appl guidelin open authent dialog prompt user input password order perform administr task alreadi look macpython author packag seem bit outdat use launch extern process alreadi use subprocess anoth altern,0.12244897959183673,6,macos pyqt4 python sudo,call appl author api pyqt4,5,authorise|privilege|open auth|authentication|password,0.44017356634140015
problem pxssh tri login slow connection.th pexpect lib appar fool remot motd prompt remot motd prompt contain unam -svr prompt contain # charact inside.appar pexpect saw prompt point lib line anymor ssh session follow workaround work me:just remov # char insid /var/run/motd.dynam debian /var/run/motd ubuntu anoth solut ask ssh prompt motd log work me:i ad follow printmotd noin /etc/ssh/sshd_config=> work anoth workaround:cr file home directory:.hushlogin ~ directori solv ad sync_multipli argument login function note sync_multipli commun timeout argument perform success synchron tri read prompt least sync_multipli seconds.worst case perform method sync_multipli * 3 second person sync_multiplier=2 depend commun speed system work,2013-11-18 17:32:06.04 UTC,161,20054030,get error use pxssh remot server run unix command uptim file ./ssh_pxssh.pi line 33 login_remotehostnam usernam password file ./ssh_pxssh.pi line 12 login_remot s.loginhostnam usernam password file /library/frameworks/python.framework/versions/3.3/lib/python3.3/site-packages/pexpect/pxssh.pi line 278 login pexpect.pxssh.exceptionpxssh synchron origin prompt** line 33 call function main function use error come time run script rather intermitt come 7 10 time run script,0.16770186335403728,27,python-3.x,pxssh error synchron origin prompt,5,ssh|login|username|password|scripting,0.4396331310272217
check ssh configur option passwordauthent sure pysvn interact ssh ~/.ssh/config mayb global config? prompt password,2009-11-20 17:41:19.937 UTC,104,1772133,work pysvn tri find decent handl repositori access via svn+ssh obvious ssh key make incred easi guarante end user use ssh key abl run without user interact go svn log pars big issu svn+ssh interact prompt pop authent obvious abl pysvn automat login given credenti set_default_usernam set_default_password good respect least abl fail log messag tell user setup ssh key howev set_interact seem bear either still prompt password client.log svn+ssh://path thought tackl issue? even realli possibl handl without ssh key sinc ssh throw prompt,0.21153846153846154,22,pysvn python ssh svn,pysvn svn+ssh,6,ssh|authentication|login|credential|username|password,0.43840643763542175
switch protocol repo ssh http remov need enter password,2014-03-10 01:25:53.063 UTC,32,22290625,run ask github usernam password put call ? look git-push man page say noth argument,0.15625,5,git python python-2.7 subprocess,input insid script subprocess.cal,4,scripting|username|password|ssh,0.4377659261226654
need pywinauto make simpl window oper automat pleas look pywinauto websit exampl open notepad input hello world automat https://pywinauto.github.io/ anoth exampl pywinauto open putti applic connect remot linux server input password login run linux command python 2.7 run python code window success need instal swapi https://github.com/pywinauto/swapi python code autom file.ex,2016-09-26 10:15:20.543 UTC,93,39700155,hey guy new program appreci help program open applic enter applic requir password usernam know make program plug automat code open program .ex file make automat plug usernam password applic pleas thank,0.10752688172043011,10,os.system passwords python username,python plugin password usernam .ex file open,3,password|username|login,0.43746915459632874
give try,2019-03-14 00:22:17.81 UTC,55,55153094,beginn programm mostli c python tri write python script use paramiko access ssh server connect fine quit work wait return data sign ssh server run applic consol requir sign wait applic finish output send requir sign password? know librari fabric cant find either,0.12727272727272726,7,fabric paramiko python,get non consol ish result python paramiko,4,scripting|ssh|signing|password,0.43743640184402466
think simplest solut ssh host-key authent combin background . basic implement enhanc kill process done. note ad arg sinc background process final alreadi consid call make sure detect loss tunnel soon possibl keep age nat implement path inact,2011-06-22 03:14:05.98 UTC,82,6434508,tri setup ssh tunnel via pexpect follow code expect password sent ssh tunnel establish loop exit continu process busi logic code block util timeout 30 second ssh tunnel establish anyon pleas give advic avoid block,0.17073170731707318,14,pexpect python ssh-tunnel,tunnel tcp port ssh without block,4,ssh|tunnelling|password|authentication,0.43694353103637695
,2015-12-30 19:44:25.637 UTC,95,34536157,work environ ntlm proxi authent want implement http commun python program in-hous develop run sever comput solut mention web page python 3 - urllib http error 407 proxi authent requir allow requir input user name password requir python program must establish session user alreadi authent program must work sever endpoint don´t know password option success write follow powershel script abl automat getsystemwebproxi automat determin defin proxi defaultcredenti credenti current establish session port applic power shell time consum achiev python? powershel web request proxi,0.11578947368421053,11,http proxy python,python http error 407 proxi authent requir use defaultcredenti,5,authentication|credential|user name|password|scripting,0.43652018904685974
assum one login session given time someth job run login kill process logout cleanli key add signal besid,2018-02-09 16:39:34.04 UTC,64,48710342,problem guy got linux machin good cpu gpu machin learn stuff jupyt notebook via ssh remot machin mine 24/7 need turn 2 mine script cpu gpu right log execut right log best easiest thing automat,0.125,8,bash linux python ssh,turn / script log / via ssh,4,ssh|scripting|login|signing,0.4365176260471344
late answer sorry.for look user password lead space need chang like use loop instead ideal want execut command follow exampl without know within need ssh command,2016-08-10 18:14:39.703 UTC,97,38880723,ssh server use parmiko python need telnet sever devic captur output abl ssh telnet one devic ablk telnet multipl devic loop pleas suggest this.i use follow use statement directli give ip work good need telnet multipl devic server thank reply! use follow code f1.close abl ssh telnet ssh server enter credenti primenm primenms123 usernam password correct credenti show author fail go wrong? pleas help guy,0.13402061855670103,13,python ssh telnet,telnet ssh server,5,ssh|credential|username|password|authorise,0.4364076852798462
check pynotifi https://github.com/seb-m/pyinotify/wiki/events-typ linux in_access event exampl site os subprocess modul execut linux command python exampl https://www.cyberciti.biz/faq/python-execute-unix-linux-command-exampl,2020-02-07 09:06:44,42,60110255,python function creat listen specif file someon open execut linux command,0.023809523809523808,1,python python-3.x linux security,creat python listen display messag log file someon open file,1,security,0.4356588125228882
follow work code question code issu local bind port along url pars proper format henc authent port couldnt authent order connect henc code mention question work work code connect mongodb ssh mongo differ credenti hope answer help someon find one anywher need :p,2019-05-21 13:16:51.927 UTC,95,56239184,tri connect remot mongodb ssh access differ usernam password mongodb differ usernam password tri pass usernam password ssh ssh tunnel server mongodb credenti client get error state ssh connect happen wherea mongodb get connect actual result,0.22105263157894736,21,automation database pymongo python ssh-tunnel,python script connect remot mongodb use ssh-tunnel pymongo client fail error,7,ssh|tunnelling|scripting|username|password|credential|authentication,0.4356037974357605
begin remot path forward slash / check directori specifi remotepath try directori login server say use ssh remote-path specifi exactli although filenam name remot path throw error specifi folder name anoth tip instead hard-cod password,2014-05-15 17:29:28.357 UTC,79,23684988,work project requir us upload vile via sftp remot server troubl tri follow youtub guid issu get file error run script know sure file exist given python script right name locat file script right,0.12658227848101267,10,pysftp python sftp upload,python script upload file remot server,5,sftp|scripting|login|ssh|password,0.43446674942970276
,2019-03-01 12:31:40.577 UTC,150,54944736,"ansibl keep one ssh connect host whole lifecycl playbook execut reach connect includ python script? problem - use ansibl make ssh connect host dont know reach includ python modul ssh connect channel read write to.- use includ python script creat new paramiko sshclinet object object gonna lost python script finish one task alway need establish connect whatconsum lot time creat connect login exampl ansibl ---- host localhost var host 10.100.100.100 usernam usernam password password .... lot task differ inputs.. - name python ssh logic python input inputx python regist python_result python - python.pyi python.pi paramiko creat sshclient object connect specif host via ssh hardcod python modul - anyway ansibl host logic,includ ssh oper login write sshchannel sshclient base input problem time connect login wast lot time one ssh connect ansibl playbook reach python modul save time? possible? thank much",0.15333333333333332,23,ansible python ssh,global ssh connect python modul includ ansibl task,5,ssh|scripting|login|username|password,0.4339909255504608
type sftp.execut ls content usernam directori directori creat file call example.pi write follow import osos.chdir /home/alex_test os.system sourc myscript.tcsh run sftp.execut python example.pi best solut work method actual noth sftp intern open separ exec ssh channel channel complet isol sftp subsystem channel clear use paramiko librari directli clearli see paramiko method intern use pysftp paramiko class actual even document method say execut given command remot machin command execut without regard remot moreov sftp protocol concept work directori pysftp actual underli paramiko librari simul local rel path pass pysftp/paramiko librari sftp method convert absolut path sent sftp server pysftp mean virtual method work remot path notabl except convers possibl sftp protocol mandat *nix style path even actual remot server system use differ syntax pysftp/paramiko know convert rel path absolut path contrari command pass method complet execut server use proprietari syntax server local librari understand somehow magic convert,2018-02-17 10:35:26.557 UTC,179,48840397,use pysftp wrapper paramiko script /home/alex_test want execut script work script found hand work ?my goal creat gener code unix window,0.13966480446927373,25,paramiko pysftp python sftp ssh,chdir pysftp librari effect execut pysftp librari,4,sftp|ssh|scripting|username,0.43385639786720276
take look section 8.3 handl except python manual catch except handl prevent except caus program exit program exit except code catch howev write code fail,2011-06-16 13:00:01.763 UTC,97,6372266,write script python pull configur cisco router use paramiko ssh connect tri make verifi login credenti correct devic without fail right code connect run command want credenti correct great! howev feed wrong credenti script fail authent error code start program fed wrong credenti output paramiko.authenticationexcept authent fail know credenti wrong want script fail make display problem continu run rest script idea,0.17525773195876287,17,authentication paramiko python ssh,paramiko authent verif turn python except handl,5,authentication|ssh|scripting|login|credential,0.4337485730648041
,2019-07-23 18:47:58.813 UTC,85,57170455,tri write custom ssh server use paramiko librari process set pty interact littl confus think pty read from/writ ssh channel correctly? unfortun try connect server use openssh ssh -p 2222 user@localhost respons corrupt mac input success authent code server class creat server object authent run loop hit method debug statement put variou point seem pty-alloc stage look fail appreci clariti guy provid tri print prefer hmac server seem match openssh expect think hmac mismatch caus,0.12941176470588237,11,paramiko python ssh,corrupt mac input connect paramiko ssh server,4,ssh|openssh|authentication|hmac,0.43361353874206543
,2018-10-05 12:41:36.927 UTC,70,52665890,"tri connect mysql db ssh tunnel use python modul sshtunnel throw error mysql.connector.errors.programmingerror 1045 28000 access deni user sql_user_nam @ 172.45.678.910 use password yes code user_nam password correct success connect via sequal_pro use credenti ssh host throw error here?and error messag ssh_host 172.45.678.910 show differ never ssh_host code,in variabl ssh_host ip different,i tri solut avail internet solv issu",0.24285714285714285,17,mysql-python python python-3.x ssh ssh-tunnel,python sshtunnel modul fail connect mysql db,5,ssh|tunnelling|password|credential|availability,0.4332372546195984
use prettygoodtermin python script cisco junip devic work me.for run simpl ios command don!t event need pyton want learn python thee script need simpl tutori look articl,2019-02-09 09:36:23.25 UTC,67,54604986,tri login cisco switch run command use python telnetlib script run script display password output termin enter switch password hang note usernam password.en password given want login show inform switch use python,0.1791044776119403,12,python,abl telnet cisco router use python script,4,scripting|login|password|username,0.43266236782073975
consid modul specifiy key file rsa privat key see familiar ssh auth function allow obtain request result use pexpect,2019-07-05 08:15:58.263 UTC,53,56899164,sshpass -p mysshpass ssh root@127.0.0.1 ./myscript.pi command execut shell ask password myscript.pi script ask execut command python prompt password python code os.systemsshpass -p mysshpass ssh root@127.0.0.1 ./myscript.pi,0.33962264150943394,18,python,provid password ssh use python script,5,password|ssh|scripting|rsa|private key,0.43257981538772583
"suggest fredrik fornwal termux https://wiki.termux.com/wiki/remote_access adb ssh unsaf android consid bang exploit wifi network someon ssh- adb enabl phone know found https://www.jnchen.com/blog/2012/11/tunnelling-adb walk around adb,ssh enabl phone good idea perspect secur",2019-01-23 20:22:45.72 UTC,85,54335065,im tri establish ssh connect android anoth linux pc autorun command client side host sinc found connect use adb consid use python programing/scriptinglanguag preinstal android unfortun preinstal languag differ usag python pip command use adb support execut .py file want import modul paramiko,0.12941176470588237,11,adb android python ssh,connect ssh server use android adb shell,6,ssh|scripting|unsafe|exploit|tunnelling|security,0.4308149218559265
