answers,creation_date,len,postid,question,ratio,raw,tags,title,uniq,words,probability
understand question well want run script remotely? use ssh pass extra argument command want execut exampl pi1 want python pi want run remot script first need enabl passwordless login want connect log run termin need enter local pi password allow local pi access remot one pi user usernam remot pi hostnam ip address run remot pi path path script want run remot pi,2018-10-26 15:15:58.007 UTC,99,53011738,tri let raspberri pi run script trigger ssh command anoth raspberri pi lan network run anoth script go connect,0.1414141414141414,14,networking python raspberry-pi ssh,execut raspberri pi use ssh command let run .py script anoth raspberri pi,5,ssh|scripting|password|login|username,0.9334927797317505
ssh tunnel so.thi post resolv problem pycharm configur multi-hop remot interpret via ssh,2017-07-13 07:56:25.26 UTC,121,45074666,tri connect first out-of-band manag server case sinc connect dell-serv idrac connect main server got work manual use window termin putty.ex -ssh usernam @ idrac-ip follow putti window open type password follow connect connect server type usernam password server complet process write script python use paramiko http://www.paramiko.org/ suggest stackoverflow follow exampl https://www.ivankrizsan.se/2016/04/24/execute-shell-commands-over-ssh-using-python-and-paramiko/ work splendid idrac first server connect work type stdin stdout stderr = ssh_client.exec_command connect still first server ssh_client tell work try connect server manual afterward occupi stop work sinc connect longer ssh_client differ server question - connect server anoth server case out-of-band manag server log one,0.12396694214876033,15,python remote-access server ssh windows,connect ssh server anoth server,5,ssh|username|password|scripting|tunnelling,0.8711244463920593
want connect paramiko ssh/sftp/scp librari machin machin must run ssh/sftp/scp server window come ssh/sftp/scp server run default see window ssh servers? question super user,2020-02-04 06:27:20,65,60051736,connect window system send file run script give follow error send file window system paramiko.ssh_exception.novalidconnectionserror [errno none] unabl connect port 22 ip address help appreciated.edit window system send file run window 2008 server,0.18461538461538463,12,python windows ssh paramiko scp,novalidconnectionerror paramiko python,4,ssh|validate|scripting|sftp,0.8675745129585266
tri window handl input output command pexpect good candid ssh part http://pexpect.readthedocs.org/en/latest/api/pxssh.html dig window port pexpect https://gist.github.com/anthonyeden/8488763 along putti command line window exampl putti command line http://etherealmind.com/putty-command-line/ work manual http://python-for-system-administrators.readthedocs.org/en/latest/ssh.html,2014-11-22 06:24:41.553 UTC,77,27074706,machin want small python script execut command machin machin window run machin either window linux usernam password log machin authent creat python script run command machin ? fine find command windows? done without sinc modul wok unknown reason,0.12987012987012986,10,linux python ssh windows,ssh python window without paramiko,5,ssh|scripting|username|password|authentication,0.8674224019050598
sampl script work,2015-08-04 19:09:13.093 UTC,45,31817319,tri establish ssh connect remot machin root seri error execut ssh command error ssh remot machin normal user error come try login root pleas provid solut code written,0.17777777777777778,8,authentication paramiko python root ssh,unabl ssh remot machin root use paramiko librari python,4,authentication|ssh|login|scripting,0.862727701663971
ssh use set server requir password machin need work password login script line attach script hotkey e.g use alfr,2013-11-23 21:09:42.853 UTC,49,20167898,solut requir run python machin process tri termin howev run python local process run ssh termin send termin command situat,0.1836734693877551,9,macos python ssh,send ctrl-c osx termin ssh session python,4,ssh|password|login|scripting,0.8549373149871826
run follow command script pleas make sure upload script use scp first execut command,2018-07-23 05:38:06.763 UTC,67,51472136,one central machin multipl remot machin configur passwordless connect remot machin central machin login central vm remot vm execut script remot vm exampl tri central machin remot machin runscript.pi someon help login run script remote1 machin exit remote1 machin run script remote2 machin,0.1791044776119403,12,bash linux python shell ssh,login remot machin run script,4,ssh|login|scripting|password,0.8517490029335022
solv follow script,2015-12-08 20:40:31.44 UTC,81,34165621,run hadoop mapreduc job log ssh via putti requir enter host name/ip address login name password putti order ssh command line window ssh consol window provid appropri mr command hadoop jar /usr/lib/hadoop-0.20-mapreduce/contrib/streaming/hadoop-streaming-2.0.0-mr1-cdh4.0.1.jar -file /nfs_home/appers/user1/mapper.pi -file /nfs_home/appers/user1/reducer.pi -mapper /usr/lib/python_2.7.3/bin/python mapper.pi -reduc /usr/lib/python_2.7.3/bin/python reducer.pi -input /ccexp/data/test_xml/0901282-510179094535002-oozie-oozi-w/extractout/ / .xml -output /user/ccexptest/output/user1/mroutput python chang clunki process launch mapreduc job within python script avoid log ssh via putti done someon show,0.12345679012345678,10,hadoop paramiko python ssh,launch hadoop mapreduc job via python without putty/ssh,4,ssh|login|password|scripting,0.8472456932067871
,2016-10-12 05:55:51.143 UTC,48,39991406,need upload execut python script window host use paramiko code hardcod usernameadmin work appdata/local/temp/script.pi c:/python27/python.ex appdata/local/temp/script.pi work right syntax execut python script window use paramiko? manual connect putti use command execut script python.ex system path,0.1875,9,paramiko python sftp shell ssh,python - paramiko upload execut python script window,4,sftp|ssh|scripting|username,0.8306694626808167
,2018-06-26 03:27:06.077 UTC,50,51034459,tri remot python interpret pycharm script path paramet interpret option use sftp ssh credenti configurations.whil run script automat add paramet base script interpret option remov execut command? command configur interpret option execut file run script pycharm automat add need remov,0.14,7,pycharm python remote-debugging,remov default paramet set remot python interpret,4,scripting|sftp|ssh|credential,0.8263158202171326
need write otherwis python script exit immedi send password turn kill command,2019-02-21 14:20:32.263 UTC,52,54809231,got script call tunnel ip server replac ssh_server_ip try run python pexpect run script connect server last long second ssh tunnel fulli establish follow shall bash expect instead python pexpect? thanx folk,0.21153846153846154,11,pexpect python ssh,python pexpect launch ssh tunnel,4,ssh|tunnelling|scripting|password,0.7991216778755188
sftp allow transfer two remot server initi transfer one server use sftp client avail server common *nix server openssh client execut feed command though work openssh public key authent setup input-less authent server run password authent complic openssh allow provid password automat abl write password bring undesir side effect believ case work without problem altern approach see run sftp command password bash script? sftp client avail server execut one server feed paramiko/sftp code,2019-03-30 09:38:55.483 UTC,129,55430075,code login unix server sftp server download file unix server use python paramiko command login unix server know use sftp file sftp server local machin howev problem sftp file unix server local machin code throw error tri sftp file local machin rather unix server,0.21705426356589147,28,linux paramiko python sftp,sftp use python paramiko directli two remot machin,8,sftp|login|availability|openssh|public key|authentication|password|scripting,0.7940157651901245
,2019-10-11 17:49:28,82,58346241,write python script 3.7 tri send file via pysftp remot storag server script use work fine local machin server want run error disabl configserv firewal server though work csf ssh port list open outgo port addit port need open sftp session via pysftp within server? thank input edit use wireshark local network investig connect appar pysftp use high port host server establish sftp connect defin pysftp portrang dynam port open csf,0.17073170731707318,14,configserver firewall pysftp python python-3.x,configserv firewal block pysftp outgo connect,4,firewall|sftp|scripting|ssh,0.7917765378952026
try pass -o stricthostkeychecking=no ssh command,2013-04-30 12:19:14.257 UTC,34,16299750,run command remot aws machin work fine first login onto machin question input yes python altern flag tell ssh ask question,0.20588235294117646,7,python ssh,python ssh without authent valid,4,ssh|authentication|validate|login,0.7849316596984863
basic gave scp script delet it. os.systemscp + bash_script os.system ssh + host bash --login bash_script rm bash_script --activ believ issu bash stdin ssh forward taken input redirect mean prompt happen alreadi end file suppli empti respons,2017-11-05 01:10:26.077 UTC,107,47117226,python script execut local bash script remot host ssh use os.system third exampl variabl consequ act well bash script point ask user input confirm proceed ignor move forward think got someth stdin get problem tri ad -tt option ssh call noth seem chang least abl make work command line deal python afterward send argument.or interact,0.14953271028037382,16,bash openssh python scripting ssh,interact local bash cript argument remot server ssh call python,4,openssh|ssh|scripting|login,0.7733919024467468
sure mean dut command accept ssh command anoth parametr want run command wait run second command easiest,2015-07-02 05:57:53.72 UTC,95,31176597,want start linux server issu command wait 5second issu command dut use python script possilb within singl python script 2 python script it? 1i ssh login withut password - work fine 2start server command ssh -i ~/.ssh/id_rsa server_name@ip-address &lt command > - work fine 3wait 5second - work fine 4need start dut command - work pleas help find solut use python,0.11578947368421053,11,linux python python-2.7 server ssh,issu command server issu command delay 5sec dut use singl python file,5,ssh|scripting|login|password|rsa,0.7710734009742737
window 10 remot server enable/instal ssh server window nativ one saw openssh ssh server run port 22 default try default port 63342 pycharm besid ssh connect port 22 https://www.jetbrains.com/help/pycharm/settings-debugger.html setup ssh server remot machin order connect it.se https://phoenixnap.com/kb/ssh-to-connect-to-remote-server-linux-or-window done host address remot machin usernam password credenti user exist remot machin port number chosen set ssh server 22 default,2019-07-08 09:14:01.327 UTC,93,56931729,tri ssh python interpret pycharm wizard askin host usernam port know name remot workstat usernam port number from? requir set pycharm remot server? instruct clear w10 side https://www.jetbrains.com/help/pycharm/configuring-remote-interpreters-via-ssh.html,0.15053763440860216,14,pycharm python,find port number remot server,5,ssh|username|openssh|password|credential,0.7707487940788269
invok option mean alloc pty pseudo-tti remot session case signal remot process ssh session ssh protocol messag send signal remot process howev probabl use openssh either client server far tell openssh implement signal messag openssh client send messag openssh server act ssh extens send break messag support openssh interact session openssh client escap sequenc type send break server openssh server handl break messag send break pty remot session unix pti normal treat break sigint howev break fundament tty concept none work remot session pty think two way want invok paramet instead caus ssh request tty remot session run remot process tty make act run interact kill local ssh process caus remot process receiv sighup write ctrl - c local ssh process standard input caus remot process receiv sigint open anoth ssh session remot host command signal process want signal,2017-09-21 00:36:44.973 UTC,211,46333657,two machin one script second one script name code script shown purpos spawn subprocess call script control need exit need send interrupt remot process run wait_for_signal.sh controller.pi current signal send process start ssh connect local machin remot machin caus local process stop remot process continu execut ssh work type signal send remot machin stopped? send appropri signal remot process start ssh connect,0.15639810426540285,33,linux process python signals ssh,send signal remot process python,4,signing|ssh|scripting|openssh,0.7671820521354675
want reboot remot system without password need configur ssh key remot systems.first need creat ssh key system run python script.bi use chang name ssh key file copi ssh key remot systems.th path ~/.ssh/ job done login remot system without password python script paramico access ssh via python,2013-06-14 04:23:43.177 UTC,105,17101049,need reboot remot system ubuntu 10.04 system everi 3 hour decid write python script reboot remot ubuntu 10.04 systems.i know reboot remot system via termin know implement python script * note *when reboot remot system via termin prompt password reboot remot system python script without ask password know let help,0.1619047619047619,17,python python-2.7,reboot remot system via python script,4,scripting|password|ssh|login,0.7659814357757568
,2018-07-29 15:12:46.103 UTC,32,51581689,connect consol server need login firewal need hit enter login prompt appear follow password prompt,0.1875,6,python python-3.x stdin,tri autom basic command use python ssh firewal consol server success termin get hang,4,ssh|firewall|login|password,0.7655966281890869
assum python print set stdout,2015-07-18 03:16:12.763 UTC,65,31487423,run script determin login inform end output login inform need run script termin want ssh credenti exit python script comput connect current termin new server say alreadi sshhost sshuser sshpass variabl script run ssh command current termin connect server? tri subprocess spur howev realli manag go realli appreci help thank advanc,0.23076923076923078,15,python shell ssh,ssh server exit python script shell,4,ssh|scripting|login|credential,0.7639997601509094
proper use configur manag solut direct run remot client one box need schedul run user desir interv,2016-11-16 11:08:27.677 UTC,51,40630602,remot server execut certain command via sudo authent done via certif login via ssh bash script python rubi someth els execut certain command,0.1568627450980392,8,bash linux python ssh,execut command sudo python/bash/rubi script via ssh,5,ssh|scripting|authentication|certificate|login,0.7596632838249207
drop root permiss sudo need check user id 0 environ variabl sudo_us bash script full script exampl script print user id regardless whether run sudo,2013-12-06 02:17:07.393 UTC,72,20414723,run python script rpi run sudo rpi.gpio librari let run bash script non-sudo caus ssh command prompt password even though key-gen authent sure miss someth simpl anyon help? run python script py script run ssh script,0.19444444444444445,14,bash python raspberry-pi ssh unix,python call subprocess bash script sudo,4,ssh|scripting|password|authentication,0.7594853639602661
first make sure local mongodb run machin ssh server mongodb run replac myuser myhost usernam host anoth termin window run mongo shell local comput default connect localhost:27017 port-forward remot host mongo shell connect correctli creat pymongo connect normal python info ssh tunnel https://help.ubuntu.com/community/ssh/openssh/portforward mongodb-specif network protocol tunnel ssh port-forward,2016-11-03 19:11:56.203 UTC,76,40409489,tri establish connect mongodb databas via ssh connect programmat python creat mongocli object connect local see establish ssh connect mongocli,0.15789473684210525,12,pymongo python ssh,pymongo mongocli ssh connect,4,ssh|username|tunnelling|openssh,0.7582839131355286
rpyc look give access anoth machin python environ directli local script establish connect ssl ssh see http://rpyc.sourceforge.net/docs/secure-connection.html#ssl well ssh creat - secur shell command execut remot machin think sit remot comput either mean execut python command shell though physic interact machin send python command simpli python command execut python script everyth thing make next step wrap piec python code file remot machin execut remov script cach execut basic shell command remot machin program think script shell extens python program command-lin paramet e.g,2012-08-20 19:57:29.61 UTC,144,12044262,use paramiko today work python ssh connect use howev one thing realli abl ssh utilis python sugar far tell inbuilt paramiko function want anyth use python remot side need script place call send python command ssh connect rather make limit paramiko ssh connection? sinc run ssh connect paramiko within python script seem right see,0.13194444444444445,19,paramiko python ssh,use python command within paramiko,5,ssh|scripting|ssl|forge|security,0.7582373023033142
know administr password cannot execut python script elev privilege! reason :the solut avail execut python script elev privileg simpli prompt uac provid administr password password correct script execut administr privileg ultim must know administr password! reason need administr password secur risk execut script administr privileg without administr right think one execut script comput guest account hope help,2014-12-17 05:32:49.943 UTC,102,27518941,use python script win32serviceutil modul order stop start window servic member group local administr login member run script error access denied.if start cmd prompt administr run window work fine.mi question insid script specifi run administrator? note know administr passwordthank,0.21568627450980393,22,python windows,run python script administr,6,scripting|login|password|privilege|availability|security,0.7556299567222595
sure work sshpass definit work nake ssh either key password base authent shell alway provid input stdout script use pipe - python script - hope work well! abl expect script problem follow link refer - https://www.thegeekstuff.com/2010/10/expect-exampl,2018-01-11 03:43:04.457 UTC,74,48199453,tri ssh remot machin run script script interact confirm want run it? {y/n} kind thing say directli ssh command? out=$sshpass -p abc ssh -o stricthostkeychecking=no -l root x.x.x.x ./abc.pi,0.20270270270270271,15,bash linux python ssh,ssh command requir interact input,4,ssh|scripting|password|authentication,0.749718964099884
want vpn ip port forward proxi http://voorloopnul.com/blog/a-python-proxy-in-less-than-100-lines-of-code/ need secur connect 2 host ssh port forward http://www.debianadmin.com/howto-use-ssh-local-and-remote-port-forwarding.html,2013-07-27 10:02:12.963 UTC,50,17896516,want creat vpn connect python script python socket need tunnel traffic script vpn proxi api? cannot chang set machin user want creat vpn tunnel traffic,0.14,7,connect python sockets vpn,python creat vpn connect host,4,scripting|tunnelling|security|ssh,0.7460644841194153
correct go need close ssh instanc well sftp open virtual sftp channel within ssh connect multipl channel singl ssh connect henc close singl channel close whole ssh connect need call close physic ssh connect take channel still open obligatori warn blindli accept host key secur flaw lose protect mitm attack correct secur approach see paramiko &quot;unknown server&quot,2018-06-20 16:00:02.89 UTC,91,50952508,troubl tri close paramiko sftp connect even though call close connect still hang check run netstat window python code proper close paramiko sftp connect works? thank,0.17582417582417584,16,paramiko python sftp ssh,paramiko close connect work,6,sftp|ssh|security|protect|mitm|attack,0.7436811923980713
,2019-02-21 14:05:55.207 UTC,78,54808935,today use ssh command line forward port remot server use intermedi server local machin command use shell ssh session use ssh config file issu multi hop ssh command requir enter password intermedi server use comput engin key remot server differ passwordsaft enter password code work howev work use manual ssh tunnel command line initi doubl tunnel key usernam password python?i tri sshtunnel packag help one port forward doubl thank,0.24358974358974358,19,paramiko python ssh ssh-tunnel,doubl ssh tunnel within python,4,ssh|tunnelling|password|username,0.7402278780937195
sequenc finei miss termin length 0 script stuck,2017-03-20 14:13:15.043 UTC,77,42905871,tri access network devic access ssh bastion host run suno proxycommand support ssh tunnel approach gener driver access bastion host ssh remotedevicenam connect remot devic case remot devic requir one step authent drop # prompt level 15 access cisco devic manag success authent send command point think chang driver script time,0.12987012987012986,10,exscript python,exscript access remot network devic via bastion host still use devic specif driver recogn devic prompt,4,scripting|ssh|tunnelling|authentication,0.7344257831573486
cannot password protect port concept sever layer network stack someth regular internet gear anyth add authent service/appl layer mean pi demand authent whether possibl depend run avail need intermediari either proxi front pi handl authent vpn server instead simpl forward port put authent point network access effect password protect port via ssh tunnel instead open applic port open tcp port 22 run ssh daemon ssh servic protect password passphras key file combin thereof connect ssh window use putti plink specifi local port window box map port remot raspberri pi rather connect say port 1234 connect window machin port 1234 establish ssh connect rout machin end ssh tunnel,2015-04-23 13:25:37.507 UTC,162,29824873,python program run window 7 comput commun raspberri pi internet port open port forward rule internet modem concern hacker get open port caus problem question password protect port anyon tri access port requir enter correct password raspberri pi?if way protect open port? help/advic much appreci thank advanc,0.1728395061728395,28,password-protection port portforwarding python security,port forward secur,8,password|protect|security|hack|authentication|availability|ssh|tunnelling,0.732591450214386
yes mani way accomplish this. want mimic ssh login execut script pexpect,2014-02-24 04:55:11.18 UTC,57,21979165,wonder possibl execut follow script unix server \home\script folderfil name current login ssh secur shell client window desktop access server manual run script run script remot window desktop without need login ssh secur sheel client time,0.2631578947368421,15,python python-2.7 ssh,execut python script remot unix box,4,ssh|scripting|login|security,0.7325533032417297
try use paramiko-sftp link transfer python script remot system login remot system use paramiko-ssh link run script remot system,2019-09-18 07:40:40,67,57987488,tri write python program execut local python script remot host let commun script run code current consist two file give follow error pipe python script remot python interpret abl someth script later? chang exampl work,0.16417910447761194,11,python python-3.x ssh subprocess,run local python script remot host commun use subprocess,4,ssh|scripting|sftp|login,0.7264992594718933
run program rather librari excel run ssh command document api connect use public key discuss ssh connect python paramiko public key abl someth,2016-11-21 11:54:35.633 UTC,84,40719565,tri access remot machin execut remot python script chang ssh configur enter host termin connect remot system without ask password run python script host machin execut use ssh subprocess call requir enter password access remot machin without need enter password? environ python version 2.7 host remot system use ubuntu 14.04 lts,0.15476190476190477,13,python ssh,connect remot system subprocess call without enter password,4,ssh|password|scripting|public key,0.7259789705276489
take keyword argument specifi privat file,2013-08-21 15:47:29.823 UTC,49,18362051,write script python necessit connect ssh move need without password need work remot server host server user code question public key within script without access command line termin everi time script run passwordless access ssh,0.20408163265306123,10,python ssh,connect remot server paramiko without password,4,ssh|password|scripting|public key,0.7208942770957947
,2018-01-06 13:03:34.377 UTC,58,48127617,abl copi file termin local pi remot pi use scp ssh key without password prompt os.system run command python script termin interrupt script prompt password pi@192.168.0.15 spent hour tri differ ssh key pair tutori tri fix avail ideas? code,0.1724137931034483,10,networking python raspberry-pi scp ssh,tri copi file local rpi remot rpi python script use scp ssh key pair,4,ssh|scripting|password|availability,0.7187163233757019
issu lie paramiko fabric ssh daemon simpli firewal configur isp intern network reason allow commun differ subnet realli fix firewal configur instead switch ips subnet try chang banner timeout 15 second 30 sec transport.pi file sshd daemon server hung ssh manual,2011-08-26 14:33:49.993 UTC,103,7206272,use fabric build script clone one vms creat new server fabric script use paramiko underneath work fine one server sinc clone know differ everytim run fabric script error script connect user server script work fine server except new one clone thing radic differ ip address total differ rang idea caus,0.1262135922330097,13,fabric linux paramiko python ssh,paramiko error error read ssh protocol banner,4,ssh|scripting|firewall|transport,0.7170613408088684
