answers,creation_date,len,postid,question,ratio,raw,tags,title,uniq,words,probability
interest similar task collect solari box add whole lot user password solari usermod --password option past use expect write expect script pain time go python crypt.crypt edit /etc/shadow directli backup cours http://docs.python.org/release/2.6.1/library/crypt.html comment suggest use variou echo incant pipe passwd afaik never work passwd program ignor input stdin accept input interact tty see http://en.wikipedia.org/wiki/expect chpasswd ubuntu 11.04 note:norm pattern work echo get elev privileg restricted_command howev work fabric.api.sudo caledwith shell=tru default fabric assembl command sudo spawn new shell /bin/bash run root privileg andthen escal shell run command anoth pipe sudo sudo tee luck method thought share method use once-off throwaway script use auto-respond type password prompt immedi expir password user chanc choos secur method depend case use trick combin python’ chang password feed new old password use e.g option enabl interpret backslash escap newlin interpret,2010-06-20 19:11:10.413 UTC,205,3080585,updat password remot box fabric expect look someth unfortun command know let one chang password ubuntu 10.4 seem pass new old password argument command one chang user password ubuntu 10.4 via ? edit :i look work recommend man page edit reason work either fabric well tri somewhat insecur variat mikej answer solv problem eleg solut work thank read brian,0.1024390243902439,21,fabric passwd passwords python unix,chang unix password command line python/fabr,6,password|insecure|security|scripting|crypt|privilege,0.37590479850769043
read password without echo reccomend read password safe use linux use window note realli someth passcod secur reason clear shell,2013-05-04 16:28:58.82 UTC,60,16376477,tri creat util program user type passcod goe main menu passcod still show right ask question user gave command instead someth script wonder someth type script clear python shell without directli type shell,0.11666666666666667,7,python shell,clear python shell within script,4,scripting|password|safe|security,0.37526580691337585
doubt regard execut code remot origin github repo best practic mount virtual machin virtualbox vmware within vm isol host try script want less risk,2018-04-17 04:31:20.733 UTC,74,49869977,link repositori giant shell script suppos to:- issu digit valu tokens- creat sign enforc contracts- particip project democrat decentr manner https://github.com/gitguild/gitguild/blob/isysd/gitguild safe run giant script? best practice? seem script interact well user git configur best,0.13513513513513514,10,blockchain encryption git pgp python,giant shell script ideal govern git repositori use pgp key,5,encrypt|pgp|scripting|signing|safe,0.374981552362442
found put password file system .cf file restrict permiss read file sure better,2013-07-26 15:01:47.917 UTC,55,17884816,write python script autom delet svmi netapp snapshot use pyspher librari creat connect instanc everyth work expect question hide password script mayb hash mechan password argument specifi password clear text script? thank,0.16363636363636364,9,esxi parameter-passing passwords python vmware,python vcenter api connect string,3,password|scripting|hash,0.3747654855251312
interact logon call make updat manual updat valu even administr right though fyi interact login file servic access exchang server access updat lastlogon thu lastlogontimestamp mang ds server kept within 10 day accuraci,2012-05-15 22:07:49.163 UTC,78,10609500,write python script automat logon user list script run month prevent account disabl due low activ work code question win32security.logonus updat last log timestamp activ directory? anoth achiev without administr right activ directori server? thank wole,0.08974358974358974,7,active-directory python pywin32 windows-security,win32security.logonus updat last logon timestamp,4,security|scripting|login|0 day,0.3747391700744629
workaround work scrape instead tri ssh connect use remot shell pull data look begin still much see connect sock socket ssh eleg simplic,2013-08-07 09:20:44.977 UTC,97,18099495,tri urllib2 proxi scrap web page directli avail run remot server local network extern access proxi prefer ssh sock proxi run access fairli secur poke around everyth find point run ssh connect sock opposit actual tri accomplish seen transport class dumb forward provid nice openssh-sock proxi interfac latch onto socksipi et al net::ssh::sock rubi exactli look wrong languag anyth avail python provid proxi ssh,0.13402061855670103,13,proxy python socks,python version ssh -d sock proxi ssh,5,ssh|availability|security|transport|openssh,0.374327689409256
"make sure permiss public privat key file possibl contain folder restrict i.e chmod 600 id_rsa turn requir oper system? file ssh key found help colleagu :also make sure use correct usernam given ssh key tri remov folder ~./ssh,then work well differ reason server side sshd connect hard debug client side exampl oct 9 15:50:26 pc1udatahgw04 sshd[27501] authent refus bad ownership mode directori /home/testus run see permiss see exampl case notic second bit home directori open group write refus key base authent case check sshd log server side issu alreadi mention /home/user/.ssh directori open /home/user/.ssh/id_rsa file open /home/user/.ssh/id_rsa.pub file open /home/user/.ssh/id_ecdsa file open /home/user/.ssh/id_ecdsa.pub file open etc late follow-up matter believ run issu waffleman context confin network hint use object turn quit help found littl puzzl implement thing today least object object connect connect first place. case use other work around overrid method ok fragil privat thing altern - actual still - manual creat object time feel much better still hood similar error server use ad authent think bug paramiko learn ssh key paramiko paramiko sshclient method load user specif key exampl doc explain need run connect server ssh server remot devic deni authent make sure use correct key public key present directori permiss correct permiss correct devic access restrict hard say go without log server [edit] look back output authent use authent usual ever permit use determin auth method allow server possibl server use host base authent none all! sinc rare use access class need directli",2010-11-09 15:18:34.8 UTC,280,4135261,problem connect devic paramiko version 1.7.6-2 ssh client ssh command line work fine anyon seen before? edit 1 verbos output ssh command edit 2 python output debug output,0.12142857142857143,34,paramiko python ssh,paramiko authenticationexcept issu,7,ssh|authentication|private key|rsa|username|ecdsa|public key,0.3735099732875824
,2019-08-07 01:56:58.927 UTC,51,57386032,tri access data hive server grant access abl ssh server run connect databas follow command prompt usernam password hit enter twice need type credenti librari connect databas remotely? found still need usernam password connect string tell auth method use,0.1568627450980392,8,apache-zookeeper hive jdbc python sasl,connect hiveserver2 use python without usernam password,4,username|password|ssh|credential,0.37313541769981384
follow work chang made comment sure though produc password authent error use full command i.e split list use hand work fine use &amp full command anyth it? environ variabl https://www.postgresql.org/docs/11/libpq-envars.html --no-password option pg_dump,2017-04-12 21:54:20.333 UTC,126,43380273,"problem psql python script use modul background use follow script localhost i.e creat backup tabl psql server i.e restor remot host i.e newer version psql server i.e function sequenti function finish success creat file function return follow error password \npg_restor [archiv db] connect databas database_nam fail fatal password authent fail user username\nfat password authent fail user username\n * check credenti &amp output execut command shell includ credenti .pgpass although relev sinc pass password anyon similar experience? pretti much stuck! regards,d",0.12698412698412698,16,pg-dump pg-restore psql python subprocess,pg_dump & pg_restor password use python modul subprocess,5,password|scripting|authentication|username|credential,0.3728722333908081
,2017-09-29 15:46:49.083 UTC,99,46492514,use mysql workbench connect mysql run amazon rds suppli ssh hostnam ssh usernam ssh password ssh key file mysql hostnam mysql server port usernam password howev python script connect databas tri use ssh tunnel run script hang minut say connect mysql server ~mysql hostname~ unsur remote_bind_address sinc suppli info success connect mysqlworkbench connect python without specifi remote_bind_address? addit tri use script tool mysql workbench abl load python script error occur one import specif import modul request error indic modul name request howev modul instal import success use outsid mysql workbench,0.15151515151515152,15,amazon-rds mysql mysql-workbench python ssh,connect amazon rds python,5,ssh|username|password|scripting|tunnelling,0.3728654086589813
well hardcod password never realli great solut even environ variabl use ssh key much better secur concern minim recommend use ansibl - wrap ssh anyth fanci authent think bit wide use fabric use fabric year seen think ansibl bit flexibl,2017-04-25 17:02:10.827 UTC,121,43616868,tri find best approach collect metric remot linux machin use python script base onlin read configur fabric &amp abl run command remot server challeng part enter password everi run &amp help schedul process two option found hardcod account password env.password approachar secur concern &amp approach work cronschedul gener ssh key user account authent thisapproach secur concern &amp notic thecron job schedul sudo fail best approach avail gather metric remotelyus python,0.12396694214876033,15,centos fabric linux python,use python collect remot server linux metric,7,scripting|password|security|ssh|user account|authentication|availability,0.3710814118385315
,2019-11-21 16:00:24,58,58979014,use t-sql abl connect sql server instanc issu run python use pyodbc/freetd logon deni t-sql statement python statement python error traceback recent call last file /users/username/documents/python script/mss sql connect script.pi line 3 conn = pyodbc.connectdsn=mssql;uid=username;pwd=password pyodbc.programmingerror 42000 [42000] [freetds][sql server]login fail user usernam 18456 sqldriverconnect help,0.13793103448275862,8,pyodbc python sql-server,cannot connect sql server use pyodbc - login fail,4,login|username|scripting|password,0.37060463428497314
,2019-06-20 15:30:46.953 UTC,92,56689361,tri authent sever server run linux ssh connect autom python use paramiko initi connect want enter password want abl pass keyfil password follow document keyfil use puttygen creat key tri differ type keyfil puttygen ultim use rsa-2 paramiko document suggest tri differ environ chang much background ssh keyfil direct greatli appreci primarili guidanc creat key applic etc code connect see anyth bar success connect problem like creat keyfil expect paramiko take keyfil sinc follow multipl step document simpli say invalid rsa privat keyfil,0.14130434782608695,13,paramiko python rsa ssh-keys,use keyfil paramiko password-less authent,6,rsa|ssh|password|authentication|validate|private key,0.3691825568675995
probabl usernam host request password mail usernam probabl password ip address mail provid password prompt creat droplet referenc exist ssh-key email password command prompt password multipl ssh keypair gener provid specif key case command,2020-02-05 08:31:05,55,60071769,login digitalocean droplet follow command ask accept [e.n unclear one op means] password respond,0.23636363636363636,13,python-3.x digital-ocean,ssh login digitalocean droplet respond,4,ssh|login|password|username,0.36914291977882385
,2019-11-11 20:51:51,93,58808536,log remot machin use wmi python script use servic account? tri servic account wmi login window remot machin use python script script execut use servic account user task schedul pull detail disk space util provid person credenti howev want provid credenti instead servic account log servic account python script without know servic account password? addit execut script use servic account user task schedul script refer user credenti run under? result cannot access remot machin use servic account without password python script,0.15053763440860216,14,python windows wmi,servic account remot access use wmi python script window,4,scripting|login|credential|password,0.36893758177757263
appear requir launch amazon ec2 instanc via instanc launch automat creat new user instanc insert public key user login instanc user data startup script creat new user store public key tricki part pass public key script includ raw script download amazon s3 detail see manag user account linux instanc add new user ec2 give ssh key access run command linux instanc launch,2016-11-11 15:29:21.653 UTC,93,40551135,look python script solutionidea order creat given ssh user provis ec2 instanc abl launch ec2 via boto.run_inst howev sure creat ssh user launch,0.13978494623655913,13,amazon-web-services python,add ssh user aws use python,5,ssh|scripting|public key|login|user account,0.3683829605579376
sinc know config file tell mistak howev check line contain two valu avoid fairli ineffici shorten,2019-06-11 11:03:25.633 UTC,74,56542276,"wrote python script connect sftp server use public key authent code get server credenti anoth text file call config file format ip,usernam ip2,username2 config file contain 5 ip usernam throw errorse although affect output what reason error solv better code output error:if 10 ip config file",0.13513513513513514,10,pysftp python python-3.x,indexerror list index rang connect sftp server use python,6,sftp|scripting|public key|authentication|credential|username,0.36780795454978943
first thing forget actual tri deseri check back right binari run magic replac check exactli binari text origin fundament take text wiser simpli base-64 encod data prior transmiss base-64 decod side need worri replac sure understand entir sure want creat new logline-messag line ssh.stdout? protobuf deseri requir entir messag abl deseri properli someth,2013-09-16 19:47:57.993 UTC,128,18836104,tri send serial protobuf messag ssh deseri local machin howev reason send serial string decodeerror say tri deseri truncat messag setup two script one run server popen ssh local script script run server simpli print message.serializetostr stdout collect output popen.stdout local script code snippet local machin script server script logsearch.pi thank advanc help provid much appreci extra inform need anyth unclear pleas let know make sure clarifi,0.1171875,15,protocol-buffers python ssh,send serial protobuf messag ssh,5,ssh|decode|scripting|forge|encode,0.367785781621933
,2018-02-18 04:33:32.323 UTC,71,48848486,use oauth2 python cli script use code https://github.com/google/google-api-python-client/blob/master/samples/calendar_api/calendar_sample.pi run script --noauth_local_webserv option first time ran script ask sign googl page gave verif code input script author success next time onward take account log first time default tri close termin still show oauth2 ui sign abl figur log thing termin script base shown code logout least signin run script everi time,0.2112676056338028,15,google-api google-app-engine google-python-api python,log googl oauth2 use python cli script,4,oauth|scripting|signing|authorise,0.3668598234653473
suggest paramiko instead hassl extern consol tool class throw except passphras wrong,2019-10-15 22:08:22,57,58403221,problem write python script brute-forc ssh privat key passphras file use command ask passphras enter script fail error ssh_askpass exec/usr/bin/ssh-askpass file directori understand tri variat subprocess modul etc think suitabl situat expect password request,0.19298245614035087,11,brute-force python ssh ssh-keys subprocess,test ssh privat key passphras brute-forc,4,ssh|private key|scripting|password,0.36558032035827637
found solut problem creat class inherit overwrit new replac call new class function creat ssh connect check environ variabl decid ssh client creat anoth stackoverflow page relat answer can&#39;t amazon cmd shell work boto howev definit better use per-person ssh key target host authorized_key file? user add key normal ssh-add ssh-agent session usual default linux need test ssh first ssh-agent/-add issu clearli resolv beforehand certain work ssh normal problem whether boto thought ssh-agent paramiko sshclient rememb correctli - paramiko code rememb look roughli seckey option key_filenam empti invok check ssh-agent boto version seem want forc use privat key file explicit call think idea instanc assign key password decrypt mean use boto directli conflict use ssh-agent standard model per-us login log connect user paramiko.sshcli much capabl document ssh-agent support explicitli pydoc paramiko.sshcli basic paramiko instead boto one issu paramiko connect readi immedi mani case requir send test command checkout output send real command part start fire ssh command paramiko right creat ec2 vpc instanc guarante listen ssh connect paramiko tend lose command deliv soon use code cope tri enforc log prod directli particular wrapper ssh-send-command script encourag script despit vagari whether amazon bother start instanc time fashion,2014-09-18 00:28:38.46 UTC,237,25902400,use creat ssh connect ec2 instanc current everi time user enter password encrypt pkey e.g want make work-flow conveni user support .so far tri without success creat result creat result ? know support boto use,0.1308016877637131,31,boto paramiko python ssh,boto.manage.cmdshel ssh-agent,9,ssh|password|encrypt|crypt|authorise|private key|signing|login|scripting,0.3648964762687683
accord doc secur consider unlik popen function implement never implicitli call system shell mean charact includ shell metacharact safe pass child process part clearli claim everyth pass safe includ plaintext password someon still convinc password probabl pass normal commun process,2019-07-18 07:35:06.16 UTC,96,57089329,need execut command multipl time execut ask password howev password specifi variabl --cpass .i modul getpass first password secur execut command multipl time similar approach leak store password plain text termin log somewhere? better approach?not provid password --cpass result password-prompt everi command execut cumbersom user.,0.16666666666666666,16,passwords python python-3.x security subprocess,use subprocess.popencommand password expos termin log,4,password|security|leak|safe,0.36371275782585144
document secur file credenti,2020-04-28 17:20:25,50,61486132,"creat script mount seri webdav folder linux possibl execut problem user ask enter credenti soon command executed. password usernam entir seri onlin dav folder write bash bash emb python script? follow ,but got sucess realli method",0.18,9,python bash echo webdav,script enter password bash &| python,5,scripting|password|credential|username|security,0.3634086549282074
try use smtp server user name window live id exampl yourname@hotmail.com password password usual sign hotmail window live smtp server smtp.live.com port 25 {note port 25 block network isp smtp port 587 tls ssl encrypt depend client use} authent required? yes match pop usernam password tls/ssl required? yes smtplib send mail find exampl,2010-03-31 21:17:15.21 UTC,67,2556533,login hotmail account send mail python program,0.19402985074626866,13,hotmail python,send mail hotmail use python,9,login|user name|password|signing|tls|ssl|encrypt|authentication|username,0.3633081018924713
none,2020-02-28 16:53:39,52,60456144,send email via python script work problem time ran code requir type password order build connect outlook id anyway run script without type password? anyway retriev password system? uid = getpass.getu + @outlook.com server.loginuid mypassword,0.17307692307692307,9,python smtp smtp-auth,send email via python without ask password build smtp connect without authent outlook,4,password|authentication|scripting|login,0.3614199757575989
none,2020-01-13 23:35:54,67,59725700,jupyt notebook run server shh tunnel server someth work fine howev everi time go localhost:8888 prompt auth token given jupyt sinc secur ssh connect server sure step overkil anyon connect server ssh cannot connect jupyt notebook right? secur run jupyt server safe sort private/publ key function jupyt authent recogn computer? thank advanc,0.19402985074626866,13,python security jupyter-notebook ssh-tunnel,safe disabl jupyt notebook token auth access exclu ssh tunnel,5,security|ssh|tunnelling|safe|authentication,0.3613087236881256
forc take ownership enabl cours access token privileg e.g elev administr forc assign ownership anoth secur princip enabl without latter assign fail error code follow function option attempt temporarili enabl privileg exampl output,2016-12-10 23:06:39.853 UTC,82,41081263,tri take ownership directori follow code call fail access deni error access right current user remov directori explor see try open first take ownership administr work explor code execut elev permiss reason still fail suggest,0.07317073170731707,6,file-permissions ownership python security windows,take directori ownership window python result access deni error,3,security|privilege|signing,0.3612223267555237
paramiko support openssh key format cannot take putti format key file add openssh header make key openssh format puttygen convert putti key openssh key convers > export openssh key,2018-08-21 20:08:05.32 UTC,103,51955990,attempt creat ssh tunnel use use window 10 alreadi connect setup putti connect without issu whenev try start connect follow error paramiko.ssh_exception.sshexcept base64 decod error incorrect pad attempt pad rsa key use . begin end exampl 1 x end tri pass file version make paramiko accept key?? full traceback chang random byte key secur reason length error file putti,0.17475728155339806,18,paramiko python ssh ssh-keys ssh-tunnel,base64 decod error incorrect pad load putty/ppk privat key paramiko,7,ssh|tunnelling|decode|private key|rsa|security|openssh,0.36099961400032043
,2018-01-18 18:18:29.813 UTC,90,48327865,run django app privat intranet requir either compani wifi access altern vpn connect order open non-compani wifi channel work intend issu access site mobil iphon ipad compani wifi connect public wifi even connect via vpn access intranet cannot access site varieti secur reason disclos precis detail code look explicit solut instead grate gener idea possibl caus thing start look and/or check know typic stack overflow post definit use believ help anybodi els run similar issu creat list possibl reason error,0.03333333333333333,3,django intranet python security,django app work mobil desktop fine,2,security|disclose,0.3609578609466553
argument cann secur hazard doc warn use shell=tru secur hazard see warn frequent use argument detail warn execut shell command incorpor unsanit input untrust sourc make program vulner shell inject seriou secur flaw result arbitrari command execut reason shell=tru strongli discourag case command string construct extern input exampl build lib see,2019-10-14 13:37:25,76,58378016,con call window cmd python script compar run python code equival functionality? code follow,0.11842105263157894,9,cmd python python-3.x windows,discourag call window command line python script,6,scripting|security|sanitise|trust|vulnerability|inject,0.3602631390094757
gener execut file text file make realli execut either execut permiss call interpret btw - password written file safe imagin cleanup code crash delet file often resolv set password system variabl refer script variabl python allow execut script see manipul environment variabl gener method add shebang hashbang direct begin file shell know find runtim requir file exampl python script need know find python envorin add first line python script ensur add script instal somewher system simpli relative/absolut refer script gener need ensur script execut permiss run without permiss error see answer inform use rather direct path python runtim,2014-05-27 21:39:11.133 UTC,151,23899419,tri creat script instal configur multipl program phpmyadmin use password determin user ensur password user safe intend gener shell script use password enter user pass script output destroy script done run ensur integr password problem sure creat shell script within python code script,0.15894039735099338,24,linux python shell unix variables,execut shell script gener python,5,scripting|password|safe|integrity|hash,0.36002084612846375
,2019-04-11 17:04:16.283 UTC,62,55637787,tri connect sftp server usernam privatekey put file use code got ssh execpt execut abl connect sftp server use winscp sshexcept valid rsa privat key file handl except anoth except occurred:sshexcept valid dsa privat key file help great python 3.6 search lot old question luck chang pem file ppk file use putti gen,0.22580645161290322,14,python-3.x sftp,unabl connect sftp server privatekey python 3.6,7,sftp|username|ssh|validate|rsa|private key|dsa,0.3595013916492462
run program run &lt payload.txt gdb ido receiv root access expect setuid program special privileg kernel run debugg otherwis possibl hijack setuid program vulner one address buffer start 0x7fffffffdfd0 know that? find address gdb? disabl aslr? gdb disabl aslr order make debug easier -- everyth alway address disabl aslr system-wid like start,2019-02-11 16:17:06.49 UTC,110,54634730,tri exploit privileg escal vulner program root privileg tri shell code know make mistak address buffer start 0x7fffffffdfd0 size buffer 272 byte use follow shell code 29 byte addit use follow input attack scenario run program run &lt payload.txt gdb ido receiv root access idea solut appreci,0.13636363636363635,15,buffer-overflow gdb privilege-elevation python,privileg escal use vulner program root privileg,8,buffer-overflow|privilege|privilege escalation|vulnerability|exploit|shell code|attack|hijacking,0.35948631167411804
