postid,links,tags,title,question,answers,uniq,raw,words,len,ratio,probability
294,https://api.github.com/repos/dotnetcore/FreeSql/issues/294,issue,system data sqlclient sqlexcept x connect timeout expir timeout period elaps post login phase,unhandl except system data sqlclient sqlexcept x connect timeout expir timeout period elaps post login phase connect time wait server complet login process respond time attempt creat multipl activ connect durat spent attempt connect server pre login initi handshak login initi authent post login complet linux sqlserver sqlserver system data sqlclient,sql r netcor x,2,7,login|authentication,70,0.1,0.2939424514770508
4421,https://api.github.com/repos/SignalR/SignalR/issues/4421,issue,memori leak signalr alot connect,base issu implement configur set defaultmessagebuffers signalr still fall memori leak analyz dump file give roughli object second signalr version expect behavior implement set defaultmessagebuffers prevent memori leak base issu actual behavior depth stack step reproduc reproduc issu start signalr servic immidetiali connect client either product activ loadtest tool crank thank advanc tim,analyz dump file give roughli object second see object see byte screenshot provid still subscript object provid littl detail client mani group client part messag exchang back forth far see per messag object reduc messag buffer size impact alloc signalr still fall memori leak clarifi signalr fail memori climb consist even client fulli connect tri understand memori leak high memori usag,3,12,leak|signing|scripting,120,0.1,0.29358768463134766
13,https://api.github.com/repos/sta/websocket-sharp/issues/13,issue,ssh tunnel,reason known websocket sharp work tunnel use ssh remot port forward test ssh net standard net httplisten work fine soon websocket sharp stop work issu seem strang troubl get use debug inform think either issu websocket sharp ssh net remot port forward issu httplisten debug seem ssh net foward connect correctli made think someth httplisten never get,ssh net report connect activ refus suggest noth listen port websocket sharp caus test follow websocket client ssh client ssh server websocket server websocket sharp websocket client wrote standard net httplisten work fine mean follow work fine websocket client web browser ssh client ssh server websocket server use std net httplisten soon websocket sharp stop work mean follow work websocket client use websocket sharp ssh client ssh server websocket server use std net httplisten,2,14,ssh|tunnelling,134,0.1044776119402985,0.2872118651866913
1884,https://api.github.com/repos/SignalR/SignalR/issues/1884,issue,possibl confus signalr client transport autotransport overrid default transport order,autotransport negoti expect specif transport order provid api allow custom transport order caus unexpect result certain environ given code snippet possibl transport skip custom list transport pass note made actual built minim repo project demo follow repo step server built net client built net defin autotransport transport order sse lp negotiationrespons trywebsocket fals sse skip lp attempt expect sse attempt first fall back lp repo step server built net client built net defin autotransport transport order sse negotiationrespons trywebsocket fals sse skip throw gener server return fals trywebsocket custom transport order pass constructor exampl sse lp ws index client unexpect behavior,still review valid set server payload trywebsocket fals client tri connect longpol transport new list new websockettransport client new longpollingtransport client new websockettransport client new serversenteventstransport client new websockettransport client autotransport auto new autotransport client transport await hubconnect start auto,3,24,signing|transport|validate,152,0.15789473684210525,0.2849726676940918
4095,https://api.github.com/repos/SignalR/SignalR/issues/4095,issue,thousand hang rt connect transport websocket request server,tri improv server perform discov thousand hang rt connect transport websocket rt reconnect transport websocket product server request time elaps day executerequesthandl state aspnetcoremodul modul name use kestrel net core websit behind iis window server expect behavior sure caus perform problem server restart day case correct behavior configur limit length request request time limit hurt anyth sure issu place aspnet kestrelhttpserv aspnet iisintegr,websocket connect design last client disconnect last day surpris name version signalr packag btw new repo signalr asp net core repo system web owin version signalr websocket connect must rt connect rt reconnect request activ long work limit amount concurr websocket connect exampl non server window allow concurr client microsoft aspnetcor signalr server wait net core upgrad server signalr client move issu repositori suggest great help understand issu design say problemat creat problem server sever day prevent case design,3,12,transport|integrity|signing,151,0.07947019867549669,0.2809084355831146
221,https://api.github.com/repos/sebastienros/jint/issues/221,issue,memori leak jint runtim descriptor propertydescriptor,hi simpl statement jint new engin execut getcompletionvalu toobject tostr oftenli memori leak one jint runtim descriptor propertydescriptor fb f fb jint runtim descriptor propertydescriptor clea j r,assum memori leak memori except see memori grow track refer see releas see memori grow winbdg dumphead stat see happin first time see j r le bastien ros crit assum memori leak memori except see memori grow track refer see releas repli email directli view github j r carnu memori grow mean memori leak loop happen memori goe memori leak memori leak point obviou catch mean collect complet object kept case pretti confid familiar gc work relat gener releas memori pleas reopen find clue hi seem memori leak similar problem memori increas outofmemoryexcept gc collect reduc memori object take mani memori dictionari jint runtim descriptor propertydescriptor jint runtim interop clrfunctioninst jint runtim mrupropertycach use anglesharp jint encount problem thank pierr luc,2,16,leak|scripting,156,0.10256410256410256,0.2797667980194092
2183,https://api.github.com/repos/SignalR/SignalR/issues/2183,issue,net client connect two transport,server take long establish websocket client fallback sse eventu server complet websocket client finish ws sse connect repro file src microsoft aspnet signalr core transport websockettransport cs begin method privat task acceptwebsocketrequest add line task delay wait,repro without chang signalr code fake slow connect use sleep user code reopen issu,2,5,transport|signing,57,0.08771929824561403,0.2773723006248474
4003,https://api.github.com/repos/SignalR/SignalR/issues/4003,issue,port leak retri connect signalr hub,expect behavior growth bound port client machin retri connect signalr server actual behavior amount bound port netstat grow pid test app exhaust time connect signalr retri multipl time port exhaust free port bound connect possibl client machin step reproduc simpl repro program program output null changest disconnect connect null disconnect null transport dispos null close start fail system aggregateexcept one error occur microsoft aspnet signalr client httpclientexcept statuscod reasonphras found version content system net http streamcont header x content type option nosniff cach control privat date tue jul gmt server microsoft iis x power asp net content length content type text html charset utf microsoft aspnet signalr client http defaulthttpcli c displayclass b httpresponsemessag responsemessag microsoft aspnet signalr taskasynchelp c displayclass microsoft aspnet signalr taskasynchelp taskrunn end inner except stack trace inner except microsoft aspnet signalr client httpclientexcept statuscod reasonphras found version content system net http streamcont header x content type option nosniff cach control privat date tue jul gmt server microsoft iis x power asp net content length content type text html charset utf microsoft aspnet signalr client http defaulthttpcli c displayclass b httpresponsemessag responsemessag microsoft aspnet signalr taskasynchelp c displayclass microsoft aspnet signalr taskasynchelp taskrunn count state disconnect,issu close part issu clean describ still encount problem pleas feel free open comment let us know still interest hear backlog got littl big bulk clean back top thing thank continu feedback root caus resolv fix underli issu,4,15,leak|signing|transport|snif,245,0.061224489795918366,0.26919257640838623
3599,https://api.github.com/repos/SignalR/SignalR/issues/3599,pr,fix websocket connect leak,error occur initi websocket notifi websockettransport leak return isal true forev,hi friendli neighborhood net foundat pull request bot call dnfbot thank contribut seem small import contribut contribut licens agreement requir point real human evalu pr ttyl dnfbot happen onclos onerror listen immedi use websocket error occur initi transport consid aliv forev even real websocket close dispos issu connect leak per day wrong alreadi fix signalr asp net bump thread still aliv bump interest see fix accept confirm commit fix issu amount connect went stabl caus server unavail restart look better fix make sure event wire signalr start read data websocket e certainli better method fix time need rapid fix connect leak instead ditch signalr fix subscrib event start read data websocket cd b e b b e f b ae,4,10,leak|transport|signing|availability,136,0.07352941176470588,0.2684672176837921
1920,https://api.github.com/repos/TASVideos/BizHawk/issues/1920,issue,lua memori leak use event,summari bizhawk seem leak memori possibl lua object code get execut event callback repro leak fast leak host env bizhawk win pro quick diff two memori snapshot visual studio suggest load lua object creat find eventu end refer loop schleif ermittelt loop detect,nlua luainterfac nlua luainterfac tell whatev use default load script lua consol window config custom advanc tab lua engin section lua luainterfac even say memori leak expect memori leak default howev chang nlua chang anyth still leak memori hope issu hang shortli start script goldeney address near end main matrix multipl function probabl call quit lot chang nlua make differ issu differ issu pleas report separ research issu happen anytim lua call function return tabl callback even loop emu frameadv ad provid script fix memori leak reason tabl return need dispos call clear tabl need dispos howev opportun dispos everyth regist callback sure clean fix either scheduleddispos anytim luatabl creat dispos anyth previou tabl creat avoid memori leak simpli assum anoth tabl creat thing hand,2,12,leak|scripting,174,0.06896551724137931,0.267857164144516
740,https://api.github.com/repos/SignalR/SignalR/issues/740,issue,hub group work longpol transport,sure got someth wrong use follow code receiv bot foo data messag foreverfram data one longpol thing differ bug use signalr mvc,see issu mvc project signalr share sampl project reproduc issu narrow bit issu test deepli coupl day middl nowher pain slow connect moment current find look messag sent server group receiv longpol transport switch serversentev longpol signalr fallback case caus fortig firewal cach caus transport switch longpol guy yet figur avoid buffer event stream mime sure caus firewal perspect suggest instead forc begin transport longpol see comment code seem work follow test environ creat simpl client result intranet foo broadcast messag firewal middl get broadcast one specifi transport option matter whether forc signalr longpol begin let fallback mechan decid issu fallback handl examin request respons sorri akoepling problem one describ morn differ nighttim applic pool schedul recycl look work close cannot reproduc,3,12,transport|signing|firewall,150,0.08,0.26652273535728455
625,https://api.github.com/repos/SignalR/SignalR/issues/625,issue,possibl sse transport iis,simpl question run product environ window server r iis got webappl use signalr hub browser chrome unlik test environ use iis express work sse transport chrome product environ transport switch longpol chang connect run serversideev transport instead limit iis thank,behind proxi anyth network stack buffer respons fallback longpol thank david exactli issu know behind proxi corpor servic know architectur test server server localhost sse work perfectli must issu david gear start fight depart specif requir ask conform corpor firewal proxi fall back longpol buffer respons make specif sse content type forev frame ie work well ok suppos ask client browser ie best longpol transport chrome instead serversentev transport right notic behavior well seem fiddler proxi turn fiddler signalr immedi start long poll everyth meant buffer respons exactli sort signalr configur set turn stream fiddler fiddler buffer respons ah work thank,3,10,transport|signing|firewall,146,0.0684931506849315,0.2650790512561798
50,https://api.github.com/repos/SignalR/SignalR/issues/50,pr,signalr websocket js client transport trigger onerror,signalr websocket js client transport trigger onerror unclean close occur,unclean close differ thing connect abort like one far protocol error basic websocket connect goe success handshak wasclean fals look github pull request system work addit chang pull request websocket transport detect page load use http wss establish websocket connect pull well yes,2,5,signing|transport,61,0.08196721311475409,0.2625156044960022
2953,https://api.github.com/repos/SignalR/SignalR/issues/2953,issue,memori leak ie chrome signalr longpol,run sampl messag loop send receiv messag hour ie chrome use longpol transport result process memori data work privat show memori leak btw run directli use xmlhttprequest send messag post poll signalr longpol infinit loop without signalr js run hour chrome show memori leak,issu report user hi patrick thank time respons reiter believ memori leak limit chrome longpol observ occur follow combin well ie foreverfram ie longpol firefox serversentev firefox longpol numer memori resourc monitor screen shot support claim need michael continu info observ resourc monitor memori page addit browser process memori leak associ w wp exe process leak memori summari step taken isol issu deploy signalr stocktick sampl applic asp net v applic pool come box iis ensur applic run pool advanc set option applic pool chang follow two set default valu ensur process recycl idl time minut regular time interv minut let applic run sever day memori usag kept grow let know assist test potenti solut come bug fix thank regard michael hello find far list bug item unfortun run time option abandon use signalr part solut sign progress end month xiaohongt question tri test initi chrome use longpol ie longpol outcom yes run test long poll ie chrome firefox cover ie rememb clear cover ie try ie result show long poll chrome leak memori hi xiaohongt comment pleas doubl check applic javascript code somewhat concern sound disconnect test code wrote test microsoft aspnet signalr sampl demo code found step took discov memori leak sampl demo compil sampl visual studio chang made upgrad version signalr use project v latest version e v deploy signalr stocktick web applic one default applic pool come box iis e asp net v ensur signalr stocktick applic applic run particular applic pool note specif deploy applic window sp os test window option therefor cannot websocket transport launch ie brows url cours sever day monitor window resourc monitor memori usag iexplor exe process associ w wp exe process observ process memori usag grew grew left run long enough eventu exhaust amount free memori avail system question conduct similar test test run sampl demo code test check sampl demo code btw mention issu test microsoft aspnet signalr sampl demo code know howev comment gener verifi workaround signalr longpol memori leak ie ie ie chrome hello wonder fix expect releas v mileston look past due month alreadi thank fix regard michael releas next week,5,25,leak|signing|transport|scripting|availability,406,0.06157635467980296,0.25804227590560913
2510,https://api.github.com/repos/SignalR/SignalR/issues/2510,issue,possibl confus signalr client transport autotransport overrid default transport order,autotransport negoti expect specif transport order provid api allow custom transport order caus unexpect result certain environ given code snippet possibl transport skip custom list transport pass note made actual built minim repo project demo follow repo step server built net client built net defin autotransport transport order sse lp negotiationrespons trywebsocket fals sse skip lp attempt expect sse attempt first fall back lp repo step server built net client built net defin autotransport transport order sse negotiationrespons trywebsocket fals sse skip throw gener server return fals trywebsocket custom transport order pass constructor exampl sse lp ws index client unexpect,mani merg conflict incorrect auto merger made auth work hub,2,14,signing|transport,121,0.11570247933884298,0.25481584668159485
162,https://api.github.com/repos/MassTransit/MassTransit/issues/162,issue,servicebusfactori caus memori leak subscript servic respons time,use servicebusfactori creat new servicebu connect subscript servic cannot establish servicebu depend hang around memori call servicebusfactori creat addit instanc stay memori,horizont line bottom graph show number instanc increas garbag collect yuck bus need dispos anyth fail start got apolog much time earlier describ problem depth develop window servic use masstransit commun anoth applic remot machin remot machin host masstransit subscript servic cannot guarante remot machin avail window servic start put creation servicebu timer loop constantli retri everi minut masstransit establish subscript servic leav window servic run overnight without abl establish subscript servic notic memori usag exce gb code demonstr leak leav consol applic run notic memori usag window task manag increas new attempt creat servicebu fix develop bus creat anyth around fail startup dispos bus rethrow except fri feb pm photomoos notificationswrot apolog much time earlier describ problem depth develop window servic use masstransit commun anoth applic remot machin remot machin host masstransit subscript servic cannot guarante remot machin avail window servic start put creation servicebu timer loop constantli retri everi minut masstransit establish subscript servic leav window servic run overnight without abl establish subscript servic notic memori usag exce gb code demonstr leak leav consol applic run notic memori usag window task manag increas new attempt creat servicebu namespac masstransitmemoryleak use system use system timer repli email directli view excel sampl app run day notic leak got idea fix make nuget releas,3,15,leak|scripting|availability,244,0.06147540983606557,0.25274938344955444
3294,https://api.github.com/repos/SignalR/SignalR/issues/3294,issue,split signalr transport signalr transport packag,current use signalr provid one one pipelin c client web browser tab scenario signalr design great transport c without messagebu system without hub system without ipersistentconnect system webbrows use nuget packag long poll websocket foreverfram ever transport server browser reus without signalr design choic one mani mani mani,without client protocol either c sharp javascript protocol provid heartbeat reconnect fallback transport option messag sent howev string without format mayb byte without format option avail use arrayseg op zondag januari heeft david fowler notificationshet volgend geschreven without client protocol either repli email directli view github issu close part issu clean describ still encount problem pleas feel free open comment let us know still interest hear backlog got littl big bulk clean back top thing thank continu feedback,4,14,signing|transport|scripting|availability,133,0.10526315789473684,0.2522872984409332
4032,https://api.github.com/repos/SignalR/SignalR/issues/4032,issue,signalr reconnect memori leak,quick pool recycl restart user reconnect hub signalr try reconnect alway get websocket close error user refresh browser normal besid creat huge memori leak fix version,experienc similar issu updat fix issu problem except throw reconnect use connect tabl connectionid primari key reconnect tri add connect primari key base unhandl except throw connect reconnect memori leak know,2,5,signing|leak,62,0.08064516129032258,0.2521588206291199
311,https://api.github.com/repos/robinrodricks/FluentFTP/issues/311,issue,tls session resumpt miss authent fail remot parti close transport stream,ftp os window ftp server filezilla server comput os window use fluentftp applic great librari applic multi thread thread instanc ftpclient ftp credenti connect ftp server differ file copi directori list task work fine ftp recent done work extend work ftp work nice use singl thread soon start use thread simultan connect get ioexcept authent fail remot parti close transport stream ftp server filezilla server see brian tls session data connect resum session match control connect think push bound knowledg messag server indic client support tls session resumpt gather tls session resumpt act prevent hacker connect data port client tls session data connect match session control connect client server know data connect genuin wherea mismatch indic potenti attack know turn tls session resumpt ftp server want help make server secur fall back singl connect viabl workaround sinc faster multipl connect nice find better forward set miss fluentftp overcom error thank log pleas gener log fluentftp past mark area see link step,nice descript never heard seem server kick multipl connect sourc ip mayb try set sourc ip limit client activeport see help found relev set server ftp tls set option x requir tls session resumpt data connect use prot p set check default uncheck fine mani ftp connect check fall straight away error filezilla client seem happi multipl connect regardless set assum fluentftp support session resumpt live multipl ftp connect alway nice hope inform use anyon els encount issu btw connect use client dataconnectiontyp ftpdataconnectiontyp autopass sure client activeport applic,8,17,tls|authentication|transport|credential|hack|attack|security|scripting,262,0.0648854961832061,0.2443491667509079
1064,https://api.github.com/repos/SignalR/SignalR/issues/1064,issue,hub method return encod script tag respons sse longpol transport encod script tag respons foreverfram transport,current encod script tag respons hub method return sse longpol transport encod script tag respons hub method return foreverfram transport need either encod script tag respons hub method return transport encod script tag respons hub method return transport note talk respons hub method return,issu close part issu clean describ still encount problem pleas feel free open comment let us know still interest hear backlog got littl big bulk clean back top thing thank continu feedback,3,18,encode|scripting|transport,93,0.1935483870967742,0.24341608583927155
1386,https://api.github.com/repos/nicehash/NiceHashMiner-Archived/issues/1386,issue,neoscrypt crash,hello nicehash work fine except mine neoscrypt algorithm rig gb ram memori neoscrypt miner alway end error messag memori nicehash miner make crash decid mine neoscrypt tri chang virtual memori seem chang anyth much ram neoscrypt requir run smoothli anyon fix buy anoth gb ram gb total run gtx ti motherboard asu z p gb ram crucial psu corsair rmx w thank help,gb ram gtx neoscrypt mine ad anymor gpu result memori error want mine gtx tri increas vram add ram nicehash nicehashmin mention physic memori hi tri gb vmem got error frequent gb vmem error mayb hour later up vmem gb error last hour x x ti card oc mhz cpu mhz memori tdp gb physic memori,2,10,crypt|hash,122,0.08196721311475409,0.2404002845287323
