postid,links,tags,title,question,answers,uniq,raw,words,len,ratio,probability
4057,https://api.github.com/repos/SignalR/SignalR/issues/4057,issue,hub error aes bit rinjdael crypto secur binnari formatt fail author attribut overrid class level,hello commun issu protect hub method class level authorizeattribut overrid method use aes bit rinjdael binnari formatt make data secur connect token data travel client server first time decrypt problem go decrypt second time time error pad invalid cannot remov start show without stop done unit test pass sever test behaviour see fail attach log file log error applic error global asax appdomain currentdomain firstchanceexcept lui guerra infant,new inform first attempt valu retriev irequest request querystr connectiontoken u u rk e j v ys u c b u ez gj u u e u g first attempt grant permiss hub method ukggwqekj hrlzkj gq mwae bjggczjfv e nsdc oirggxqb hqxiixjhbriw jqx ua prwzkzifricb bcmwgi zs rj owzjzg esbj mpitramdd fail first one bit second one bit know happen investig enough time somebodi give hand look appreaci info note client first call signalr magic grant permiss sever time authorizehubconnect best understand resum one call signalr client authentif sever server intern call grant author hub first request first attempt author fail chang specif valu send encrypt aes issu close part issu clean describ still encount problem pleas feel free open comment let us know still interest hear backlog got littl big bulk clean back top thing thank continu feedback,9,19,aes|crypt|security|authorise|protect|validate|signing|authentication|encrypt,224,0.08482142857142858,0.14980873465538025
16680,https://api.github.com/repos/dotnet/AspNetCore.Docs/issues/16680,issue,avoid memori leak invok net instanc method,noth doc avoid memori leak dug ms doc found say order avoid leak memori dotnetobjectrefer use invok net instanc method javascript must later dispos js code net code best practic dispos dotnetobjectrefer,hello pleas page feedback button form bottom topic add metadata ping author automat move,3,5,leak|scripting|authorise,54,0.09259259259259259,0.1495397686958313
1568,https://api.github.com/repos/mRemoteNG/mRemoteNG/issues/1568,pr,ssh tunnel aka jumphost implement,descript new connect attribut ssh tunnel ad refer name anoth configur ssh connect main chang connectioniniti ssh tunnel configur connect search found free local tcp port determin ssh tunnel connect setup addit paramet tunnel origin connect info copi copi modifi connect local host local tcp port target connect open new ssh connect attribut addit ssh option ad use intern tunnel setup use normal ssh connect well specifi addit option f e start shell ssh server specif setup tunnel allow specifi privat key file login putti session configur stay within mremoteng necessari setup mani putti configur motiv context solv issu make mremoteng readi rdp connect reachabl ssh server test test environ use non open sourc solut far test portabl version rdp vnc connect configur save load test xml type chang new featur non break chang add function checklist x read contribut document x code follow code style project x test within visualstudio pass x pull request target master branch x updat changelog file accordingli necessari x updat document accordingli necessari,,5,20,ssh|tunnelling|scripting|private key|login,175,0.11428571428571428,0.14943058788776398
55,https://api.github.com/repos/dotnet/wcf/issues/55,issue,numer nativ memori leak channelfactori close invok channel,need investig whether tri dispos httpclient still use race condit insid httpclient cleanup follow scenario pseudo code produc numer nativ memori leak note memori leak race condit e g channel factori channel use channel factori close valid scenario wcf workaround avoid scenario top call stack,unabl add label probabl due permiss ideal mark bump prioriti,3,6,leak|race condition|validate,64,0.09375,0.14936451613903046
2443,https://api.github.com/repos/aspnet/SignalR/issues/2443,issue,net core signalr enforc authent,use net core vs preview creat simpl web server ident ui explain ad signalr chat follow particular start debugg start browser make sure user log go razor page use signalr js sinc user log correctli redirect login page login chat work properli far good creat net core consol applic run consol app see messag browser client see null join null consoleapp seem server allow consol client null connect signalr even authent ensur client signalr without authent done authent signalr consol client thank,put middlewar run order place make differ edit issu realiz miss author hub consol client connect authent client usernam email password ok close open anoth issu regard authent,6,17,signing|authentication|login|authorise|username|password,116,0.14655172413793102,0.1493510603904724
2550,https://api.github.com/repos/aspnetboilerplate/aspnetboilerplate/issues/2550,issue,depend inject ionlineclientmanag signal r hub asp core,need add chat function exist asp core project implement signalr creat hub everyth work fine need track onlin user tri inject ionlineclientmanag hub maintain user user connect hub add onlin manag client second user connect hub show first user list getallcli method alway return,,2,4,inject|signing,53,0.07547169811320754,0.14926943182945251
2570,https://api.github.com/repos/SignalR/SignalR/issues/2570,issue,websocket transport ping wrong server url,blatant bug special case websocket creat url,test websocket pingserv invok period send request signalr ping connectiondata b b name hubconnectionapi respons pong deferr complet,2,2,transport|signing,32,0.0625,0.1490030288696289
917,https://api.github.com/repos/SignalR/SignalR/issues/917,issue,javascript client websocket transport reconnect twice appdomain restart,saw test sampl step run raw connect open web config save forc appdomain restart see client reconnect,fail reproduct two applic close,2,2,scripting|transport,31,0.06451612903225806,0.1486286222934723
14375,https://api.github.com/repos/mono/mono/issues/14375,pr,mutex memori leak sgen gc nurseri major,gc alloc gray queue protect mutex sgen gray object queue init mutex never destroy clear object contain sgen gray object queue dispos leak overtim caus oom system depend memori relat system primit handl partit,backport backport,2,3,leak|protect,44,0.06818181818181818,0.14858460426330566
1352,https://api.github.com/repos/nicehash/NiceHashMiner-Archived/issues/1352,issue,nicehash connect issu nhml launch,assum someth load due spike btc possibl dos attack sinc last night get follow error launch nicehash miner look possibl cloudflar protect api use pull data guess ancillari look consol log debug websocket sendhttprequest request server v nhm http user agent websocket sharp host api nicehash com upgrad websocket connect upgrad sec websocket key r zxpfbmnju ms k vig sec websocket version debug websocket sendhttprequest respons request http forbidden date thu nov gmt content type text html charset utf transfer encod chunk connect close cooki cfduid fed c aaf b b expir fri nov gmt path domain nicehash com httponli cf chl bypass cach control max age expir thu nov gmt x frame option sameorigin server cloudflar nginx cf ray c eda fe lax fatal websocket connect websocket handshak respons debug websocket closehandshak clean fals sent fals receiv fals socket connect close error occur connect wait dialog box nicehash requir internet run verifi try later mine backup pool fine open internet connect pretti sure internet let know anyth els provid help resolv issu,manual start miner softwar point nicehash pool initi setup determin best algorithm mine,7,13,hash|attack|cloudflare|protect|encode|cookie|bypass,192,0.06770833333333333,0.14821210503578186
14383,https://api.github.com/repos/mono/mono/issues/14383,pr,mutex memori leak sgen gc nurseri major,gc alloc gray queue protect mutex sgen gray object queue init mutex never destroy clear object contain sgen gray object queue dispos leak overtim caus oom system depend memori relat system primit handl partit backport cc,,2,3,leak|protect,44,0.06818181818181818,0.14781317114830017
691,https://api.github.com/repos/OPCFoundation/UA-.NETStandard/issues/691,issue,certif authent server aggreg,succes connect uaserv aggreg server anonym authent abl brows namespac right tri connect uaserv use basic sha secur polici x certif correct chang user token polici xml config file aggreg server certif howev connect client aggreg server use valid certif see aggreg namespac cannot brows uaserv namespac aggreg server need certif connect server,check connect underli opc ua serev creat success throw except null assum contain certif data receiv context null think need implement valid user ident server server project order transport userident underli server someth hi alin tri thing tri connect certif receiv context null getclientsess method anonym authent receiv context serversystemcontext connect succes call stack anonym authent see send context differ null try certif call call stack certif send context null know problem thank need make debug insid stack find place,6,18,certificate|authentication|sha|security|validate|transport,138,0.13043478260869565,0.14780448377132416
14382,https://api.github.com/repos/mono/mono/issues/14382,pr,mutex memori leak sgen gc nurseri major,gc alloc gray queue protect mutex sgen gray object queue init mutex never destroy clear object contain sgen gray object queue dispos leak overtim caus oom system depend memori relat system primit handl partit backport cc,,2,3,leak|protect,44,0.06818181818181818,0.14778761565685272
2080,https://api.github.com/repos/aspnet/SignalR/issues/2080,issue,longpol connect deadlock pipe backpressur,enough messag written connect pipe sit insid longpol transport read pipe tri poll try acquir lock result,,2,2,deadlock|transport,23,0.08695652173913043,0.1474664956331253
5114,https://api.github.com/repos/Particular/NServiceBus/issues/5114,issue,timeout trigger immedi infinit azur storag queue transport packag referenc,use timeout manag either saga use method trigger hundr timeout second nservicebu azur transport windowsazurestoragequeu transport referenc issu present endpoint configur msmq transport memori persist transport persist explor issu found applic two endpoint co host process one use msmq transport one use azurestoragequeu investig problem seem present long azurestoragequeu transport packag refer applic even follow version use packag id nservicebu version targetframework net packag id nservicebu azur transport windowsazurestoragequeu version targetframework net see minim exampl demonstr problem stackoverflow,problem msmq endoint scan azurestoragequeuestransport featur mess timeout manag configur like azur queue transport packag fix exclud transport assembl msmq endpoint assembl scanner design featur differ packag interf design featur enabl default found applic domain base directori scan activ said think make sens enabl featur endpoint actual request delay deliveri thought alway question need mix differ transport case two endpoint co host process caus issu assembl scan answer provid accur altern move asq endpoint host let know resolv issu solv issu co host differ transport bridg two applic one run azur one prem thu need process work well use nsb creat webapi etc great long multi host thing think bit danger someon msmq endpoint reli timeout manag later extend co host asq endpoint introduc quit critic bug sinc hundr timeout suddenli trigger everi second point doc actual mention exclud assembl import anyway thank great feedback welcom fyi bridg mean run differ endpoint transport differ host addit briddg process,3,17,transport|signing|danger,247,0.06882591093117409,0.14738047122955322
17715,https://api.github.com/repos/dotnet/runtime/issues/17715,issue,socket sendfil leak filestream case error,sketch method leak except actual find place stream ever close oversight part resourc leak therefor bug leak case anyth throw class final probabl minor issu anoth issu fact disconnect realli intend whole design enum stink well stuck enum valid directli pass unmanag code hope alright disclaim test code review,cc thank believ refer net desktop code found referencesourc code corefx sendfil api avail net core recommend use instead filestream leak except see dispos say leak go gced later time situat except given app abl commun complet good fix new transmitfileoverlappedasyncresult leak case anyth throw point final handl case leak anoth issu reusesocket disconnect fact disconnect realli intend map directli window os accord socket handl reus request complet flag valid disconnect specifi use disconnect flag return socket disconnect reusabl state file transmit yes desktop code forgot check coreclr thank confirm assign triag track net desktop bug point final issu gener final avoid filestream case file lock unspecifi time clearli must fix said case mere ineffici object run final queue guarante reach gen understand unwant correct issu pleas investig triag point specif code refer look clearli use around filestream similarli unix believ desktop desktop bug track github close issu case sorri miss yes appear desktop issu close per info,5,14,leak|signing|validate|availability|forge,214,0.06542056074766354,0.14705955982208252
2125,https://api.github.com/repos/npgsql/npgsql/issues/2125,issue,cannot specifi ssl certif connect ssl secur postgresql ad data connect server explor,hi tri add data connect server explor visual studio download latest x vsix see postgrsql data provid spun local develop cluster cockroachdb use secur mode follow instruct found talk postgresql wire ultim connect string need howev secur section advanc properti appear abil specifi achiev connect string,add certif code pleas look short intern use sslstream use callback valid certif cool hope connector least allow brows postgresql instal seper client gui open track ad connect string paramet suppli client certif,4,11,ssl|certificate|security|validate,93,0.11827956989247312,0.14702540636062622
239,https://api.github.com/repos/xamarin/Xamarin.Forms/issues/239,pr,android memori leak masterdetailpag detail navigationpag,descript chang switch master detail page child page requir fragment manag remov previou fragment properli dispos navigationpagerender clean attach drawer listen avoid memori leak dispos fragmentcontain handl pagecontain render separ ensur dispos bug fix memori leak formsappcompatact api chang none behavior chang none pr checklist x test omit state reason descript x rebas top master time pr x chang adher code standard x consolid commit make sens,pass ui test wait remain uitest,2,5,leak|scripting,80,0.0625,0.14651183784008026
2773,https://api.github.com/repos/tidusjar/Ombi/issues/2773,issue,login access via nginx,describ bug instal stabl version ombi window pro machin abl access web interfac local abl follow setup wizard add servic etc abl add ombi instal current nginx conf run window box host embi sonarr radarr mani servic via domain access login screen success howev input usernam password click sign noth happen screen show load anyth cmd window open noth report window attempt login know proxi correctli abl access login screen servic work use set sure go wrong tri instal latest dev branch give result tri set fresh instal connect proxi ideal know wizard abl screen ask enter embi connect detail howev click button add embi server noth happen situat tri log alreadi server tri multipl browser window machin firefox chrome ie well firefox chrome note network differ network reproduc step reproduc behavior ombi local w usernam password confirm local access work intend add ombi instal exist nginx conf navig sub mydomain com enter usernam password use click sign noth happen expect behavior click sign take ombi home screen screenshot n screenshot log log log directori ombi locat n log produc cmd window desktop pleas complet follow inform os window pro ombi version pleas complet follow inform version ombi v media server e g plex embi addit context edit figur format look pretti hope idea nginx conf user nobodi multipl worker work worker process event worker connect includ nginx conf naxsi core rule includ mime type default type applic octet stream server token sendfil gzip gzip disabl msie gzip comp level gzip min length gzip buffer k gzip proxi gzip type text plain text css text js text xml text javascript applic javascript applic x javascript applic json applic xml applic rss xml imag svg xml tcp nodelay server name hash bucket size map hash bucket size start timeout client bodi timeout client header timeout keepal timeout send timeout keepal request end timeout gzip ombi server server listen listen listen ssl listen ssl server name ombi mydomain com ssl session timeout ssl protocol tlsv tlsv tlsv ssl certif ssl cert pem ssl certif key ssl privat key ssl session cach share ssl scheme return add header x xss protect mode block alway add header x content type option nosniff alway add header strict transport secur max age includesubdomain alway add header x frame option sameorigin alway proxi hide header x power add header referr polici referr add header content secur polici frame ancestor mydomain com embi mydomain com radarr mydomain com sonarr mydomain com mydomain com book mydomain com hydra mydomain com tini mydomain com vault mydomain com ombi mydomain com locat proxi pass local embi ip non ssl port proxi hide header x power proxi header rang rang x real ip remot addr proxi header host host proxi header x forward proxi add x forward next three line allow websocket proxi header upgrad proxi header connect upgrad locat well known acm challeng,recommend use exampl config wiki knowledg outsid limit regard nginx sure want well hope someth someon seen although search issu turn anyth turn follow portion conf caus issu although idea remov solv issu next three line allow websocket proxi header upgrad proxi header connect upgrad,14,38,login|username|password|signing|scripting|hash|ssl|certificate|private key|xss|protect|snif|transport|security,532,0.07142857142857142,0.1464248150587082
494,https://api.github.com/repos/SignalR/SignalR/issues/494,issue,protocol error unknown transport,signalr websit empti asp net websit signalr ad via nuget actual use js simpli server app smart client app use signalr client packag receiv messag server look connect distribut messag thing deploy subfold iis web site sure use correct url access question whether app deploy subfold support,work fine vs iis well yes real distinct know signalr use rout therefor url noth exist filesystem bit troubl get connect asp net app deploy root iis websit wonder rout thing sinc got connect think client forgotten last bit url need rout pick signalr request connect probabl issu close issu,3,7,transport|signing|forge,102,0.06862745098039216,0.1459656059741974
3130,https://api.github.com/repos/Azure/azure-functions-host/issues/3130,issue,want chang connect secur iot hub iot devic connect secur ensur data transmit iot devic iot hub confidenti tamper proof use wolfssl certif,hi team want chang connect secur iot hub iot devic connect secur ensur data transmit iot devic iot hub confidenti tamper proof use wolfssl certif question possibl chang connect secur certif iot hub devic connect azur provid connect secur cert certif default possibl chang certif base requir ex wolfssl certif possibl explain step certif ad hub devic end make work thank advanc,pleas move question msdn forum iot hub,4,17,security|confidential|tampering|certificate,93,0.1827956989247312,0.1453585922718048
148,https://api.github.com/repos/sta/websocket-sharp/issues/148,pr,review chang support ntlm kerbero proxi authent websocket sharp,work project requir websocket proxi support ntlm kerbero authent websocket sharp current support basic digest search altern webscoket libari support ntlm kerbero luck final came upon solut without need complet implement proxi ntlm kerbero authent scratch use articlebelow basi solut solut base leverag proxi authent handl alreadi build httpwebrequest net http connect made proxi authent handl intern later reus socket connect remot end point solut alreadi use xscoket client user set avail websocket sharp offici releas,updat handl tcpclient connect async timeout second must import window infrastructur chanc review updat side realli appreci,3,10,kerberos|authentication|availability,103,0.0970873786407767,0.14520038664340973
16047,https://api.github.com/repos/dotnet/efcore/issues/16047,pr,fix diagnosticlisten memori leak,isconfigur call appli servic caus diagnosticlisten instanti dbcontext instanti sinc dispos caus leak fix pr master cherri pick commit ad cd ec e b e afc,descript applic call leak instanc instanc creat use leak dispos diagnost system hold construct listen dispos never happen custom impact report support like impact custom includ run azur regress yes leak exist work correctli leak risk low avoid creat instanc need approv checkin fix check branch readi yet work,2,7,leak|scripting,80,0.0875,0.14499634504318237
4069,https://api.github.com/repos/SignalR/SignalR/issues/4069,issue,pass bearer authtoken secur differ transport,correct wrong seem secur pass token connect initi use oauth bearer token solut seen seem pass authtoken queri string problem long poll transport pick queri string expos url potenti expos store server log etc reli transport secur author header problem howev client librari allow set differ properti differ transport either pretti big oversight mistaken someth,well sinc seem websocket leav querystr web log authent insid hub logic default authent mechan,5,11,security|transport|oauth|authorise|authentication,77,0.14285714285714285,0.14485865831375122
530,https://api.github.com/repos/sta/websocket-sharp/issues/530,issue,error proxi server offer multipl authent method,hi behind corpor proxi server password authent proxi server offer multipl authent method messag proxi authent negoti ntlm basic realm abcd case websocket sharp fail connect method pars expect exactli one authent method offer proxi server made workaround use string search includ master version,,2,6,authentication|password,52,0.11538461538461539,0.14460766315460205
13718,https://api.github.com/repos/OpenRA/OpenRA/issues/13718,issue,better script support load onto transport,notic load onto transport easi either transport cargo die detect lua side requir make sever function detect passeng load anoth tediou thing especi multipl transport unit team requir anoth coupl function make transport move next cargo lua stabli need find empti cell next passeng easier transport ground chinook canent cell true everywher path finder best lua worst part chinook land automat load cargo fail land due blockag whole action screw back ra ai script done one line loadontotransport,,2,9,scripting|transport,85,0.10588235294117647,0.14417466521263123
2348,https://api.github.com/repos/EventStore/EventStore/issues/2348,pr,fix grpc append stream race condit,client stream call throw connect close earli server side exampl happen legitim case wrong credenti provid connect close credenti sent header requeststream writeasync call made append event,,2,3,race condition|credential,34,0.08823529411764706,0.14285962283611298
650,https://api.github.com/repos/shimat/opencvsharp/issues/650,issue,memori leak use imdecod,summari issu memori leak everi call function crash environ ubuntu x net core face problem normal run alway happen exampl code intend memori leak advic,leav method gener memori leak found workaround end,2,5,leak|decode,38,0.13157894736842105,0.14281480014324188
3332,https://api.github.com/repos/xamarin/Xamarin.Forms/issues/3332,issue,android memori leak masterdetailpag,descript switch detail page leak memori step reproduc run attach project click test button time watch memori leak expect behavior memori consumpt stay constant actual behavior memori leak basic inform version issu last known good version n ide vs platform target framework android reproduct,ran profil confirm leak hope get fix soon notic issu pretti seriou problem,2,6,leak|scripting,62,0.0967741935483871,0.14156325161457062
4029,https://api.github.com/repos/SignalR/SignalR/issues/4029,issue,serversendev transport work well,recent launch websit use signalr auto transport model domin support htt use http everyth work well use sendsendev transport connect cost site work design longpol find caus suggest,work fine need provid detail otherwis possibl tell go encourag make sure websocket transport use case effici reliabl transport,2,7,transport|signing,52,0.1346153846153846,0.14144109189510345
1211,https://api.github.com/repos/StackExchange/StackExchange.Redis/issues/1211,issue,authent azur cach redi stackexchang redi librari certif,authent azur cach redi certif instead use password see option stackexchang redi librari,document provid ssl host server certif try find specif ask authent redi got answer microsoft stackoverflow redi azur cach redi support cert base authent redi support password authent via auth command client stackexchang redi automat period send command password connect string,4,12,authentication|certificate|password|ssl,63,0.19047619047619047,0.1410120129585266
92,https://api.github.com/repos/aspnet/SignalR/issues/92,pr,add messag endpoint transport,need separ primit handl messag use channel pipelin provid data flow messag transport messag base transport ad adaptor convert messag base transport serv stream endpoint side thing requir order refer channel remov build librari mean net minimum chang build app test updat,block aspnet coher sign host pr host pend merg build complet unless someon complaint verbal clear request chang statu clap,2,5,transport|signing,67,0.07462686567164178,0.14077818393707275
