postid,links,tags,title,question,answers,uniq,raw,words,len,ratio,probability
1832,https://api.github.com/repos/SignalR/SignalR/issues/1832,issue,scale retryonerror true start longpol transport receiv messag scale,scale retryonerror true start longpol transport client error start scale run send messag longpol transport receiv messag function impact case retryonerror realli work scale longpol transport still send receiv messag expect result retryonerror true scale longpol transport send receiv messag actual result retryonerror true scale longpol transport still send receiv messag repro step usesqlserv scale sql server machin stop sql server servic asp net sampl configuresignalr add connectionstr retryonerror true request page longpol start connect e g request start sql server servic client input messag click broadcast see receiv messag note case sourc code scaleoutstreammanag send int streamindex ilist messag call scaleoutstreammanag send object state call scale send call transport trace signalr transport transportheartbeat inform connect c b c b c bcc b f new signalr transport longpollingtransport inform timeout c b c b c bcc b f signalr transport longpollingtransport inform end c b c b c bcc b f signalr transport longpollingtransport verbos cancel c b c b c bcc b f signalr transport longpollingtransport verbos drainwrit c b c b c bcc b f signalr transport longpollingtransport inform completerequest c b c b c bcc b f signalr transport transportheartbeat verbos connect c b c b c bcc b f exist close previou connect,captur bus trace transport trace interest sql server specif messag bus tranc basic log record receiv scaleoutstreammanag send object state call scale send call messag ad sqlserver tabl onerror callback scale call either run test add messag bus trace descrip ad trace scaleouttaskqueu latest releas build run test collect trace trace signalr scaleoutmessagebu inform stream chang state initi buffer signalr scaleoutmessagebu inform stream chang state buffer open signalr messagebu verbos creat worker alloc busi realli need see full sql trace make sure background thread sampl app disabl captur sql specif noth longpol good know smile sqlserver repro step start sqlserver client longpol transport receiv error note repro servicebu argumentoutofrangeexcept index rang must non neg less size collect paramet name index system throwhelp throwargumentoutofrangeexcept system collect gener list messag e dd signalr releas signalr src microsoft aspnet signalr sqlserver sqlmessagebu cs microsoft aspnet signalr messag scaleoutstreammanag send object state e dd signalr releas signalr src microsoft aspnet signalr core messag scaleoutstreammanag cs microsoft aspnet signalr messag scaleoutstreammanag b object state e dd signalr releas signalr src microsoft aspnet signalr core messag scaleoutstreammanag cs microsoft aspnet signalr infrastructur taskqueu b func item int index microsoft aspnet signalr sqlserver sqlmessagebu send int streamindex ilist next object nextstat e dd signalr releas signalr src microsoft aspnet signalr core infrastructur taskqueu cs line microsoft aspnet signalr taskasynchelp genericdeleg c displayclass b task e dd signalr releas signalr src microsoft aspnet signalr core taskasynchelp cs line signalr transport transportheartbeat verbos connect eda b c bdf c f f exist close previou connect signalr transport longpollingtransport inform end eda b c bdf c f f signalr transport longpollingtransport verbos drainwrit eda b c bdf c f f signalr transport longpollingtransport inform completerequest eda b c bdf c f f signalr transport transportheartbeat verbos eda b c bdf c f f dead signalr transport transportheartbeat verbos eda b c bdf c f f dead signalr transport transportheartbeat verbos eda b c bdf c f f dead signalr transport transportheartbeat verbos eda b c bdf c f f dead signalr transport transportheartbeat verbos eda b c bdf c f f dead signalr transport transportheartbeat verbos eda b c bdf c f f dead signalr transport transportheartbeat inform remov connect eda b c bdf c f f signalr transport longpollingtransport inform abort eda b c bdf c f f signalr transport longpollingtransport inform end eda b c bdf c f f signalr transport longpollingtransport verbos cancel eda b c bdf c f f signalr transport longpollingtransport verbos drainwrit eda b c bdf c f f signalr transport longpollingtransport inform completerequest eda b c bdf c f f signalr transport longpollingtransport verbos drainwrit eda b c bdf c f f signalr transport longpollingtransport inform completerequest eda b c bdf c f f signalr scaleoutmessagebu inform stream chang state initi buffer signalr scaleoutmessagebu inform stream chang state buffer open signalr scaleoutmessagebu inform onreceiv signalr messagebu verbos creat worker alloc busi signalr scaleoutmessagebu inform onreceiv signalr messagebu verbos need add worker alloc worker busi alloc busi signalr sqlmessagebu inform start instal signalr sql object signalr sqlmessagebu inform start instal signalr sql object signalr sqlmessagebu inform start instal signalr sql object signalr sqlmessagebu inform start instal signalr sql object signalr sqlmessagebu inform signalr sql object instal signalr sqlmessagebu verbos stream save payload messag sql server signalr sqlmessagebu verbos stream start sql notif listen signalr sqlmessagebu inform stream sql servic broker disabl disabl queri notif signalr sqlmessagebu verbos stream payload contain messag receiv signalr sqlmessagebu verbos stream record receiv signalr sqlmessagebu verbos stream record receiv signalr sqlmessagebu verbos stream record receiv signalr sqlmessagebu verbos stream wait ms check messag signalr sqlmessagebu verbos stream record receiv signalr sqlmessagebu verbos stream wait ms check messag signalr sqlmessagebu verbos stream record receiv signalr sqlmessagebu verbos stream wait ms check messag signalr sqlmessagebu verbos stream record receiv signalr sqlmessagebu verbos stream wait ms check messag signalr sqlmessagebu verbos stream record receiv signalr sqlmessagebu verbos stream wait ms check messag signalr sqlmessagebu verbos stream record receiv signalr sqlmessagebu verbos stream wait ms check messag signalr sqlmessagebu verbos stream record receiv signalr sqlmessagebu verbos stream wait ms check messag signalr sqlmessagebu verbos stream record receiv signalr sqlmessagebu verbos stream wait ms check messag signalr sqlmessagebu verbos stream record receiv signalr sqlmessagebu verbos stream wait ms check messag signalr sqlmessagebu verbos stream record receiv signalr sqlmessagebu verbos stream wait ms check messag signalr sqlmessagebu verbos stream record receiv signalr sqlmessagebu verbos stream wait ms check messag signalr sqlmessagebu verbos stream record receiv signalr sqlmessagebu verbos stream wait ms check messag signalr sqlmessagebu verbos stream record receiv signalr sqlmessagebu verbos stream wait ms check messag signalr sqlmessagebu verbos stream record receiv signalr sqlmessagebu verbos stream wait ms check messag signalr sqlmessagebu verbos stream record receiv signalr sqlmessagebu verbos stream wait ms check messag signalr sqlmessagebu verbos stream record receiv signalr sqlmessagebu verbos stream wait ms check messag signalr sqlmessagebu verbos stream record receiv signalr sqlmessagebu verbos stream wait ms check messag signalr sqlmessagebu verbos stream record receiv signalr sqlmessagebu verbos stream wait ms check messag signalr sqlmessagebu verbos stream record receiv signalr sqlmessagebu verbos stream wait ms check messag signalr sqlmessagebu verbos stream record receiv signalr sqlmessagebu verbos stream wait ms check messag signalr sqlmessagebu verbos stream record receiv signalr sqlmessagebu verbos stream wait ms check messag signalr sqlmessagebu verbos stream record receiv signalr sqlmessagebu verbos stream wait ms check messag signalr sqlmessagebu verbos stream record receiv signalr sqlmessagebu verbos stream wait ms check messag signalr sqlmessagebu verbos stream record receiv signalr sqlmessagebu verbos stream wait ms check messag signalr sqlmessagebu verbos stream record receiv signalr sqlmessagebu verbos stream wait ms check messag signalr sqlmessagebu verbos stream record receiv signalr sqlmessagebu verbos stream wait ms check messag signalr sqlmessagebu verbos stream record receiv signalr sqlmessagebu verbos stream wait ms check messag signalr sqlmessagebu verbos stream record receiv signalr sqlmessagebu verbos stream wait ms check messag signalr sqlmessagebu verbos stream save payload messag sql server signalr sqlmessagebu verbos stream payload contain messag receiv signalr sqlmessagebu verbos stream record receiv signalr sqlmessagebu verbos stream record receiv signalr sqlmessagebu verbos stream record receiv record receiv signalr transport transportheartbeat inform connect b bf b df f b new signalr transport longpollingtransport verbos drainwrit b bf b df f b signalr transport longpollingtransport inform completerequest b bf b df f b signalr transport transportheartbeat verbos connect b bf b df f b exist close previou connect signalr transport longpollingtransport inform end b bf b df f b signalr transport longpollingtransport verbos drainwrit b bf b df f b signalr transport longpollingtransport inform completerequest b bf b df f b signalr transport transportheartbeat verbos connect b bf b df f b exist close previou connect signalr transport longpollingtransport inform end b bf b df f b signalr sqlmessagebu inform start instal signalr sql object signalr scaleoutmessagebu inform stream chang state initi buffer signalr sqlmessagebu inform start instal signalr sql object signalr sqlmessagebu inform start instal signalr sql object signalr sqlmessagebu inform start instal signalr sql object signalr sqlmessagebu inform start instal signalr sql object signalr sqlmessagebu inform start instal signalr sql object signalr sqlmessagebu inform start instal signalr sql object signalr sqlmessagebu inform start instal signalr sql object signalr sqlmessagebu inform start instal signalr sql object signalr sqlmessagebu inform signalr sql object instal signalr scaleoutmessagebu inform stream chang state buffer open signalr sqlmessagebu verbos stream start sql notif listen signalr sqlmessagebu verbos stream save payload messag sql server signalr sqlmessagebu verbos stream save payload messag sql server signalr sqlmessagebu inform stream sql servic broker disabl disabl queri notif signalr scaleoutmessagebu inform onreceiv signalr sqlmessagebu verbos stream payload contain messag receiv signalr scaleoutmessagebu inform onreceiv signalr sqlmessagebu verbos stream payload contain messag receiv signalr sqlmessagebu verbos stream record receiv signalr sqlmessagebu verbos stream record receiv signalr sqlmessagebu verbos stream record receiv signalr sqlmessagebu verbos stream wait ms check messag signalr sqlmessagebu verbos stream record receiv signalr sqlmessagebu verbos stream wait ms check messag signalr sqlmessagebu verbos stream record receiv signalr sqlmessagebu verbos stream wait ms check messag signalr sqlmessagebu verbos stream record receiv signalr sqlmessagebu verbos stream wait ms check messag signalr sqlmessagebu verbos stream save payload messag sql server signalr scaleoutmessagebu inform onreceiv signalr sqlmessagebu verbos stream payload contain messag receiv signalr sqlmessagebu verbos stream record receiv signalr sqlmessagebu verbos stream record receiv signalr sqlmessagebu verbos stream record receiv signalr sqlmessagebu verbos stream wait ms check messag signalr sqlmessagebu verbos stream record receiv signalr sqlmessagebu verbos stream wait ms check messag signalr sqlmessagebu verbos stream record receiv signalr sqlmessagebu verbos stream wait ms check messag signalr sqlmessagebu verbos stream record receiv signalr sqlmessagebu verbos stream wait ms check messag signalr sqlmessagebu verbos stream save payload messag sql server signalr sqlmessagebu verbos stream save payload messag sql server signalr scaleoutmessagebu inform onreceiv signalr sqlmessagebu verbos stream payload contain messag receiv signalr scaleoutmessagebu inform onreceiv signalr sqlmessagebu verbos stream payload contain messag receiv signalr sqlmessagebu verbos stream record receiv signalr sqlmessagebu verbos stream record receiv signalr sqlmessagebu verbos stream record receiv signalr sqlmessagebu verbos stream wait ms check messag signalr sqlmessagebu verbos stream record receiv signalr sqlmessagebu verbos stream wait ms check messag signalr sqlmessagebu verbos stream record receiv signalr sqlmessagebu verbos stream wait ms check messag signalr sqlmessagebu verbos stream record receiv signalr sqlmessagebu verbos stream wait ms check messag signalr sqlmessagebu verbos stream record receiv signalr sqlmessagebu verbos stream wait ms check messag signalr sqlmessagebu verbos stream record receiv signalr sqlmessagebu verbos stream wait ms check messag signalr sqlmessagebu verbos stream record receiv signalr sqlmessagebu verbos stream wait ms check messag signalr sqlmessagebu verbos stream record receiv signalr sqlmessagebu verbos stream wait ms check messag signalr sqlmessagebu verbos stream record receiv signalr sqlmessagebu verbos stream wait ms check messag signalr sqlmessagebu verbos stream record receiv signalr sqlmessagebu verbos stream wait ms check messag csharp public overrid task onconnect client foo onconnect context connectionid return null seem happen reconnect look unrel issu though file new bug still repro without send messag client onconnect event client receiv except error first reconnect file new issu debug relat reconnect file new bug ok,3,300,transport|signing|delegation,1897,0.158144438587243,0.8786233067512512
1243,https://api.github.com/repos/SignalR/SignalR/issues/1243,issue,js client multipl connect server process restart websocket sse transport one connect rais reconnect work connect rais reconnect work,js client multipl connect server reset websocket sse transport one connect rais reconnect work connect rais reconnect work note issu repro websocket sse transport repro foreverfram lp transport repro download repro issu repro zip persist connect map repro iis websit request page raw connect html connect raw connect html connect websocket sse transport specifi querystr e g transport serversentev click broadcast button see connect work run iisreset see one connect rais reconnect connect rais reconnect work click broadcast button connect test etc e g websocket transport caus condit id currentsocketid connect socket onclos need updat similar caus sse transport repro client log connect pst signalr negoti raw connect negoti pst signalr negoti raw negoti pst signalr connect websocket endpoint ws localhost repro raw connect connect transport websocket connectionid ca e c f bede caac b tid pst signalr connect websocket endpoint ws localhost repro raw connect transport websocket connectionid fe ff df f tid pst signalr websocket open pst signalr monitor keep aliv warn timeout connect lost timeout pst signalr websocket open pst signalr tri monitor keep aliv alreadi monitor script websocket error network error connect server termin abnorm script websocket error network error connect server termin abnorm pst signalr unclean disconnect websocket pst signalr close websocket pst signalr websocket reconnect pst signalr connect websocket endpoint ws localhost repro raw transport websocket connectionid fe ff df f messageid b c ch c ci c tid script websocket error incorrect http respons statu code servic unavail pst signalr close websocket pst signalr websocket reconnect pst signalr connect websocket endpoint ws localhost repro raw transport websocket connectionid fe ff df f messageid b c ch c ci c tid script websocket error incorrect http respons statu code servic unavail pst signalr close websocket pst signalr websocket reconnect pst signalr connect websocket endpoint ws localhost repro raw transport websocket connectionid fe ff df f messageid b c ch c ci c tid pst signalr websocket open,move rtm look regress move backlog stop work verifi,4,38,transport|signing|scripting|availability,352,0.10795454545454546,0.6760373711585999
1273,https://api.github.com/repos/SignalR/SignalR/issues/1273,issue,client websockt sse transport reconnect disconnect command server caus reconnect connect disconnect,repro map aspnet sampl iis websit build web site remot machin websocket sse transport request iis websit raw default aspx disconnect network cabl second reconnect event rais connect network cabl connect becom reconnect reconnect see client receiv disconnect command server client disconnect connect regress rc shoud remov server send disconnect command much use anymor caus issu repro client event pst connect reconnect bf bbc fb b b b pst reconnect connect bf bbc fb b b b pst connect establish pst connect disconnect undefin repro client log pst signalr negoti signalrtest releas rc signalr negoti pst signalr connect websocket endpoint ws xiaota vm signalrtest releas rc signalr connect transport websocket connectionid bf bbc fb b b b connectiondata b b name myhub tid pst signalr websocket open pst signalr monitor keep aliv warn timeout connect lost timeout pst signalr trigger client hub event foo hub myhub pst signalr keep aliv miss connect dead slow script websocket error network error connect server termin abnorm pst signalr unclean disconnect websocket pst signalr close websocket pst signalr websocket reconnect pst signalr connect websocket endpoint ws xiaota vm signalrtest releas rc signalr transport websocket connectionid bf bbc fb b b b connectiondata b b name myhub messageid b c cg c ch c ci c cf c group b myhub group tid script websocket error network error server name address resolv pst signalr close websocket pst signalr websocket reconnect pst signalr connect websocket endpoint ws xiaota vm signalrtest releas rc signalr transport websocket connectionid bf bbc fb b b b connectiondata b b name myhub messageid b c cg c ch c ci c cf c group b myhub group tid script websocket error network error server name address resolv pst signalr close websocket pst signalr websocket reconnect pst signalr connect websocket endpoint ws xiaota vm signalrtest releas rc signalr transport websocket connectionid bf bbc fb b b b connectiondata b b name myhub messageid b c cg c ch c ci c cf c group b myhub group tid script websocket error network error server name address resolv pst signalr close websocket pst signalr websocket reconnect pst signalr connect websocket endpoint ws xiaota vm signalrtest releas rc signalr transport websocket connectionid bf bbc fb b b b connectiondata b b name myhub messageid b c cg c ch c ci c cf c group b myhub group tid pst signalr websocket open pst signalr disconnect command receiv server pst signalr stop monitor keep aliv pst signalr close websocket pst signalr websocket close,regress fact command receiv need server side log look remov disconnect command requir help ensur disconnect event rais server side rais disconnect event client come back reconnect start receiv messag connect id actual disconnect rais disconnect event connect id make server disconnect timeout bigger client disconnect timeout issu fix issu seem caus bad set defaultconfigurationmanag follow commit address verifi use net client ws sse lp realli affect net client need verifi js client verifi js client ws sse,3,47,transport|signing|scripting,510,0.09215686274509804,0.6695494055747986
