postid,links,tags,title,question,answers,uniq,raw,words,len,ratio,probability
9880,https://api.github.com/repos/dotnet/runtime/issues/9880,issue,websocket client leak socket descriptor x,see issu know still elig reproduc linux try connect websocket server constantli throw error see amount socket descriptor grow reason analzi code socket connectedsocket await connectsocketasync uri host uri port cancellationtoken configureawait fals stream stream new networkstream connectedsocket ownssocket true upgrad ssl need uri scheme urischem wss var sslstream new sslstream stream await sslstream authenticateasclientasync uri host option clientcertif securityprotocol allowedsecurityprotocol checkcertificaterevoc fals configureawait fals stream sslstream creat secur key expect respons build request header keyvaluepair seckeyandsecwebsocketaccept createseckeyandsecwebsocketaccept byte requesthead buildrequesthead uri option seckeyandsecwebsocketaccept key write header connect await stream writeasync requesthead requesthead length cancellationtoken configureawait fals pars respons store state remaind connect string subprotocol await parseandvalidateconnectresponseasync stream option seckeyandsecwebsocketaccept valu cancellationtoken configureawait fals except thrown function connect connectedsocket left unclos lead drastic fd increas propos fix socket connectedsocket await connectsocketasync uri host uri port cancellationtoken configureawait fals stream stream new networkstream connectedsocket ownssocket true string subprotocol try upgrad ssl need uri scheme urischem wss var sslstream new sslstream stream await sslstream authenticateasclientasync uri host option clientcertif securityprotocol allowedsecurityprotocol checkcertificaterevoc fals configureawait fals stream sslstream creat secur key expect respons build request header keyvaluepair seckeyandsecwebsocketaccept createseckeyandsecwebsocketaccept byte requesthead buildrequesthead uri option seckeyandsecwebsocketaccept key write header connect await stream writeasync requesthead requesthead length cancellationtoken configureawait fals pars respons store state remaind connect subprotocol await parseandvalidateconnectresponseasync stream option seckeyandsecwebsocketaccept valu cancellationtoken configureawait fals catch stream dispos throw,open differ repositori,7,27,leak|scripting|ssl|authentication|certificate|security|validate,235,0.1148936170212766,0.18444018065929413
1189,https://api.github.com/repos/SignalR/SignalR/issues/1189,issue,modifi transport support onconnect ack behavior,ack indic client ok start send data server prevent race condit establish send receiv signal involv chang longpol transport longer ping server connect,implement,3,4,transport|race condition|signing,31,0.12903225806451613,0.18255919218063354
1205,https://api.github.com/repos/npgsql/npgsql/issues/1205,issue,system outofmemoryexcept open connect ssh tunnel,try connect databas ssh tunnel use ssh net npgsql version sampl easi system outofmemoryexcept thrown open connect conn open stack,forward local port remot port instead word seem npgsql talk ssh server instead postgresql yes right mistak sorri look except npgsql took size valu data stream tri alloc buffer size without check maximum bound sure max bound though think bound protect potenti server crash malici mistaken connect partial right think problem npgsql unbound buffer alloc rather check messag code valid postgresql messag almost alway start byte length follow one byte messag code debug assert messag code valid actual check prevent error scenario howev fifth byte happen valid messag code obviou done case legitim singl postgresql messag huge think datarow messag contain big binari blob open got around cours first messag code length least initi packet length bound secur issu lie packet type whose length known higher level secur great idea implement part,6,13,ssh|tunnelling|protect|malicious|validate|security,159,0.08176100628930817,0.1823476403951645
3492,https://api.github.com/repos/SignalR/SignalR/issues/3492,issue,signalr self host authent,write chat room signalr consol applic server asp net mvc client need authent program user login mvc client server cant recogn user context user alway null fix problem startup class server class startup public void configur iappbuild app app usecor corsopt allowal app mapsignalr hub server public class myhub hub public void send string name string messag client addmessag name messag login mvc client,issu close part issu clean describ still encount problem pleas feel free open comment let us know still interest hear backlog got littl big bulk clean back top thing thank continu feedback,3,7,signing|authentication|login,101,0.06930693069306931,0.18230271339416504
22767,https://api.github.com/repos/dotnet/aspnetcore/issues/22767,issue,signalr cross origin negoti fail blazor webassembl cooki authent,develop blazor webassembl pwa want connect signalr hub differ subdomain use cooki authent develop visual studio window net sdk server host cento use asp net core applic server blazor webassembl web client signalr client use nuget packag microsoft aspnetcor signalr client signalr hub server use microsoft azur signalr applic run blazor webassembl load app exampl com user log issu secur httponli authent cooki signalr client tri connect signalr exampl com signalrhub host negoti step fail unauthor server signalr exampl com accept authent cooki issu app exampl com requir cor polici use azur blob storag azur keyvault provid data protect servic share server verifi abl post success negoti endpoint signalr exampl com provid specif request credenti includ use exampl client code razor page result run code signalr hubconnect result respons statu code indic success unauthor post negoti result negotiatevers connectionid xxxxxx connectiontoken yyyyyyy availabletransport transport websocket transferformat text binari transport serversentev transferformat text transport longpol transferformat text binari check request come server authent cooki miss post messagehub negoti come hubconnect uncom two line skip negoti forc websocket signalrconnect work appear negoti step fail howev approach compat use azur signalr servic good solut comment direct post messagehub negoti fail unauthor authent cooki manual option hubconnectionbuild withurl httponli authent cooki read client code appear tell hubconnect browserrequestcredenti includ authent cooki sent post messagehub negoti miss someth great hear thank,thank contact us configur underli signalr client seem miss abil configur underli websocket right thing hi thank get back think websocket connect issu work skip negoti step websocket transport problem authent cooki attach http post negoti thank configur underli signalr client yes need option provid set option request guess wasm set omit default credenti like post snippet document thank give try blazor pwa thu blazor pwa doc blazor wasm scenario thu blazor host model configur topic blazor wasm config area blazor wasm gener cross link blazor pwa doc think appli blazor wasm scenario current coverag think deleg use configur replac use send http request use websocket connect deleg must return non null valu receiv default valu paramet either modifi set default valu return return new instanc replac handler make sure copi set want keep provid handler otherwis configur option cooki header appli new handler refer advic speak copi certain set unawar best one give specif exampl want code exampl text otherwis safe mention briefli similar state point cross link signalr topic section work give upvot happi exampl beauti work treat thank much help,11,53,signing|cookie|authentication|security|authorise|protect|credential|availability|transport|delegation|safe,419,0.12649164677804295,0.18048222362995148
11898,https://api.github.com/repos/dotnet/aspnetcore/issues/11898,issue,signalr websocket avail support transport negoti,server side use asp net core signalr follow tutori use uniti f besthttp pro come signalrcor client attempt establish connect come two serversideev longpol expect websocket avail signalr server side tutori mention add except renam endpoint configur app usewebsocket miss someth otherwis obviou,host server side applic host iis default iis support websocket run window server window higher b enabl websocket protocol featur window featur configur app usewebsocket signalr use azur web app need enabl websocket portal thank trick,3,8,signing|availability|transport,86,0.09302325581395349,0.18040752410888672
1296,https://api.github.com/repos/nicehash/NiceHashMiner-Archived/issues/1296,issue,nichhash memori leak,g memori instal window pro system run x evga gb rig often time nicehash caus system memori dead seem nicehash beta memori leakag issu,anoth issu nicehash miner freez due run memori abl termin nich miner keep bring excav cmd window releas window home gb ram runn evga gb evga ftw issu,2,6,hash|leak,56,0.10714285714285714,0.17884746193885803
2134,https://api.github.com/repos/aspnet/SignalR/issues/2134,issue,httpclient dispos transport fail start use httpconnect hubconnect,dispos httpclient transport fail start caus resourc leak use hubconnect retri loop sinc call disposeasync even refer connectioncontext connectasync fail start,reopen track port fix next mileston pend shiproom approv bring back shiproom,2,3,transport|leak,42,0.07142857142857142,0.17880624532699585
1285,https://api.github.com/repos/xamarin/Xamarin.Forms/issues/1285,pr,uwp fix variou memori leak uwp applic,descript chang current uwp listview creat first cell without go templateditemslist subsequ updat data behind cell caus second cell realiz doubl number cell creat leak first cell never garbag collect chang forc cell creation go templateitemslist avoid doubl creation leak chang fix bug switch applic main page display modal page leak modal page content window chang fix bug navigationpagerender instanc leak event handler pagecontrol clean chang fix bug page instanc leak resourc chang event handler clean bug fix memori leak xamarin form api chang none behavior chang none pr checklist x test omit state reason descript x rebas top master time pr x chang adher code standard x consolid commit make sens,,2,9,leak|scripting,120,0.075,0.17878815531730652
4078,https://api.github.com/repos/SignalR/SignalR/issues/4078,issue,question signalr firewal,websit oper port e normal websit signalr self host window servic listen port everyth work fine question compani block port except signalr servic block well solut,ok fire virtual machin block access port client signalr code work sinc websit oper port need signalr port need proxi signalr sure resolv info appreci hello inform help regard thank turn solut asp net modul iis effect put process port solv problem,2,7,signing|firewall,72,0.09722222222222222,0.1783478558063507
3228,https://api.github.com/repos/Particular/NServiceBus/issues/3228,issue,regist pipelin step transport,tri figur regist pipelin step part impl rabbitmq transport bit context rabbit use publish channel send messag part transport impl use regist cach layer pipelin step reus channel effici use regist step part implement rabbitmq transport struggl figur go back featur,ad channel context msmq nativ transact say creat channel part dequeu messag regist step pipelin transport implementor say creat channel part dequeu messag seem reson alreadi channel avail right regist step pipelin transport implementor add featur hunch need smell indic potenti flaw transport api seem reson alreadi channel avail right sure need work tomorrow add featur hunch need smell indic potenti flaw transport api rais issu area api think quit difficult hope feed discuss better api still issu close transport longer use behavior cc close one note sqlserver use one callback backward compat note sqlserver use one callback backward compat rabbitmq got assum work,2,11,transport|availability,150,0.07333333333333333,0.17752407491207123
592,https://api.github.com/repos/quasar/Quasar/issues/592,issue,revers proxi increas account password enhanc secur,revers proxi increas account password enhanc secur figur l,mean refer password length connect sock proxi user pass add account password verifi sock connect need sock proxi server listen localhost thu allow connect remot comput,2,6,password|security,43,0.13953488372093023,0.17677916586399078
778,https://api.github.com/repos/aspnet/SignalR/issues/778,issue,refus unsaf header user agent,relat check connect signalr hub follow error httpclient js refus unsaf header user agent eventu result code signalr connect error invalidstateerror fail execut setrequesthead xmlhttprequest object state must open,hello signalr client js error ie test chrome window mac remov pollxhr setrequesthead user agent userag transport xhr setrequesthead user agent userag httpclient work test ie cite signalr client js error correct chrome someth syntax javascript launch nativ js instead ts version current appear client js support ie thank report look work ie compat version see fix ad ecb e de b,5,9,unsafe|signing|validate|transport|scripting,97,0.09278350515463918,0.17668132483959198
48,https://api.github.com/repos/ShareX/ShareX/issues/48,issue,sftp work,step reproduc problem server side linux host amd smp debian x gnu linux ssh non standart port directori screenshot creat file upload show error show login requir jing winscp work fine sharex win server r standart,select replac test storag destin login requir error exist sure insid sftp librari tri pem file destin see login requir applic window screenshot first messag ftp client sharex set ftpssecurityprotocol starksoft net ftp ftpconnectionclosedexcept connect close starksoft net ftp ftpbase getnextcommandrespons int timeout starksoft net ftp ftpbase waitforhappycod int timeout ftpresponsecod happyresponsecod starksoft net ftp ftpbase sendrequest ftprequest request starksoft net ftp ftpbase createpassiveconn consol pm auth ssl pm ssh openssh p debian squeez pm protocol mismatch pm pasv ftp client sharex set ftpssecurityprotocol none starksoft net ftp ftpcommandresponsetimeoutexcept timeout occur wait destin send respons last repons destin starksoft net ftp ftpbase getnextcommandrespons int timeout starksoft net ftp ftpbase waitforhappycod int timeout ftpresponsecod happyresponsecod starksoft net ftp ftpbase sendrequest ftprequest request starksoft net ftp ftpbase createpassiveconn consol pm ssh openssh p debian squeez pm pasv pm protocol mismatch futur refer want chang file upload locat dropbox ftp server menu chang want recheck whether right upload destin select error suitabl authent method found configur problem error messag happen try authent allow server exampl log password password auth disabl think sharex problem sharex use sftp librari even problem librari fix,8,18,sftp|ssh|login|security|ssl|openssh|authentication|password,227,0.07929515418502203,0.1757611632347107
14108,https://api.github.com/repos/OpenRA/OpenRA/issues/14108,issue,add abil transport pick passeng,right passeng order go transport transport order pick passeng featur exist rts starcraft exampl use imagin much easier pick strand engin tanya first move transport passeng order passeng forget sent transport first place extra use combin queu order drive passeng pick drive somewher els passeng board,warcraft difficult pull naval transport cargo posit make imposs pick,2,7,transport|forge,62,0.11290322580645161,0.17393088340759277
376,https://api.github.com/repos/sta/websocket-sharp/issues/376,issue,websocket authent rais event error messag valid credenti,tri connect websocket client use wrong usernam password event error close valid credenti close websocket reason except occur connect code,issu,5,7,authentication|validate|credential|username|password,30,0.23333333333333334,0.17382310330867767
353,https://api.github.com/repos/dotnet/runtime/issues/353,issue,marshal getfunctionpointerfordeleg leak memori,copi vsfeedback item custom notic repeat call p invok took deleg appear leak memori underli caus new alloc umentrythunk getfunctionpointerfordeleg cach previous thunk return use run tight loop see code new thunk use everi time result memori seemingli increas use system use system runtim interopservic namespac test class program static void main string arg true var delg new enumwindowsproc myenumproc intptr ptr marshal getfunctionpointerfordeleg delg gc collect gc waitforpendingfin gc collect privat static int myenumproc intptr hwnd intptr lparam return privat deleg int enumwindowsproc intptr hwnd intptr lparam,introduc new thunk use everi time result memori seemingli increas see thunk get reus yes extra fix amount memori better diagnost memori leak agre memori leak problem leak gc handl noth call destructor bug introduc window phone coreclr port net core sinc day yes look thunk good creat reus note howev everytim get call creat new weak long handl seem bit odd sinc reus thunk reus handl stop leak although sure correct approach thank look commit stop leak although sure correct approach want destroy gc handl thunk otherwis gc handl keep user object aliv good reason differ type leak think fix move code delet version net core fix fix ship net back port older version bug net framework deploy long run program lot getfunctionpointerfordeleg expect problem bug net core,2,14,delegation|leak,222,0.06306306306306306,0.17335429787635803
28586,https://api.github.com/repos/dotnet/runtime/issues/28586,issue,possibl forc ssl client certif reauthent everi connect,wonder possibl forc client connect kestrel iis server authent client certif close ssl connect given differ ssl connect ssl session client reus ssl connect ssl connect close either timeout send connect close server mean close ssl connect client abl abbrevi handshak base server session cach negoti new ssl connect thu authent client certif thing tri clear cachedcr sslsessionscach serversid use reflect still client forc reauthent client certif send connect close header close current ssl connect client forc reauthent cach ssl session abbrevi handshak use possibl disabl chang behavior server side,like client behavior client use e g browser prone cach user cert select provid cert futur connect seen anyth server use chrome test chrome definit cach ultim parti agre reus previou ssl handshak server say chrome prompt client new client certif authent basic look say server info log dump indic realli ssl session experi chrome cach cert select beyond ssl session reset close browser try creat log dump sure reason convinc ssl session client certif nation ident card privat key remov card comput still setup connect assum chrome negoti new ssl session need privat key trace wireshark first solut clear cachedcr sslsessionscach creat new ssl session howev user prompt enter pin code remov card prompt enter card enter pin code howev cach pin code seem happen browser os level close issu sinc net problem someon clue prevent ping thank tip,4,32,ssl|certificate|authentication|private key,239,0.13389121338912133,0.17271727323532104
233,https://api.github.com/repos/ninject/Ninject/issues/233,issue,cach possibl memori leak,struggl memori leak problem app asp net web api ninject depend resolv found suspici code ninject cach class rememb method subscrib dispos event notifyscop never unsubscrib event notifyscop activationblock instanc runtim creat ninjectdependencyresolv class ninjectdependencyresolv mostli look ninject web webapi blob master src ninject web webapi ninjectdependencyresolv cs creat new instanc ninjectdependencyscop instead reus ninjectdependencyresolv cs ninjectdependencyscop via kernel creat new instanc activationblock use type resolut new instanc activationblock creat cach keep subscript activationblock dispos event cach instanc singleton kernel instanc hold link cach singleton well suspect memori leak reason happen cach unsibscrib dispos event handler,usual basic event subscrib refer round notifyscop refer cach notifyscop need inform cach dispos event event subscript keep cach collect keep notifyscop collect sidenot strong refer either cach notifyscop still collect eventu best go solv problem memori profil know actual memori leak feedback,3,16,leak|inject|scripting,144,0.1111111111111111,0.1716575026512146
1717,https://api.github.com/repos/SignalR/SignalR/issues/1717,issue,abortstopdisconnect scenario leak event,abortstopdisconnect scenario leak event handl upload dump file indigof commonshar jcond signalr bug investig help fix handl handl e ff dumpheap type event stat dumpheap mt f b ab e gcroot c f,exceptionsthrowneverywher test hit use serversentev system object mscorlib e system thread task task system object mscorlib e system thread task standardtaskcontinu e e system thread task continuationtaskfromtask e system action still happen last run fail due leak handl memori leak like leak relat leak handl issu reproduc yesterday run,2,7,leak|signing,87,0.08045977011494253,0.17157648503780365
330,https://api.github.com/repos/StackExchange/StackExchange.Redis/issues/330,issue,access encrypt azur redi work asp net applic,hi problem access azur redi server use ssl within asp net applic tri consol applic work use unencrypt connect work even asp net applic connect string use host password redact ssl true password connecttimeout abortconnect fals call azur redi asp net applic lot tcp rst packet call consol app expect result tcp handshak certif exchang data exchang connect close saw link solut work,specif happen instead particular except stack trace etc jan p andr luiz alv mora notificationswrot hi problem access azur redi server use ssl within aspnet applic tri consol applic work use unencrypt connect work even aspnet applic connect string use host password redact ssl true password connecttimeout abortconnect fals call azur redi aspnet applic lot tcp rst packet call consol app expect result tcp handshak certif exchang data exchang connect close saw link solut work repli email directli view github connect avail servic oper starttim stack trace processor serverendpoint server c teamciti buildag work ae edff stackexchang redi stackexchang redi connectionmultiplex cs line stackexchang redi redisbas executesync messag messag resultprocessor expiri commandflag flag c teamciti buildag work ae edff stackexchang redi stackexchang redi redisdatabas cs line chanc specifi certif valid routin app somewher seen case cert valid return fals se redi give type gener error anyth app problem solv rememb solut right code deliv client access anymor close relev info anyon anyth add happili reopen,6,17,encrypt|ssl|password|certificate|availability|validate,237,0.07172995780590717,0.17137932777404785
3953,https://api.github.com/repos/SignalR/SignalR/issues/3953,issue,fail iis window integr authent,asp net mvc app net signalr work fine form base authent host via iis iis express soon chang app window integr authent web config stop work jqueri signalr min js websocket connect fail error websocket handshak unexpect respons code updat ad author attribut hub websocket connect fail http authent fail valid credenti avail probabl chrome support ntlm authent websocket connect main question fall back anoth transport handler call call either ps stackoverflow question,updat apolog judg fast got mix test ad attribut hub altern ad startup class fall back altern transport even though error still thrown browser consol,8,15,integrity|authentication|signing|authorise|validate|credential|availability|transport,104,0.14423076923076922,0.1709851771593094
