answers,creation_date,len,postid,question,ratio,raw,tags,title,uniq,words,probability
provid address ssh command know ip address network host name default raspberrypi,2017-06-25 21:37:33.887 UTC,318,44750867,"went exist thread unabl find solut issu use raspberri pi 2 model b abl connect display via hdmi tri ssh via macbook air os sierra use gigawar usb ethernet adapt step follow termin type ssh -v pi@ prompt enter password enter raspberri termin ask three time enter password fourth time enter password pi@ thank help get follow output last login sun jun 25 16:33:22 ttys000annas-macbook-air:~ annazotova$ ssh -v pi@192.168.0.3openssh_7.3p1 libressl 2.4.1debug1 read configur data /etc/ssh/ssh_configdebug1 /etc/ssh/ssh_config line 20 appli option *debug1 /etc/ssh/ssh_config line 102 appli option *debug1 connect 192.168.0.3 [192.168.0.3] port 22.debug1 connect established.debug1 key_load_publ file directorydebug1 ident file /users/annazotova/.ssh/id_rsa type -1debug1 key_load_publ file directorydebug1 ident file /users/annazotova/.ssh/id_rsa-cert type -1debug1 key_load_publ file directorydebug1 ident file /users/annazotova/.ssh/id_dsa type -1debug1 key_load_publ file directorydebug1 ident file /users/annazotova/.ssh/id_dsa-cert type -1debug1 key_load_publ file directorydebug1 ident file /users/annazotova/.ssh/id_ecdsa type -1debug1 key_load_publ file directorydebug1 ident file /users/annazotova/.ssh/id_ecdsa-cert type -1debug1 key_load_publ file directorydebug1 ident file /users/annazotova/.ssh/id_ed25519 type -1debug1 key_load_publ file directorydebug1 ident file /users/annazotova/.ssh/id_ed25519-cert type -1debug1 enabl compat mode protocol 2.0debug1 local version string ssh-2.0-openssh_7.3debug1 remot protocol version 2.0 remot softwar version openssh_7.3debug1 match openssh_7.3 pat openssh* compat 0x04000000debug1 authent 192.168.0.3:22 pi debug1 ssh2_msg_kexinit sentdebug1 ssh2_msg_kexinit receiveddebug1 kex algorithm curve25519-sha256@libssh.orgdebug1 kex host key algorithm ecdsa-sha2-nistp256debug1 kex server->cli cipher chacha20-poly1305@openssh.com mac compress nonedebug1 kex client->serv cipher chacha20-poly1305@openssh.com mac compress nonedebug1 expect ssh2_msg_kex_ecdh_replydebug1 server host key ecdsa-sha2-nistp256 sha256:lpy5oyssyqw7ggmg0p3ygylrk1bsaxtbijxywicpnncdebug1 host 192.168.0.3 known match ecdsa host key.debug1 found key /users/annazotova/.ssh/known_hosts:10debug1 rekey 134217728 blocksdebug1 ssh2_msg_newkey sentdebug1 expect ssh2_msg_newkeysdebug1 rekey 134217728 blocksdebug1 ssh2_msg_newkey receiveddebug1 ssh2_msg_ext_info receiveddebug1 kex_input_ext_info server-sig-algs=debug1 ssh2_msg_service_accept receiveddebug1 authent continu publickey,password,keyboard-interactivedebug1 next authent method publickeydebug1 tri privat key /users/annazotova/.ssh/id_rsadebug1 tri privat key /users/annazotova/.ssh/id_dsadebug1 tri privat key /users/annazotova/.ssh/id_ecdsadebug1 tri privat key /users/annazotova/.ssh/id_ed25519debug1 next authent method keyboard-interactivepassword:debug1 authent continu publickey,password,keyboard-interactivepassword:debug1 authent continu publickey,password,keyboard-interactivepassword:debug1 authent continu publickey,password,keyboard-interactivedebug1 next authent method passwordpi@192.168.0.3 password debug1 authent continu publickey,password,keyboard-interactivepermiss deni pleas try again.pi@192.168.0.3 password",0.2672955974842767,85,authentication permission-denied permissions raspberry-pi ssh,raspberri pi ssh permiss deni,10,authentication|ssh|password|login|openssh|rsa|dsa|ecdsa|cipher|private key,0.4691738486289978
fatal error due cygwin sshd w10 one mention error messag c:\windows\syswow64\bsh\usr\sbin\sshd.ex cygwin one instal cgwin sshd need remov disabl w10 one servic enabl cygwin one https://cygwin.com/ml/cygwin/2018-06/msg00276.html,2018-12-06 14:28:51.417 UTC,582,53653601,"tri autom file transfer linux odroid xu4 linux comput window authent ssh key window machin even access mobaxterm termin odroid try send ssh scp command follow error 1 [main] sshd 11572 c:\windows\syswow64\bsh\usr\sbin\sshd.ex *** fatal error - unabl load c:\windows\system32\user32.dl win32 error 1114 understand come follow reason work try manag ssh connect command python work raspbian raspberri pi even start get error thought mayb inadvert modifi someth cygwin configur fact still connect send command via rp say otherwis still quit new make ssh/scp commun protocol modifi channel use access remot host? anyon came across overcam issue? document found bug relat cygwin 5 year old window server 2003 1 2 suggest ad permiss follow alreadi run idea debug join configur full callback error underneath well tri python everyth break let know need inform setup local host odroid xu4 - linux ubuntu lts 18.04 architectur arm7l openssh_7.6p1 python 3.6 remot host window 10 - 64 bit mobaxterm cygwin python python use paramiko scp librari tri follow command made connect success tri two way send file via paramiko scp start error even termin send command error scp full callback odroid@odroid:~$ scp -v dir/test.png user@ip:/cygdrive/c/users/user/box/ execut program /usr/bin/ssh host ip user user command scp -v -t /cygdrive/c/users/user/box/ openssh_7.6p1 ubuntu-4ubuntu0.1 openssl 1.0.2n 7 dec 2017 debug1 read configur data /etc/ssh/ssh_config debug1 /etc/ssh/ssh_config line 19 appli option * debug1 connect ip [ip] port 22 debug1 connect establish debug1 ident file /home/odroid/.ssh/id_rsa type 0 debug1 key_load_publ file directori debug1 ident file /home/odroid/.ssh/id_rsa-cert type -1 debug1 key_load_publ file directori debug1 ident file /home/odroid/.ssh/id_dsa type -1 debug1 key_load_publ file directori debug1 ident file /home/odroid/.ssh/id_dsa-cert type -1 debug1 key_load_publ file directori debug1 ident file /home/odroid/.ssh/id_ecdsa type -1 debug1 key_load_publ file directori debug1 ident file /home/odroid/.ssh/id_ecdsa-cert type -1 debug1 key_load_publ file directori debug1 ident file /home/odroid/.ssh/id_ed25519 type -1 debug1 key_load_publ file directori debug1 ident file /home/odroid/.ssh/id_ed25519-cert type -1 debug1 local version string ssh-2.0-openssh_7.6p1 ubuntu-4ubuntu0.1 debug1 remot protocol version 2.0 remot softwar version openssh_7.1 debug1 match openssh_7.1 pat openssh* compat 0x04000000 debug1 authent ip:22 user debug1 ssh2_msg_kexinit sent debug1 ssh2_msg_kexinit receiv debug1 kex algorithm curve25519-sha256@libssh.org debug1 kex host key algorithm ecdsa-sha2-nistp256 debug1 kex server->cli cipher chacha20-poly1305@openssh.com mac compress none debug1 kex client->serv cipher chacha20-poly1305@openssh.com mac compress none debug1 expect ssh2_msg_kex_ecdh_repli debug1 server host key ecdsa-sha2-nistp256 sha256 ksdjsqnsèsq987s8skhgsjbsqqshdfqf87kjj debug1 host ip known match ecdsa host key debug1 found key /home/odroid/.ssh/known_hosts:1 debug1 rekey 134217728 block debug1 ssh2_msg_newkey sent debug1 expect ssh2_msg_newkey debug1 ssh2_msg_newkey receiv debug1 rekey 134217728 block debug1 ssh2_msg_service_accept receiv debug1 authent continu publickey,password,keyboard-interact debug1 next authent method publickey debug1 offer public key rsa sha256:jbsqqshdfqf87kjj/fqf87kjjg2egcsqqshhdsd /home/odroid/.ssh/id_rsa debug1 server accept key pkalg ssh-rsa blen 279 debug1 authent succeed publickey authent ip [ip]:22 debug1 channel 0 new [client-session] debug1 request no-more-sessions@openssh.com debug1 enter interact session debug1 pledg network debug1 client_input_global_request rtype hostkeys-00@openssh.com want_repli 0 debug1 send environ debug1 send command scp -v -t /cygdrive/c/users/user/ 1 [main] sshd 13224 c:\windows\syswow64\bsh\usr\sbin\sshd.ex *** fatal error - unabl load c:\windows\system32\user32.dl win32 error 1114 debug1 client_input_channel_req channel 0 rtype exit-sign repli 0 debug1 client_input_channel_req channel 0 rtype eow@openssh.com repli 0 debug1 channel 0 free client-sess nchannel 1 debug1 fd 0 clear o_nonblock debug1 fd 1 clear o_nonblock transfer sent 2748 receiv 2932 byte 0.3 second byte per second sent 9984.6 receiv 10653.1 debug1 exit statu -1 lost connect",0.12886597938144329,75,cygwin linux mobaxterm python ssh,ssh scp command fail execut success ssh key authentif error messag win32 error 1114,11,ssh|authentication|openssh|openssl|rsa|dsa|ecdsa|cipher|password|public key|signing,0.4634803533554077
manag overcom problem simpli re-instal ubuntu machin problem instal properli upon instal problem setup /home directori mount via nfs network file system bellow command job check make sure remot .ssh directori authorized_key file proper permiss own permiss 0700 rwx:---:--- $home/.ssh 0600 rw-:---:--- $home/.ssh/authorized_key verifi ssh daemon allow key auth i.e openssh server line config pubkeyauthent yes re-run ssh command debug output enabl ssh -v yourhost show authent method go try i.e good luck,2014-08-28 07:59:00.683 UTC,222,25543666,"use give pass phrase key-fingerprint success gener shown give prompt user password provid state prompt password ask password ps use noth seem work fine everytim prompt password [edit] show debug1 ssh2_msg_kexinit sent debug1 ssh2_msg_kexinit receiv debug1 kex server->cli aes128-ctr hmac-md5-etm@openssh.com none debug1 kex client->serv aes128-ctr hmac-md5-etm@openssh.com none debug1 send ssh2_msg_kex_ecdh_init debug1 expect ssh2_msg_kex_ecdh_repli debug1 server host key ecdsa b2:58:a9:da:84:3f:43:1c:86:51:ba:cd:b7:88:a3:74 debug1 host localhost known match ecdsa host key debug1 found key /home/harsh/.ssh/known_hosts:1 debug1 ssh_ecdsa_verifi signatur correct debug1 ssh2_msg_newkey sent debug1 expect ssh2_msg_newkey debug1 ssh2_msg_newkey receiv debug1 roam allow server debug1 ssh2_msg_service_request sent debug1 ssh2_msg_service_accept receiv debug1 authent continu publickey,password debug1 next authent method publickey debug1 offer dsa public key /home/harsh/.ssh/id_dsa debug1 authent continu publickey,password debug1 offer rsa public key /home/harsh/.ssh/id_rsa debug1 authent continu publickey,password debug1 tri privat key /home/harsh/.ssh/id_ecdsa debug1 tri privat key /home/harsh/.ssh/id_ed25519 debug1 next authent method password harsh@localhost password",0.2882882882882883,64,linux ssh ubuntu,ssh ssh-keygen gener rsa key work,14,ssh|rsa|fingerprint|password|hmac|md5|openssh|ecdsa|dsa|signature|authentication|public key|private key|authorise,0.3948715627193451
debug ssh passwordless authent run detail debug mode -vvv ssh -vvv user@host run specif key ssh -i public_key user@host check file permiss ~./ssh permiss 700 ~./ssh own account ~/.ssh/authorized_key permiss 600 ~/.ssh/authorized_key own account permiss client /.ssh/config permiss 600 ~/.ssh/id_* permiss 600 check privat key match public key local ssh-keygen -y -f ~/.ssh/id_rsa server cat ~/.ssh/authorized_key,2018-02-20 02:04:33.29 UTC,147,48876839,"creat pair key send public key server via ssh-copy-id still abl log password output ssh -v user@host debug1 found key /home/pumba/.ssh/known_hosts:1 debug1 rekey 134217728 block debug1 ssh2_msg_newkey sent debug1 expect ssh2_msg_newkey debug1 rekey 134217728 block debug1 ssh2_msg_newkey receiv debug1 ssh2_msg_ext_info receiv debug1 kex_input_ext_info server-sig-algs= debug1 ssh2_msg_service_accept receiv debug1 authent continu publickey,password debug1 next authent method publickey debug1 offer rsa public key /home/pumba/.ssh/id_rsa debug1 authent continu publickey,password debug1 tri privat key /home/user/.ssh/id_dsa debug1 tri privat key /home/pumba/.ssh/id_ecdsa debug1 tri privat key /home/pumba/.ssh/id_ed25519 debug1 next authent method password",0.36054421768707484,53,ssh,perform password authent ssh,9,ssh|password|authentication|public key|rsa|private key|dsa|ecdsa|authorise,0.3936586380004883
guid show control access linux instanc creat ssh key edit public ssh key metadata gener ssh key use ssh-keygen tool need add key instanc base project-wid metadata articl help,2018-05-22 17:24:56.603 UTC,134,50473374,tri connect googl cloud ssh get deni permiss error public key follow internet tutori none work chmod 0700 .ssh folder file insid 0600 none option work ssh-addev $ ssh-agent -sssh-add ~ / .ssh / id_rsaauthorized_key error log debug1 found key /home/dev01/.ssh/known_hosts:2 debug1 rekey 134217728 block debug1 ssh2_msg_newkey sent debug1 expect ssh2_msg_newkey debug1 rekey 134217728 block debug1 ssh2_msg_newkey receiv debug1 ssh2_msg_ext_info receiv debug1 kex_input_ext_info server-sig-alg = debug1 ssh2_msg_service_accept receiv debug1 authent continu publickey debug1 next authent method publickey debug1 offer rsa public key /home/dev01/.ssh/id_rsa.pub debug1 authent continu publickey debug1 authent method try permiss deni publickey,0.22388059701492538,30,gcloud google-cloud-platform google-compute-engine ssh ssh-keys,error tri connect googl cloud ssh,5,ssh|public key|rsa|authorise|authentication,0.34679943323135376
output see look consist server reject key ssh check even specifi command-lin load ssh-agent troubleshoot remov ssh-agent pictur specifi privat key command-lin run new shell close afterward trash exist environ ssh-keygen prompt key password work double-check key ssh-agent provid actual correct one check ssh-agent ident agent differ dump key re-load differ sure hope help bit,2013-03-28 10:31:39.05 UTC,255,15679503,problem connect ssh servic ssh-agent run ps -e | grep ssh 12163 ? 00:00:00 ssh-agent cach ident ssh-add -l 4096 25:56:f4:9c:09:65:fe:39:b3:17:73:bd:3c:76:3f:8d /home/matthias/.ssh/id_rsa rsa everyth exist ls ~/.ssh/ id_rsa id_rsa.pub known_host id_rsa.pub upload bitbucket.org ssh-key section howev ssh authent fail use verbos mode one see somehow tri load non-exist id_dsa file ssh -v -t hg@bitbucket.org [...] debug1 next authent method publickey debug1 offer rsa public key /home/matthias/.ssh/id_rsa debug1 authent continu publickey debug1 offer rsa public key /home/matthias/.ssh/id_rsa debug1 remot forc command conq username:matthias_hues debug1 remot port forward disabl debug1 remot x11 forward disabl debug1 remot agent forward disabl debug1 remot pty alloc disabl debug1 server accept key pkalg ssh-rsa blen 535 debug1 key_parse_private_pem pem_read_privatekey fail debug1 read pem privat key done type enter passphras key /home/matthias/.ssh/id_rsa debug1 read pem privat key done type rsa debug1 remot forc command conq username:matthias_hues debug1 remot port forward disabl debug1 remot x11 forward disabl debug1 remot agent forward disabl debug1 remot pty alloc disabl debug1 authent continu publickey debug1 tri privat key /home/matthias/.ssh/id_dsa ident /home/matthias/.ssh/id_dsa file directori debug1 tri privat key /home/matthias/.ssh/id_ecdsa ident /home/matthias/.ssh/id_ecdsa file directori debug1 authent method try permiss deni publickey somebodi els run problem hasa suggestion? [thank edit,0.23137254901960785,59,ssh,bitbucket ssh authent,9,ssh|authentication|rsa|dsa|public key|username|private key|ecdsa|password,0.29103976488113403
