answers,creation_date,len,postid,question,ratio,raw,tags,title,uniq,words,probability
least gener pair public/priv key upload public key server /users/danass/.ssh/id_rsa privat key ok..mi bad.when prompt key password type return thought password.us return key put empti password skip key input method type wrong password prompt password.i tri differ password abl enter type right password.i induc error fact authent prompt pass use return key password without know password wrong check password right,2018-03-11 18:35:54.443 UTC,406,49223627,ad key get list key return nothing.i remov known_host file prompt key password.but authent fail file known_host mean server recogn anymor key invalid properli add key computer? mac sierra 10.12.6here extract log silence:.ssh danass$ ssh-add -l agent ident silence:.ssh danass$ ssh-add my.key enter passphras my.key silence:.ssh danass$ ssh-add -l agent ident silence:.ssh danass$ ssh -vt daniel@167.114.x.x openssh_7.4p1 libressl 2.5.0 debug1 read configur data /etc/ssh/ssh_config debug1 /etc/ssh/ssh_config line 53 appli option debug1 connect 167.114.x.x [167.114.x.x] port 22 debug1 connect establish debug1 key_load_publ file directori debug1 ident file /users/danass/.ssh/id_rsa type -1 debug1 key_load_publ file directori debug1 ident file /users/danass/.ssh/id_rsa-cert type -1 debug1 key_load_publ file directori debug1 ident file /users/danass/.ssh/id_dsa type -1 debug1 key_load_publ file directori debug1 ident file /users/danass/.ssh/id_dsa-cert type -1 debug1 key_load_publ file directori debug1 ident file /users/danass/.ssh/id_ecdsa type -1 debug1 key_load_publ file directori debug1 ident file /users/danass/.ssh/id_ecdsa-cert type -1 debug1 key_load_publ file directori debug1 ident file /users/danass/.ssh/id_ed25519 type -1 debug1 key_load_publ file directori debug1 ident file /users/danass/.ssh/id_ed25519-cert type -1 debug1 enabl compat mode protocol 2.0 debug1 local version string ssh-2.0-openssh_7.4 debug1 remot protocol version 2.0 remot softwar version openssh_7.2p2 ubuntu-4ubuntu2.4 debug1 match openssh_7.2p2 ubuntu-4ubuntu2.4 pat openssh compat 0x04000000 debug1 authent 167.114.x.x:22 daniel debug1 ssh2_msg_kexinit sent debug1 ssh2_msg_kexinit receiv debug1 kex algorithm curve25519-sha256@libssh.org debug1 kex host key algorithm ecdsa-sha2-nistp256 debug1 kex server->cli cipher chacha20-poly1305@openssh.com mac compress none debug1 kex client->serv cipher chacha20-poly1305@openssh.com mac compress none debug1 expect ssh2_msg_kex_ecdh_repli debug1 server host key ecdsa-sha2-nistp256 sha256:cxfjy5s*n7*jzd9p*7nivs9j*4e4bo8bnb*$//swqk7i authent host 167.114.x.x 167.114.x.x establish ecdsa key fingerprint sha256:cx2jy5spn7hjzc9p77nivs9jb4e4bo8nbmf//swqk7i sure want continu connect yes/no? yes warn perman ad 167.114.x.x ecdsa list known host debug1 rekey 134217728 block debug1 ssh2_msg_newkey sent debug1 expect ssh2_msg_newkey debug1 ssh2_msg_newkey receiv debug1 rekey 134217728 block debug1 ssh2_msg_ext_info receiv debug1 kex_input_ext_info server-sig-algs= debug1 ssh2_msg_service_accept receiv debug1 authent continu publickey debug1 next authent method publickey debug1 tri privat key /users/danass/.ssh/id_rsa debug1 tri privat key /users/danass/.ssh/id_dsa debug1 tri privat key /users/danass/.ssh/id_ecdsa debug1 tri privat key /users/danass/.ssh/id_ed25519 debug1 authent method try permiss deni publickey silence:.ssh danass$ edit:i id_rsa copi privat key chmod 600 itknown_host contain ip address key link connect alreadi connect,0.22413793103448276,91,authentication macos ssh,add ssh key mac - authent fail,12,authentication|ssh|password|validate|openssh|rsa|dsa|ecdsa|cipher|fingerprint|private key|public key,0.6334112882614136
,2018-04-20 20:16:31.553 UTC,297,49949132,"tri ssh gce instanc gcomput ssh seem done everyth right far run debug1 read configur data /etc/ssh/ssh_config debug1 /etc/ssh/ssh_config line 48 appli option * debug1 connect 104.xxx.xxx.xxx port 22 debug1 connect establish debug1 ident file /users/myusername/.ssh/google_compute_engin type 0 debug1 key_load_publ file directori debug1 ident file /users/myusername/.ssh/google_compute_engine-cert type -1 debug1 local version string ssh-2.0-openssh_7.6 debug1 remot protocol version 2.0 remot softwar version openssh_5.3 debug1 match openssh_5.3 pat openssh_5* compat 0x0c000000 debug1 authent 104.xxx.xxx.xxx:22 myusernam debug1 use hostkeyalia compute.1694426511137997xxxx debug1 ssh2_msg_kexinit sent debug1 ssh2_msg_kexinit receiv debug1 kex algorithm diffie-hellman-group-exchange-sha256 debug1 kex host key algorithm ssh-rsa debug1 kex server->cli cipher aes128-ctr mac umac-64@openssh.com compress none debug1 kex client->serv cipher aes128-ctr mac umac-64@openssh.com compress none debug1 ssh2_msg_kex_dh_gex_request2048&lt;3072&lt;8192 sent debug1 got ssh2_msg_kex_dh_gex_group debug1 ssh2_msg_kex_dh_gex_init sent debug1 got ssh2_msg_kex_dh_gex_repli debug1 server host key ssh-rsa sha256:cyfi+cpp+t4kyotsjoe80cugt0gl3txislch/8axxx debug1 use hostkeyalia compute.1694426511137997xxxx debug1 host compute.1694426511137997xxxx known match rsa host key debug1 found key /users/myusername/.ssh/google_compute_known_hosts:1 debug1 rekey 429496xxxx block debug1 ssh2_msg_newkey sent debug1 expect ssh2_msg_newkey debug1 ssh2_msg_newkey receiv debug1 rekey 4294967296 block debug1 ssh2_msg_service_accept receiv debug1 authent continu publickey,gssapi-keyex,gssapi-with-m debug1 next authent method publickey debug1 offer public key rsa sha256:rp2w5apdgoueqyu0xyuatuquz7/fqrttuc3howaxxxx /users/myusername/.ssh/google_compute_engin debug1 authent continu publickey,gssapi-keyex,gssapi-with-m debug1 authent method try myusername@104.xxx.xxx.xxx permiss deni publickey,gssapi-keyex,gssapi-with-m error: gcloud.compute.ssh [/usr/bin/ssh] exit return code [255] tri far delet ssh key project metadata page comput instanc setup inherit ssh key project noth chang ssh page instanc authent gcloud ‘gcloud auth login’ use account ‘gcloud init’ setup configur default project timezon verifi firewal port 22 open use ‘gcloud comput firewall-rul list’ renew rsa public key use ‘ssh-keygen -t rsa -f ~/.ssh/google_compute_engin -c myusername’ updat gcloud metadata new public key use ‘gcloud comput ssh svuppala@instancename’ verifi https://console.cloud.google.com/compute/metadata/sshkeys?project=xxx reinstal gcloud sdk perform step never ad key instanc directli seem exhaust option help highli appreci",0.22895622895622897,68,gcloud google-cloud-platform google-compute-engine ssh,ssh gce instanc fail despit right ssh configur,9,ssh|username|openssh|authentication|rsa|cipher|public key|login|firewall,0.6096985340118408
mention name user ssh server e.g machin ubuntu instanc ssh -v -i .\cheftutorial.pem ubuntu@ec2-54-148-153-153.us-west-2.compute.amazonaws.com try find correspond user machin aws doc guess prefix username@ server address pleas make sure permiss pem file 400 go directori pem file exist execut execut ubuntu server provid rhel cento server provid usernam note:- owner pem file root provid command,2017-04-05 19:56:36.323 UTC,270,43240492,made new ec2 instanc aws includ new key pair ad ssh secur group output trace ssh.ex openssh_7.1p2 openssl 1.0.2h 3 2016 line:1 char:4 + ssh &lt;&lt;&lt;&lt -v -i .\cheftutorial.pem ec2-54-148-153-153.us-west-2.compute.amazo naws.com 2> out.txt + categoryinfo notspecifi openssh_7.1p2 ....2h 3 2016 :string [] remoteexcept + fullyqualifiederrorid nativecommanderror debug1 read configur data /etc/ssh/ssh_config debug1 connect ec2-54-148-153-153.us-west-2.compute.amazonaws.com [54.14 8.153.153] port 22 debug1 connect establish debug1 key_load_publ file directori debug1 ident file .\cheftutorial.pem type -1 debug1 key_load_publ file directori debug1 ident file .\cheftutorial.pem-cert type -1 debug1 enabl compat mode protocol 2.0 debug1 local version string ssh-2.0-openssh_7.1 debug1 remot protocol version 2.0 remot softwar version openssh_7.2p2 ubun tu-4ubuntu2.1 debug1 match openssh_7.2p2 ubuntu-4ubuntu2.1 pat openssh* compat 0x04000000 debug1 authent ec2-54-148-153-153.us-west-2.compute.amazonaws.com:22 i861009 debug1 ssh2_msg_kexinit sent debug1 ssh2_msg_kexinit receiv debug1 kex server->cli chacha20-poly1305@openssh.com none debug1 kex client->serv chacha20-poly1305@openssh.com none debug1 expect ssh2_msg_kex_ecdh_repli debug1 server host key ecdsa-sha2-nistp256 sha256:8jkpw+j1g8lx8eamhioym0xttca +elsrgjznvyk7rnw debug1 host ec2-54-148-153-153.us-west-2.compute.amazonaws.com known match ecdsa host key debug1 found key /c/users/i861009/.ssh/known_hosts:2 debug1 ssh2_msg_newkey sent debug1 expect ssh2_msg_newkey debug1 ssh2_msg_newkey receiv debug1 ssh2_msg_service_request sent debug1 ssh2_msg_service_accept receiv debug1 authent continu publickey debug1 next authent method publickey debug1 tri privat key .\cheftutorial.pem debug1 authent continu publickey debug1 authent method try permiss deni publickey input reason server reject key? play permiss inform answer question note issu,0.14074074074074075,38,amazon-ec2 amazon-web-services private-key ssh,aws permiss deni publickey new instanc,8,ssh|security|openssh|openssl|authentication|ecdsa|private key|username,0.604941189289093
fail add host list known host /users/oktolab/.ssh/known_host permiss ? run command fix permiss provid exact ssh command run read pem privat key done type rsa debug1 authent continu publickey debug1 authent method try permiss deni publickey lot time error appear instead usernam vice-versa case seem ubuntu imag thing clarifi provid exact ssh command run,2013-10-20 18:58:45.593 UTC,273,19481496,tri connect ec2 instanc amazon connect error - permiss deni publickey instal cmhod 400 mypem.pem file help.connect log openssh_6.2p2 osslshim 0.9.8r 8 dec 2011 debug1 read configur data /etc/ssh_config debug1 /etc/ssh_config line 20 appli option * debug1 connect 54.214.31.168 [54.214.31.168] port 22 debug1 connect establish debug1 ident file wenglepemnew.pem type -1 debug1 ident file wenglepemnew.pem-cert type -1 debug1 enabl compat mode protocol 2.0 debug1 local version string ssh-2.0-openssh_6.2 debug1 remot protocol version 2.0 remot softwar version openssh_5.9p1 debian-5ubuntu1 debug1 match openssh_5.9p1 debian-5ubuntu1 pat openssh_5* debug1 ssh2_msg_kexinit sent debug1 ssh2_msg_kexinit receiv debug1 kex server->cli aes128-ctr hmac-md5 none debug1 kex client->serv aes128-ctr hmac-md5 none debug1 ssh2_msg_kex_dh_gex_request1024&lt;1024&lt;8192 sent debug1 expect ssh2_msg_kex_dh_gex_group debug1 ssh2_msg_kex_dh_gex_init sent debug1 expect ssh2_msg_kex_dh_gex_repli debug1 server host key rsa code authent host 54.214.31.168 54.214.31.168 establish rsa key fingerprint code sure want continu connect yes/no? yes fail add host list known host /users/oktolab/.ssh/known_host debug1 ssh_rsa_verifi signatur correct debug1 ssh2_msg_newkey sent debug1 expect ssh2_msg_newkey debug1 ssh2_msg_newkey receiv debug1 roam allow server debug1 ssh2_msg_service_request sent debug1 ssh2_msg_service_accept receiv debug1 authent continu publickey debug1 next authent method publickey debug1 tri privat key wenglepemnew.pem debug1 read pem privat key done type rsa debug1 authent continu publickey debug1 authent method try permiss deni publickey ami creation deploy new instanc new pem file help need connect server,0.18315018315018314,50,amazon-ec2 amazon-web-services authentication ssh,troubl connect amazon ec2 ssh,10,authentication|ssh|openssh|hmac|md5|rsa|fingerprint|signature|private key|username,0.596024215221405
make sure sha thumbprint post azur api uppercas process handl cloud-init ubuntu thumbprint post save /var/lib/waagent/ovf-env.xml later datasourceazure.pi try convert crt file /var/lib/waagent/{thumbprint}.crt public key {thumbprint} come ovf-env.xml crt file tri convert alway retriev upper-cas name check line /var/lib/boot.log {thumbprint} upper-cas,2014-07-04 09:55:43.783 UTC,197,24571568,"problem ubuntu vm test applic th ssh authent work fine imag c290a6b031d841e09f2da759bbabe71f__oracle-linux-6 tri ubuntu imag b39f27a8b8c64d52b05eac6a62ebad85__ubuntu-14_04-lts-amd64-server-20140618.1-en-us-30gb debug2 bit 547/1024 debug1 ssh_rsa_verifi signatur correct debug2 kex_derive_key debug2 set_newkey mode 1 debug1 ssh2_msg_newkey sent debug1 expect ssh2_msg_newkey debug2 set_newkey mode 0 debug1 ssh2_msg_newkey receiv debug1 roam allow server debug1 ssh2_msg_service_request sent debug2 service_accept ssh-userauth debug1 ssh2_msg_service_accept receiv debug2 key /users/me/vm.pem 0x0 explicit debug1 authent continu publickey debug3 start pass differ list publickey debug3 prefer publickey,keyboard-interactive,password debug3 authmethod_lookup publickey debug3 remain prefer keyboard-interactive,password debug3 authmethod_is_en publickey debug1 next authent method publickey debug1 tri privat key /users/me/vm.pem debug1 read pem privat key done type rsa debug3 sign_and_send_pubkey rsa 6f:9c:f4:64:03:20:48:4a:bf:3f:62:74:32:61:3b:0b debug2 sent publickey packet wait repli debug1 authent continu publickey debug2 send packet disabl method debug1 authent method try permiss deni publickey.i check password authent authorized_key file contain key know wierd thing tri creat instanc azur ui key everyth work fine idea",0.14720812182741116,29,azure linux ssh ubuntu,connect ssh ubuntu imag azur,10,ssh|authentication|rsa|signing|signature|password|private key|authorise|sha|public key,0.5570814609527588
known_host file typic use record system level ssh key server ssh ing privat key storag particular reason put privat key there? probabl complet clear ~/.ssh directori client server make backup first start scratch keep thing simpl client machin typic ~/.ssh directori 0700 permiss ~/.ssh/id_rsa ~/.ssh/id_rsa.pub 0600 permiss known host file auto-popul time ssh new system actual id_rsa filenam critic cours long ssh client find pars never tri put content insid file alreadi mean someth ssh server machin .ssh directori 0700 permiss authorized_key file 0600 permiss contain text id_rsa.pub key equival client box client server client server try ssh -vvv work run follow command client server post result move key file .ssh directori make sure gave right permiss file connect server via ssh,2017-08-31 05:01:06.223 UTC,794,45973514,"ok know question ask tri everyth post closest relat question none work abl log abl - tri ssh-ing neither work root tell ec2-us ssh-ing ubuntu 16.04- correct permiss pem file - file sure ad one anyth seem try authent local user fail first time - get even thought file abl open vim realli confus go go includ extra verbos log file question read sure output -openssh_7.2p2 ubuntu-4ubuntu2.1 openssl 1.0.2g 1 mar 2016 -debug1 read configur data /etc/ssh/ssh_config -debug1 /etc/ssh/ssh_config line 19 appli option * -debug2 resolv 52.53.159.22 port 22 -debug2 ssh_connect_direct needpriv 0 -debug1 connect 52.53.159.22 [52.53.159.22] port 22 -debug1 connect establish -debug1 key_load_publ file directori -debug1 ident file .ssh/rh17-06-11.pem type -1 -debug1 key_load_publ file directori -debug1 ident file .ssh/rh17-06-11.pem-cert type -1 -debug1 enabl compat mode protocol 2.0 -debug1 local version string ssh-2.0-openssh_7.2p2 ubuntu-4ubuntu2.1 -debug1 remot protocol version 2.0 remot softwar version openssh_6.6.1 -debug1 match openssh_6.6.1 pat openssh_6.6.1* compat 0x04000000 -debug2 fd 3 set o_nonblock -debug1 authent 52.53.159.22:22 ec2-us -debug3 hostkeys_foreach read file /home/dingofarmers/.ssh/known_host -debug3 record_hostkey found key type ecdsa file /home/dingofarmers/.ssh/known_hosts:21 -debug3 load_hostkey load 1 key 52.53.159.22 -debug3 order_hostkeyalg prefer hostkeyalg ecdsa-sha2-nistp256-cert-v01@openssh.com,ecdsa-sha2-nistp384-cert-v01@openssh.com,ecdsa-sha2-nistp521-cert-v01@openssh.com,ecdsa-sha2-nistp256,ecdsa-sha2-nistp384,ecdsa-sha2-nistp521 -debug3 send packet type 20 -debug1 ssh2_msg_kexinit sent -debug3 receiv packet type 20 -debug1 ssh2_msg_kexinit receiv -debug2 local client kexinit propos -debug2 kex algorithm curve25519-sha256@libssh.org,ecdh-sha2-nistp256,ecdh-sha2-nistp384,ecdh-sha2-nistp521,diffie-hellman-group-exchange-sha256,diffie-hellman-group-exchange-sha1,diffie-hellman-group14-sha1,ext-info-c -debug2 host key algorithm ecdsa-sha2-nistp256-cert-v01@openssh.com,ecdsa-sha2-nistp384-cert-v01@openssh.com,ecdsa-sha2-nistp521-cert-v01@openssh.com,ecdsa-sha2-nistp256,ecdsa-sha2-nistp384,ecdsa-sha2-nistp521,ssh-ed25519-cert-v01@openssh.com,ssh-rsa-cert-v01@openssh.com,ssh-ed25519,rsa-sha2-512,rsa-sha2-256,ssh-rsa -debug2 cipher cto chacha20-poly1305@openssh.com,aes128-ctr,aes192-ctr,aes256-ctr,aes128-gcm@openssh.com,aes256-gcm@openssh.com,aes128-cbc,aes192-cbc,aes256-cbc,3des-cbc -debug2 cipher stoc chacha20-poly1305@openssh.com,aes128-ctr,aes192-ctr,aes256-ctr,aes128-gcm@openssh.com,aes256-gcm@openssh.com,aes128-cbc,aes192-cbc,aes256-cbc,3des-cbc -debug2 mac cto umac-64-etm@openssh.com,umac-128-etm@openssh.com,hmac-sha2-256-etm@openssh.com,hmac-sha2-512-etm@openssh.com,hmac-sha1-etm@openssh.com,umac-64@openssh.com,umac-128@openssh.com,hmac-sha2-256,hmac-sha2-512,hmac-sha1 -debug2 mac stoc umac-64-etm@openssh.com,umac-128-etm@openssh.com,hmac-sha2-256-etm@openssh.com,hmac-sha2-512-etm@openssh.com,hmac-sha1-etm@openssh.com,umac-64@openssh.com,umac-128@openssh.com,hmac-sha2-256,hmac-sha2-512,hmac-sha1 -debug2 compress cto none,zlib@openssh.com,zlib -debug2 compress stoc none,zlib@openssh.com,zlib -debug2 languag cto -debug2 languag stoc -debug2 first_kex_follow 0 -debug2 reserv 0 -debug2 peer server kexinit propos -debug2 kex algorithm curve25519-sha256@libssh.org,ecdh-sha2-nistp256,ecdh-sha2-nistp384,ecdh-sha2-nistp521,diffie-hellman-group-exchange-sha256,diffie-hellman-group-exchange-sha1,diffie-hellman-group14-sha1,diffie-hellman-group1-sha1 -debug2 host key algorithm ssh-rsa,ecdsa-sha2-nistp256,ssh-ed25519 -debug2 cipher cto aes128-ctr,aes192-ctr,aes256-ctr,arcfour256,arcfour128,aes128-gcm@openssh.com,aes256-gcm@openssh.com,chacha20-poly1305@openssh.com,aes128-cbc,3des-cbc,blowfish-cbc,cast128-cbc,aes192-cbc,aes256-cbc,arcfour,rijndael-cbc@lysator.liu.s -debug2 cipher stoc aes128-ctr,aes192-ctr,aes256-ctr,arcfour256,arcfour128,aes128-gcm@openssh.com,aes256-gcm@openssh.com,chacha20-poly1305@openssh.com,aes128-cbc,3des-cbc,blowfish-cbc,cast128-cbc,aes192-cbc,aes256-cbc,arcfour,rijndael-cbc@lysator.liu.s -debug2 mac cto hmac-md5-etm@openssh.com,hmac-sha1-etm@openssh.com,umac-64-etm@openssh.com,umac-128-etm@openssh.com,hmac-sha2-256-etm@openssh.com,hmac-sha2-512-etm@openssh.com,hmac-ripemd160-etm@openssh.com,hmac-sha1-96-etm@openssh.com,hmac-md5-96-etm@openssh.com,hmac-md5,hmac-sha1,umac-64@openssh.com,umac-128@openssh.com,hmac-sha2-256,hmac-sha2-512,hmac-ripemd160,hmac-ripemd160@openssh.com,hmac-sha1-96,hmac-md5-96 -debug2 mac stoc hmac-md5-etm@openssh.com,hmac-sha1-etm@openssh.com,umac-64-etm@openssh.com,umac-128-etm@openssh.com,hmac-sha2-256-etm@openssh.com,hmac-sha2-512-etm@openssh.com,hmac-ripemd160-etm@openssh.com,hmac-sha1-96-etm@openssh.com,hmac-md5-96-etm@openssh.com,hmac-md5,hmac-sha1,umac-64@openssh.com,umac-128@openssh.com,hmac-sha2-256,hmac-sha2-512,hmac-ripemd160,hmac-ripemd160@openssh.com,hmac-sha1-96,hmac-md5-96 -debug2 compress cto none,zlib@openssh.com -debug2 compress stoc none,zlib@openssh.com -debug2 languag cto -debug2 languag stoc -debug2 first_kex_follow 0 -debug2 reserv 0 -debug1 kex algorithm curve25519-sha256@libssh.org -debug1 kex host key algorithm ecdsa-sha2-nistp256 -debug1 kex server->cli cipher chacha20-poly1305@openssh.com mac compress none -debug1 kex client->serv cipher chacha20-poly1305@openssh.com mac compress none -debug3 send packet type 30 -debug1 expect ssh2_msg_kex_ecdh_repli -debug3 receiv packet type 31 -debug1 server host key ecdsa-sha2-nistp256 sha256:qaptccft8a+snztbfvaskbpqvvkrqdbyev93an/sy+w -debug3 hostkeys_foreach read file /home/dingofarmers/.ssh/known_host -debug3 record_hostkey found key type ecdsa file /home/dingofarmers/.ssh/known_hosts:21 -debug3 load_hostkey load 1 key 52.53.159.22 -debug1 host 52.53.159.22 known match ecdsa host key -debug1 found key /home/dingofarmers/.ssh/known_hosts:21 -debug3 send packet type 21 -debug2 set_newkey mode 1 -debug1 rekey 134217728 block -debug1 ssh2_msg_newkey sent -debug1 expect ssh2_msg_newkey -debug3 receiv packet type 21 -debug2 set_newkey mode 0 -debug1 rekey 134217728 block -debug1 ssh2_msg_newkey receiv -debug2 key dingofarmers@ubuntu 0x55ce58f7d660 agent -debug2 key dingofarmers@ubuntu 0x55ce58f7e920 agent -debug2 key .ssh/rh17-06-11.pem nil explicit -debug3 send packet type 5 -debug3 receiv packet type 6 -debug2 service_accept ssh-userauth -debug1 ssh2_msg_service_accept receiv -debug3 send packet type 50 -debug3 receiv packet type 51 -debug1 authent continu publickey,gssapi-keyex,gssapi-with-m -debug3 start pass differ list publickey,gssapi-keyex,gssapi-with-m -debug3 prefer gssapi-keyex,gssapi-with-mic,publickey,keyboard-interactive,password -debug3 authmethod_lookup gssapi-keyex -debug3 remain prefer gssapi-with-mic,publickey,keyboard-interactive,password -debug3 authmethod_is_en gssapi-keyex -debug1 next authent method gssapi-keyex -debug1 valid key exchang context -debug2 send packet disabl method -debug3 authmethod_lookup gssapi-with-m -debug3 remain prefer publickey,keyboard-interactive,password -debug3 authmethod_is_en gssapi-with-m -debug1 next authent method gssapi-with-m -debug1 unspecifi gss failur minor code provid inform kerbero credenti avail -debug1 unspecifi gss failur minor code provid inform kerbero credenti avail -debug1 unspecifi gss failur minor code provid inform -debug1 unspecifi gss failur minor code provid inform kerbero credenti avail -debug2 send packet disabl method -debug3 authmethod_lookup publickey -debug3 remain prefer keyboard-interactive,password -debug3 authmethod_is_en publickey -debug1 next authent method publickey -debug1 offer rsa public key dingofarmers@ubuntu -debug3 send_pubkey_test -debug3 send packet type 50 -debug2 sent publickey packet wait repli -debug3 receiv packet type 51 -debug1 authent continu publickey,gssapi-keyex,gssapi-with-m -debug1 offer rsa public key dingofarmers@ubuntu -debug3 send_pubkey_test -debug3 send packet type 50 -debug2 sent publickey packet wait repli -debug3 receiv packet type 51 -debug1 authent continu publickey,gssapi-keyex,gssapi-with-m -debug1 tri privat key .ssh/rh17-06-11.pem -debug3 sign_and_send_pubkey rsa sha256:gwwpjtqxofvicvyc7ilz8rtns9f/tjwaycmxj6toati -debug3 send packet type 50 -debug2 sent publickey packet wait repli -debug3 receiv packet type 51 -debug1 authent continu publickey,gssapi-keyex,gssapi-with-m -debug2 send packet disabl method -debug1 authent method try permiss deni publickey,gssapi-keyex,gssapi-with-m",0.327455919395466,260,amazon-ec2 rhel7 ssh,"ssh rhel7 aws-ec2 instanc permiss deni publickey,gssapi-keex,gssapi-with-m",20,ssh|authentication|openssh|openssl|ecdsa|rsa|cipher|cbc|hmac|rijndael|md5|password|validate|kerberos|credential|availability|public key|private key|signing|authorise,0.4937549829483032
