answers,creation_date,len,postid,question,ratio,raw,tags,title,uniq,words,probability
ok solv though bit complic approach figur better one store user group access right given data object form number describ action user data read/writ etc permiss node similar structur instead group put group member target everi singl user given data object secur rule sinc one user one access right sourc given object owner data + member sever group differ access right data keep track differ ar sourc given user updat recalcul result ar given user take highest number ar sourc,2018-05-07 11:46:00.143 UTC,192,50213452,app data object object read/writ either singl user group user tri figur best approach write secur rule logic best structur real time db tri look solut never found exact case exampl db question setup secur rule check whether user read/writ data node? know check singl user figur check group check secur rule eg read/writ node? sinc sever group per user sever group per data node realli address dynam variabl pleas note open chang db structur curiou deal problem gener without much duplic data save user group datapermiss group id node order keep db mainten sane check user permiss secur rule thank help,0.041666666666666664,8,firebase firebase-realtime-database firebase-security-rules javascript,user group permiss firebas secur rule,2,security|scripting,0.46410536766052246
yes check firebas document restrict user write data authent someth trick,2018-01-29 23:35:03.217 UTC,47,48511731,current develop javascript base applic store relev user data field name howev want user write/read field belong achiev wish restrict user access field name rule configur allow this?,0.0851063829787234,4,firebase firebase-realtime-database firebase-security-rules javascript,firebas field/child access restrict,3,security|scripting|authentication,0.46326401829719543
,2017-04-27 08:38:16.267 UTC,64,43652749,troubl write rule cant seem approach right appreci fresh eye see go wrong rule snippet data submiss ever creat new map function permiss deni write true custommap level work fine know data submit correct inform cant see go wrong thank time refer ad write rule $map actual grant permiss push data admin data,0.03125,2,firebase firebase-realtime-database firebase-security javascript,firebas write rule deni cant see issu,2,security|scripting,0.46324828267097473
,2019-06-17 08:04:49.653 UTC,44,56627153,success done firebas auth link firebas auth firebas databas work forgot screen get mail regard password chang success chang password want show updat password firebas databas done get follow error want updat password firebas databas,0.18181818181818182,8,firebase firebase-authentication firebase-realtime-database javascript react-native,updat new password databas,4,authentication|scripting|password|forge,0.46299120783805847
check collect alreadi exist document collect think moment make sens - oper costli check document specif id alreadi exist collect typic solut type problem therefor creat collect domain id e.g secur rule check whether domain alreadi claim collect note want batch write perform updat sinc must alway kept sync approach,2018-04-24 13:34:20.583 UTC,123,50003056,use firestor user contain attribut call domain current use cloud function gener random domain user signup cloud function queri databas order check whether random domain alreadi exist caus second delay question prevent insert new user anoth user alreadi exist domain firestor secur rule without queri entir database? far tri ad secur rule allow duplic idea whether feasibl use secur rule,0.06504065040650407,8,firebase firebase-security-rules google-cloud-firestore javascript,firestor secur rule - creat check attribut anoth document,3,security|scripting|signing,0.46271297335624695
,2019-10-02 20:49:53,78,58209159,collect note firebas realtim databas client subscrib modif /note path databas client add new note data push client b databas structur firebas access rule access rule meant prevent client read note howev - new note creat client client b access never get push client b client b reload applic new note appear - defeat purpos subscript make sure addit /note node get push client access rule place,0.038461538461538464,3,firebase firebase-realtime-database firebase-security javascript,firebas realtim databas - subscrib databas addit,2,security|scripting,0.4606597423553467
,2018-05-12 04:09:43.973 UTC,46,50302760,rule pass simul test client got error permiss deni success authent use googl partial rule check uid object insid user object exist allow creat object whole rule json angular code,0.08695652173913043,4,angular firebase firebase-realtime-database firebase-security-rules javascript,firebas rule allow new user creat account object login first time,4,security|scripting|login|authentication,0.4605497717857361
give null mean go give error null mean user sign new page load user immedi sign auth state observ determin sign user account first avail,2019-12-01 19:31:34,59,59129177,know uid return null usersessioncheck contain code keep session login user.uid give result code error code -- uncaught typeerror cannot read properti uid null,0.13559322033898305,8,firebase firebase-authentication javascript,uncaught typeerror cannot read properti uid null,6,authentication|scripting|login|signing|user account|availability,0.4594837427139282
open firebas databas go rule section add rule forget javascript asynchron log email password mayb alreadi log queri rule fail try,2018-04-18 07:43:04.117 UTC,39,49893938,wrote code read data databas give error say authent ca fix,0.1282051282051282,5,firebase firebase-realtime-database javascript node.js,firebas auth databas,4,scripting|authentication|forge|password,0.4594360589981079
rule configur quit match databas structur work need try someth rule valu match key exampl key use obtain valu new data use valu rule wildcard variabl automat match node name locat rule document variabl use refer key use earlier rule structur rule structur match variabl within rule express name actual child read written requir current structur ad node payload look someth test rule rule simul firebas databas consol test write deni alreadi databas payload includ valu,2017-10-30 12:37:19.397 UTC,133,47015483,use firebas add user newus empti user initialis use id id come tag alreadi made newus initialis firebas check given tagid alreadi use user tabl key user newus data look firebas rule appli work simul reason abl add newus record use exist tagid use firebas rest api postman,0.022556390977443608,3,firebase firebase-realtime-database firebase-security javascript,valid id exist ignor firebas,3,security|scripting|validate,0.4584046006202698
cannot done firebas method need listen authent state chang user updat profil info see code come state firebas user api https://firebase.google.com/docs/reference/js/firebase.user#updateprofil hope help creat endpoint store custom user data look https://firebase.google.com/docs/database/web/read-and-writ need creat databas child node ;- function creat new user firebas authent servic databas chang result add new user databas well try,2017-04-20 02:12:04.277 UTC,80,43509021,use firebas tri add usernam databas email password function email password? solut found add usernam createuserwithemailandpassword function,0.1375,11,firebase firebase-authentication firebase-realtime-database javascript promise,add usernam email password firebas,4,authentication|scripting|username|password,0.4582598805427551
,2019-02-26 02:17:36.603 UTC,33,54877500,web app administr creat user account default password tri firebas auth alway log administr log new user in! make hard creat one two account time anyth,0.15151515151515152,5,firebase firebase-authentication javascript,auth.createuserwithemailandpassword without log user,4,authentication|scripting|password|user account,0.4580581784248352
grant access specif user abl run queri node firebas must read access node firebas reject queri access document cover section rule filter mani peopl run problem sinc common approach relat databas fact rule filter permiss cascad two common pitfal firebas secur model case like want grant user access entir node move read permiss one level everi github-authent user read user thu queri reject case model data differ work secur constraint want,2016-01-17 18:54:49.38 UTC,110,34842287,hello guy new firebas tri develop simpl chat app.so far got authent done follow step firebas document login method getcontact method tri consol snapshot got noth secur rule mention use vuej,0.09090909090909091,10,firebase firebase-authentication firebase-security javascript,read data firebas authent,4,authentication|security|scripting|login,0.4579353928565979
intend behavior firebas authent independ firestor creat firestor collect uid document key store data specif user forget adjust secur rule user cannot exampl chang data anoth user abl find everyth firebas doc accomplish firebas authent cloud firestor explain document firebaseui javascript librari callback invok user sign success callback return fals noth page automat redirect sinc pass callback object includ current log user follow write node realtim databas use method asynchron write databas success method redirect page accordingli,2019-05-27 07:48:00.68 UTC,111,56321802,use firebas javascript applic creat user email password creat authent databas tell make connect two javascript? thank ! hre code login.html login.j main.j main.html firebase.j,0.12612612612612611,14,firebase javascript,creat user databas user creat authent system,7,scripting|authentication|password|login|forge|security|signing,0.45787400007247925
check start cloud firestor secur rule document see write condit cloud firestor secur rule document one common secur rule pattern control access base user authent state exampl app want allow signed-in user write data help start reason get error allow access document collect call channel order fix login consol firebase.navig databas > firestor databas click rule rule give permiss per wish.if want give access al user simpl replac current code follow code good practic secur,2019-01-23 05:30:58.587 UTC,107,54320563,respons code uncaught except encount type google\cloud\core\exception\serviceexcept messag { messag miss insuffici permiss code 7 statu permission_deni detail [] } filenam /var/www/html/riglynx/vendor/google/cloud/core/src/grpcrequestwrapper.php line number 263,0.08411214953271028,9,firebase firebase-security-rules google-cloud-firestore javascript,permiss firebas firestor,5,security|scripting|authentication|signing|login,0.45691731572151184
yes possibl mfa verif two differ things.you keep mfa enabl verif select either one two email phone number help confirm user recoveri function forgot password etc verifi user signup abl sign access / id token sign allow confirm user go mfa option well want setup advanc secur user,2018-02-16 01:58:45.937 UTC,82,48819084,want phone number verifi user sign requir mfa - mean user abl sign email address password.cognito requir mfa enabl phone verif understand correct,0.12195121951219512,10,amazon-cognito javascript,amazon cognito - requir phone verif - mfa possibl,5,scripting|signing|password|forge|security,0.45659196376800537
,2019-10-29 20:52:35,49,58615253,use firebas rule user_uuid user want manag document work pat exampl admin read data user exactli work contain user_uuid abl read data everi user wrong? follow code get user user_uuid collect call class search name user return warn caus insuffici permiss ~filip,0.04081632653061224,2,firebase firebase-security google-cloud-firestore javascript,modifi firebas rule,2,security|scripting,0.45522385835647583
,2019-01-29 10:36:26.857 UTC,39,54419103,tri make multipath updat path root / path get warn error say permiss deni given permiss specifi path obvious give permiss root / updat work index.j rule updat tri,0.05128205128205128,2,firebase firebase-realtime-database firebase-security-rules javascript,firebas multipath updat fail permiss deni,2,security|scripting,0.4542001783847809
,2016-10-05 11:03:34.99 UTC,79,39872258,valid newdata use firebas secur rule follows? achiev make sure multi-loc updat happen atom use-cas make sure singl write contain outcom event opinion user moment $userid cannot ad rule rule invalid want someth * instead $userid make sure outcom event updat opinion field user updat possible? updat detail rule updat user data look work fine wildcard need $eventid alreadi defin .validate.howev event $userid $userid wildcard cannot use multi-loc updat,0.08860759493670886,7,firebase firebase-realtime-database firebase-security javascript,firebas multi-loc updat - secur rule,3,security|scripting|validate,0.4541311264038086
secur rule filter data mere enforc rule data client read client current tri read hospit sinc secur rule restrict data client read reject oper need ensur client request secur rule allow read data queri match secur rule someth note requir document field otherwis name empti info see firestor document secur queri firestor select null,2018-04-30 10:26:38.593 UTC,95,50098585,firestor secur rule resource.data emtpi object alway bug someth ? firestor rule javascript current databas snapshot solv thank frank answer issu reli firestor secur evalu actual document valu queri multipl document case,0.11578947368421053,11,firebase-security-rules google-cloud-firestore javascript,firestor secur rule resource.data empti object,2,security|scripting,0.45391950011253357
within object return cloud function callback two type databas refer one scope permiss user trigger write one scope admin right grant full read write access tell sinc provid code sampl show cloud function bet use switch resolv problem,2017-03-11 15:49:02.463 UTC,103,42737203,cloud function get firebas permiss deni error updat remov servic account initi credenti file order current avail default account secur rule prevent updat user insert data cloud function tri updat subsequ remov oper fail even though admin account supposedli bypass secur rule includ valid first error updat disappear chang rule updat workaround redefin,0.08737864077669903,9,firebase firebase-admin firebase-security google-cloud-functions javascript,firebas secur rule appli admin cloud function,6,security|scripting|credential|availability|bypass|validate,0.45293429493904114
follow function creat accept answer work avail question comment,2020-04-01 16:45:33,39,60976052,rule firestor everyon read content authent applic owner document creat write updat delet follow rule firestor firestor structur request output receiv wrong,0.10256410256410256,4,javascript firebase google-cloud-firestore firebase-security,firestor permiss execut oper,4,scripting|security|authentication|availability,0.45273342728614807
help bolt function see sampl file test check bolt ! bolt schema valid tool firebas defin schema write rule make sure one author delet need gener secur rule command-lin upload use firebas cli bolt support dashboard yet copi past gener rule dashboard need well,2015-11-23 14:21:09.45 UTC,100,33873290,"firebas structur like question prevent user run ref.remov directli client browser inspector delet data without prompt? want allow client script run firebas oper add/upd data /root/ mean ad group child node,lik group2 group3. delet node add data /root/group/ well updat delet setup secur rules? thank",0.08,8,firebase firebase-realtime-database firebase-security javascript json,secur rule prevent delet data firebas,4,security|scripting|validate|authorise,0.4524019956588745
creat differ user modifi user data fine howev abl hold anonym user data ensur specif user identifi uniqu user id access his/her data set follow rule anonym user uniqu uid check doc https://firebase.google.com/docs/database/security/user-secur protect user sign real app anonym data access extern phish app howev protect someon use api key sign anonym user want secur sign-in mechan look oauth provid phone sign-in origin verif mechan,2017-07-16 19:11:10.437 UTC,132,45132390,web app write data visitor submit form read data whenev form submit everyon read data write data firebas anonym login option whenev user click submit button firebas databas rule write auth != null user still want secur data anyon find config file browser develop tool creat app use config file anonym login abus data? ensur data stay secur,0.15151515151515152,20,firebase firebase-authentication firebase-realtime-database firebase-security javascript,firebas anonym login secur,8,authentication|security|scripting|login|protect|signing|phishing|oauth,0.45222240686416626
approach pretti much document say connect quit dot one place - help address confus address first point - essenti use const result = await expo.google.loginasync{ get user googl detail expo take care loginasync call made approach link firebas expo provid detail creat firebas googl sign credenti credenti signin firebas provid access googleauthprovid https://firebase.google.com/docs/reference/js/firebase.auth.googleauthprovid expo return detail case result give access idtoken &amp accesstoken use const credenti = firebase.auth.googleauthprovider.credentialidtoken accesstoken creat firebas googl credenti leverag firebase.auth.signinwithcredentialcredenti firebas regist googl credenti sign user / log use googl detail chang authstat second point - firebas allow listen call onauthstatechang https://firebase.google.com/docs/auth/web/manage-us signinwithcredenti authstat chang callback trigger - point trigger call firebas databas - captur user detail access googl sign commit firebas databas callback componentdidmount user sign - press submit consist listen authstatechang,2018-04-19 19:35:30.583 UTC,222,49928938,attempt expo googl sign function &amp link author firebas auth troubl understand transfer data auth token receiv from/us expo/googl servic firebas auth i.e creat firebas identifi uid follow doc regard link auth expo doc googl sign obtain code look question stackoverflow accept answer two main point confus expo googl login firebas auth similar differ way authent user expo use firebas use user log expo/googl method includ firebas record user databas uid identifi one go ensur user log method user creat firebas auth? one use,0.11711711711711711,26,expo firebase firebase-authentication javascript react-native,link expo/googl login firebas auth,6,authentication|scripting|login|signing|authorise|credential,0.45122480392456055
accord firebas document rule filter howev last year 2018 queri rule introduc think blog post better doc understand keep current data structur rule chang chang queri well one last thing seem databas structur point need want make data access user creat admin see everyth better solut denorm data data structur admin problem solv admin node use conjunct custom claim firebas function sinc place word mayb need someth els geofir locat,2019-05-06 17:28:11.097 UTC,112,56009832,defin firebas rule read data userid userid flag data creat user cours user uid rule access data client side want data access owner base userid flag item sampl data structur,0.017857142857142856,2,firebase firebase-realtime-database firebase-security-rules javascript,get permission_deni /item client permiss access desir data,2,security|scripting,0.45072922110557556
,2017-12-30 17:16:59.653 UTC,88,48036157,rel new firebas secur read document know basic - databas structur simplifi uid authent user id gener login use fb googl tri rule want restrict authent user match uid abl read updat newcontact valu work authent user access newcontact valu howev one access notifications-set mean one actual read updat set error line code mayb problem tri access notifications-set code code node error uncaught promis error permission_deni /notifications-set client permiss access desir data error permission_deni /notifications-set client permiss access desir data,0.09090909090909091,8,firebase javascript security,firebas secur uid push id,4,scripting|security|authentication|login,0.4505479633808136
,2016-02-22 02:01:31.3 UTC,70,35544668,databas full user user score valu repres score leaderboard easili firebas secur rule prevent peopl chang score user prevent user edit score databas without prevent program abl updat user score? problem easi edit user data browser consol prevented? code set valu user score call function user score 10 databas allow howev tri prevent user abl simpli type consol hack score structur db,0.05714285714285714,4,firebase firebase-security javascript,restrict user edit inform firebas,3,security|scripting|hack,0.4504135847091675
function think simpl logout/login page initi - new user id refresh hold data userid final key rule restrict write user id. util anonym login allow assign user per-sess uniqu id use secur rule secur rule,2014-06-21 00:09:38.66 UTC,80,24337108,restrict write access object properti firebas browser session creat use ? want client read access children secur rule want client abl push child edit want edit child disallow browser refresh firebas secur rule js,0.1125,9,firebase firebase-security javascript,firebas restrict child write access browser session creat,4,security|scripting|login|signing,0.45013320446014404
regular firebas javascript/web sdk allow user creat account creat account anoth user task typic firebas admin sdk run trust environ server control cloud function creat user simpl api call,2018-03-01 17:43:40.527 UTC,60,49055682,write administ function allow system admin creat new accounts.sinc system admin alreadi authent system regist user firebas function auth error.how handl kind situat,0.11666666666666667,7,firebase firebase-authentication javascript,firebas createuserwithemailandpassword alreadi authent account,4,authentication|scripting|password|trust,0.4498635232448578
,2019-07-16 07:47:06.517 UTC,76,57052420,want allow user sign web app via github use firebas creat new auth use code python server python user display authent gui firebas consol problem come want sign user use next code javascript next error account alreadi exist email address differ sign-in credenti sign use provid associ email address sure miss someth figur whole process works.how link made previou code sign action? firebas recogn user,0.14473684210526316,11,firebase firebase-admin firebase-authentication javascript python,firebas log / sign via github,4,authentication|scripting|signing|credential,0.4498470425605774
forc token refresh user updateprofil idtoken updat afterward,2016-12-18 20:36:20.98 UTC,45,41212619,data structur rule structur javascript confus permiss deni made sure valu sure comparison return fals updat seem variabl secur rule refresh chang idea fix,0.13333333333333333,6,firebase firebase-authentication firebase-realtime-database firebase-security javascript,firebas read permiss deni use auth secur rule,3,authentication|security|scripting,0.4492512047290802
make sure user inform edit user want https://www.firebase.com/docs/web/guide/understanding-security.html import built-in variabl auth variabl popul user authent contain data auth.uid uniqu alphanumer identifi work across provid auth variabl foundat mani rule make littl clear refer current log user refer locat databas point rule variabl https://www.firebase.com/docs/security/api/rule/path.html user authent firebas app three thing happen inform user return callback client devic allow custom app user experi specif user user inform return contain uid uniqu id guarante distinct across provid never chang specif authent user uid string contain name provid authent follow colon uniqu id return provid valu auth variabl app secur firebas rule becom defin variabl null unauthent user authent user object contain user uniqu auth.uid potenti data user allow secur control data access per-us basi,2015-06-17 15:33:15.26 UTC,176,30896075,work site use firebas secur everyon add info none access main part someon type consol userdata removed.al user uid e.g storageid e.g mayb someth those? realli want anyon abl remov user data need let user edit info remov account code secureti rule regist updat right,0.09090909090909091,16,firebase firebase-security html javascript security,firebas secur per user,3,security|scripting|authentication,0.4488542079925537
cloud function trigger user sign app firebas authent someth user sign control app sinc callback signin signout directli invok http callabl type function case pass function uid look use firebas admin sdk,2019-07-29 15:16:03.82 UTC,52,57256744,current user email event call oncreat want trigger onlogin currentus,0.15384615384615385,8,firebase google-cloud-functions javascript,current user login user firebas cloud function,4,scripting|login|signing|authentication,0.4482586085796356
see api document signinwithpopup yield usercredenti object contain properti user object code promis callback current sign user,2019-08-16 12:07:51.447 UTC,38,57524395,use firebas googl sign-in project authent user want properti name email,0.21052631578947367,8,firebase firebase-authentication javascript,properti log user use firebas googl sign-in,4,authentication|scripting|signing|credential,0.4472063481807709
take look rule filter doc allow read oper satisfi read whole collect try read forget actual put properti messag ps rule look person note messag user want recipi differ author chang data structur rule mayb field know done anyth similar firestor yet,2020-04-21 08:13:44,64,61338854,code rule fireba error uncaught error onsnapshot firebaseerror miss insuffici permiss help solv problem,0.0625,4,javascript firebase vue.js google-cloud-firestore firebase-security,permiss firestor work,4,scripting|security|forge|authorise,0.44652286171913147
