answers,creation_date,len,postid,question,ratio,raw,tags,title,uniq,words,probability
,2016-03-06 17:17:52.273 UTC,63,35829923,let assum data structur similar one use fan-out updat want convert invit user root user kc88nkzeqsx6alpjrvp email test1@yahoo.com uid 19570b6c-afd0-xxxx-xxxx-650be04c5767 kcaw6t_au2ronjcaf85 email test2@yahoo.com uid 22570b6c-afd0-xxxx-xxxx-650be04c5767 invit kczndfnkzeqrtr6alpjrvp email test3@yahoo.com byyaw6t_au2rffeaf85 email test4@yahoo.com updat code write valid rule bolt check invit email exist newli creat user email equal email invit user uid actual id auth object,0.06349206349206349,4,firebase firebase-security javascript,firebas fan-out updat valid bolt,3,security|scripting|validate,0.7337476015090942
firebas databas secur rule filter data instead check whether listen allow access data attach user attach listen firebas databas server check read permiss node sinc grant read permiss nobodi read permiss read reject want attach listen instead,2018-09-01 10:11:35.403 UTC,89,52127093,tri retriev data realtim databas firebas base log user node firebas look https://prnt.sc/kpdoq9 rule tri retriev data method think rule main inner node actual uid log user id random key gener firebase? structur look like? assum rule look uid path firebas node,0.0449438202247191,4,firebase firebase-authentication firebase-realtime-database firebase-security-rules javascript,retriev data base rule firebas,3,authentication|security|scripting,0.7097985744476318
current rule allow write foo node databas tri write user rule user firebas fall back default rule fals want abl write user chang rule rememb allow everyon even unauthent user read/writ locat secur option limit user read/writ data exampl firebas doc,2018-07-02 09:52:05.987 UTC,65,51133392,use firebas get permiss deni error try write databas rule code write databas abl write databas,0.06153846153846154,4,firebase firebase-realtime-database firebase-security-rules javascript,abl write firebas databas,3,security|scripting|authentication,0.6859131455421448
think clone user firebas authent realtim databas firestor data deal question make logic signout function clear data realtim databas firestor base choic cloud function trigger user sign current trigger user account creat delet firebas authent user expect abl sign repeatedli without disrupt data,2019-06-10 16:13:54.457 UTC,81,56529947,cleanup user data cloud firestor user sign want remov everyth relat user collect sub-collect imag user sign frigger function user delet cloud function altern solv problem,0.13580246913580246,11,firebase firebase-authentication google-cloud-firestore google-cloud-functions javascript,cleanup user data cloud firestor user sign,4,authentication|scripting|signing|user account,0.6812442541122437
none,2020-04-02 16:41:50,98,60996671,collect firestor access log verifi user secur rule emul work expect googl auth provid email verifi read allow googl auth provid email verifi read allow realli need dont send verif provid email email auth provid email verifi read allow email auth provid email verifi read allow frontend happen googl auth provid email verifi read allow googl auth provid email verifi read allow email auth provid email verifi read allow email auth provid email verifi read allow → fail relev snippet frontend code someon clue problem possibl,0.04081632653061224,4,javascript google-cloud-firestore firebase-authentication firebase-security angularfire2,firestor check log user verifi email,3,scripting|authentication|security,0.6807814240455627
break read rule list rule appli request singl document rule list appli queri request collect doc give follow try abl test apolog mistyp someth,2018-02-07 08:42:23.59 UTC,62,48659317,use firebas cloud firestor want modifi rule restrict user queri collect allow allow current rule look rule allow user collect queri allow singl document get collect queri,0.03225806451612903,2,firebase firebase-security-rules google-cloud-firestore javascript,disabl queri collect firebas cloud firestor rule,2,security|scripting,0.6713884472846985
,2017-12-05 01:37:08.327 UTC,113,47644722,tri secur rule access firebas databas react nativ project current root path within push task item task 3 children import one uid field popul user id user creat task sampl task locat tri secur rule restrict read / write access task allow user creat task uid read / queri task match secur rule regard task portion databas secur rule simul say restrict access success - try read / write task match uid block access allow match attempt access task within app permiss deni error goe away go back allow authent user read / write access differ fix rules? thanks! edit code exampl caus error,0.07079646017699115,8,firebase firebase-realtime-database firebase-security javascript react-native,firebas secur rule clarif,3,security|scripting|authentication,0.6568447947502136
verifi account email address match valu see document list properti avail altern requir user know email address emb email address path user restrict read-access peopl know full path,2016-09-09 06:22:31.077 UTC,82,39405047,save user data refer id user info contain email address want make data avail prevent peopl guess id see info behind want give data provid id email address regist data store firebas fail unless provid well sure approach take want user authent provid link,0.08536585365853659,7,firebase firebase-realtime-database firebase-security javascript,valid email address firebas ssecur rule,5,security|scripting|validate|availability|authentication,0.6540255546569824
add boolean node test,2017-03-24 14:35:13.523 UTC,30,43002244,firebas secur rule restrict user push data one database? tri work,0.1,3,firebase javascript json rules security,restrict user push data ad child one firebas databas child,2,scripting|security,0.6467045545578003
firebas server-sid secur rule use filter data attach listen databas server check listen guarante alway meet rule matter data meet rule listen reject right away attach listen server check read permiss sinc reject listen want allow user read messag owner need two thing queri retriev messag user own secur rule ensur queri allow see firebas document secur queri data blog post introduc featur,2019-08-04 14:05:54.297 UTC,152,57347223,give multipl user access fetch collect messag access firebas realtim databas databas fetch read /messag return collect messag user access databas structur look creat follow rule howev abl collect messag list author assign user rule allow user list author user-one-id-987654 assign user assigned-user-id-1234 collect messag access simpli read /messages/ databas path? guess rule root messag answer? tri rule - grant access authent user - wish return collect user list author assign user kind regards/k,0.08552631578947369,13,firebase firebase-realtime-database firebase-security-rules javascript,firebas realtim databas rule - allow multipl user access list messag,5,security|scripting|authorise|signing|authentication,0.6460652947425842
read secur rule grant read access want read grant read access,2020-04-18 02:39:03,42,61283581,read/retriev data fireba realtim databa nuxt-commun fireba modul link alreadi ad fireba config insid file rule sure correct want restrict read access somecomponent.vu,0.07142857142857142,3,javascript firebase firebase-realtime-database nuxt.js firebase-security,nuxtjs/fireba permiss deni,2,scripting|security,0.6455588340759277
,2018-10-22 21:15:53.93 UTC,95,52937864,firebas realtim db follow rule structur allow anyon see db user email even sign use social googl fb? avoid case? read true caus creat dynam link open rout show certain data certain user unregist user remain edit let better understand process need rule user sign sign user write data creat link one item id contain link anyon open link read item tricki part time non regist user allow read user email email address save firebas upon social login programmat save email address db,0.06315789473684211,6,firebase firebase-realtime-database firebase-security-rules javascript,firebas read true rule allow see user email,4,security|scripting|signing|login,0.6363881826400757
correct secur rule remov first condit allow read comment work firestor rule,2018-08-08 19:13:11.067 UTC,65,51754070,firestor rule read collect overrid document rule deni unauthor access user data scenario get user inform phone number associ authent document databas queri whole /user collect claus firestor rule let anyon read /user collect think insecur javascript firestor rule tri achiev workaround issu thank,0.12307692307692308,8,firebase firebase-authentication firebase-security-rules google-cloud-firestore javascript,firestor rule read collect,5,authentication|security|scripting|authorise|insecure,0.6288044452667236
,2018-12-16 01:54:59.393 UTC,53,53798818,use firebas realtim databas make pokemon-go style game user data structur entri pokemon node id correspond id tap pokemon node want secur rule ensur one creat new node pokemon node id exist tappedpokemon node tri rule code produc true everi time,0.09433962264150944,5,firebase firebase-authentication firebase-realtime-database firebase-security-rules javascript,refrenc data path issu firebas secur rule,3,authentication|security|scripting,0.6277281641960144
get permiss deni delet actual write oper null valu updat rule ad new claus,2018-04-20 18:24:35.897 UTC,55,49947688,new firebas tri rule use rule let user comment owner abl write problem requir poster id owner id try remov node work send poster id i? rule try delet comment permiss deni error,0.03636363636363636,2,firebase firebase-realtime-database firebase-security-rules javascript,firebas rule owner delet,2,security|scripting,0.6272369027137756
secur rule three variabl refer data - data exist locat rule updat - data exist locat rule updat - data exist root thd databas updat refer rule data updat updat data refer sinc unfortun navig requir level call multipl time exampl,2017-06-10 18:54:14.03 UTC,120,44476969,implement user event system one restrict user host 1 event time initi tri implement restrict queri node rule look event alreadi userid equal figur decid creat new node lookup tabl store userid current host event user tri creat event userid alreadi exist error rule javascript problem updat call alway fail tri insert time rule expect userid write guess fail make 2 separ updates? 1 insert userid succe anoth insert,0.03333333333333333,4,firebase firebase-realtime-database firebase-security javascript,firebas multi path updat rule path,2,security|scripting,0.6255226135253906
approach prevent user b read field contain block inform want appli rule anoth hierarch level use auth.uid scenario user b prevent current user read data specif user scenario user,2018-06-29 16:23:46.773 UTC,121,51105925,work social media app user follow user need incorpor block user featur user block user b user b allow look user profil read data function block user instagram facebook think get close node firebas add block user case user user b databas look -blockedus ---user ------user b true databas rule look issu rule term user user b user b block prevent user b read data databas tri achiev user b block user prevent user b read user data adjust rule,0.01652892561983471,2,firebase firebase-realtime-database firebase-security-rules javascript,firebas rule allow user block user read data,2,security|scripting,0.6250206232070923
accord question comment - think user permiss write db check check rule databas firebas consol,2018-07-21 10:42:48.737 UTC,46,51455257,updat firebas user profil photourl upadt store firebas user db. signout signin user photourl chang store action wrong ? thank feedback,0.10869565217391304,5,firebase firebase-authentication firebase-realtime-database firebase-security-rules javascript,firebas updat user profil work,4,authentication|security|scripting|signing,0.6240667700767517
think figur problem {userid=**} follow rule tri access users/5ls2na21ugbabew4akywyef9fh42/group userid variabl evalu 5ls2na21ugbabew4akywyef9fh42 know guess 5ls2na21ugbabew4akywyef9fh42/group want privat document specifi everi document rule follow,2017-12-17 15:08:48.287 UTC,109,47856426,write rule cloud firestor firebas want restrict access databas use user auth id rule behav expect databas structur /users/{userid}/groups/{groupid} want user abl access document userid achiev write rule follow user abl read group databas use javascript code retriev group follow sinc cloud firestor nice debug tool realtim databas littl debug test user uid 5ls2na21ugbabew4akywyef9fh42 chang rule test user abl success retriev group data document cours user chang rule abl data databas someon tell wrong,0.03669724770642202,4,firebase firebase-security google-cloud-firestore javascript,privat cloud firestor databas use rule authent,3,security|scripting|authentication,0.6235811710357666
,2018-10-24 19:31:33.863 UTC,38,52976635,app tri follow document link multipl auth firebas follow exampl link pre-exist account linkwithcredenti fail error user current sign confus re-sign previou account order abl link newli delet account credenti,0.18421052631578946,7,firebase firebase-authentication javascript react-native,linkwithcredenti delet current user,4,authentication|scripting|credential|signing,0.6188411712646484
,2013-04-22 14:15:07.597 UTC,25,16149387,cant wrap head around creat /location/groupid/users/usernam firebas restrict group user insid group,0.12,3,firebase firebase-security javascript,creat group firebas creat new user group? restrict access group,3,security|scripting|username,0.6180278658866882
,2018-06-16 22:51:22.6 UTC,38,50892375,queri collect document use secur rule check field document allow read queri rule document return queri field someth return multipl document prevent check individu document field,0.10526315789473684,4,firebase-security-rules google-cloud-firestore javascript,firestor secur rule - check document field queri collect,2,security|scripting,0.6154379844665527
right nobodi read permiss everyon signed-in user read permiss node abl read locat need read permiss locat fix problem move rule one level,2017-02-13 14:08:47.86 UTC,62,42206060,db structur want permiss allow read/writ user proper user uid owner allow read public everyon write proper user uid owner.for tri list posit public find valu whole public read/writ true works.intuit work,0.06451612903225806,4,firebase firebase-authentication firebase-realtime-database firebase-security javascript,firebas permiss,4,authentication|security|scripting|signing,0.6150152683258057
case queri rule filter explain doc write queri retriev document keep mind secur rule filters—queri noth need write queri fit constraint secur rule hand behavior appli queri retriev one document collect individu document retriev document id retriev singl document cloud firestor read document evalu request use secur rule actual document properti work queri one doc queri collect need add filter queri follow,2019-05-24 16:00:02.077 UTC,130,56296046,collect call announc use store data howev document field call permiss contain permiss level string wrote function determin user access base permiss level resourc setup onsnapshot callback singl document work respons switch snapshot collect get invalid permiss error base find firestor fail chanc user access document collect model use? document user access too? rule work vvv work vvv,0.046153846153846156,6,firebase firebase-security-rules google-cloud-firestore javascript,firestor access document collect user permiss,3,security|scripting|validate,0.6117715835571289
default fireba allow one email per user user alreadi signup email password later sign googl oauth user detail updat googl oauth user detail email automat verifi app work prevent,2020-01-19 01:25:10,94,59806371,current one account per email address fireba authent problem user log googl oauth email address alreadi creat email/password account googl oauth automat replac email/password provid follow error handl process user prompt choic link two account googl oauth even incur error catch simpli silent replac exist account,0.1702127659574468,16,javascript firebase react-native firebase-authentication google-oauth,fireba one account per email address allow googl oauth replac email/password account without consent,5,scripting|authentication|oauth|password|signing,0.6109657883644104
break granular oper state doc read rule broken list write rule broken creat updat delet exampl particular case,2018-05-25 22:10:19.21 UTC,63,50537447,node web app firebas data storag wonder firebas consol add rule allow creation view data certain databas exampl app want user abl creat messag view messag howev want ever abl delet restrict delet document firestor rule,0.031746031746031744,2,firebase firebase-security-rules google-cloud-firestore javascript node.js,restrict delet permiss firestor,2,security|scripting,0.6102989315986633
code attach listen user sign firebas databas server immedi check permiss listen first attach immedi reject unauthor listen solut wait user authent attach listen highli recommend updat code firebas databas version 3.x,2016-12-21 22:27:43.21 UTC,88,41272968,data firebas readabl context web page exampl open firebas url user alreadi regist signinanonym give user.uid still appear authent thu rule result permission_deni user even though user object javascript correspond rule work chang read permiss true rule allow sign anonym user regist logged-in user read data,0.125,11,firebase firebase-authentication firebase-realtime-database firebase-security javascript,firebas rule user sign anonym,5,authentication|security|scripting|signing|authorise,0.6035656332969666
,2018-06-12 10:47:49.317 UTC,40,50815330,start try-out firebas firestor encount problem.whenev setup rule try queri document permiss deni error see point bee denied. rule queri js current data project collect edit user tri access document uid 4ujfzogqexulqpyatoscweh2gsa3,0.05,2,firebase firebase-security-rules google-cloud-firestore javascript,firestor permiss deni queri,2,security|scripting,0.6019903421401978
appli rule everi child specif node so-cal $ variabl case rule appli everi messag inform see firebas document use $ variabl,2015-07-20 15:18:06.823 UTC,85,31520250,creat firebas databas want add rule data cannot figur right access data rule section firebas default databas parent node default random letter number data shown chang name node allow access rule section firebas access configur currently? tri access tri nest anoth refer insid rules{} message{} #messageid{} none abl read data thank help,0.023529411764705882,2,firebase firebase-security html javascript jquery,chang name firebas parent node enabl rule,2,security|scripting,0.5992583632469177
createuserwithemailandpassword signinwithemailandpassword assum user verfi email,2017-03-03 06:12:54.003 UTC,29,42571879,follow listen use detect user log determin user creat due login thank,0.20689655172413793,6,firebase firebase-authentication javascript,determin user newli creat exist user firebas auth,5,authentication|scripting|login|password|signing,0.591556191444397
write instead defined? duplic exampl,2018-09-07 12:18:34.923 UTC,72,52222428,new firebas rule abl write data user node current log in.mi db structur want give write access node relat current log user databas rule user node profil contain node ad 3 sub node fro user node understand structur leav additionaldata node problem unabl write data profil node run simul get follow [ anyon help fix thank advanc,0.027777777777777776,2,firebase firebase-realtime-database firebase-security-rules javascript,firebas databas rule unabl write data,2,security|scripting,0.5892621874809265
firebas secur rule find whether specif valu exist list children want ensur valu uniqu valu key collect exampl case easili chang data mac address key sinc properti name definit uniqu json duplic mac address data structur see firebas android make usernam uniqu prevent duplic user properti firebase? firebas secur rule check uniqu valu child #askfirebas uniqu properti firebas enforc uniqu usernam firebas simplelogin,2018-04-13 12:09:40.04 UTC,161,49816684,tri restrict write two relat firebas node follow data structur firebas slavesibbl pushkey uniqu mac address freeli creat updat user condit 1 user permiss write new mainsibbl slavesibbl 2 permiss overwrit neither mainsibbl &amp slavesibbl slavesibbl key case 111111111111 alreadi exist 3 owner abl updat node even creat someon type mac address regist alreadi child node updat user referenc ownerid want updat mac address creat abl write firebas databas rule control this?i tri prevent duplic work write oper want allow/disallow replac macaddress variabl hardcod macaddress,0.043478260869565216,7,firebase firebase-realtime-database firebase-security-rules javascript,restrict write firebas mainsibbl slavesibbl node slavesibbl variabl key,4,security|scripting|username|login,0.5875554084777832
,2018-06-12 20:27:39.96 UTC,89,50825365,issu try access document say permiss access docuemnt follow firestor rule simul uid phone number applic say allow document path howev try thing applic user uid phone number allow access document code try access document one thank helping! --------- edit ---------- figur exactli problem firestor rule allow document collect list figur chang rule firebas allow read document least document name iyb0710-2018-06-13-1528922084314 one document list collect mean actual happen replac $reservationinfo document name try group document command applic,0.033707865168539325,3,firebase firebase-security-rules google-cloud-firestore javascript,firestor secur rule work perform queri multipl doc,2,security|scripting,0.5863252878189087
firebas check read permiss attach listen read permiss locat read queri allow read permiss locat read queri reject case read get reject one read permiss queri locat must read permiss locat read permiss locat read data locat doc mean queri cannot use filter data access firebas document call rule filter see mani question topic mani contain workaround behavior,2017-07-18 16:20:12.433 UTC,123,45172282,build app use react-n firebas code work anoth app pull firebas fail work time modifi simpler - one time data call follow error even make rule true open anyon still error elsewher app read/writ function work current rule databas structur databas structur action creator make call tri everyth wit end thank,0.024390243902439025,3,firebase firebase-authentication firebase-realtime-database firebase-security javascript,cannot access firebas databas despit make read rule true,3,authentication|security|scripting,0.5855922102928162
,2019-08-07 06:57:04.3 UTC,39,57388571,secur data allow multipl user abil fetch note access firebas realtim databas databas structur firebas rule correspond databas queri correct secur data? prevent anyon author member read note? kind regard /k,0.15384615384615385,6,firebase firebase-realtime-database firebase-security-rules javascript,firebas realtim databas secur,3,security|scripting|authorise,0.5843924880027771
code tri read rule grant read access keep mind rule filter data luckili rule use author specif queri need rule queri allow broad read reject,2019-05-19 21:14:31.757 UTC,75,56212059,reason data return use wildcard firebas rules? tri give access data use id firebas rule data store complete/-docid/ firebas rule retriev data code want give access data statu valu resolv keep get /complet client permiss access desir data,0.04,3,firebase firebase-realtime-database firebase-security-rules javascript,wildcard firebas rule work tri access data id,3,security|scripting|authorise,0.583620011806488
far know order guarante queri perform firestor secur rule valid queri individu document mean queri allow rule valid queri retriev data allow current model simpli possibl requir secur rule check individu document exampl queri secur look firestor document secur queri,2018-06-10 01:44:03.867 UTC,80,50779921,work angular app use firestor book function want user publicli read write book provid exist within one document document structur current secur rule queri sure get note sign access,0.1375,11,firebase firebase-security-rules google-cloud-firestore javascript,firestor secur rule allow one document public,4,security|scripting|signing|validate,0.5832162499427795
fail tri access locat instead queri specif bundl directli pass abl filter data firebas rule state section firebas doc suggest updat schema provid separ node anonym bundl e.g,2017-12-04 05:14:16.02 UTC,71,47626898,firebas realtim db secur js app allow read permiss password-auth users.then type anonym per scheme want allow read specif /bundles/ rule - /bundl - expect logged-in anonym see first bundl instead error fb - permission_deni /bundl,0.07042253521126761,5,firebase firebase-security javascript,firebas anonym data secur,3,security|scripting|password,0.5823683738708496
,2019-09-03 14:55:24,53,57774216,"onlin librari system store file name,download url bookfrom firebas storag authd.uid user real-tim databas want updat databas rule allow user uid store data access data javascript code put valu databas work mebut problem user cannot read data databas look tri databas rule work",0.05660377358490566,3,firebase firebase-realtime-database firebase-security javascript,specif rule data store real-tim databas,2,security|scripting,0.5818882584571838
