answers,creation_date,len,postid,question,ratio,raw,tags,title,uniq,words,probability
code watch see log user base offici doc firebas let know need know flow authent token etc,2017-12-19 00:22:55.47 UTC,48,47878363,work javascript firebas app.i abl createuserwithemailandpassword success app new user registr show insid firebas consol question check user exist log browser,0.1875,9,firebase firebase-authentication javascript jquery node.js,javascript firebase.auth.signinwifemailandpassword abl login firebas,5,authentication|scripting|signing|password|login,0.3214937746524811
code call anywher definit explain noth written databas probabl look call,2018-06-04 16:41:44.453 UTC,68,50685178,new use firebas look firebas document found follow user put follow input usernam email password confirm password call createuserwithemailandpassword work want time creat entri db firebas tri write follow line work wrong? suggest add addit element entri user use uid creat authent method? thank advanc time,0.11764705882352941,8,firebase firebase-authentication javascript,creat user email add element db firebas javascript,4,authentication|scripting|username|password,0.3213631808757782
work local make sure host domain regist googl oauth firebas consol develop -> authent -> sign-in method -> author domain add domain list take time verifi work try log error.messag inform updat firebas work fine npm firebase@latest,2019-06-20 10:48:39.627 UTC,89,56684375,use googl sign popup method vuej live googl sign pop window flash never sign everyth work fine local firebas googl sign &amp sign method code tri chang chrome pop cooki set noth work help much appreci pleas,0.16853932584269662,15,firebase firebase-authentication google-signin javascript vue.js,firebas googl sign pop window flash never sign use vuej,6,authentication|signing|scripting|cookie|oauth|authorise,0.3211515545845032
sign involv forget refresh token use keep user sign persist time server need notifi happen,2019-03-28 19:28:54.947 UTC,52,55405504,set simpl form - 2 button 2 function test firebas auth problem sign sign function work perfect.howev sign send xhr noth nada error promis resolv consol log sign wrong?thank,0.19230769230769232,10,firebase firebase-authentication javascript,firebas web sign send xhr,4,authentication|scripting|signing|forge,0.32113462686538696
email field user collect enter email id place usernam make login system use accounts-ui abl accounts-ui config facil helper meant easi drop-in helper prototyp custom need creat custom login/signup form actual pretti easi document account api simpl exampl custom login/signup form method valid user field perform custom user object respect exampl callback chang user field whatev want return user object insert db note exampl includ code user forgot password want reset method,2013-12-30 05:05:29.423 UTC,114,20833631,meteor current use default login field howev user creat uniqu user id upon creat account hardcod wonder edit loginbutton field somehow.would anybodi know add extra field gener user sign forc fill out? name usernam etc,0.13157894736842105,15,javascript meteor,creat custom login field meteor,7,scripting|login|signing|username|validate|forge|password,0.32083460688591003
method take so-cal cancel callback call user lose permiss listen locat refer document cancelcallbackorcontext option option callback notifi event subscript ever cancel client permiss read data permiss lost callback pass object indic failur occur case someth,2016-08-18 15:44:24.903 UTC,85,39022447,rule user white-list read databas everyth work fine white-list user howev figur handl case especi authent user white-list sinc fail secur rule .on valu listen fire rais except either pleas enlighten detect authent user without read permiss,0.07058823529411765,6,firebase-realtime-database firebase-security javascript,catch read permiss denial firebas use js web api,3,security|scripting|authentication,0.32015344500541687
,2019-01-19 01:28:32.487 UTC,70,54263360,tri add googl sign-in system websit display first &amp last name well profil pictur implement html websit use sign googl api websit https://developers.google.com/identity/sign-in/web/sign-in alreadi implement sign button web site code shown basic webpag sign-in button div id profil info obvious div profil info appear expect page contain sign-in button alreadi well sign user profil pictur first last name,0.18571428571428572,13,google-oauth google-signin html javascript,display user name profil pictur sign googl site,4,oauth|signing|scripting|user name,0.31898754835128784
https://developer.mozilla.org/en-us/docs/web/javascript/reference/statements/try...catch seem away w/ null check gener better flow control trigger avoid except,2016-07-28 14:50:08.73 UTC,64,38639837,got 2 text box one usernam password firebas code say uncaught promis typeerror cannot read properti email null firebas code work fetch email usernam match usernam exist throw typeerror catch error? unfortun work case email password authent java someth,0.140625,9,firebase firebase-authentication firebase-realtime-database javascript,firebas - uncaught promis typeerror cannot read properti,4,authentication|scripting|username|password,0.3183490037918091
need go firebas panel activ signup method email/password case add domain list author domain https://www.firebase.com/docs/web/guide/user-auth.html#section-configur,2016-06-07 06:11:46.553 UTC,49,37671742,current follow tutori link follow error firebase.js:75 uncaught error domain author oauth oper firebas project edit list author domain firebas consol need creat authent system first,0.22448979591836735,11,firebase firebase-authentication javascript,domain author use firebas authent,6,authentication|scripting|authorise|oauth|signing|password,0.3179173171520233
,2017-04-20 02:02:08.17 UTC,103,43508928,let say build web app requir form valid firebas data layer accord document done databas rule specifi json document firebas databas rule made javascript-lik express contain json document question prevent malici person modifi databas rule document submit unvalid data form database? document explain follow firebas databas rule declar configur databas mean rule defin separ product logic number advantag client respons enforc secur buggi implement compromis data perhap importantli need intermedi refere server protect data world doubt document understand list advantag work specifi rule declar json document prevent hacker modifi rule submit bad data,0.10679611650485436,11,firebase firebase-realtime-database firebase-security javascript validation,firebas form-valid server-side? prevent circumvent,6,security|scripting|validate|malicious|protect|hack,0.3176051676273346
follow trick sinc need read valu databas node method handler call promis return resolv valu argument method try chang,2018-08-11 14:19:13.157 UTC,66,51800539,app user input nicknam password search correspond email firebas databas firebas sign html javascript problem clear first time click login button email address record snapshot function still undefin click button second time email address record,0.12121212121212122,8,database firebase firebase-authentication firebase-realtime-database javascript,javascript click login button twice email appear,5,authentication|scripting|login|password|signing,0.3172600269317627
pleas check offici document authent firebas phone number use angularfire2 librari david east answer issu decid wrap auth method instead provid inject firebas auth instead upgrad 4.0 avail inject,2017-06-05 12:46:39.113 UTC,48,44369263,anyon tell complet code angular2 firebas phone number authentication? get googl,0.14583333333333334,7,angular firebase javascript,angular2 firebas phone number authent,4,scripting|authentication|inject|availability,0.3171308636665344
great question show meteor secur model work secur issu meteor never trust client code meteor server decid data client access see meteor.publish data client allow chang see meteor.allow client authent server server store user id client log provid id function server meteor send user id client cours want chang client behav screen base log say stop rogu client arbitrarili chang javascript code chang think user id is! give client new permiss still server code make secur decis try use secur parti applic make parti app creat user account doubl click map creat parti check box make privat parti open javascript consol type user` id log parti disappear screen server publish user go consol overwrit new function return id want fake client think user server know better still parti screen updat parti collect chang parti inform fact complet safe client user id anyth want! reach right account system call try see login button upper right corner turn anim client call show email address log user log server user publish inform user spinni strong secur model worri client code even though app code lives! long write secur server method publish function allow/deni rule complet lock matter client tri test meteor use two browser copi local storag browser log person log one still abl publish think secur made copi valu still seen user even use differ browser secur updat upon reflection. suppos possibl log ip address user login user tri access ip address ask log,2012-11-11 14:06:50.81 UTC,264,13331836,play around meteor found even insecur packag remov client chang meteor.userid function exampl done redirect function secur,0.07575757575757576,20,javascript meteor security,meteor.userid changeabl,8,scripting|security|insecure|trust|authentication|user account|safe|login,0.31611356139183044
appear problem domain author oauth oper firebas project. forgotten add domain list author one fix go firebas project > authent > sign-in method > add domain author domain thank @ymmanuel help,2016-06-02 22:24:07.807 UTC,84,37603118,tri build websit use email auth user howev everytim try sign log user firebase.auth.onauthstatechang function fire recogn user log sign current code know work alert user! everi log sign go firebas consol see user sign anyon know fix appreci it! thanks! code code login &amp signup,0.17857142857142858,15,authentication firebase html javascript web,firebase.auth.onauthstatechang work,7,authentication|scripting|signing|login|authorise|oauth|forge,0.31568455696105957
specifi key need index allow rule top level key look data appear escap key sure requir escap valu index queri jsbin demo,2015-12-19 14:36:38.917 UTC,91,34371900,tri simpl equalto firebas test data upload code get noth consol firebas doc code next code work https://www.firebase.com/docs/web/guide/retrieving-data.html#section-queri index.on errori get resolv comment firebas warn use unspecifi index consid ad .indexon citi /busi secur rule better perform get first time ad .indexon citi still get error get noth consol rule secur rule consol json structur follow help greatli appreci thank,0.04395604395604396,4,firebase firebase-security javascript,proper structur queri get log output,2,security|scripting,0.3155490756034851
work fireba storag api correctli first line put return refer see api doc return uploadtask work promi want download url upload file need wait upload complet call getdownloadurl refer upload shown document minim secur rule irrelev show cloud firestor cloud storag differ product differ rule need pay attent rule storag instead,2020-04-06 21:46:30,105,61069463,add imag fireba storag add data firestor imag url imag upload fireba storag return url getdownloadurl method give back error uncaught typeerror cannot read properti getdownloadurl undefin input store data code first imag input send fireba storag pass imag url path send fireba firestor storag rule,0.02857142857142857,3,javascript firebase-storage firebase-security,fireba storag getdownloadurl return undefin,2,scripting|security,0.31542375683784485
read doc better look firebas persist accord current user portion doc basic stop store token let firebas handl,2017-06-20 21:27:53.513 UTC,68,44663299,user sign app firebas auth save return idtoken refreshtoken cooki app refresh rather make user go sign process pull store token re-auth provid token refresh occur far tell firebas doc matter trigger sign token do? firebas store cooki persist across refresh,0.14705882352941177,10,authentication firebase firebase-authentication javascript oauth-2.0,firebas signin idtoken refreshtoken,5,authentication|scripting|oauth|signing|cookie,0.3146662712097168
return so-cal promis promis succeed fail separ claus handl success claus reason see document miss import flow user sign exampl happen reload page/app? firebas automat persist user session local storag code awar app like requir user sign lead not-so-good experi firebas authent better monitor authent state callback automat get call whenev user sign whether creat account reload page short-liv token refresh - code first block execut similar whether user session expir sign reason sign - code second block run singl place handl case user get sign sign sinc fail kind spectacular way still want handl error explicitli complet idiomat code handl monitor sign-in state,2016-07-20 03:50:15.767 UTC,145,38472017,use firebas sdk web user login link authent firebas use password-bas account use code creat user account success creat user question decid creat success? creat fail code catch error success catch,0.11724137931034483,17,firebase firebase-authentication javascript web,firebas sdk web creat password-bas account,6,authentication|scripting|password|login|user account|signing,0.31425637006759644
make separ node databas name store usernam user check right login run check child look usernam user enter match grant login access attach observ list data return entir list data singl snapshot loop access individu children read doc child event,2018-10-17 00:56:46.693 UTC,88,52845878,creat webapp class assign creat login usernam tri push usernam databas get push child connect id firebas javaascript creat far plan allow user maintain stat leav page figur assign usernam go better way go pleas let know,0.17045454545454544,15,firebase firebase-realtime-database javascript jquery,firebas - implement login use usernam password/email,5,scripting|login|username|password|signing,0.31418269872665405
instead,2018-01-25 00:47:42.353 UTC,42,48433974,exampl creat user verifi error indic user creation success sinc need take action save user name databas user creation success redirect user creation success take action success user createuserwithemailandpassword,0.11904761904761904,5,email firebase javascript passwords,know creation user email password successful? take action,3,scripting|password|user name,0.3141079246997833
firebas simpl login servic built on-top firebas custom login provid use primit authent user via common mean design firebas simpl login give access user password programmat increas risk handl store secur today two method use remov email / password hash map either via client api use email password via admin panel keep mind use email / password login firebas simpl login simpli creat new map email address password hash store inform firebas note blacklist user id remov map user re-creat want ban / block user better approach creat new list firebas blacklist user secur rule ensur user list i.e user block,2014-04-30 08:57:56.587 UTC,203,23383826,tri remov user programat firebas method removeus take 2 argument email password email hard find sinc store auth variabl + ad databas user creat howev suppos find password user? creat user add gener md5_hash inform user databas howev convert valu back real password obvious want store real password databas sinc ask problem wonder anyth overli obviou miss remov user programat databas password? actual even need password remov him? edit clarifi allow admin delet user list everi user creat firebas user delet user account still easi sinc presum firebas hash algorithm public check input correct password,0.15270935960591134,31,database firebase firebase-security javascript,remov user firebas,10,security|scripting|password|md5|hash|user account|login|authentication|signing|blacklist,0.3138622045516968
mgooglesigninclient.signout.addoncompletelistenerclassname.thi new oncompletelisten { @overrid public void oncomplete@nonnul task task { toast.maketextclassname.thi log toast.length_short.show } } normal expect behavior sign firebas unrel sign googl user need explicitli sign googl howev know applic use share devic follow,2018-05-13 20:01:55.437 UTC,76,50320147,use firebas authent googl account login process work fine problem logout successfuli log firebas googl mean user remain log googl log them? code seen post speak similar issu android find anyth js,0.14473684210526316,11,firebase firebase-authentication google-authentication javascript,logout googl login firebas,4,authentication|scripting|login|signing,0.31353864073753357
,2019-08-19 23:31:25.44 UTC,57,57565051,get ‘account alreadi exists’ issu android app try creat new account regist user app.th problem regist new user give error user alreadi registered.i ad email password databas directli login function work clearli problem sign php script look fix please?thi php script,0.12280701754385964,7,android javascript mysql php sql,unabl creat new user mysql databas :account alreadi exist error login,4,scripting|login|password|signing,0.31298425793647766
expect behavior inde confus first perform write oper client firebas immedi fire event local listen without wait respons server part reason firebas write seem immedi local user send write oper server wait respons respons either acknowledg reject write oper server reject write oper firebas client fire event client app correct state chart form,2019-09-14 08:34:01,152,57933821,discov weird behavior updat data rdb permiss deni exampl minim code necessari reproduc bug let suppos subscript getbook data chang let updat author use method happend permiss requir ? → work fine log foo pop new node author = foo happend permiss requir ? → 3 log follow order foo pop new node author = foo @firebase/databas firebas warn updat /books/1 fail permission_deni foo pope old node origin author note weird behavior happen client tri updat fortun updat work confirm open anoth browser log pope explan act updat,0.046052631578947366,7,firebase firebase-realtime-database firebase-security javascript,firebas databas weird behavior updat + permission_deni,3,security|scripting|authorise,0.3128795623779297
detail firebas call custom claim function detail control access custom claim secur rule basic stand separ node server instal firebas adminsdk generate/download privat key servic account tab firebas consol put node server simpli creat bare bone node app assign custom claim uid user wish someth work verifi custom claim appli log app previous log log back updat web app method store role user databas look client updat ui use idiomat long time realtim databas still work firestor thing chang rule read instead hard-cod uid uid one place instead rule document want consid altern custom claim admin user read server-sid secur rule enforc author access front-end optim ui custom claim firebas admin sdk custom server cloud function scenario simpler run develop machin,2018-02-09 16:34:13.513 UTC,210,48710246,firebas web app requir administr access i.e ui show thing admin administr section came mean author ui display admin section valid admin question good bad? sound mean authorizing? ...so mani way particular requir configur admin secur rule vs node/tre db/firestor idea fail due unauthor access tell app logic user admin succe logic show admin section cours section html skeletons/empti element popul databas even end user hack js/logic real data - empti admin section framework firestor rule specifi admin uid,0.06666666666666667,14,firebase firebase-authentication firebase-security-rules google-cloud-firestore javascript,administr view firebas web applic,8,authentication|security|scripting|authorise|validate|hack|private key|signing,0.31122341752052307
log sandbox account? sinc work sandbox accord screenshot need make sure log sandbox buyer account test,2018-12-18 20:04:02.813 UTC,97,53840252,tri make onlin payment use paypal button make button use instruct paypal develop paypal payment button show fine page want pay test open popup need login paypal account tri login anoth paypal account money come paypal account everi time show error messag check email address password try email address password correct login paypal anoth tab imag popup need login paypal account error messag code got paypal develop,0.12371134020618557,12,javascript payment paypal paypal-sandbox php,unabl login paypal use paypal payment button - localhost,4,scripting|sandbox|login|password,0.3109954595565796
none,2020-03-22 20:57:03,26,60804876,problem fireba react know implement someth keep user vote twice case click button react code fireba rule,0.07692307692307693,2,javascript firebase google-cloud-firestore firebase-security,react fireba implement function,2,scripting|security,0.3101333975791931
,2019-04-16 12:37:17.467 UTC,92,55708321,tri html2canva order screenshot div render imag save firebas storag creat folder within firebas storag call paintings/ use code found https://gist.github.com/ddly/aa86a19594d1b82156d88854ebf253d8 problem run function canvasscreenshottofirebasethumbnail - receiv permiss deni error within browser consol firebas warn /paint fail permission_deni similar problem solv chang rule realtime/cloud firestor howev use either howev chang firebas storag rule allow public permiss error end configur firebas instanc within web app screenshot div folder paintings/ inform think provid moment anyth els let know greatli appreci help resolv issu,0.021739130434782608,2,firebase firebase-realtime-database firebase-security-rules html5 javascript,fix firebas warn /paint fail permission_deni,2,security|scripting,0.30954286456108093
send otp given method instead use otp verif method sign user credenti,2019-12-06 07:47:15,63,59208960,use mobil verif authent cordova plugin plugin work fine login logout everyth defin document plugin use firestor use third parti authent mechan firebas defin work obviou give auth user want convert auth user auth user auth user firebas secur rule,0.15873015873015872,10,cordova firebase firebase-authentication firebase-security javascript,convert cordova-plugin-firebase-authent auth firebas js-sdk auth,6,authentication|security|scripting|login|signing|credential,0.3094053864479065
know much chrome.ident appear provid method googl oauth access token https://developer.chrome.com/apps/identity#method-getauthtoken sign chrome.ident oauth2.0 googl access token sign firebas prevent need prompt user sign,2017-01-22 11:24:04.49 UTC,87,41790278,know think possibl pass link authent user firebas why? googl cloud print connect classic printer user sign chrome chrome need openend keep printer onlin ux cool open webbpag firebas login insid chrome webapp verifi user chrome.ident want ask twice log creat two separ app basic question verifi user chrome.ident creat account firebas well pass webtoken,0.12643678160919541,11,firebase firebase-authentication google-chrome-app javascript,pass chrome.ident firebas login,5,authentication|scripting|login|signing|oauth,0.3088417649269104
none,2020-04-05 14:14:26,55,61043985,issu vue.j fireba applic cau eventu let sign user try sign alreadi regist user throw error signinwithemailandpassword fail first argument email must valid string process almost equal except signup one demand confirm password someth missing?sign processhtml script vuex manag,0.23636363636363636,13,javascript firebase vue.js firebase-authentication,fireba app throw error recogn first argument email signinwithemailandpassword method vuej,5,scripting|authentication|signing|password|validate,0.308817058801651
instead send password reset email contain token allow recipi reset password mean safe assum user sign receiv email verifi email address admin sdk properti,2017-12-18 15:02:48.88 UTC,84,47871143,react app sport team sign team coach coach abl invit member team via e-mail alreadi setup creat team member coach formwher temporari password onsubmit form call well work charm cannot seem figur hack enabl send password email sinc edit email templat grey firebas consol anyon figur resolv coach inform member respect password,0.14285714285714285,12,email-verification firebase firebase-authentication javascript,firebas email-verif temporari password,6,authentication|scripting|password|signing|hack|safe,0.3088051974773407
use custom signin button use signin button wl.ui? use wl.ui signin button clear cooki user click sign button function provid sign user sign want chang event auth.statuschang call wl.getloginstatu see return,2015-03-30 10:04:47.027 UTC,146,29343398,follow javascript interact live sdk enabl onedr web app work fine follow method set wl_auth cooki specifi redirect domain contain detail user sign time sign user sign differ account valu old cooki still remain abl attach file old user new account follow tediou process delet cooki everytim sign n new user seen javascript method subscrib logout event microsoft account call wl.event.subscrib attach follow code subscrib logout event try log old account log differ account still problem persist why? help kindli appreci thank you! note signin button web app user click attach onedr button first time ask sign inform sign alreadi redirect onedr file pickertil cooki expir,0.17123287671232876,25,cookies javascript onedrive,sign chang wl_auth cooki valu onedr,4,cookie|scripting|signing|login,0.3086588978767395
