answers,creation_date,len,postid,question,ratio,raw,tags,title,uniq,words,probability
,2017-11-10 14:49:00.183 UTC,64,47225407,work project store data firebas databas tri make sure peopl read write new children edit remov them.i tri use rule prevent peopl delet updat instead appear block request - even data ad new child code use add children someth know use incorrect rule incorrect ad data rule allow peopl add new children delet updat,0.03125,2,firebase firebase-realtime-database firebase-security javascript,prevent delet updat children firebas refer,2,security|scripting,0.38009074330329895
option firebas link auth provid togeth workflow fairli simpl user authent googl log link account facebook usernam / password combin whenev login come user id auth object come back differ provid link auth user see https://firebase.google.com/docs/auth/web/account-link inform,2017-08-16 07:31:58.023 UTC,79,45707582,googl say video https://www.youtube.com/watch?v=8sgy55yxica&amp;t=1m3 user inform contain uniqu id guarante distinct across provid possibl user differ email password provider? googl know facebook googl github account belong user,0.12658227848101267,10,authentication facebook firebase firebase-authentication javascript,user id firebas authent across authent provid googl facebook github,5,authentication|scripting|password|username|login,0.3794630467891693
variabl secur rule point object data need,2019-05-15 11:37:32.137 UTC,37,56148455,tri read rule work array per blog https://firebase.googleblog.com/2018/08/better-arrays-in-cloud-firestore.html angularfirestor db rulesservic cloud.firestor { user egsht477klokw0yeysryo0j8aky2 access read user list viewer warn,0.08108108108108109,3,angular firebase-security-rules google-cloud-firestore javascript,firestor queri array/rul work resources.view,2,security|scripting,0.3791901767253876
,2016-02-07 01:35:33.59 UTC,44,35248728,tri check user regist app part check usernam btw want make sure possibl regist usernam even user bypass check process firebas rule check sourc code user exist access deni error. pleas help,0.13636363636363635,6,firebase firebase-realtime-database firebase-security javascript,firebas javascript access deni angularj mayb bad rule,4,security|scripting|username|bypass,0.3784703314304352
email firebas support got back respons guess anonym authent last call user clear cache/cooki,2016-07-31 23:17:11.86 UTC,50,38689181,make chrome extens use firebas databas authent type use anonym one wonder long last want last indefinit user alway associ uid somewher consol check long anonym sign last,0.14,7,firebase firebase-authentication google-chrome-extension javascript,long anonym login persist,5,authentication|scripting|login|signing|cookie,0.3775351047515869
absolut firebas handl secur bit differ admiss basic concept authent firebas provid tool allow authent includ integr facebook github googl twitter authent provid email &amp password login account manag single-sess anonym login custom login token author firebas allow specifi rule live firebas server via account dashboard data valid firebas rule languag includ rule specifi declar valid rule rule specif case write declar rule limit write access app someth,2016-03-07 06:19:45.133 UTC,105,35837379,use javascript creat user firebas .thi code given firebas guid data avail anyon browser consol secur threat one creat account themselvesi secur measur take prevent,0.21904761904761905,23,firebase firebase-authentication firebase-security javascript,firebas secur issu creat user account use javascript,11,authentication|security|scripting|user account|availability|threat|integrity|password|login|authorise|validate,0.37684106826782227
sinc store valu string firebas lexicograph order string comparison oper highli recommend store numer valu actual number make rule lot simpler reason json javascript code rule note chang last express sinc probabl want allow write user exactli enough money updat asid rule declar declar one level lower specif order,2019-05-25 13:44:09.42 UTC,99,56305391,im ad rule firebas realtim databas need check newdata valu ad certain amount case user balanc uid user balanc price data ad write data here databas look code im use add databas rule everyth work add rule rule use,0.030303030303030304,3,firebase firebase-realtime-database firebase-security-rules javascript,firebas rule check newdata valu certain amount,2,security|scripting,0.3766157925128937
check error callback fireba list gener error code see https://firebase.google.com/docs/auth/admin/error exampl,2020-04-21 06:58:22,65,61337653,current work login registr system googl fireba authent login regist account function work ad window alert user properli log log struggl ad window alert user regist exist email user enter invalid email password login function regist log in:what code should/must add order alert,0.13846153846153847,9,javascript firebase google-chrome firebase-authentication dom-events,googl fireba alert regist login error,5,scripting|authentication|login|validate|password,0.3762090504169464
firebas authent use browser local storag track sign-in state user add token user sign remov token user sign firebas authent cooki store authent state verifi quickli ran follow chrome develop consol axeiivc30anfogvwrdl3yev6mhk2,2016-09-02 13:36:37.757 UTC,53,39293804,log button use firebas sign method consol log log type sure clear cookies?,0.24528301886792453,13,cookies firebase firebase-authentication javascript,clear cooki log firebas,4,cookie|authentication|scripting|signing,0.37564438581466675
know anyth reduxfirestor look tri write subcollect user secur rule anyth say document subcollect queri go reject want abl read write document rule match full path read write consol alway work bypass secur rule,2019-10-16 13:03:45,73,58414018,basic rule place moment access firestor databas rule detailedbelow anyon help understand second block code caus permiss error? tri add imag subcollect exist yet thank app code,0.0684931506849315,5,firebase firebase-security google-cloud-firestore javascript,firestor miss insuffici permiss tri add new subcollect,3,security|scripting|bypass,0.3755992352962494
,2018-04-10 18:24:28.717 UTC,64,49760602,new firebas tri integr wordpress authent firebas auth aim user regist wordpress creat user firebas phonenumb authent mobil app firebas phone number auth web without recaptcha verifi sms code verif creat firebas account email password tri updat user phonenumb without success tri updateprofil updatephonenumb welcom idea method integr firebase/wordpress user creation thank,0.140625,9,firebase firebase-authentication javascript web wordpress,firebas phone auth without code verif recaptcha,5,authentication|scripting|captcha|integrity|password,0.37552839517593384
email-already-exist thrown firebase-admin sdk think thrown client sdk.for client sdk follow error thrown link exist account anoth one sign new account email exist anoth one auth/account-exists-with-different-credenti auth/credential-already-in-us auth/email-already-in-us error contain addit field error.email email associ credenti tri sign error.credenti credenti typic return oauth credenti lookup exist account find provid exist auth/account-exists-with-different-credenti sign provid need link error.credenti sign user error occur link auth/credential-already-in-us directli sign credenti,2017-04-10 12:09:06.493 UTC,107,43322778,try login app use auth method exampl first user use googl use fb 2 account mail error thing 3+ auth method error messag isnt specif littl tricki develop logic handl situat solv issu,0.18691588785046728,20,authentication firebase firebase-authentication javascript node.js,firebas account link error,6,authentication|scripting|login|signing|credential|oauth,0.3750494420528412
help valid try catch,2016-10-08 10:13:12.53 UTC,19,39931155,code userdata user uid signup success,0.3157894736842105,6,firebase firebase-authentication firebase-realtime-database javascript,userdata signup firebas email password,5,authentication|scripting|signing|password|validate,0.3746875822544098
short make sure user sign page answer show,2020-04-07 16:52:12,34,61085229,build simpl web app googl oauth2 user sign wonder uniqu identifi googl user user id privat googl user password,0.17647058823529413,6,javascript google-oauth,identifi googl user uniqu privat,4,scripting|oauth|signing|password,0.3740980923175812
auth0 lock trigger specif event user signup howev detect custom rule enrich user profil metadata signup sampl rule illustr possibl use store inform associ user keep track user alreadi execut addit first-tim signup logic mind rule execut server-sid authent pipelin logic want implement requir user interact achiev someth similar step upon login applic user profil flag assum user sign custom logic custom logic updat user signup flag server-sid applic logic auth0 manag api,2016-10-25 21:47:26.293 UTC,97,40250292,event emit success authent detect new user sign applic store user databas check time user authent,0.13402061855670103,13,auth0 authentication javascript,user signup event auth0 lock,4,authentication|scripting|signing|login,0.3736303448677063
messag tell exactli go firebas consol project turn correspond auth method tri gmail googl login enabl googl sign-in method insid authent tab make sure put sign-in option need turn insid paramet googl one want put remov everyth els,2019-03-24 19:56:29.8 UTC,78,55327973,solv tri put authent firebas finish code tri say given sign-in provid disabl firebas project enabl firebas consol sign-in method tab auth section tri search youtub googl didn´t find anyth,0.14102564102564102,11,firebase firebase-authentication javascript,firebas authent error given sign-in provid disabl,4,authentication|scripting|signing|login,0.37354332208633423
accord document paramet store variabl,2018-05-27 05:30:23.11 UTC,36,50549299,consid piec secur rule want access paramet {item} valu that? cloud function someth context.params.item need someth similar firestor secur rule,0.1388888888888889,5,firebase firebase-security-rules google-cloud-firestore javascript,firebas firestor secur rule access path param,2,security|scripting,0.373522013425827
try hope work problem auth.createuserwithemailandpassword fact log type user find type createuserwithemailandpassword trigger consol log howev seem valid user object explain noth appear sinc log user ran exact problem sendemailverif step notic requir auth.currentus signal must sort user sign sure firebas handl differ email verifi user non-verifi user behind scene simpli call signout function send email verif allow onauthstatechang function call log first time without reload app rather confus actual log success without caus chang authstatechang return error tldr rememb auth.signout function send email verif,2017-07-14 17:21:44.89 UTC,189,45108570,upgrad version firebas app 3.5.0 4.1.3 notic onauthstatechang callback function longer call user success sign first time verifi email address app written javascript relev section code callback setup callback sign edit - step reproduc problem typic action user app user download launch app user regist email password app send email verif email user receiv verif email click link user goe sign page app user sign trigger console.logsigninwithemailandpassword success onauthstatechang callback call develop test purpos user done user reload app user app user sign app user sign app trigger console.logsigninwithemailandpassword success onauthstatechang callback call,0.12169312169312169,23,firebase firebase-authentication javascript,firebas 4.1.3 onauthstatechang call first sign email password,5,authentication|scripting|signing|password|validate,0.3732437193393707
depend initi connect server run unrestrict servic account run administr permiss bypass secur rule see authent section firebas server doc section doc explain overrid behavior give server process initi,2016-07-16 10:43:56.463 UTC,79,38410327,rule work firebas simul write process got reject timestamp later 1 minut tri write server pass rule write process allow code wonder write process reject firebas simul allow request came server give reason firebas secur rule work simul code,0.0759493670886076,6,firebase firebase-realtime-database firebase-security javascript,firebas rule work server request work simul,4,security|scripting|bypass|authentication,0.3723517656326294
,2019-02-23 20:34:27.137 UTC,72,54845947,tri build simpl angular applic upload imag firebas storag store download url firebas databas display later use outdat guess? tutori abl upload storag fine howev try save url databas follow error unhandl promis reject permission_deni permiss deni zone task websocket.addeventlistener:messag valu error permission_deni permiss deni preceed follow warn @firebase/databas firebas warn /photos/8fffeaa5-e051-4f09-a667-91907fbe48b4 fail permission_deni firebas databas rule code tri save url databas,0.027777777777777776,2,firebase firebase-security-rules google-cloud-firestore javascript,angular 7 & firebas permiss deni,2,security|scripting,0.372069388628006
,2019-07-24 18:40:19.397 UTC,55,57189335,work react firebas capabl log app googl sign well press login instead ask account log previou user want sign want log popup ask account try almost solut internet tri firebase.auth.signout firebase.getinstance.auth.signout want log app log right away want ask account cant login without account,0.16363636363636364,9,firebase firebase-authentication javascript reactjs,sign alway pop ask account googl firebas,4,authentication|scripting|signing|login,0.3714207708835602
modifi rule real time databas,2017-03-29 02:31:41.593 UTC,86,43083247,current work firebas applic use googl auth provid singl sign-in flow new return user call authent user want popul object firebas databas store new user uuid inform ideal gener inform server side allow write access object client best tell new user sign up? pass user token server cooki authent request make sure sign author check uuid request see alreadi user object seem huge wast major request new user,0.11627906976744186,10,firebase firebase-authentication firebase-realtime-database javascript node.js,popul user object firebas databas new user sign,5,authentication|scripting|signing|cookie|authorise,0.37026795744895935
function look uid user email address client-sid sdk function exist firebas admin sdk exampl server-sid node.j reason function admin sdk use trust environ mani applic function avail client unwant api trust environ develop machin server control cloud function expos function app need use-cas altern store necessari inform databas firebas realtim databas cloud firestor allow user look see firebas user uid email,2019-01-27 18:09:57.273 UTC,84,54391295,anyway retriev uid firebas authent wintout login use email provid time signup,0.11904761904761904,10,firebase-authentication javascript react-native reactjs,anyway retriev uid firebas authent wintout login,6,authentication|scripting|login|signing|trust|availability,0.3691903352737427
,2017-03-10 07:11:03.79 UTC,38,42712375,work javascript authent user googl use oauth.i get user sign account chooser open twice select account ask account ask offlin access everytim need select account select offlin access code,0.21052631578947367,8,google-oauth-java-client google-oauth2 javascript,googl oauth2 ask account detail twice,4,oauth|scripting|authentication|signing,0.3689745366573334
,2017-11-11 05:01:06.61 UTC,49,47234527,datastor current user particip list event read write cascad troubl get work properli firebas consol test rule work test consol data actual show unless global read:auth !=null rule tri rule attempt scratch head day issu help appreci,0.061224489795918366,3,firebase firebase-realtime-database firebase-security javascript,firebas databas secur rule limit read write particip,2,security|scripting,0.36866047978401184
work place databas part createuserwithemailandpassword part createuserwithemailandpassword work perfectli thought,2018-01-09 05:51:30.183 UTC,60,48162144,tri store signup user detail respect email authent ids web applic detail store previou signup user authent ids tri much alway show pleas give solut store correct user authent id think fault get authent id firestor signup.html page,0.21666666666666667,13,authentication firebase-authentication google-cloud-firestore html javascript,current user authent id firebas web applic,4,authentication|scripting|signing|password,0.3686515986919403
array string valu actual one string valu replac,2019-10-27 10:26:46,44,58578503,error messag firebas warn use unspecifi index data download filter client consid ad .indexon author /question secur rule better perform firebas rule firebas data code,0.09090909090909091,4,firebase firebase-realtime-database firebase-security javascript,firebas index defin even use .indexon correctli,3,security|scripting|authorise,0.36835795640945435
authent implement project let say want authent user email password someth authent user code upload file read user authent implement googl auth facebook auth github auth twitter auth phone number custom email login,2018-05-15 10:49:48.643 UTC,96,50348328,follow code firebas storag rule section basic allow read/writ oper folder folder path one understand javascript code upload file storag databas code follow abl upload file folder nurs storag databas want allow authent user write/read upload/download file refer rule code look follow guess kind javascript code need upload/download file authent user pleas help,0.13541666666666666,13,firebase firebase-security-rules firebase-storage javascript,firebas storag allow write/read authent user,5,security|scripting|authentication|password|login,0.3677895963191986
send http respons indic end execut run function need wait complet respond,2019-07-14 13:26:29.267 UTC,66,57027841,current firestor rule project collect author user run perfectli addit creation delet etc document collect non authent user jqueri post request client.j ad data use server index.j cloud firestor section data present firestor rule wrong somewher ? client.j index.j server send back code creat doc collect,0.06060606060606061,4,firebase firebase-security-rules google-cloud-firestore javascript,problem ad data admin.firestor,4,security|scripting|authorise|authentication,0.36751502752304077
user new page listen shown block typic redirect back login page sinc firebas authent automat refresh short-liv id token code dashboard page mean user safe bookmark dashboard page url return later,2019-08-28 12:58:12.667 UTC,76,57692998,sign email password use firebas authent page redirect user dashboard user credntial dashboard page redirect data store cloud firestor use given command :- want store detail index user uid databaseand display user dashboard,0.11842105263157894,9,firebase firebase-authentication javascript,firebas authent user data page redirect anoth page dashboard,6,authentication|scripting|signing|password|login|safe,0.36732518672943115
none,2020-04-15 03:00:24,43,61220633,current follow problem . try give permiss delet possibl give insuffici permiss understand read without problem elimin receiv error messag . tried. rule appli let read let delete? wrong? error alway receiv,0.046511627906976744,2,javascript firebase google-cloud-firestore firebase-security,problem give permiss delet firestor rule,2,scripting|security,0.3670670688152313
base facebookauthprovider.credenti signatur need oauth token / accesstoken creat credenti extract accesstoken user log exampl extract https://firebase.google.com/docs/auth/web/facebook-login find info want reauthent facebook user simpli assum use sign user facebook,2019-02-25 19:46:23.94 UTC,59,54873601,tri write function reauthent firebas user log facebook account email creat credenti email password facebook password store user tri find doc find,0.2711864406779661,16,firebase firebase-authentication javascript,firebas reauthenticateandretrievedatawithcredenti facebook user credenti,8,authentication|scripting|credential|password|signing|signature|oauth|login,0.3664826452732086
need login firebas consol enabl sign-in method see point 3 begin section authent document enabl email/password sign-in firebas consol open auth section sign method tab enabl email/password sign-in method click save try - work enabl,2018-04-16 23:47:06.553 UTC,81,49867777,tri simpl email/password authent work test tri creat user work click button pass hard-cod email/password var auth consol error far understand abl client-sid without server firebas email/password authent enabl firebas consol though check googl ident toolkit api enabl,0.2222222222222222,18,authentication client firebase firebase-authentication javascript,firebas createuserwithemailandpassword work,6,authentication|scripting|password|login|signing|open auth,0.3657234013080597
possibl token outdat ie custom claim id token issu token lifetim 1 hour next refresh token pick latest claim forc refresh custom claim call,2018-06-11 22:09:53.987 UTC,95,50806735,admincont node firebas databas read/writ access user admin true custom claim follow code show one test user admin true claim one test user problem seem set claim correctli rule test user one admin claim one without abl read write admincont test simul rule firebas consol uid two user none permiss data structur follow anyth wrong rules? simul real scenario differ,0.031578947368421054,3,firebase firebase-authentication firebase-realtime-database firebase-security-rules javascript,firebas rule - restrict access admin,3,authentication|security|scripting,0.3639756143093109
bit late parti well answer anyon looking.th current method assign role user firebas custom claim mint jwt add custom claim point firebas function server see document,2016-11-03 08:34:23.717 UTC,55,40396897,quit understand user differ right rule user link screen user realtim databas firebas script understand test javascript...i make applic vue.j thank,0.10909090909090909,6,firebase firebase-authentication firebase-security javascript,add user role firebas,4,authentication|security|scripting|signing,0.36327266693115234
success registr offici passport document note middlewar invok automat function primarili use user sign invok automat log newli regist user sampl registr code look read req.login offici passport documents hope help creat token success registr send back registr respons,2019-03-29 17:21:40.02 UTC,54,55422593,directli authent user signup.below deatail serializeus deserializeus,0.14814814814814814,8,javascript node.js passport.js,directli authenticatelogin success signup node.j,4,scripting|authentication|login|signing,0.3620182275772095
sinc firebas v3.0 method avail anymor need reset user password custom email action handler https://firebase.google.com/docs/auth/custom-email-handl follow user manag action requir user complet action use email action handler reset password recommend read document start realli quick reset user password edit need reset password updat method import user password user must sign recent see re-authent user inform https://firebase.google.com/docs/auth/web/manage-users#set_a_users_password hope help,2016-09-13 10:01:50.857 UTC,104,39467262,use firebas ver 3.2.1 react nativ ios project read log version 2.4.2 method name changepassword use chang user password look doc firebas ver 3.2.1 find method name changepassword wonder changepassword method use firebas version 3 anymore? thank,0.15384615384615385,16,firebase firebase-authentication javascript react-native,changepassword method firebas version 3,5,authentication|scripting|password|availability|signing,0.3616335093975067
accord document hash valu secur rule one hash algorithm describ work read work relea note new hash hashing-adjac method exampl previou version email firestor hash sha-256 abl compar email plaintext email sent auth object altern field document user store novella want shorter identifi long string string treat utf-8-encod byte return valu byte type,2020-02-18 15:56:48,89,60284859,user login fireba first timeu encrypt creat collect document id firestor user want write mention encrypt encrypt decrypt ? hash sha256 decod sha256 client side ?,0.24719101123595505,22,javascript firebase google-cloud-firestore firebase-security,decrypt encrypt uid firestor secur rule,9,scripting|security|crypt|encrypt|login|hash|sha|decode|encode,0.36105743050575256
need someth,2018-04-23 10:38:55.183 UTC,25,49979044,function log facebook method firebas react nativ need user data login usernam phone email data,0.2,5,firebase firebase-authentication javascript react-native reactjs,data login facebook,4,authentication|scripting|login|username,0.3608100712299347
,2016-11-29 20:51:47.167 UTC,101,40875552,issu figur implement function current task try explain situat simpli app angular 2 webapp use firebas authent app load user automat authent anonym sinc databas file storag rule auth != null later app featur user authent auth provid googl try sign googl say user alreadi sign sign try authent googl user close auth popup box deni give app permissions? user authent all! re-authent anonym googl sign-in fail complet differ usernam creat uid weird ux user perhap think correctli see good solut tri hope someon els find better solut thank,0.1485148514851485,15,angular authentication firebase firebase-authentication javascript,firebas authent issu juggl anonym authprovid account,4,authentication|scripting|signing|username,0.36063215136528015
,2018-07-02 13:31:11.917 UTC,59,51137412,need give anonym user abil updat specif valu insid nest architectur without give permiss rest document top level collect updat document tri solut mention fail halv fail independ missing? updat one field go insid nest object? super help abl console.log note ideal allow modif deepest properti current user insid,0.05084745762711865,3,firebase-security firebase-security-rules google-cloud-firestore javascript,allow specif nest valu updat firestor,2,security|scripting,0.36000385880470276
