answers,creation_date,len,postid,question,ratio,raw,tags,title,uniq,words,probability
propos still race condit mallori creat link want follow link mallori replac link regular file test pass link mallori replac regular file link fix non- case call open file descriptor well path ensur member howev work use - time discov decept late - mallori alreadi induc truncat one import file believ tradit elimin hole without support creat temporari directori mode error retri fail due exist directori creat new file within temporari directori atom move temporari file target name remov temporari directori,2010-05-26 22:48:03.303 UTC,136,2917395,safe abl simul system support somewhat achiev ask introduc race condit possibl secur problem thought mayb creat dummi file user abl write kind ing check use finish write correct file mode bit overlook someth major e.g file exist regular file alreadi symbol link think,0.04411764705882353,6,c posix-api race-condition security symlink,good simul o_nofollow system without flag,4,security|safe|race condition|scripting,0.5665623545646667
linear attack attack take advantag certain code flaw code end incorrect charact enter attack determin mani correct charact enter work tutor see sinc flag everi time incorrect 5 7 incorrect flag 5 time attempt run faster 7 time attack tri everi possibl solut first charact insert standard charact remain portion string attempt correct first charact run slightli faster appli logic charact eventu obtain serial number,2015-11-04 23:52:51.933 UTC,86,33534321,understand linear attack perform want clariti code allow sinc termin iter count string enter equal greater 8,0.08139534883720931,7,c security,linear attack,2,security|attack,0.5656424164772034
run servic imperson user within servic servic must grant imperson privilev servic account grant default imperson caller probabl imperson deleg go machin easili seem realli funki dll! sound job servic rather dll go allow user account remov data put privileg account simpli acl object allow delet operation? said actual tri do? user account gener abl remov data put admininstrt account! backup restor privileg togeth provid full access file full stop avail localsystem must open file file_flag_backup_semant win32 api design use pass flag kernel although case createfil open directori instead kernel directori anoth kind file realli need abl access everyth say enabl privileg scan ops succeed regardless caller secur unimperson one outstand issu file lock open share access around user mode without kill process own resourc probabl overkil mainstream scanner know implement function kernel mode filesystem filter driver think audit want audit entri show localsystem user associ call process,2010-03-17 16:48:26.14 UTC,237,2464158,maintain dll lot system-rel thing travers file system registri etc caller dll use imperson order better support possibl scenario tri modifi smarter exampl delet file current call deletefil fail end come follow first tri caller fail access deni temporarili enabl privileg caller token tri fail access deni caller imperson temporarili unimperson tri fail access deni temporarili enabl privileg process token tri think handl pretti much situat wonder better achiev this? lot oper potenti want method i.e pretti much oper access secur object,0.06751054852320675,16,c security windows,temporarili imperson enabl privileg,7,security|privilege|delegation|user account|availability|signing|audit,0.5646056532859802
c program wild deal unexpect function result malloc often? fairli recurr problem? deal problem often usual try read junk data usual problem data need initi anyway real danger lie unintenti read junk/zero data cannot rule use way ensur program read junk data easiest execut test suit report read junk data catch use-after-fre error access unalloc memori lost memori block etc much perform penalti realli everi time instead ? precis overhead write write data twice remov valuabl data cach realli depend big memori block sequenc oper afterward fill sensibl data worst case zero evict data cach need fill memori block data need reload memori main part perform impact memori block order megabyt amount impact order 100 microsecond detail depend machin best case fill small memori block right alloc without read data case overhead simpli write data first level cach even though fast oper still expect zero take time initi - cach infinit fast peson conveni zero initi block need zero initi block usual case happen time time,2014-08-22 19:35:08.16 UTC,252,25454358,accord linux man page differ initi memori initi memori mean practic creat struct creat seem realli valu point memori initi know must equal reason presum exist case write entir memori space alloc immedi realli care first save extra step zero data overwritten anyway seem though program secur stabil point view use except rather rule easili lead undefin behavior two question c program wild deal unexpect function result often? fairli recurr problem? much perform penalti realli everi time instead,0.015873015873015872,4,c memory-management performance security,security/perform implic malloc calloc,2,security|danger,0.563713550567627
idea try begin turn termin non-echo mode user input show termio set start variabl counter creat loop read function getchar everi singl input.next check input right write termin * noth help http://www.askdavetaylor.com/how_to_read_password_without_echoing_c.html use c featur make password input prompt limit number charact set prompt input password save variabl usual linux command line substitut charact display input password command offer option still good approxim look,2012-07-30 06:42:48.35 UTC,107,11716481,possibl duplic hide password input termin pleas give solut password program linux use c languag enter first letter password window show instead enter letter enter next charact window show 8 charact verifi password thank,0.09345794392523364,10,c linux passwords,password program ubuntu use c langaug,1,password,0.5621340274810791
oper system leak content memori process especi differ privileg broken secur point view chang anyth especi sinc oper system memori page write point taken away swap given someon els safe say need worri normal termin unless oper system special anyon leak memori certain way kill process without abil catch kill signal handl case anyway come abnorm termin sigsegv etc best bet either disabl dump core least make sure core dump readabl main worri physic memori leak core dump readabl someon els said still good practic wipe secret memori soon need anymor leak other normal oper leak bug exploit bug mayb stray pointer write log mayb leav key stack forget initi data etc main worri wipe secret memori exit actual identifi point code need secret anymor wipe right unfortun use mention enough mani compil today smart enough understand call dead store optim away stack buffer leav function see issu libressl discuss implement current best known attempt work around clang gcc,2015-07-15 10:34:31.21 UTC,227,31428019,suppos program decrypt file store decrypt content heap want protect inform non-root process run system call releas heap alloc use overwrit data make unavail next process use physic memori understand concern system prefer err side safeti howev sure case program termin normal either forc termin etc due error condit etc trap mani signal possibl clear heap exit orderli thing,0.08370044052863436,19,c memory security unix,protect heap data program halt,10,security|protect|crypt|availability|safe|signing|leak|privilege|exploit|forge,0.5609790682792664
,2014-11-25 13:59:39.26 UTC,33,27128700,mount function problem except write file partit read em permiss read_onli know mountflag someth fix problem? tri mountflag ms_rdonlyand opposit one ~ms_rdonli work thank,0.06060606060606061,2,c cryptography mount permissions,mount2 write permiss encrypt partit,2,crypt|encrypt,0.5598942637443542
java safer pointer arithmet bound check normal allow one access arbitrari chunk memori see sun.misc.unsaf ! howev similar problem aris principl one read write byte array bytebuff etc accord offset provid untrust client problem much reduc one attack data within bound array similar contain rather data arbitrari adjac object even one typic uh safe one tend alloc access specif performance-crit object rather entir applic includ encrypt key password etc fundament problem trust user input happen languag whole varieti context e.g sql inject,2014-04-08 18:31:21.367 UTC,141,22945406,recent librari openssl reveal seriou flaw enabl attack read 64kb memori http://blog.existentialize.com/diagnosis-of-the-openssl-heartbleed-bug.html caus seem due memcpi cross check size input provid attack assum standard librari call c java immun type secur flaws? specif type secur flaw refer trust user input specif bound memori access,0.1347517730496454,19,c heartbleed-bug java security,standard java immun memcpi secur flaw recent open ssl heartbeat flaw,10,security|ssl|openssl|attack|trust|safe|unsafe|encrypt|password|sql injection,0.5594915747642517
rust prevent someth rust rare raw pointer directli prefer conveni safer 0-cost wrapper slice fact raw-point arithmet rare even oper method slice guarant point valid memori awar size assum develop becom rust index oper bound check default panick indic bound prevent invalid read follow rest c code cour assum develop safe rust deem branch import enough deserv extra optim requir eg call notic assumed!? compil optim bound check kind problem exist rust c rust safe default,2020-03-02 09:48:42,109,60486202,https://www.qualys.com/2020/02/24/cve-2020-8794/lpe-rce-opensmtpd-default-install.txt lpe rce opensmtpd default instal cve-2020-8794 afaik read longer post base out-of-bound read big question code written rust c rust prevent out-of-bound read? thank,0.08256880733944955,9,c security rust openbsd opensmtpd,cve-2020-8794 logic issu,4,security|cve|safe|validate,0.5594485402107239
think got happen comment code node invalid still point rather danger uncom code right one forget test,2014-08-06 23:09:31.823 UTC,50,25171771,function assign oper assign pointer temp *todel assign content one one work node structur int type member along self-referenti pointer,0.14,7,c pointers,delet node singli link list pointer node given assign pointer work,4,signing|validate|danger|forge,0.558250367641449
modern viru scanner look unusu program program someth anyth make unusu add code viru scanner look kind pattern bahaviour thing code import thing sign softwar less detect fal posit submit exact .ex virustot sign unsign sign version triggerd 2 hit unsign version triggerd 16 hit care much write profess softwar definit sign .ex .dll file ship sign give guarant c++ sourc code compil visual studio 2019 16.4.3 relea mode configur properties->c/c++->runtim librari multi-thread /mt configur properties->general->platform toolset visual studio 2019 v142 configur properties->general->window sdk version 10.0.17134.0,2020-02-21 14:04:29,135,60340213,visual studio make new empti project give .c file put compil x86 optim virustot flag trojan cau this? fix it? malwarebyt scan comput nasti stuff find anyth unexpected. noth shown detect comput memori relat virustot flag 32 bit version program malwar,0.13333333333333333,18,c antivirus,cau virustot flag empti program trojan,5,antivirus|virus|trojan|malware|signing,0.5556250214576721
,2019-03-27 12:58:36.443 UTC,128,55377806,pre one similar question differ hash algorithm chang array size answer question head post 2016 problem perform buffer overflow attack program get input password hash sha1 compar correct hash scanf limit thing know alreadi -nul byte \x00 accept scanf -if feed 20 charact input null termin overwrit first correct hash valu -if feed 37 charact inputscanf limit overwrit first 17 byte correct hash 18th null termin tri write python brute forc script find hash match last 3 byte understand 18th byte 20 byte null termin correct hash compar it? tri work = 00a450 last 3 byte represent string code c program python script hard time understand nul byte overridden byte string termin correct hash valu compar,0.125,16,buffer-overflow c scanf sha1,approach buffer overflow problem limit string scanf hash,6,buffer-overflow|buffer overflow|hash|attack|password|scripting,0.5543375611305237
,2019-08-09 11:31:48.73 UTC,72,57429160,base question answer can&#39;t instruct pointer directly? alway thought cannot chang eip rip process anoth process read sourc code metasploit framework https://github.com/rapid7/metasploit-framework/blob/master/data/templates/src/pe/dll/template.c line 66 68 set eip rip child process thought cannot even chang ip process let alon anoth process miss someth here? allow chang ip process process not? limit process chang t? chang process ip use someth ctx.rip even anoth process child,0.041666666666666664,3,c security x86,chang instruct pointer regist child process,2,security|metasploit,0.5523167252540588
one run command captur output read string output perhap use put new string environ use p.s step 2 add step 2a strip trail,2019-09-04 14:47:34,71,57790909,c program environment variabl via howev setenv allow setup environment variabl via string current environ setup bash profile. decryptpassword java execut jar file accept encrypt password print decrypt password want someth similar c program pass encrypt password via string decrypt,0.14084507042253522,10,c environment-variables,set environment variabl c via assign,4,signing|crypt|password|encrypt,0.5512087941169739
noth stop hackers!!!your question search needl hay.assembl larg room responses.y thing hrder noth never stop bad person upx well known dont it!!! make thing complet secur make harder pack upx add level complex hacker check runtim run debugg sever place run virtual machin encrypt dll use load manual complic write loader check hash applic applic check hash loader system time compar system time alreadi wrote disk see monotonic.al depend level protect want go piratebay torrent site see everyth hack hacker interest one make realli difficult expiri main theme trick make expir date independ system time make depend hour pass irrespect whatev system time creat separ thread perform task suppos want applic expir 70 hour creat binari file call record store number hard guess tell latter put number binari file applic start check number present yes applic current time store file along hour=1 replac alreadi present number thread creat keep check hour system time chang chang store current time file along hour=2 time come hour=70 add code two place insid thread start applicaiton ever hour=70 applic work earlier told keep number binari file ever run applic binari file read number found applic replac current time hour=1 suppos applic 5 hour close run time applic run check binari file number replac time store previous hour=5 mean store current time along hour=stor hour file +1 even chang time anyth els effect expir period expir check base system time base hour pass irrespect whatev time absenc number indic file access first time current present hour file increment binari file client see number one last thingyour binari file format another_secret_numb place even chang binari abl put another_secret_numb know mean read binari file make sure end entri binari file contain another_secret_numb end check purpos hidden number hard code code sure see read binari know hope help,2013-12-19 18:24:14.677 UTC,498,20688977,write simpl applic semi-trust client say certain specif client must given copi binari make proprietari code extern librari window applic run separ window 7 laptop inform applic serv purpos delet know perfect solut implement expiri date program hinder effort potenti revers engin code least prevent content expos easili first step static link everyth contain one binari need piec includ final binari interfac longer publish second want implement sort mechan naiv anyth window secur call trick chang time system tray bios? thirdli secur call modifi ntp queri trust time server fail time trial period elaps fool mess dns gateway unless sort certif mechan place verifi time server know much though need suggest implement next alter binari impract individu attempt revers engin view assembl code? mayb sort wrapper encrypt binari requir third-parti authent tool? mayb sort certif creat requir run expir later? final softwar ie packag publish softwar either repack final sort plugin microsoft visual studio? thank advanc edit meant bullet proof system fail accept want make inconveni non-techn person attempt crack peopl use technic luddit softwar crack hire someon sinc name compani name watermark applic one person benefit unlik redistribut,0.040160642570281124,20,c c++ security windows,disabl applic expiri date trial,9,security|trust|certificate|encrypt|authentication|crack|hack|hash|protect,0.5510477423667908
exampl provid quit valid compil optim variabl set oper detect side effect valu longer use code use share buffer access multipl locat work fine almost differ processor differ cach polici memori barrier ensur data zero reach memori chip cach worri hardwar level detail make sure compil optim oper suffici exampl memset block releas execut want ensur data remov hardwar item need check data cach implement platform appropri code forc cach flush non-trivi multi-cor machin,2015-02-12 17:16:18.277 UTC,104,28483713,read question curiou one c receiv inform anoth program probabl assum memori writabl found state regular memset mayb optim comment state memset wrong,0.028846153846153848,3,c memset security,eras sensit inform memori,3,security|sensitive information|validate,0.550693154335022
think someth done build set level howev appli sort memori scrub zero memori pointer string @artal say use write memori posit found framework ima secur memori use handl ima secur memori framework provid tool secur clear valid memori region individu variabl allow object data section overwritten memori either encrypt version null byte method use clear memori posit,2015-05-29 21:10:56.18 UTC,162,30539141,research iphon manag heap stack difficult find good sourc inform tri trace password kept memori even dealloc far tell iphon clear memori content write zero garbag releas count arc go 0 string password live memori memori posit overridden debug option xcode debug memori problem fill dealloc memori enabling/dis option disabl zombi memori dump simul use check content replac memori wonder someth done appl store build fill dealloc memori garbag data assumpt iphon default correct better option handl sensit data memori clear use mutabl data maybe? write memori posit,0.05555555555555555,9,c ios iphone objective-c security,iphon memori manag dealloc password malloc scribbl production? fill zero dealloc memori,4,security|password|validate|encrypt,0.5443288683891296
version function posix function avail nearli everi system use want alloc new memori alreadi buffer want better known big buffer string fit know string fit copi given number charact limit copi amount buffer size besid lot sting librari manag string size differ way sinc tag c++ memori manag give problem understand correctli real question api function made secur one reason reason c librari legaci late chang main reason howev librari design minimalist bare minimum user respons ensur call correctli excess check price paid everi time call even user assur reason problem go occur common mani api said enough librari provid safer altern part standard librari mani peopl higher level stuff work c++ standard class librari mani thing actual microsoft provid secur altern crt function everybodi know hate though disabl warn old function want someth secur mayb c++ either stl string someth qt well go platform .net java usual suffer problem app crash inject code app buffer overflow edit:with data execut prevent / nx enabl default vista .net problem tradit platform well l strlcpi strlcat function openbsd usual better n function faster easier secur nonstandard howev bsd licens includ known good implement program cross platform secur window care portabl *_s function mayb find use read answer question,2009-01-27 11:12:50.09 UTC,289,483018,"recent finish univers cours c therefor lack experi cours univers tend teach student secur program least element even video taken c copi string requir - far know - strcpi string.h function secur every-day programming? function handl alloc prevent buffer overflows? cert secur code standard c offer exampl compliant solut altern taken 2nd exampl far challeng code work one chang librari itself? least one provid secur altern librari function handl right way? thank reading,wishi",0.0657439446366782,19,buffer-overflow c security,secur c univers - train buffer overflow,7,buffer-overflow|security|buffer overflow|availability|signing|safe|inject,0.5415080785751343
opinion must-read cryptographi c c++ - http://www.amazon.com/cryptography-c-michael-welschenbach/dp/1590595025/ secur program cookbook c c++ recip cryptographi authent input valid &amp - http://www.amazon.com/secure-programming-cookbook-cryptography-authentication/dp/0596003943/ cryptographi engin design principl practic applic - http://www.amazon.com/cryptography-engineering-principles-practical-applications/dp/0470474246/ secur metric replac fear uncertainti doubt - http://www.amazon.com/security-metrics-replacing-uncertainty-doubt/dp/0321349989/ secur engin guid build depend distribut system - http://www.amazon.com/security-engineering-building-dependable-distributed/dp/0470068523/ high-level manag issu etc follow book deserv honor mention although mani expert repudi day howev say best book subject judg appli cryptographi protocol algorithm sourc code c second edit - http://www.amazon.com/applied-cryptography-protocols-algorithms-source/dp/0471117099,2011-10-14 18:57:08.42 UTC,128,7772264,book realli must read person attempt creat critic part applic secur field e.g driver deal coding/decod firewal kernel subsystem reli check rights/polici secur mail client etc specif book cover appli c program topic field this? design/writ secur code common attack program must resist,0.21875,28,c security,must read book program cryptographi c applic,9,security|crypt|decode|firewall|signing|attack|authentication|validate|repudiation,0.5410997867584229
initi element group g1 contain element gt serial form incompat differ group differ size extens field initi element gt work,2016-03-27 13:09:56.637 UTC,57,36247701,freshman pbc librari troubl odd problem insid librari cannot element byte buffer contain element code use ubuntu 14.04 x64 version pbc librari 0.5.14 file a.param copi uncompress pbc folder,0.03508771929824561,2,c cryptography encryption,import export element pbc librari,2,crypt|encrypt,0.5408202409744263
password file alreadi hash calcul hash instead read password text simpli compar,2017-12-30 10:58:16.95 UTC,104,48033270,2 file shadow.txt mytab2411.txt shadow.txt contain password hash mytab2411.txt password lookup file contain password correspond hash want mytab2411.txt find password shadow.txt compar hash shadow.txt mytab2411.txt 2 problem know obtain password text mytab2411.txt output instead desir output user id pyc 1 -password found user id pyc 2 -password found user id pyc 3 -password found user id pyc 4 -password found user id pyc 5 -password found user id pyc 6 -password found shadow.txt mytab2411.txt shorten version sinc 200k line desir output main code,0.19230769230769232,20,c hash passwords strcmp substring,compar substr 2 file,2,hash|password,0.5406653881072998
,2014-06-29 18:28:57.327 UTC,102,24478957,linux/android process kill os kernel de-alloc memori stack heap etc associ process &amp put back memori pool clear ram i.e valu still visibl ram dump taken ?? pleas let know clear zero memori associ process killed? know mm_struct structur sched.h hold memori relat info process need manual go &amp reset param struct ensur process memori cleared? pleas guid call clear function anoth simpler clear memory? pleas let know.. [updat comment:] tri ensur one steal data page dump process kill fine user space kernel space solut,0.0196078431372549,2,android c linux memory security,clear zero memori region stack heap etc process kill linux/android - kernel,2,security|steal,0.539070188999176
...but string present file expect ? yes expect string liter save execut see tham exampl gnu print printabl charact sequenc least 4 charact long. see hide string exe dll? even hide string - even encrypt - execut reassembl decrypt string give execut peopl want know authent strings? go work book bank data put rubber band around keep everyon read give book out? well hardcod authent string - even obfusc encrypt provid tool produc actual string use,2015-04-10 05:11:34.427 UTC,140,29553859,gcc ubuntu compil c program string valu want end user know string use authent passcod file path / passcod etc compil program object file string valu readabl text format machin readabl charact string present file expect ? tell compil print valu plain text thought string encrypt within program look engin,0.06428571428571428,9,c gcc object security string,c object code file show string valu plain text,5,security|authentication|encrypt|crypt|obfuscate,0.5383415818214417
