answers,creation_date,len,postid,question,ratio,raw,tags,title,uniq,words,probability
"tri solut accept work knew gdb ad environ variabl reason stack address match even remov variabl work exploit without gdb tri script post accept solut search web found script work https://github.com/hellman/fixenv/blob/master/r.sh basic script accept solut r.sh gdb ./program [args] run program gdb r.sh ./program [args] run program without gdb script work address stack frame pointer run code gdb differ run normal corrupt return address right gdb mode right run normal mode main reason environ variabl differ among two situat demo chang victim code print address buffer chang return address offset+address buffer realiti however,y need guess return address add nop sled malici code guess multipl time correct address guess incorrect hope help cento 6.4 32 bit tri caus buffer overflow program. howev run program stack seg fault ensur fortify_sourc affect result seg fault sound fortify_sourc issu fortify_sourc insert safer function call guard type buffer overflow compil deduc destin buffer size size check call violat i.e seg fault turn fortify_sourc test compil straightforward run program ident stack termin first make sure program compil without stack protect aslr disabl note default valu machin 2 note chang run program termin gdb respect within make sure note got environ variabl play around test program two run give ident pointer top stack need remot script shenanigan tri exploit binari host remot one main thing gdb doesnt happen outsid gdb zero memori like somewher code initi memori get garbag valu gdb automat clear memori alloc hide type error exampl follow work gdb outsid try run program valgrind see detect issu reason buffer overflow work gdb segfault otherwis gdb disabl address space layout random believ turn default gdb version 7 check run command exploit develop lead seriou headach adequ account factor introduc non-determin debug process particular stack address debugg match address normal execut artifact occur oper system loader place environ variabl program argument begin stack sinc vulner program take argument environ variabl like culprit mare sure invoc shell debugg end wrap invoc debugg exampl two environ variabl gdb disabl return empti list point start debug process find absolut stack address envis jump e.g hardcod exploit one subtl import detail differ call sinc hold program exactli invok need ensur equal invoc string use exampl learn exploit memori safeti vulner recommend wrapper program heavi lift ensur equal stack offset script",2013-07-21 17:55:38.63 UTC,409,17775186,cento 6.4 32 bit tri caus buffer overflow program within gdb work output howev run program stack seg fault,0.06356968215158924,26,buffer-overflow c fortify-source memory-safety security,buffer overflow work gdb without,10,buffer-overflow|safe|security|buffer overflow|exploit|scripting|malicious|violate|protect|vulnerability,0.9973613619804382
short answer yes comput virtual memori keep data code separ much harder write catastroph bug hardwar except os translat someth softer bug run overwrit execut code runaway code start execut random op code data segment bug still cours need fix whole lot less mysteri nearli disastr comput secur featur requir care test programm crash whole system still quit possibl mostli bug os api occasion blue screen death window still thing effort lag whole comput use 100% cpu alloc excess amount heap memori turn next useless realm accident certainli gotten easier ms-do day rememb bug corrupt in-memori disk cach lucki anyth left one unless write c code run insid kernel possibl anymor crash os gener unless activ tri exploit flaw variou thing nx bit attempt erect bit secur fenc around c program make program crash faster place closer error realli happen anywher near level win got simpl separ address space design make activ attempt exploit thing much difficult far better catch accid mistak corrupt login environ distinct os whole gener statist like though program sophist file manipul bug mess user file short actual crash os accident caus resourc exhaust often recov uncomfort go system slow crawl even abl launch process linux protect put develop environ cgroup prevent complet cours anyth activ exploit mistak talk statist likelihood thing accid probabl biggest improv sinc separ address space tool valgrind monitor program on-the-fli out-of-bound acess access freed memori ms-do earli window rather weird gener purpos comput high-qual c develop environ promiscu memori taken window long time outgrow program practic platform still littl weird,2017-06-12 13:54:40.57 UTC,419,44501212,understand past c screw pointer memori alloc potenti accident corrupt run program oper system outsid program crash system requir restart pick piec continu program develop system secur improv stop happening? past msdo window 3.1/95/98/me maco prior version 10 gener preemptiv multitask becam norm everyth system secur gener exist program full control write data anywher time modern system design process secur program gener block system secur accident intent damag anyth els execute-dis featur modern processor help prevent accident jump random memori locat run whatev processor machin code badli screw modern program c without attempt hack oper system security? still manag accident crash whole system? assum longer possibl kernel system secur step halt action corrupt login environ log back again? assum prevent process normal access process memori space even within login secur environ gener seem program c much easier past due system protect use everywher keep shoot system foot,0.05250596658711217,22,c crash environment security,program c gotten easier oper system secur execut disabl,6,security|signing|hack|login|protect|exploit,0.9973346590995789
problem forgot zero top bit zero alreadi perform syscal someth els simpl debug point solut trivial insert furthermor sinc append return address exploit string longer zero termin easi fix store zero runtim use exampl clear full exploit look initi part correspond note due code size chang offset end chang well number instruct code return address adjust system work fine,2015-07-28 00:07:59.007 UTC,374,31665401,note alreadi ask question stackoverflow portugues languag https://pt.stackoverflow.com/questions/76571/seguran%c3%a7a-syscall-dentro-de-shellcode-n%c3%a3o-executa seem realli hard question question translat question portugues studi inform secur perform experi tri exploit classic case buffer overflow succeed creation shellcod inject insid vulner program execut problem syscal shell work detail code vulner program compil ubuntu 15.04 x88-64 follow gcc flag -fno-stack-protector -z execstack -g aslr turn small assembl program spawn shell exit note code work independ assembl link run code alon work output objdump -d -m intel program shellcod extract note languag output portugues command payload inject shellcod along need nop sleed return address overwrit origin return address far alreadi debug program shellcod inject care pay attent rip regist see execut goe wrong discov return address correctli overwritten execut jump shellcod execut goe alright e line assembl program syscal happen syscal simpli work even regist correctli syscal strang line rax rcx regist bit result execut goe non-condit jump push address shell infin loop start program crash segfault main problem syscal work note say /bin/sh string need null termin well seem necessari nasm seem put null byte implicitli assembl program work state rememb 64 bit shellcod shellcod work follow code wrong shellcode? edit 1 thank answer jester first problem solv additionali discov shellcod requir work alon new assembl code shellcod assembl link work inject anoth program payload will! why? run program alon try termin alreadi null termin string /bin/sh os seem initi setup even assembl program true inject shellcod real reason syscal succeed /bin/sh string null termin runtim work standalon program case null termin therefor shellcod run alright standalon program proof work exploit successfull. least gdb new problem exploit work insid gdb outsid outsid immedi search found question buffer overflow work gdb without initi thought matter unset two environ variabl discov new return address unset two variabl made minim differ second question exploit work insid gdb outsid,0.09090909090909091,34,assembly buffer-overflow c security shell,syscal insid shellcod run,9,buffer-overflow|security|shellcode|exploit|buffer overflow|inject|vulnerability|protect|forge,0.9971824288368225
code run text segment stack heap data storag organ code section execut immut wikipedia articl detail https://en.wikipedia.org/wiki/data_seg jump place execut segment run evil code. data storag memori bit bit instruct cpu execut kind protect provid os cannot done applic layer see wikipedia articl tell enabl window http://en.wikipedia.org/wiki/data_execution_prevent concret exampl arrang return address point next slot stack first argument regist pass-by-regist arch pointer string call return-ori program aka rop type exploit attack find make evil code differ piec program exploit find usabl byte sequenc instruct return instruct byte use oper regist memori move valu locat add valu compar valu etc etc micro subroutin exploit get built exploit code bug attack forc program start execut chain micro subroutin evil work good code turn evil code noth execut stack heap noteworthi cpu instruct span multipl byte variabl length even immedi instruct operand iow numer constant part instruct becom code chanc find usabl byte sequenc higher simpler cpu often possibl construct malici code chang memori protect exploit longer constrain exist applic code overflow overwrit return address function jump known address code os writer respond random address code execut on. understand question correctli none answer address answer execut occur code section neither stack heap typic page memori system code program file e.g .ex window load execut read-onli page addit writabl execut page alloc process stack heap suggest oper system hardwar cooper mark page writabl execut rgngl answer explain window even non-execut heap stack exploit still possibl return-ori program mention alexey frunz answer protect techniqu stymi even stack-smash protect address space layout random -- see http://en.wikipedia.org/wiki/return-to-libc_attack#protection_from_return-to-libc_attack,2012-07-14 07:33:52.163 UTC,297,11481926,read book buffer overflow suggest next deal make stack heap non-execut provid high degre protect mani type buffer overflow attack exist program understand - execut take place heap stack,0.07407407407407407,22,buffer-overflow c security,stack heap non-execut code run,7,buffer-overflow|security|buffer overflow|protect|attack|exploit|malicious,0.9963477849960327
end execut index -28 valid lead segfault.th code valid index less zero addit valid memori address revers run littl endian machin least signific byte store first within integ pointer goal code execut sinc execut uid level04 shell spawn uid level04 done run deprec function notic function call function select user input try creat memori locat make bounds-check mean malici provid must less 4 — negative! therefor goal becom find memori locat writabl write memori address assign someth start shell check address run program insid break notic local variabl address step 1 done need check next question write memori locat easi second argument function check address little-endian system address encod string string obtain shell use command last step make start shell assign actual call want ! easili work around link file name add directori file whole solut therefor note number bit differ run machin instead stripe segfault interpret address run ascii code 4 byte echo invalid address 1 fns[-28] point address buf 2 want execut function run 0x804875b 3 pass -28 argv[1] address run argv[2] 4 index get valu -28 5 argv[2] copi buf 6 call truncate_and_cal execut function run 7 run execut valu argument str valu buf 8 take valu buf symlink /bin/sh 9 put present directori path path=$pwd:$path - put $pwd first make sure present directori get look first 10now system execut run command look file name valu buf path 11 sinc alreadi symlink /bin/sh shell prompt,2012-02-24 11:31:00.027 UTC,300,9430017,tri stripe ctf contest know absolut noth secur look problem 3 got stuck still understand work goal hack access password file differ user use applic bit simplifi code applic solut found http://pastebin.com/vj4xpawq confus work run code someth ./level03 -28 segfault memori address revers printf function???? lost learn thank advanc,0.05,15,c memory security stack symlink,creat symlink memori address spoiler stripe ctf contest,8,security|ctf|hack|password|validate|signing|malicious|encode,0.9961051344871521
return address point code buffer often easier put shell code return address buffer simplest buffer overflow small fit shell code feasibl put shell code anoth buffer jump vulner buffer overflow protect data execut prevent nx prevent code execut stack case techniqu return-ori program use circumv dep techniqu involv use legitim execut code segment run code attack want tricki requir fiddl around payload usual start buffer address align case ensur return address correctli align mean write buffer multipl cpu word 4 byte 32-bit machin 8 byte 64-bit buffer word align attack experi ad remov byte time think reason simpler everyth one buffer much chang inject shell code jump newli modifi return address point attack unlik attack refer memori anoth process must look buffer process put shell code differ buffer requir attack understand long buffer stay place differ function call caus one buffer deallocated? one buffer heap instead stack? long singl buffer larg enough much simpler put nop sled shell code near start fill rest return address compar find one buffer popul shell code anoth popul address previou buffer shell code refer stack pointer mean need correctli,2013-05-28 10:02:37.66 UTC,276,16789241,code reffer found link code read buffer overflow exploit use buffer look someth | nop sled | shellcod | repeat return address | understand exploit happen buffer put onto stack function paramet overwrit function return address understand repeat return address point nop sled buffer stack understand follow return address point shellcod buffer? reapeat return address point anoth part memori nop sled shellcod found? return address buffer perfectli align origin one ret command read correct address read middl exampl,0.10869565217391304,30,buffer-overflow c exploit security x86,buffer overflow exploit - shellcod put return address,10,buffer-overflow|exploit|security|buffer overflow|shellcode|shell code|vulnerability|protect|attack|inject,0.9960530400276184
run multipl problem tri order local variabl stack necessarili order one code compil free rearrang wish compil often align data boundari faster execut mean space differ local variabl much bigger think uncommon see stack variabl align 8 16 byte boundari even content much smaller disassembl program debug give much better idea stack align program disclaim use ubuntu 14.04 gcc version 4.8.4 compli code thusli differ compil differ option gcc probabl give differ result modifi code slightli make easier find thing chang line 6 chang line 25 compil run execut gdb break point main disassembl main set disassembly-flavor intel first four line prolog import thing notic line set stack frame function see subtract 48 bytesfrom esp actual bit first align stack frameto 16-byte boundari look stack frame look valuesfor esp ebp find thing locat stack frame deduc stack layout memori imag taken run past program read command line argument string bbbbb recal ascii code b 0x42 easi see sequenc 0x42 byte note command line argument bbbbbbbb content stack frame notic content flag variabl remain unchang content overflown input buffer move toward top stack recal x86 stack grow downward lower memori address buffer grow upward buffer overflow write store eip stack system believ possibl overwrit variabl user input system lay thing differ stack need similar exercis verifi note locat variabl stack correl order declar sourc file,2017-11-15 00:13:54.29 UTC,281,47297399,made simpl c program try understand buffer overflow tri overflow input buffer flag get chang true program output got program assum password.txt hey stack someth guess think need give program 17 byte overwrit flag variabl gave aaaaaaaaaaaaaaaaa work give 23 time 23 byte 17 byte enough,0.017793594306049824,5,buffer c overflow security,c buffer overflow - mani byte input,3,security|buffer overflow|password,0.9959671497344971
abl modifi sampl code work 64-bit program book mani protect modern ose build tool must turn work obvious educ purpos reason first turn aslr system must done root work sinc appli command redirect first run next program must compil two import safeti protect disabl default program built stack canari detect buffer overflow non-execut stack sinc usual legitim reason run code stack exploit code problem narrow simpl return address overwrit nop sled requir addit shellcod origin post 32-bit 64-bit shellcod use http://shell-storm.org/shellcode/files/shellcode-806.php big question come from? start number larger 0x78 sinc know guess 175 sinc bigger target buffer first iter line try note test use non-setuid version facilit success core dump program crash creat core file run show good crash why? tri return control address good offset control string point return address? try chang core dump analyz show good control return address surgic want put instead bunch b s? search reason rang stack shellcod dword correspond first 4 byte shellcod buffer mask lower 3 digit start begin page shellcod exist stack desir return address updat code inform make setuid code provid work setup like probabl need follow similar path correct offset,2016-11-17 04:23:47.323 UTC,265,40646694,basic tri run buffer overflow attack base understand need 3 part nope sled shell code execut return address problem 64 bit linux return address someth 0x00007fffffffdcf2 strcpi null charact seen stop copi basic end endup someth look last 8 byte instead assum 43 garbag data start basic overcom buffer flow attack work 64 bit system strcpi function? code base book art exploit help greatli appreci,0.07169811320754717,19,c gdb linux security x86,buffer overflow 64 bit strcpi,8,security|buffer overflow|attack|shell code|exploit|protect|safe|shellcode,0.9959143400192261
reason unabl overrid stack regist use strcpi even though applic crash question relat manag trick use code rememb integ pretti sure includ return address store littl endian format mean least-signific byte come first therefor byte desir return address 0x00001eda look code karlphillip link insert two address byte end string strcpi function happili copi two byte end string stack happili add null termin charact \x00 therefor strcpi first 3 byte fake return address lucki mayb 4th byte alreadi \x00 4th byte correct return address \x00? expertis wrong function stop encount zero byte sinc address want write stack contain byte perhap accept someth similar one follow exampl disclaim due lack access os x 10.6 environ follow code develop test window 7 64-bit use gcc 4.5.2 mingw 32-bit reli gdb assist determin address locat return address stack frame explan gdb determin offset buffer return address provid exampl 1 code size buffer reduc order shorter input text overflow buffer output gcc -g -fno-stack-protector -o test test.c printf 1234567890abcdef\xc6\x13\x30 | ./test hacked! exampl 2 code atoi directli target return address realli good exampl buffer overflow howev good exercis locat modifi return address within stack frame output gcc -g -fno-stack-protector -o test test.c ./test 112 4013c6 hack,2011-03-25 07:27:48.403 UTC,243,5429672,tri buffer overflow work osx10.6 follow program need make foo execut overflow buffer compil as:- disassembl address exploit work intend probabl return address suppos overflow contain case target address buffer overflow exploit perform,0.053497942386831275,13,buffer-overflow c macos security,buffer overflow return address 00,7,buffer-overflow|security|buffer overflow|exploit|signing|protect|hack,0.9956390857696533
exampl quit easi understand realiti even know attacked_adress look ? right spectr meltdown possibl ready-to-us attack know address attack sourc spectr meltdown data even use browser virtual address offset physic address manag find import memori locat first place ? sure virtual address sinc happen user space program prior recent kernel patch full kernel space map user space process made speedup system call i.e privileg context switch process context switch syscal due design meltdown possibl read kernel space unprivileg user space applic exampl browser unpatch kernel gener easiest attack scenario target machin old kernel address random i.e kernel symbol place machin run specif kernel version basic run specif kernel test machin write import memori address run attack victim machin use address look specter-bas meltdown poc i.e 2-in-1 https://github.com/berestovskyy/spectre-meltdown much simpler easier understand origin code specr paper 99 line c includ comment use describ techniqu i.e linux 3.13 simpli tri read predefin address symbol locat kernel space run without privileg differ machin kernel 3.13 success read kernel space machin harmless tini work poc,2018-04-02 09:54:36.517 UTC,249,49609055,part learn project work bit spectr meltdown poc confort concept manag recov previous access data use clock timer wonder actual read physic memori point lead question lot spectr v1\v2 exampl read piec toy-cod exampl x supposedli equal attacked_adress - adress_of_array effect lead z get valu attacked_adress exampl quit easi understand realiti even know attacked_adress look ? virtual address offset physic address manag find import memori locat first place,0.05220883534136546,13,c kernel security segmentation-fault spectre,part physic memori access segfault,4,security|attack|privilege|signing,0.9955536127090454
cesarb note unix unset bit process umask complet access unset umask - temporarili ok assert fire pisto note creat file /tmp fraught process think file yet add o_excl prevent follow symlink unexpect place one final point - make file executable? think aim 666 permiss 777 766 certainli execut program other chang time owner execut permiss file other write member group probabl realli appreci generos either perhap deserv execut file - still nice umask 000 bit umask remov permiss chosen default umask usual 022 002 note thing default acl selinux label affect readabl writabl file getfacl see acl ls -z see selinux label selinux know polici activ effect presenc acl seen ls -l + charact permiss fwiw secur risk creat anyth /tmp /var/tmp etc fix name symlink setup /tmp name point anyth program destroy target file user run program permiss thing creat programmat /tmp given random name best directori unless whole system secur potenti malici user assum tri perform ipc concid use mean achiv use dbu som system design purpose? thing chmod file creat anyway safe kind file,2008-10-18 17:25:04.123 UTC,251,215302,"tri creat file /tmp directori work linux ubuntu 7.10 read/write/execut access user use openfilename,o_creat|o_rdwr,0777 function creat file c program user1 account user2 abl write specif file howev check /tmp directori ls -l see write access permiss user2 consid fact user1 creat write access user1 user2 consid other access.i tri mode 0766 open function combin 7 6 mode write access user2 still requir access",0.02390438247011952,6,c security unix,creat file unix /tmp directori user read write,4,security|malicious|signing|safe,0.9955143332481384
"smash stack fun profit best howto/faq subject see http://insecure.org/stf/smashstack.html snip actual shellcod first need program launch program program execut os form highli os language-specif second program launch program must read extern sourc buffer third must examin run program -- lay memori compil -- see input buffer variabl use step 1 launch program exist fourth must concoct input actual overrun buffer variabl part 1 2 program look someth c part 3 requir analysi look find probabl part 4 input fill write get properli ask size buffer scanf read string input hit whitespac user type 16 charact buffer overflow phrack smash stack fun profit enough explan enabl ask simpl exampl see protect buffer-overrun attack exampl attack http://www.greenend.org.uk/rjk/random-stack.html buffer overflow use make code someth intend write data outsid alloc buffer overwrit someth els overwritten data typic code anoth function simpl exampl overwrit variabl next buffer call function data buffer hold overwrit file name well dont know launch notpad.ex overwrit buffer simpli two separ thing code overflow buffer easi like end segment fault shown sprintfbuffer,01234567890123456789 mean put overwritten memori code execut oper system harder mere overflow buffer relat program execut usual grab next instruct execut stack manag put next valu stack valid instruct via overwrit memori without creat execut pointer corrupt kind corrupt creat exploit usual done put jump instruct next read valu stack section memori contain code mark section memori non execut help kind exploit",2009-08-20 15:07:03.12 UTC,251,1306823,heard much buffer overflow believ understand problem still see exampl say,0.055776892430278883,14,buffer-overflow c c++ security,give exampl buffer overflow,9,buffer-overflow|security|buffer overflow|insecure|shellcode|protect|attack|validate|exploit,0.995279848575592
