answers,creation_date,len,postid,question,ratio,raw,tags,title,uniq,words,probability
issu permiss write item array ask 64 char buffer system requir give least 64 byte normal system give -- case memori belong problem practic -- possibl even first byte array belong somebodi els happen overwrit it? somebodi els actual insid program mayb differ structur thread oper system probabl notic trampl data structur thread tell data trampl affect thing case alloc buffer stack mean 1 somebodi els fact current stack frame 2 anoth thread affect local variabl current stack frame malici attack figur function foo works? basic kind secur potenti problem code vulnerable? probabl best exampl bug easili exploit secur purpos although exploit potenti crash code simpli use string 64-charact longer certainli bug corrupt address immedi array stack singl zero byte easi hacker inject data corrupt area call printf function push paramet stack clear zero written array bound lead potenti untermin string pass printf howev without intim knowledg goe printf need exploit printf well foo hacker hard press anyth crash code fwiw good reason compil warn function respect buffer size includ termin null even copi string larger buffer line even necessari read shell coder handbook 2nd edit lot inform disclaim infer knowledg research taken gospel go overwrit part save frame pointer null byte - refer point call function offset memori access point call function memori oper go differ locat know locat want access wrong memori say anyth abl someth know realli infer this? smash stack fun profit aleph one quit old know window compil chang stack behav avoid problem start point example1.c understand program call function compil gcc use -s switch gener assembl code output $ gcc -s -o example1. example1.c look assembl languag output see call function translat push 3 argument function backward stack call function instruct call push instruct pointer ip onto stack call save ip return address ret first thing done function procedur prolog push ebp frame pointer onto stack copi current sp onto ebp make new fp pointer call save fp pointer sfp alloc space local variabl subtract size sp must rememb memori address multipl word size word case 4 byte 32 bit 5 byte buffer realli go take 8 byte 2 word memori 10 byte buffer go take 12 byte 3 word memori sp subtract 20 mind stack look function call space repres byte off-by-on error see line talk about? expert thing mayb overlook someth sinc thing ever written wrong byte zero think possibl quit limit attack control written like caus crash caus ton odd behavior specif applic see code inject vulner unless error caus app expos anoth vulner use vector actual attack take grain salt,2009-05-05 21:40:19.267 UTC,469,827016,code off-by-on error malici attack figur function foo works?bas kind secur potenti problem code vulnerable? person thought attack realli anyth case heard lot thing even limit work 1 byte,0.053304904051172705,25,c c++ security,off-by-on error string function c/c++ secur potenti,9,security|malicious|attack|vulnerability|exploit|hack|inject|shell code|salt,0.9190396666526794
correct take stack bare reli assumpt argument pass stack rather regist variad function probabl safe assumpt still assumpt implement detail ask next argument print hex actual occur next argument locat architectur compil depend compar valu process abl narrow number mean misunderstood paper text link assum current posit stack 0x08480110 look surround text dump data wherev stack happen begin format string mere print assum address stdout front dump data number modifi address data dump think paper provid exampl somewhat confus exampl string liter format string gener permit type vulner describ format string vulner describ depend format string provid user input exampl better present sinc array automat compil like put stack copi user input array look follow word stack assum littl endian compil put item stack see fit local variabl save regist whatev call made stack look note complet make entri - compil stack differ way format string vulner custom craft particular exact scenario word alway 5 dummi format specifi exampl - attack need figur mani dummi particular vulner need call argument address push stack call argument area stack look howev printf realli know anyth mani argument place stack - goe format specifi find format string one argument sure get format string argument start process get 1st %08x correspond save edi exampl next %08x print save ecx %08x format specifi eat data stack get back string attack abl input determin mani need someth attack kind trial error probabl test run whole slew %08x format see format string start anyway get process %s format specifi consum stack entri buffer resid %s specifi treat stack entri pointer string user put buffer care craft binari represent print whatev address asciiz string 6 format specifi 5 lot one provid valu format specifi immedi fall realm undefin behaviour - anyth happen wrong answer howev normal cours event valu pass store stack code read valu stack extra valu pass function return address stack guarante see valu 0x08480110 actual produc sort attack much depend specif program faulti function call well differ valu exampl code like written assum 32-bit intel little-endian cpu - rather 64-bit big-endian cpu adapt code fragment compil complet program ignor compil warn use 32-bit compil maco x 10.6.7 gcc 4.2.1 xcode 3 follow code produc follow result see eventu found string main program statement compil 64-bit mode got core dump instead result perfectli correct program invok undefin behaviour anyth program valid curiou search nasal demon inform undefin behaviour use experi sort issu anoth variat produc recogn format string hex output - 0x41 capit exampl 64-bit output code similar differ,2011-04-15 06:09:45.343 UTC,450,5672996,print valu memori address 0x08480110? sure 5 %08x argument - take stack? exampl taken page 11 paper http://crypto.stanford.edu/cs155/papers/formatstring-1.2.pdf,0.028888888888888888,13,c format security string,format string vulner - printf,6,security|vulnerability|crypt|safe|attack|validate,0.9188663363456726
,2019-06-25 01:14:56.85 UTC,53,56745627,been tri implement buffer overflow attack program isthisgood.c exploit input see get without modifi program craftinga malici input caus success exploit success exploit invok function oopsigottothebadfunct though function explicitli call isthisgood.c! read seem exampl seem scanf strcpi tri bus error core dump sure go help appreci,0.1509433962264151,8,c linux unix,buffer overflow attack get,4,buffer overflow|attack|exploit|malicious,0.9174032807350159
best know avoid buffer overflow make 100% fulli exhaust unit test check function deal buffer size type alway realist cours exhaust mean possibl case taken account matter whether applic ever gener specif case time first write code although tool help arena quit well autom gener unit test automat never tri one cannot warrant one time crunch help anoth somewhat work run static analyz code code cover one use past mani other case static analysi catch problem declar static buffer stack now. unix two problem buffer overflow make system crash case howev hacker access code abl call specif system function kernel function clear case potenti problemat process run elev user i.e worst case scenario root point hacker obtain permiss stuff without author elimin risk two main solut chroot environ difficult setup new linux work virtual unic virtualbox environ virtual system qemu get environ setup gener pretti easi although want automat gener new environments. api tediou one last slow cpu mmu mmu protect/unprotect memori ensur read write happen buffer alloc case stack frame buffer use make sure within correct window imagin write possibl mani read interrupt handler small good tool/idea debug softwar mani buffer overflow gener useabl product unfortun none option part g++ suit default,2014-09-13 10:20:57.21 UTC,281,25822216,went logic behind buffer overflow attack associ protect mechan avail kernel version 2.6 unix avoid buffer overflow attack address random stack smash protect time go ahead disabl address random assign 0 kernel address random stack smash protect includ -fno-stack-protector compil analyz buffer overflow attack curiou know bypass protect mechan avail without mention two activ disabl still enforc good hear mechan pleas help,0.099644128113879,28,assembly buffer c security unix,feasibl bypass address random stack smash protect - buffer overflow attack,9,security|bypass|protect|buffer overflow|attack|availability|signing|hack|authorise,0.9154077768325806
,2019-12-28 00:20:35,51,59507190,need address particular array obtain array address success one got stuck main code ok put breakpoint first printf ok obtain success address buf. address polpetta! tri differ method hell?? tri repeat routin differ breakpoint insid main function...thank kind,0.0196078431372549,1,c debugging gdb security,gdb print command work one variabl work breakpoint correct,1,security,0.9148218631744385
guess add syscal shellcod cours chang owner,2019-12-13 06:00:40,57,59316935,work assign see http://www.cis.syr.edu/~wedu/seed/labs_12.04/software/buffer_overflow/ run end instead root shell follow code creat read use copi buffer big enough handl exploit.c stack.c compil stack.c permiss root compil exploit.c seed run creat error run run shell root shell run shell root need chang root shell,0.12280701754385964,7,buffer-overflow c,root shell buffer overflow assign,5,buffer-overflow|buffer overflow|signing|exploit|shellcode,0.9141750335693359
program contain code snippet consid viru code anti-viru program antiviru protect system often heurist algorithm give fals postivi sometim mayb program certain suspici function call specif low-level instruct whatnot network like caus antiviru alarm well talk fals posit,2010-03-19 05:18:11.487 UTC,50,2475126,sometim program flag viru anti-viru softwar,0.18,9,antivirus c,program sometim flag viru,4,antivirus|virus|anti-virus|protect,0.912983238697052
let try without print state question clearli see without print first fail let compar hapen insid mark line see valu %edx put 3 rd argument stack printf scanf cdecl call convent stack remain less across invoc third argument remain avail vulner set print stack easili avail inject format string enough abl reach actual anyway limit 50 input charact get,2013-01-24 16:23:50.203 UTC,96,14505995,aim execut format string attack - execut func input string tri %n overwrit variabl came conclus imposs without display b variabl first idea hint appreci sorri bad english,0.08333333333333333,8,c exploit format-string printf security,format string attack printf,6,exploit|security|attack|availability|vulnerability|inject,0.912683367729187
,2014-04-18 07:36:05.31 UTC,211,23149615,recent tri test tutori applic demonstr buffer overflow written c use visual studio 2012 toolchain compil link sourc made sure follow option address space random disabl /gs disabl disabl stack protect buffer overrun protect victim applic vulner stack overflow although extra space ad stack besid size buffer go overwrit shellcod manag identifi return address want replac start address buffer order run shell code stack get follow messag /gs flag enabl stack cooki instrument code detect stack-bas buffer overrun know problem? second applic invok victim applic shellcod paramet far know interfer victim handl use winexec call victim attack applic still behaviour gs enabled? think overwritten option disabl /sdl - secur checks.for linker follow ad /dynamicbase:no option configur order diasbl stack cooki buffer overflow protection? set besid environ configur order make work? seem /gs- ignor moment edit similar problem seem cover buffer overflow attack window result access violat think root problem behavior mention due /nxcompat:no flag seem introduc behavior place return address stack activ stack-cooki protect mechan /nxcompat enabl return address place local variabl base-point omit access violat messag anyon manag bypass manag achiev success buffer overflow attack program compil cl vs2010 later,0.12322274881516587,26,buffer-overflow c compiler-construction shellcode visual-studio-2012,still stack cooki except although disabl /gs flag vs11 compiling? scenario buffer overflow tutori test,11,buffer-overflow|shellcode|cookie|buffer overflow|protect|vulnerability|shell code|attack|security|violate|bypass,0.9110502004623413
read stream fact automat enlarg block memori need mean use denial-of-servic attack trivial gener input long exhaust avail memori process wors system! out-of-memori condit occur vulner come play behaviour code low/no memori rare nice hard predict imho safer reason upper bound everyth especi security-sensit applic furthermor anticip mention special charact give buffer make guarante content buffer safeti entir application-depend sanitis input still essenti part process valid user data sscanf tend prefer regular express librari narrowli defin regexp user data rather perform good deal valid time input gener comment fuzz tool avail gener random input valid invalid use test input handl buffer manag critic buffer overflow underflow out-of-memori race condit exploit otherwis secur code binari file manipul inject invalid valu overs valu header file format code must rock-solid assum binari data valid temporari file often sourc secur issu must care manag code inject use replac system runtim librari call malici version plugin provid huge vector attack gener principl suggest clearli defin interfac user data data outsid applic assum invalid hostil process sanitis valid user data enter applic insecur program exampl blog answer yannick moy develop hoare/floyd weakest precondit system c phd appli cert manag string librari found number bug see page 197 memoir good news librari safer work good place start look david wheeler excel secur code site free onlin book secur program linux unix howto excel resourc regularli updat look excel static analys flawfind hint rememb autom tool replac good pair experienc eye david colour put static analysi tool flawfind mere tool tool substitut human thought! short fool tool still fool mistak think analysi tool flawfind substitut secur train knowledg person use david resourc sever year find excel input buffer automat alloc i.e stack idiom keep work decid chang size prefer form first form use determin second argument clearer check return valu look les hatton web site book safer c amazon think sscanf exampl wrong still overflow use try specifi maximum number byte read take look ibm dev articl protect buffer overflow term test write program gener random string random length feed program make sure handl appropri,2010-01-05 18:26:33 UTC,633,2008173,averag man want free simpli want safe - h l menken attempt write secur c list techniqu ask secur think pleas hesit tear code/preconcept shred answer find even trivial vulner teach new idea highli valu read stream accord gnu c program tutori getlin getlin function automat enlarg block memori need via realloc function never shortag space -- one reason getlin safe [..] notic getlin safe handl line input matter long assum getlin input prevent buffer overflow occur read stream assumpt correct? input and/or alloc scheme lead exploit? instanc first charact stream bizarr control charact mayb 0x08 backspac ctl-h work done mathemat prove getlin secure? malloc return null failur malloc encount error malloc return null pointer present secur risk sinc one still appli pointer arithmet null 0x0 pointer thu wikipedia recommend secur sscanf use sscanf gotten habit alloc size to-be-extract string size input string hope avoid possibl overrun exampl str1 str2 size inputstr charact strleninputstr read inputstr seem imposs given possibl valu inputstr caus buffer overflow? correct? strang corner case thought of? better way write this? librari alreadi solv it? gener question post larg number question expect anyon answer question guidelin sort answer look realli want learn secur c mindset secur c idiom there? corner case need alway check ? write unit test enforc rules? enforc constraint testabl provabl correct way? recommend static/dynam analysi technic tool c? secur c practic follow justifi others? resourc mani resourc borrow answer secur program linux unix howto david wheeler secur c program - sun microsystem insecur program exampl add nop - blog cover issu cert secur code initi flawfind - static analysi tool use thm prover prove safeti yannick moy libsaf,0.0947867298578199,60,buffer-overflow c exploit security,write secur c secur c idiom,16,buffer-overflow|exploit|security|safe|vulnerability|buffer overflow|insecure|attack|availability|sanitise|validate|fuzz|race condition|inject|malicious|protect,0.9095072150230408
buffer-overflow mean secur problem expect find line whenev provid format-str make sure safe control ask argument provid access argument provid wrong type result undefin behavior kind bizarr potenti danger thing happen addit one poke memori obvious danger case contain follow arbitrari insecur user-input addit program uncondit read assumpt assum point string assumpt pass code ub without possibl hack consid buffer overflow analyz possibl one buffer overflow use attack techniqu must overwrit data use later program chang variabl place code less common possibl exampl compil mingw result happen? buffer overwritten passwordcorrect variabl system implement etc relat hack someth abstract portabl,2019-01-05 19:27:13.657 UTC,123,54055462,tri understand buffer overflow attack better one exercis came buffer overflow vulner know one exploit vulner code.i sure search,0.16260162601626016,20,buffer-overflow c,vulner c code,11,buffer-overflow|vulnerability|buffer overflow|attack|exploit|security|safe|danger|insecure|hack|password,0.9088342785835266
need read chapter two show chang owner root via chown chmod u+s page 93,2014-01-16 14:06:18.347 UTC,85,21163978,problem deal exploit page 155 book hack art exploit notetak program use append entri root privileg onto /etc/passwd file.th code notetaker.c goe soft link creat /bin/bash thru /tmp/etc/passwdpassword given default password salt xx--xxq2wkiyi43a2and user id given 0- root privileges.th exploit goe try fatal error open file say permiss denied.it seem work fine book sinc $tail /etc/passwd show new entri thru exploit give root access.pl help,0.12941176470588237,11,c linux unix,issu notetak exploit,5,exploit|hack|privilege|password|salt,0.9073799252510071
see http://www.viruslist.com/en/viruses/encyclopedia?virusid=1857 guess antivir scan text string dos/candi contain sinc one second piec code one look antivir detect compil execut viru look false-posit modern virus polymorph hide anti-viru program anti-viru program report even partial match appar compil given sourc code produc partial match malwar think real viru somewher perhap modifi standard librari :dor simpli antiviru detect pattern execut viru scanner heurist signatur detect vulner fals posit unavoid program seem trigger heurist presum checksum file size characterist match known viru second fact small chang suffici resolv problem edit call applic virus.ex pretti unfortun choic presum trigger viru scanner quickli although certainli perfect name real viru .,2010-03-14 18:13:16.703 UTC,198,2443166,save program virus.cpp use turbo c compil compil program run turbo c ctrl + f9 use window 7 instal avira antivir viru system tri run program creat worm dos/candi believ noth wrong program alt text someth special execut program follow differ differ space differ \n space question simpl program detect virus? anoth code sampl time c++ run program give viru warn - even viru tragedi remov destructor detect viru screen shot similar question c languag - \n - creat viru alt text question,0.1414141414141414,28,antivirus c c++ turbo-c++ windows-7,c languag program detect viru,8,antivirus|virus|worm|anti-virus|malware|signature|vulnerability|checksum,0.8994371294975281
need need subtract byte allow trail null byte string exampl fencepost error probabl mani buffer overflow error type,2014-05-07 16:40:28.713 UTC,78,23523522,hi guy need help code want know buffer overflow code basic exercis univers need exploit open shell studi buffer overflow format string linux debian 32 bit usual solv exercis put 0 valu randomization_va_spac put shellcod environment variabl send vulnerable-program exploit guess need format string know shellcod techniqu open shell thank much,0.14102564102564102,11,buffer-overflow c shellcode stack-overflow,need detect possibl buffer overflow,5,buffer-overflow|shellcode|buffer overflow|exploit|vulnerability,0.8984886407852173
problem here.point troubl nop sled multipl 4/8 byte.th instruct 0xc0319090 0x2f2f6850 nop instruct mix lead shift 2 byte shift shellcod point cpu abl interpret shellcod incomplet instruct --> segment fault fix ad small nop sled shellcod sinc shellcod ad stack end buffer push thing stack overwrit code,2013-11-14 17:39:58.1 UTC,137,19984562,basic c program obviou buffer overflow shellcod correct system http://www.shell-storm.org/shellcode/files/shellcode-811.php put nop sled front correct return address back run exploit gdb see return address correctli alter execut jump nop sled continu shellcod step start shellcod segfault near end program execut stack aslr three question bound instruct come from? shellcod url bound oppcod segfaulting? fix it? rather understand go tri differ shellcod -- editi forgot mention use shellcod system exploit differ binari work updat yes shellcod deliv entireti see sled follow exploit,0.15328467153284672,21,c exploit gdb security stack-overflow,shellcod segfault nop sled,5,exploit|security|shellcode|buffer overflow|forge,0.8958958387374878
say buffer overflow class program error return libc exploit techniqu best mix concept togeth exampl return libc exploit buffer overflow vulner techniqu return .text return shellcod convers return libc exploit bug format string classic buffer overflow exploit stack buffer overflow fill machin code execut call shellcod typic invok shell process new return address new return address craft point back within overflow stack buffer obvious requir know guess address stack buffer attack process day memori layout process typic highli determinist - locat stack buffer usual predict quit well attack particularli knew exactli version target softwar attack improv chanc success guesswork involv activ shellcod often preceed larg quantiti execut machin code perform use oper - call nop sled nop slide nop typic name machin code instruct perform oper return point anywher nop sled desir effect return-to-libc exploit hand caus hijack process return directli shellcod instead caus process return one one start chain librari function librari function directli perform oper attack want commonli use indirectli execut attack shellcod well actual bufferoverflow attack insert malici code overrid ret pointer need modifi anyth conclus cannot see differ attack mention exampl code exploid user insert string larger 5 char everyth stack follow overwritten due fact ret-ptr lower stack overrid distanc right intent overrid let point begin input insert malici assembl code execut soon ret-ptr call jump execut part overwrit ret address share attack repli indic use simpli return assembl code written assembl code say spawn root user shell neither attack overwrit sourc code view assembl perspect sourc code .text segment alway least time know write-protect use take advantag write code priorli assembl memori segment jump code code typic locat near stack segment overflow whatev choos overlow re-direct traffic ret address say attack venu includ environment variabl priorli creat fill shellcod heap function pointer plt code insert usual system call execut desir - need abl execut memori area reloc entri intend declar writabl differ two attack memori made larg non-execut attack type stack overflow pretti much screw attempt bypass type attack write instead access share librari function directli - aka longer need write code first stack segment elsewher execut howev believ libc type attack larg patch detail handi mayb wrong see attack thwart day least read key idea googl smash stack 2011 2010 start,2011-09-05 00:01:39.373 UTC,489,7302878,want comprehend exact differ two type attack read buffer overflow overwrit ret address stack point anoth section code malici code insert effect - need modifi sourc code program actual carri attack return libc- instead modifi sourc code run time function call provid c librari use say open shell paramet use function call pass overwrit buffer end ret part stack accur descript ? anoth relat question - possibl buffer overflow attack without actual modifi sourc code origin program? probabl write new program allow modifi certain section memori new ret address corrupt stack origin program think possibl due memori protect offer process kernel,0.10020449897750511,49,buffer-overflow c security shellcode,differ - buffer overflow return libc attack,12,buffer-overflow|security|shellcode|buffer overflow|attack|malicious|scripting|protect|exploit|vulnerability|hijacking|bypass,0.8946354389190674
