answers,creation_date,len,postid,question,ratio,raw,tags,title,uniq,words,probability
invok setuid script call popen mani distibut linux exampl check shell invoc prevent script begin run setuid seteuid problem popen /bin/sh default shell popen use linux /bin/sh normal bash believ call getresuid check save uid root work around call exec function shell perform check write code c shell call - real intent secur check,2012-02-15 20:27:46.53 UTC,93,9300804,c code fail even call seteuid0 execut setuid seem seteuid popen work togeth popen call print stderr follow msg word popen succe new shell creat permiss maintain case fail solv problem,0.043010752688172046,4,c linux security setuid,popen fail call seteuid0,2,security|scripting,0.7710831761360168
system3 start anoth process run command interpret /bin/sh -c execut command problem program run suid sgid bit behaviour shell control mani environ variabl use gain control command interpret situat similar execut suid sgid shell script use liter secur risk needless execut anoth process need one risk come build string programmat risk shell command inject thought build one command malici user subvert program give care craft input caus command someth expect problem trust string pass system safe trust sourc suppos someth abl trust command safe someth nasti rm -fr ~/* ? use fopen make necessari safe either though hacker pass name file /etc/passwd read want bottom line program interfac outsid world put valid restrict extern user,2012-07-09 13:05:06.177 UTC,173,11395633,possibl duplic issu system command linux c c++ see text good system call linux program wonder real reason it? consum memori mayb cpu apart reason? exampl type instead use hacker program/linux system? saw system advis secur issu person hack linux system use system call? glad someon explain tangibl go bad system,0.09248554913294797,16,c linux security,bad system linux program,8,security|hack|scripting|inject|malicious|trust|safe|validate,0.7708215117454529
,2019-08-05 07:44:35.937 UTC,65,57354239,someon pleas help specifi width %p format specifi let say sscanf? know unsaf sscanf without specifi width sub-str format specifi easi till encount sscanf %p specifi alreadi question primarili print valu %p printf question mostli revolv possibl full width %p format string question mainli safe sscanf %p specifi need specifi full width sub-str thank advanc,0.06153846153846154,4,buffer-overflow c format-specifiers scanf security,specifi width %p format specifi,4,buffer-overflow|security|unsafe|safe,0.7707720994949341
,2016-12-12 20:24:47.85 UTC,50,41108946,tri exploit vulner code phrack magazin code vulner binari succeed got integ bypass verif 65536 cast unsign short equal 0 tri put find posit return address eip got error:thi payload gdb r 65536 $python -c print a*65536 look problem understand happen,0.14,7,buffer-overflow c gdb integer,debug vulner binari use gdb,5,buffer-overflow|vulnerability|exploit|bypass|signing,0.7707138061523438
part problem sourc seem use term scale convert interchang scale refer one sens scale perform context pointer arithmet exampl address initi point singl byte 2 ad address advanc 8 16 byte depend whether system 32-bit 64-bit system size either 4 8 byte actual valu use said scale sens term scale sourc refer exampl valu scale int scale confus realli mean valu convert legal pointer arithmet scale context arithmet becom problem pointer arithmet cours whether convers lose inform main thing rememb pointer arithmet alway certain valu think use -- fact valu actual use,2019-04-07 19:09:37.013 UTC,130,55562665,read c recommend add subtract scale integ pointer secur arbitrarili code execut pointer address rang someon explain scale integ detail purpose?i find trust sourc mayb someon help url sourc https://wiki.sei.cmu.edu/confluence/plugins/servlet/mobile?contentid=87152330#content/view/87152330 thank much,0.023076923076923078,3,c pointers security,c scale integ,2,security|trust,0.7692970037460327
,2017-08-03 14:37:51.09 UTC,75,45487368,tri compil follow code window 10 use visual studio 2017 specif tri learn buffer overflow sampl program learn practic exploit configur build option look compil option linker option seem work feed program 32 byte input data command line howev windbg report run program buffer overflow detect correct action taken undesir prevent behavior possibl anyon explain step need take make happen? screenshot windbg output,0.08,6,buffer c c++ security,make window 10 c++ program exploit buffer overflow,3,security|exploit|buffer overflow,0.7652294039726257
"write memori infinit program crap x posit expect good idea see secur threat either valu larger 0 put infinit loop overwrit process memori segment fault occur process die one paramet zero call result memori leak code complet mad anyway asum question academ yes,ther infinit loop stack overflow loops.also sure go pose secur threat potenti threat system caus memori issues.ther check boundari x user send huge amount data segment fault error.ther miss cast address return malloc.also code style*p++ confus peopl difficult maintain code.thi code sure fail applic real world receiv code trust user problem never chang assum one posit loop alway evalu thing result infinit loop posit keep write memori program crash good piec code greater caus undefin behavior sinc enter infinit loop assign pointer point memori yes write memori alloc program segfault memset want empti block memori prototyp look code look someth other point code post contain infinit loop probabl meant follow",2011-12-06 14:27:00.477 UTC,196,8401484,x paramet receiv data untrust user piec code pose secur threat? updat peopl seem comment infinit loop code piec crash program eventu write alloc memori howev except problem possibl issu malloc used? e.g heap overflow sinc upper bound check x,0.0663265306122449,13,c security,unsaf malloc,6,security|unsafe|trust|threat|leak|signing,0.7647159099578857
mostli prevent attack allow jit without mark page non-writ execut vice versa said system alreadi malwar issu speak alreadi past airtight door ideal case process acl prevent anoth process inspect memori chang memori protect secur playback work malwar alreadi system noth work malwar kernel mode case alreadi whatev like use help track improp memori access alloc page memori initi mark unreadable/unwrit anoth compon mega-monolith program improperli access pointer soon compon tri write unwrit page saw access violat knew offend parti prior knew memori overwritten. know compon someon easili write piec malwar target execut it? virtualprotect allow make memori execut select mean mark buffer store untrust data non-execut secur vulner allow untrust user modifi return address function cannot jump buffer execut code thu stop attack execut virtualprotect allow make memori read-onli mean mark area next untrust buffer read-onli buffer overflow cannot overwrit essenti data thu remot code applic virtualprotect attack attack somehow gain access system virtualprotect remov protect process secur level point alreadi lost anyway,2015-05-04 14:06:43.77 UTC,214,30032200,understand function chang permiss page memori without question sure end immedi purpos run process abl it? exampl someon easili write piec malwar use function order detour instruct caus havoc hand user legitim reason allow process modifi memori ie game cheat,0.12149532710280374,26,c c++ detours hook memory,point virtualprotect process includ malwar,8,protect|malware|attack|security|violate|trust|vulnerability|buffer overflow,0.7644544839859009
"usual password request say sudo linux take password suppli user encrypts/hash test hash store /etc/shadow match permiss grant bueno unless manag ask user password backdoor login somesuch techniqu probabl go achiev specif activ consid use setuid trick perhap helper execut start applic setuid root run appropri thing bewar secur risk code care ensur intern helper execut start applic commun eg thru pipe ipc configur care notic tricki strongli recommend read sever document it,not advanc unix program advanc linux program read care sever time read care execve2 credentials7 man page other misunderstand setuid huge secur risk forget minim program use setuid trick particular make whole qt applic setuid make small helper program setuid",2012-09-27 02:28:29.23 UTC,146,12613232,suppos start process p1 use qprocess process p1 requir root privileg pass password process p1 without human intervent cours password read locat,0.11643835616438356,17,c linux process qt root,possibl pass password process requir root privileg,9,password|privilege|encrypt|hash|backdoor|login|security|credential|forge,0.7621597051620483
-fstack-protector -fstack-protector-al noth heap alloc -fstack-protector protect string main problem target buffer overflow attack -fstack-protector-al protect type descript http://en.wikipedia.org/wiki/buffer_overflow_protect mudflap pointer check see pdf need instal relev lib abl gcc featur valgrind better detect error need recompile/relink easier valuabl,2011-10-18 15:48:26.71 UTC,72,7810036,-fstack-protector -fstack-protector-al protect heap-bas memori alloc stack-bas one ? differ first 2 -fmudflap ? recommend better debug ? sure gcc man page clear enough simpli understand it.,0.20833333333333334,15,c gcc linux,-fstack-protector -fstack-protector-al -fmudflap,4,protect|buffer overflow|attack|scripting,0.7620387673377991
assum kernel intern take look question realiti number way proceed depend sort exploit tri learn want inject code buffer overflow chang return pointer? alreadi call want exploit use one error ? want return orient program instead code inject mani other list,2010-07-01 13:26:20.523 UTC,122,3158194,build c applic exploit confidenti inform kernel memori issu realli understand start. found copy_to_us without appropri check return valu lead sort issu understand exploitable.if give pointer progress great edit kind exploit http://inj3ct0r.com/exploits/7837 x byte kernel memori final dump fact want sctp socket anyth easiest recreat dump confidenti inform make parallel buffer overflow creat file vuln.c use get function build special string job. case disclosur think anoth c file hope make sense. best,0.13114754098360656,16,c disclosure memory security,build applic kernel memori disclosur,6,disclosure|security|exploit|confidential|buffer overflow|inject,0.761364758014679
solv student su two differ shell execut two loop simultan keep_run continu run vulp.c program input string pass file call file keep_attack creat file first remov creat symbol link target file belong root need follow order execut command order attack succeed keep_attack >> touch /tmp/xyz keep_run >> run vulp check file access command keep_ attack >> rm /tmp/xyz keep_attack >> ln –s target_fil /tmp/xyz keep_run >> reach command tri open file *make sure program set-uid own root -- setuid program own non-root user,2014-03-05 06:03:54.397 UTC,138,22189847,lab seedubuntu virtual machin race condit vulner c program need util creat attack access shadow file link lab program pdf inform http://www.cis.syr.edu/~wedu/seed/labs/vulnerability/race_condition/ confus exactli approach compil run vulp.c program shell script seper termin next? sort code command need execute? confus realli appreci assist solv task! thank,0.09420289855072464,13,c command-line linux race-condition security,race condit vulner lab,5,security|race condition|vulnerability|attack|scripting,0.7612028121948242
solv error inlin assembl c find regist class general_reg reload asm go hazard guess say ran gener purpos regist mayb rather place accord machin constraint | simpl constraint describ regist memori immedi integ operand allow except regist gener regist sometim work,2017-06-04 22:34:02.603 UTC,101,44359462,part implement lightweight cryptographi present algorithm optim speed 8 bit implement c relat player algorithm implement inlin assembl compil code error occur search reason found data solv problem solut defin regist compil especi syntax correct current code except rewrit code anoth way? thank help,0.019801980198019802,2,algorithm c cryptography gcc inline-assembly,solv error inlin assembl c find regist class general_reg reload asm,1,crypt,0.7605320811271667
asan author list sever way disabl aslr maco https://code.google.com/p/address-sanitizer/issues/detail?id=29 10.6 10.7 newer unset mh_pie bit alreadi link execut flag script http://src.chromium.org/viewvc/chrome/trunk/src/build/mac/change_mach_o_flags.py?view=markup link program --no_pi flag hard method use gdb http://reverse.put.as/2011/08/11/how-gdb-disables-aslr-in-mac-os-x-lion/ environ variabl dyld_no_pi see man dyld work os x 10.6 10.5,2011-06-12 23:57:48.823 UTC,72,6325537,essenti want disabl aslr mac os x snow leopard gcc todo buffer overflow stack overflow anyon know disabl aslr,0.06944444444444445,5,aslr c macos osx-snow-leopard security,disabl aslr mac os x snow leopard,5,security|buffer overflow|authorise|sanitise|scripting,0.7604820728302002
scanf buffer input buffer best clear approach problem input redirect want clear scanf buffer howev code dangerous. better luck conceptu task tri accomplish read discard junk user type care lead construct avoid entir problem use first place good idea sever reason read entir line pars hand,2012-12-01 03:42:19.443 UTC,90,13656134,danger use %*c scanf clear buffer necessari exampl concern buffer overflow secur issues?ther seem formal document usag asterisk scanf c edit true troubl find exactli happen extra charact inputted.i better clear scanf buffer c,0.06666666666666667,6,buffer c io security,danger use %*c clear scanf buffer,3,security|danger|buffer overflow,0.7597128748893738
obviou one buffer overrun instead think main problem buffer overflow .it happen use function fget scanf without specifi max number byte read malici input string larger alloc buffer overrit return address stack caus execut suppli exploit topic quit larg start want avoid segment fault buffer overflow,2011-06-07 20:18:40.503 UTC,68,6271110,beginn c want know basic secur tip everi c programm familiar strictli refer c,0.10294117647058823,7,c c++ security,basic secur mistak avoid c,4,security|buffer overflow|malicious|exploit,0.7585662007331848
turn look instead,2018-11-08 15:24:38.47 UTC,32,53210868,suppos allow run program 10:00 12:00 creat final code unfortun work leav empti ask login password obvious appli time.conf rule program finish without word,0.09375,3,c pam security,pam_tim program,3,security|login|password,0.7558941841125488
rememb read book somewher race condit problem x11 creat file secur flaw one chang content file time creat time access sure think one https://bugzilla.redhat.com/show_bug.cgi?id=988498,2017-11-22 08:39:10.53 UTC,115,47430121,look famou easi real-lif secur flaw preferredli c/c++ necessarili result race condit far found somewhat comprehens access danger flaw glibc setuid linux kernel probabl complex trigger result long possibl bore demonstr addit found databas race condit probabl use off-context alreadi got small program race condit occur manual sleep call question boil well-known race condit c c++ occur wild danger secur context? context show concurr becom danger real-lif exampl target audienc experienc c/c++ programm think much concurr beforehand thank time,0.12173913043478261,14,c c++ concurrency race-condition security,comprehens race condit bug result secur flaw,3,security|race condition|danger,0.7534728050231934
code fine issu pass string user control printf format string secur bug aris instanc usernam suppli user user pass %s function start access data random address stack result crash printf try pop addit paramet stack result stack corrupt denial servic attack probabl best case inform disclos get printf dump valu stack even way printf style function modifi return address stack sinc string user control safe ignor messag typic fix replac printf exampl gave appear help case const string appear contain format string wikipedia format string vulner http://en.wikipedia.org/wiki/format_string_vulner idea valu chang somehow includ extra format specifi possibl check whether number paramet match number format specifi take next address stack valu next format specifi weird thing happen known format string attack,2009-03-10 18:31:03.87 UTC,143,631661,cover bug line code error say chang teststr const anyth idea error realli say,0.07692307692307693,11,c c++ printf security,snprintf format string secur vulner issu,6,security|vulnerability|username|attack|disclose|safe,0.7528824806213379
,2019-12-18 10:08:32,63,59389649,probelm want obtain pointer return addr main function order calcul distanc heap top chunk $eip store stack hous forc attack overrid $eip address win function search $eip gdb result machin ok show code code exploit tri obtian pointer esp $esp print differ one shown gdb different? obtain it? thank much,0.09523809523809523,6,buffer-overflow c gdb security,obtain pointer $esp $eip order exploit hous forc attack,4,buffer-overflow|security|exploit|attack,0.7501768469810486
short answer yes function alloc buffer stack variabl q call b pass address q paramet b overflow buffer nuke return address back watch buffer underflow attack modifi arbitrari memori free element doubl link list find question perfectli solv hallaron book csapp brief introduct firstli idea overwrit ebp use buffer overflow work call ret instruct address put return point pull back linux kind protect mechan call stack random mean cannot find exact address ebp instruct name nop call slopmayb guess last linux last wall protect set canari valu ebp+4 address call function return check one find stack overflow attack want try checkout ics lab3 well exercis techniqu,2013-12-12 23:51:32.227 UTC,159,20556614,scenario stack start address 00000000 grow array access char[6] 00002301 char[7] 00002302 ebp-> 00001904....esp-> 00002100 top stack still execut buffer overflow bad input question - exploit overflow execut shell code input regular stack overwrit ebp point shell code still stack flip,0.08176100628930817,13,buffer-overflow c security,stack flip still execut shell code use buffer overflow,7,buffer-overflow|security|shell code|buffer overflow|exploit|attack|protect,0.7481436133384705
answer pretti clear corret exploit buffer overflow vulner differ thing without exploit vulner pleas look last 2 row see secret key rememb string extra charact termin string input 32 charact write 33 charact buffer write beyond limit array lead undefin behavior often lead crash function bounds-check danger deprec sinc long latest c11 standard even remov input string long buffer size 32 charact extra one need termin null charact victim buffer array overflow sometim call array overrun note deprec c99 eventu drop c11 standard secur reason want call function outsecret overwrit return code checksecret bewar leav rel safe region c standard mean behaviour rel compil compil version optim set abi mayb incluc current phase moon x86 call convent integ return valu store directli regist assum cpu stack-likely-loc array handl offset within current stack frame let consult disassembl command overwrit directli c code overwrit select fragment code section case want replac easi accomplish let confirm point return even match howev easi need know guess somehow? correct offset particular code section instruct,2014-12-01 11:05:38.23 UTC,201,27227016,hello code disass outsecret assumpt know try run program string fail segment fault wrong? thank help ps want call function overwrit return code,0.04975124378109453,10,buffer-overflow c security,overflow buffer c x86_64 call function,7,buffer-overflow|security|exploit|buffer overflow|vulnerability|danger|safe,0.7480834126472473
109 charact longer overrun 1 sinc length comparison,2015-09-19 04:54:14.883 UTC,50,32664368,search onlin day still cannot figur vulner code first thought overflow int length buffer overflow exploit copi shell code return address buffer howev length size code prevent buffer overflow anyon shed light exploit program? thank much,0.16,8,buffer-overflow c integer-overflow strlen,buffer overflow,5,buffer-overflow|buffer overflow|vulnerability|exploit|shell code,0.7455694079399109
none,2020-03-19 15:31:26,53,60760350,assign see concurr open lock file program lock know somehow delet /tmp/xyz order gain ?access/overwrite? open file 2 shell run passwd shadow order overwrit seem work attack.sh check.sh run parallel termin command permiss deni time realli sure wrong miss help appreci,0.09433962264150944,5,c linux shell security,exploit concurr vulner lock file ubuntu seed,5,security|exploit|vulnerability|signing|attack,0.7452887892723083
think figur least 64 buffer count variabl locat higher stack buffer per disassembly.that mean 65th store chang valu note entir valu probabl 4 byte integ lower byte little-endian case count enough next write 66 point area popul environment variabl past ret harmless pollut eip batt almost done finish rigor think along line edit/cross batt finger 66th write alreadi pull 0 side affect pollut store rel &buffer read rel argv[1][0,2014-02-01 21:51:23.573 UTC,140,21504107,experi secur stuff especi tri understand ret2ret exploit.th code experiment aslr n^x stack canari test compil 32 bit gcc.i know usual 0x41414141 ?? say overwritten $eip decid debug gdb put breakpoint ret function cop strang enough even writ 300 stack 64 char correspond buffer rest written know ? due kind updat ? edit gdb log buff[64] edit 2 gdb log buff[20,0.02857142857142857,4,assembly buffer-overflow c fortify-source security,imposs write stack stack overflow,3,buffer-overflow|security|exploit,0.7443263530731201
design implement clear warn mention man page strncpi onu user ensur he/sh use correctli cannot exploit warn null byte among first n byte src string place dest null-termin curiou print stop two charact undefin behavior! try print string use %s printf function keep print charact contigu memori start begin address string provid till encount string provid null termin behavior printf case cannot predict print 2 addit charact even 200 addit charact lead unpredict behavior peopl exploit code control manner yes ofcours lead print content memori otherwis inaccess / unknown user use content memori depend actual present memori privat key inform pleas note need care craft attack extract critic inform attack want try print someth string use behavior undefin undefin behavior observ function design intend produc call fixed-width string exactli case gener case fixed-width string differ normal zero-termin string cannot print gener case tri creat normal zero-termin string make littl sens solut chang solut stop use want work zero-termin string mani platform provid function design limited-length string copi function zero-termin string ala standard want print fixed-width striung format precis case print fixed-width string properli,2017-03-28 06:31:15.23 UTC,255,43062158,print understand issu room null termin solut chang curiou print stop two charact secur flaw bug? exploit user? edit 1 understand offici undefin behavior nasal demon occur point develop perspect anyon good understand regard actual code run peopl exploit code control manner wonder point view exploit develop whether use make effect exploit edit 2 one comment led site think cover whole idea wonder http://www.cse.scu.edu/~tschwarz/coen152_05/lectures/bufferoverflow.html,0.054901960784313725,14,c security string,strcpi room null termin print,5,security|exploit|signing|private key|attack,0.7443145513534546
pleas refer get function danger used? understand indic alreadi know vulner keyword c still provid code use . tri store string prefer format follow buffer space read string charact user,2014-11-18 23:28:31.603 UTC,61,27006161,got small program vulner buffer overflow exampl array limit 8 charact still abl realiz get vulner plan fget function get segment error recommend welcom thank,0.13114754098360656,8,buffer-overflow c,protect program buffer overflow,5,buffer-overflow|protect|buffer overflow|vulnerability|danger,0.7401320338249207
first thing nowaday heap exploit linux realli hard well easi overwrit differ buffer overflow hard thing execut arbitrari code want know inner work heap exploit read paper mention post heap overflow write arbitrari data understand concept warn say method used/explain malloc malleficarum silent patch know still work today hand realli want improv knowledg advic download ptmalloc implement http://www.malloc.de/en/ one base alloc linux compil make share use add -g flag load ld_preload abl debug malloc code gdb step step good luck! last year vendor default use fortifi version memori manipul function instanc instead memset builtin_memset_chk instead strcpi strcpy_chk simpl overflow program work build program,2012-08-09 07:37:19.357 UTC,242,11878755,studi comput vulner work problem countless hours.i cannot seem heap overflow correctli despit glibc detect memori corrupt disabl malloc_check_ program execut exit correctli overwrit chunk header matter run kubuntu 12.04 exercis shellcod handbook 2nd edit featur heap overflow tutori onlin follow instruct multipl time receiv result code program write past buffer glibc write past buffer glibc gdb chunk header without overwrit gdb chunk header overwrit time program exit normally.what missing? chang heap work latest version ubuntu?ani help greatli appreciated! updat step assembl gdb found program enter function free_check function mem2chunk_check mem2chunk_check function overwritten valu pick esi regist edi regist point address valu thing see valu esi subtract 1 dump valu abl find document mem2chunk_check function mani googl search heap overflow obsolet modern system,0.024793388429752067,6,c heap kubuntu security ubuntu,heap overflow issu - overwrit chunk header corrupt free program crash,5,security|vulnerability|shellcode|exploit|buffer overflow,0.739960789680481
