answers,creation_date,len,postid,question,ratio,raw,tags,title,uniq,words,probability
116 101 115 116 82 67 52 ascii testrc4 i.e unencrypt valu printf statement actual chang data back origin due to. assign r-valu first chang data[t] take new valu print prior valu express n ^ ^ == n chang printf,2015-10-12 13:06:44.717 UTC,92,33081933,want find intern state rc4 brute forc array valu rc4 sure brute forc line printf%d\n data[k] ^= s[t] show valu 116 101 115 116 82 67 52 sure brute forc valu line edit brute forc find intern state rc4 pleas help,0.13043478260869565,12,arc4random c cryptography encryption rc4-cipher,brute forc find intern state rc4,5,rc4|crypt|encrypt|cipher|signing,0.41191360354423523
type return oper possibl ub signed type matter n1570 6.5.7 bitwis shift oper result e1 left-shift e2 bit posit vacat bit fill zero e1 unsign type valu result e1 × 2 e2 reduc modulo one maximum valu represent result type e1 sign type nonneg valu e1 × 2 e2 represent result type result valu otherwis behavior undefin howev fix straight forward cast unsign type shift overhead 2 complet machin cast essenti free type valu either subsequ left-shift result undefin behavior result valu cannot repres exampl assum 32 bit two complement happen 1 bit shift beyond sign bit potenti pitfal mention inde one code well defin function behavior long avoid condit undefin behavior mention second function equival first said first probabl prefer sinc explicit intent henc easier read chanc undefin behavior see potenti pitfal isbitset type int bit_n 31 alreadi gone anoth pitfal right name assum type matter logic oper c return type valu 1 0 express per design danger use mention undefin behavior anoth reason use programm incorrectli believ result type express type programm write someth exampl reli unsign wrap-around caus undefin behavior = integ overflow 32 bit system sinc left operand sign intend root problem use multipl oper singl line almost alway bad practic lead numer bug experi presenc trick often sign fishi code ideal fulli portabl version code fulli equival,2017-04-21 09:25:47.973 UTC,300,43538890,small research two function equival perform point view even light optim result ident assembl code code 1 code 2 disassembl ident code 1 code 2 compil gcc 6.3 x86_64 +optim person prefer c version code 2 look cleaner safe code 1 ? see potenti pitfal type 31 code lead undefin behavior question addit pitfalls? code 1 realli safer code 2 ?if yes known way make code 2 safer without much overhead,0.04666666666666667,14,c conditional optimization security,condit bit set,4,security|safe|signing|danger,0.4090547263622284
jeff lawson msdn interact win32 job object createprocesswithlogonw execut new process child secondari logon servic outcom make process escap job object membership/restrict even job object allow breakaway furthermor secondari logon servic automat creat new job object assign new process possibl caller explicitli assign new process job object sinc process assign one job object never remov job object assign one new process need differ logon? otherwis creat singl process new logon spawn new process use createprocess associ job object,2009-08-17 12:14:53.28 UTC,170,1287620,window servic winxp sp2 run localsystem account launch process use createprocesswithlogonw order clean child process tri job object terminatejobobject msdn state job handl must job_object_assign_process access right sinc creat via createjobobject process handl must process_set_quota process_termin right think sinc terminateprocess setprocessworkingsets return error though assignprocesstojobobject fail errno 5 access deni everyth work fine replac createprocesswithlogonw simpl createprocess miss someth tri imposs ? edit seem svchost.ex actual creat process createprocesswithlogonw use alreadi assign process anonym job create_creakaway_from_job flag ignor function real question prevent svnhost assign process job,0.058823529411764705,10,c security winapi windows,createprocesswithlogonw assignprocesstojobobject,2,security|signing,0.40721940994262695
typic reason void * provid context user api/librari context provid often pointer void * make opaqu problem librari develop valid void * pass back quit challeng fact librari better provid identifi user easili valid without expos intern data word think use void * excus even c mention much better done pointer incomplet type effect hide intern structur / implement user program much easier particular user mix differ opaqu interfac exampl know void pointer pointer cast hidden outsid make softwar secur compil noth blatant assembl code reveal type pointer type higher level concept -- noth regist width assembl code theoret studi assembl code probabl deduc size data type variou field use use void pointer chang digress said someth outsid know pointer type via api provid like via header file one advantag api -- allow somebodi els pass pointer absolut guarante type intern void pointer make softwar secur reason void* c form polymorph - know type data pass void* c++ less need void* languag prevent c use,2011-02-26 03:11:16.713 UTC,200,5124793,hey wonder void pointer appli real world term make softwar secur flexible.for exampl know void pointer pointer cast hidden outsid make softwar secure.ar reason void pointer,0.035,7,c c++ pointers security void-pointers,usag void pointer c/c,2,security|validate,0.3969508111476898
wrong that? dereferenc pointer check null compil allow think oh pointer got dereferenc point program null otherwis derefer work safe omit whole code path think person wrote that? idea bad style anyway first thing everi function expos symbol valid input short helper function static inlin exempt rule caller function must make sure paramet valid practic mean first thing first pointer structur valu pass function check null kind tree-travers method peopl prefer breadth first normal depth first import part everi pointer check null dereferenc dereferenc null pointer segfault? yes note idiom pointer devic struct test null there’ problem! function pointer dereferenc null check,2014-11-17 09:37:00.54 UTC,168,26969565,read articl http://blog.regehr.org/archives/213 contain exampl bottom page linux kernel slightli edit articl claim easili see neither case necessit null pointer check check remov potenti creat exploit secur vulner dereferenc null pointer segfault? even check right? vulner be? edit:i read articl understand it! want understand peopl code anyway perhap deliberate? least guy claim mistak blog mean want doubl check wrong,0.047619047619047616,8,c security undefined-behavior,check pointer null use,5,security|exploit|vulnerability|safe|validate,0.39141976833343506
think intend array unsign char decalr singl unsign char valu,2014-07-09 15:41:33.123 UTC,75,24658074,work tri creat crc use data byte written function keep get error whenev function call quit sure fix even wrong avoid bloat question includ primari .h .cpp file referenc command header file cmgcom.h crc comput crc16.cpp primari command file cmgcom.cpp realli appreci help inform need provid let know familiar c/c++ know caus issu thank,0.12,9,arrays c c++ crc types,invalid type ‘unsign char[int]’ array subscript,4,crc|validate|signing|scripting,0.38767412304878235
cast promot e.g unari plu rid warn note user enter anyth want usual canyou risk out-of-bound access either valu larger unsign neg valu sign safest strategi expand array size cast char use index,2019-06-08 08:55:28.597 UTC,64,56504908,problem warn 15 18 warn array subscript type ‘char’ [-wchar-subscripts] deal withsampl input:they students.aeiousampl output:thi r stdnt run warn idea,0.125,8,c hash,deal warn 15 18.warn array subscript type ‘char’ [-wchar-subscript,4,hash|scripting|signing|safe,0.3841526210308075
work fine run code singl thread start get invalid read use valgrind mani intern free pbkdf2_check function appear alway suffer race condit written run dangl pointer reus due static storag class probabl remov storag class initi everyth c99 optim remov initializers/writ need,2016-03-03 07:58:52.25 UTC,106,35766313,tri jan-piet men pbkdf2 code mosquitto-auth-plug multithread app work fine run code singl thread start get use valgrind mani intern function use global share resourc code setup openssl lock callback use libcurl exampl still keep get mostli code pbkdf2.c base jan-piet men pbkdf2.c code opensslthreadlock.h implement opensslthreadlock.c .here code base64.c/h use build test,0.12264150943396226,13,c mosquitto multithreading openssl pbkdf2,use openssl base pbkdf2 multithread app,4,openssl|pbkdf2|validate|race condition,0.38287559151649475
problem line find length printabl string look termin data binari data termin contain valu part data replac actual valu length sha256 hash 32 updat seem correct output achiev process sha256 output know got test vector seem expect input ripemd160 function sha256 output convert printabl string - hash string modif seem achiev output expect,2020-03-20 19:32:36,142,60780535,wrote c program perform sha256 hash char array perform ripemd160 hash output sha256 hash function code } problem line unsign char *d = sha256raw-data strlenraw-data 0 pass pointer output sha256 function ripemd160 function result hash output ripemd160 function becom wrong anyon tell happening? correct code print store ripems160 hash char array? result hash output string 046eaf0968aa895addfee599566f0b880242461d1377f4887c9b84631e13067b96db18c41e0c208f8d12ebcc3f99f2522903af6105833e4cbade9d6a1d0f039187 37a0df85d5ccf7cb5f92b53aa3f223d76c115a844ed52d8978deecd2ecb3e406 correct ripemd160 hash 37a0df85d5ccf7cb5f92b53aa3f223d76c115a844ed52d8978deecd2ecb3e406should 4ecc9d3eea56b0af96b6db612b76911858dcb40dbut wrong output code compil command gcc sha256.c -lssl -lcrypto -wno-deprecated-declar output 37a0df85d5ccf7cb5f92b53aa3f223d76c115a844ed52d8978deecd2ecb3e40663bb23be08e2c097008c4c272cc56c14e5656831 second string 63bb23be08e2c097008c4c272cc56c14e5656831 ripemd160 hash wrong,0.1056338028169014,15,c openssl cryptography sha256 ripemd,sha256 ripemd160hash c program,4,openssl|crypt|hash|signing,0.3808364272117615
"cb_arg old version openssl mean? rsa_generate_keyint bit unsign long e,void *callbackint,int,void *,void *cb_arg function callback allow implement progress bar rsa key gener oper take long time deprec instead see gener rsa privat key use openssl? stack overflow man page man page provid context find sure compil openssl program optim high valgrind gener fals posit see valgrind quick start guid",2017-08-01 08:32:00.4 UTC,108,45432765,instal archaic version openssl function defin follow test code run loop forev run valgrind see guess understand function signatur realli mean pass incorrect paramet - problem method loop fed incorrect paramet sinc forev openssl came ask understand function signatur find guid internet,0.12962962962962962,14,c openssl,cb_arg old version openssl mean,5,openssl|signing|signature|rsa|private key,0.37997737526893616
problem solv next upper error appear one alreadi exist paramet nid howev set one default paramet mean use everi time exampl function call openssl - take paramet object easili customiz long correct point curv etc,2012-10-12 23:21:15.483 UTC,66,12868384,insert custom paramet gost 2001 paramet programmat api used? manag gener simul openssl function found paramet bound nid need ad custom one idea anyon,0.07575757575757576,5,c cryptography gost3410 openssl,openssl gost paramet,2,crypt|openssl,0.3717029392719269
updat see comment rouven weßl answer … specul answer perhap someth one guess mention probabl backward compat function undergo futur chang ever reason 1 return fals equal length thu vulner leak length inform – 2 algorithms/check one need know - n . like candid leftov propos implement request comment time attack safe string comparison function version 1.0 propos one user mind import user suppli string hash string use second paramet first present sinc propos creation request comment time attack safe string comparison function version 0.1 link refer exampl symfony2 constant-tim string comparison note commit 2013 one return equal length loop uselen,2015-01-12 22:08:37.853 UTC,234,27911597,php 5.6 introduc function safe comparison password hash prevent time attack signatur describ document must length function effect prevent time attack otherwis return immedi leak length known string doc say import provid user-suppli string second paramet rather first seem unintuit function symmetr argument question import user string suppli last? excerpt function sourc code implement complet symmetr regard two argument oper make differ xor oper possibl xor oper execut non-const time depend argument values? execut time depend order argument e.g 1st argument zero? note php doc reserv chang implement futur versions? edit morpfh state initi propos implement differ see draft implement attempt handl hash differ length process argument asymmetr mayb draft implement first one summar note doc argument order seem leftov draft implement,0.07692307692307693,18,c php php-internals security timing-attack,order argument php hash_equ function import,8,security|attack|hash|safe|password|signature|leak|vulnerability,0.3697669804096222
usernam password type char read %s string scanf function %c char instead usernam password contain 1 char char array exampl char usernam [20] fill scanf function paramet %s compar function strcmp keep mind includ string.h possibl solut case,2018-07-16 12:01:41.693 UTC,108,51361375,enter imag descript try creat regist login c got bug im use 2 function u see first function u insert usernam password second function u login use variabl user name password program detect variabl second function differ variabl first function variabl second function first one program loopback state password usernam wrong enter imag descript run program automaticli said password usernam wrong need,0.16666666666666666,18,c,try creat simpl regist login use c,5,login|scripting|username|password|user name,0.3689737319946289
retriev messag decrypt call libsodium fail error code 1 mean return -1 right ? wonder issu size array contain binari valu mean size data store hexadecim form smaller buf alloc store loos inform part buf actual written especi concern enc_bodi -> tmp size binari data smaller buflen give crypto_box_seal_open buffer size bigger one want give caus issu decrypt ? practic think must recov size data call hex2bin probabl output pass crypto_box_seal_open instead sizeoftmp aka buflen return constant size pointer code alway return 4 8 matter messag size probabl want either new c languag recommend forget keyword rare need main sourc confus bug vulner applic written peopl new languag thing need rememb alway return constant,2018-10-10 12:59:30.35 UTC,181,52740857,use follow function creat seal box use libsodium convert binari encrypt messag hex storag disk util follow libsodium function hex_cipher_text store sqlite3 databas retriev messag decrypt call libsodium fail error code 1 decrypt function follow advic greatli appreci updat follow advic frank deni damv modifi previou encrypt decrypt function follow note chang sizeof function call appropri strlen function call,0.08839779005524862,16,c cryptography libsodium macos public-key-encryption,libsodium crypto_box_seal_open fail,6,crypt|public-key|encrypt|cipher|forge|vulnerability,0.3534785211086273
msdn descript virtualprotect link say virtualprotect fail lpfoldprotect paramet null look use null http://msdn.microsoft.com/en-us/library/windows/desktop/aa366898v=vs.85.aspx lpfloldprotect [out]a pointer variabl receiv previou access protect valu first page specifi region page paramet null point valid variabl function fail,2014-01-17 19:38:50.62 UTC,85,21194431,intercept win32 function call use jmp instruct given jmp intercept abl success inject dll process address space unabl intercept call new function dll code inject process call win32 function fail virtualprotect2 fail error code 998invalid access mistak intercept call,0.12941176470588237,11,c detours hook winapi windows,api hook fail use jmp instruct,4,inject|protect|validate|scripting,0.3532566726207733
determin string bit bit bit binari search exampl alreadi know first bit say sa determin a+1th bit upper bound lower bound first guess a+1th bit say string result updat upper bound lower bound guess secret string input string compar observ enough string chosen compar secret string string comparison written execut time reveal inform secret string known weak cryptograph softwar seriou cryptograph softwar written nowaday avoid weak instanc avoid reveal inform argument function test whether two buffer differ written sever techniqu check piec code leak secret time attack wrote static analysi base previou idea use valgrind dynam analysi note goe articl show even need execut path depend secret leak inform enough secret use comput array indic subsequ access modern comput chang execut time cach make two success access similar indic faster two success access indic far reveal inform secret,2012-01-07 08:51:21.03 UTC,237,8768469,wonder strang idea given algorithm wich take string input compar string know algoritm trivial comparison one char time coupl match found 0 return otherwis return 1 guess secret string polynomi time use provid algorithm? string match time use give answer 0 less time taken return 1 less comparison need time involv small reason try singl instanc mani time accur estim estim time taken inform secret string work properli guess string one char time polynomi time happen try kind brute forc attack char char make sense? someth misunderstanding? thank advanc,0.029535864978902954,7,brute-force c c++ cryptography time,guess string time comparison possibl,3,crypt|attack|leak,0.35207465291023254
forget compil -lcrypt c free librari manual page along sourc code enjoy http://linux.die.net/man/3/crypt http://saa.dyndns.org/stewart/software/my_crypt.c.html specifi version c standard care though crypt function string encod function algorithm implementation-defin,2013-02-16 10:36:24.077 UTC,51,14909340,crypt const char *key const char *salt saw code find implement function convent c,0.21568627450980393,11,c encryption function passwords,function call crypt c? build function,6,encrypt|crypt|password|salt|forge|encode,0.3475272059440613
firstli say chunk input file size 1024 - howev line read 1023 charact file use one space null termin think well closer tri secondli someth,2009-12-04 10:21:39.857 UTC,130,1846081,"work project problems.i search find satisfi answer huge file consist 0 1s.i get 1024 chunk bit array chunk appli sha1 function implement openssl/sha.h librari char chunk[1024] whilefgetschunk,1024,fp!=nul intent file consist chunk want count mani chunk 1024 bit array chunk appli unsign char obuf[20] sha1chunk,strlenchunk obuf function result hash function sha1 function work unsign char *sha1const unsign char *d unsign long n,unsign char *md want store hash function result array.aft read file array compar hash result start project.but stuck point put result obuf array tri :memcopystrcopyor myarray[n][20]=obuf etc suggest happi thank biggest problem find mani hash uniqu",0.14615384615384616,19,c openssl sha1,get result openssl sha1 function array,4,openssl|sha|signing|hash,0.34225526452064514
forget space everi 8 charact caus error pack char,2017-05-11 23:59:35.683 UTC,68,43927374,tri implement hash implement sha-1 txt file abc get output know problem either read method troubl figur issu readfil need append 1 bit end buffer[]array return number charact file variabl length const unsign int convertarraytointarray need convert unsign char equival array unsign int pack 4 char 1 inter-vari,0.16176470588235295,11,c hash sha sha1,readfil convertchartointarray method affect hash implement sha-1,4,hash|sha|signing|forge,0.33653801679611206
try someth open sourc openssl person use md5 hash function work pretti well.you want take look hashlib2++ far know intel made dedic instruct sha-1 two upcom architectur codesinchao indic comment major compon hash algorithm xor oper alreadi instruct x86 instruct acceler sha sha1/2/256/512 encoding? novemb 2016 answer final yes sha-1 sha-256 extens sha-224 intel cpu sha extens hit market recent look processor support goldmont microarchitectur pentium j4205 desktop pentium n4200 mobil celeron j3455 desktop celeron j3355 desktop celeron n3450 mobil celeron n3350 mobil look offer amazon machin architectur processor number find avail yet believ hp acer one laptop pentium n4200 expect avail novemb 2016 decemb 2016 meet test need technic detail sha-1 sha-224 sha-256 see crypto arm64/sha256 - add support sha256 use neon instruct kernel crypto mail list short answer sha-256 thing easili paralleliz find sourc code intel sha intrins armv8 sha intrins noload github | sha-intrins c sourc file provid compress function sha-1 sha-224 sha-256 intrinsic-bas implement increas throughput approxim 3× 4× sha-1 approxim 6× 12× sha-224 sha-256 intel upcom instruct acceler calcul sha1 /256 hash read detect cpu support sha-512 still need manual vector regular simd instruct avx512 help sha-512 sha-1 / sha-256 cpu avx512 sha extens provid simd rotat well shift exampl https://github.com/minio/sha256-simd hope intel skylak microarchitectur intel cpu low-pow goldmont 2016 goldmont plu 2017 intel first mainstream cpu sha extens cannon lake skylak / kabi lake / coffe lake amd ryzen 2017 sha extens c/c++ programm probabl best use openssl whatev cpu featur hash quickli includ sha extens cpu version openssl new enough 2019 updat openssl h/w acceler present intel side goldmont µarch atom-seri cannonlak desktop/mobil 10nm onward sha-ni support cascad lake server cpu older support 2017 amd releas zen µarch current server desktop cpu base zen fulli support benchmark show 550% speed increas block size 8kib real 1gb 5gb file load ram hash roughli 3x time faster benchmark ryzen 1700 @ 3.6 ghz 2933cl16 ram openssl 1.0.1 support vs 1.1.1 support cpuid identif page 298 07h eax → ebx bit 29 == 1 intel instruct refer page 1264ff code exampl simd comparison minio/sha256-simd,2013-12-19 21:51:29.767 UTC,376,20692386,exampl x86 instruct hardwar acceler aes x86 instruct acceler sha sha1/2/256/512 encod librari fastet encod sha x86,0.16489361702127658,62,c c++ cryptography sha x86,x86 instruct acceler sha sha1/2/256/512 encod,8,crypt|sha|encode|aes|openssl|md5|hash|availability,0.33472302556037903
seem pass bad paramet queri dictionari specifi three differ return type document say key found item return result key indic whether seek item’ attribut item’ data refer data persist refer data combin specifi one return type search return dictionari contain type request search allow multipl result they’r return togeth array item type return sinc limit one result contain item data item attribut refer item pass document first paramet say itemref refer keychain item wish retriev data attribut modifi queri dictionari includ return type remov code work extract refer dictionari return pass,2019-11-21 01:34:00,169,58965941,wrote sampl code help receiv earlier add retriev password os x keychain abl success add password try retriev exc_bad_access code=exc_i386_gpflt tri two way use secitemcopymatch api use queri base approach access keychain use seckeychainfindgenericpassword bad access error happen with first approach second one succe tri first approach ensur use seckeychainitemfreecont clean done note - sampl code henc put check return valu though keep eye debugg see error,0.023668639053254437,4,c keychain macos security xcode,exc_bad_access tri access os x keychain,2,security|password,0.3328946530818939
usual safe variant unsaf function ensur manipul problem gener detect dealt introduc difficult detect bug notic later execut understand question correctli want look thing snprintf place printf strncat instead strcat use variant malloc creat charact array follow succeed die convent find refer help code c android know nativ librari lack bit http://www.cplusplus.com/reference/clibrary/cstring/ http://en.wikipedia.org/wiki/c_string_handling#overview_of_funct use variant requir addit inform max buffer size trigger easi spot error failur gener help avoid subtl bug hassl later,2012-07-18 10:34:11.663 UTC,99,11539384,wonder - safe function provid android librari develop nativ librari android? thing microsoft strsafe.h bstring? port,0.06060606060606061,6,android android-ndk c security,safe string function nativ android develop,3,security|safe|unsafe,0.3186766803264618
pass correct size function? size base64 buffer return size destin buffer i.e use exampl main function,2012-05-27 13:20:47.76 UTC,152,10774287,tri encrypt plain text public key use rsa_public_encrypt data sent remot server valid believ encryption/decrypt work sinc output rsa_public_encrypt pass rsa_private_decrypt work problem need base64 encod data order send http test send server encod base64 output rsa_public_encrypt decod pass back rsa_private_decrypt appear work time fail error memcmp compar origin data pre-base64 output base64 decod function receiv -1 despit content appear match visual studio view content memori hex check base64 encod version variou onlin tool appear decod expect valu doubl check input/output base64/unbase64 function null termin appear make littl differ go round circl problem coupl day believ must someth base64 encode/decod process involv everyth work anyon advic happen appreci openssl version 1.0.1c platform windows/msvc base64 code unbase64 code encrypt hello world exampl base64 version use code thank help,0.19078947368421054,29,c openssl windows,openssl base64 decod string alway decrypt,8,openssl|decode|crypt|encrypt|public key|rsa|validate|encode,0.3098513185977936
