answers,creation_date,len,postid,question,ratio,raw,tags,title,uniq,words,probability
error suppos work sign user anonym firebas assign uid anonym user user link proper account account assign uid anonym user sign exist user anonym assign new uid tri link uid exist account error get correct account credenti alreadi first time link previou anonym account user creat account i.e anonym account link need continu account mean either let sign anonym anymor leav sign convert anonym account perman account link multipl auth provid account ios,2017-11-15 06:40:21.74 UTC,152,47300927,scenario login via anonym use firebas auth anonym login account ad event favorit item list event want login googl facebook favourit item never lost whenev login favourit item must login account use scenario firebas link problem firebas link work one time anonym account start login anonym add favourit event previou method googl sign link anonym account alway got error credenti alreadi link code,0.125,19,authentication firebase ios swift swift3,need link firebas anonym account googl login facebook login account firebas,4,authentication|login|signing|credential,0.5967897772789001
sign user firebas authent facebook need sign facebook firebas authent want sign user firebas authent anoth provid need sign firebas authent link unlink provid serv anoth use-cas say want allow user sign googl account addit facebook account sign case leav user sign creat separ authent credenti googl account link two provid togeth moment matter user sign facebook googl credenti sign firebas authent account call allow unlink one provid account updat think understand now. user sign anonym sign facebook account next sign facebook account want go back previou anonym authent account possibl sign user facebook sign previou account user sign anonym authent account cannot recov normal use-cas app link facebook account exist anonym authent account step 2 instead replac inde unlink facebook account back anonym authent provid,2019-03-10 14:20:09.917 UTC,181,55088617,use firebas sdk ios project creat anonym account app launch facebook login follow code - implement sign-out? need user back firebas anonym account directli call firebas signout creat new anonym account? call logout method fbsdkloginmanag persist firebas anonym user facebook login? unlink provider? ideal,0.19889502762430938,36,facebook-authentication firebase firebase-authentication ios swift,sign-out facebook authent firebas sdk ios,4,authentication|signing|login|credential,0.5504211783409119
case anyon els run issu appear link firebas auth provid fly new auth provid email address exist firebas auth account via login flow therefor solut creat link facebook profil button profil log use email/password button creat linkag firebas recogn facebook secondari auth provid account test log use login facebook button work expect think ux greatli diminish util featur week research best come code profil link facebook email/password origin account code login page email/password login forget add loginbuttondeleg view control button ad button use storyboard view use custom class fbsdkbutton style accordingli lastli sure import appropri librari use import firebaseauth import fbsdkcorekit import facebookcor import facebooklogin import fbsdkloginkit import firebas,2019-12-18 16:15:07,266,59396085,difficulti tri fb login credenti log firebas auth account account email address alreadi exist ultim want link two auth provid firebas user account present fb credenti login firebas one alreadi exist use code think follow firebas document exactli alreadi restrict abil singl user email multipl account base auth provid delet origin firebas user account facebook login abl login creat user account expect issu appear occur alreadi firebas auth account email address differ auth provid scenario scenario test alreadi creat email/password account origin tri add fb account via fb login use email address email/password account origin account abl fb accesstoken fb credenti pass auth.auth.signwith credential... alway error follow error error error domain=firautherrordomain code=17012 account alreadi exist email address differ sign-in credenti sign use provid associ email address userinfo={firautherroruserinfonamekey=error_account_exists_with_different_credenti firautherroruserinfoemailkey=akash11x@gmail.com firautherroruserinfoupdatedcredentialkey= nslocalizeddescription=an account alreadi exist email address differ sign-in credenti sign use provid associ email address code,0.13909774436090225,37,facebook firebase firebase-authentication google-cloud-platform swift,link multipl auth provid use firebas auth,9,authentication|login|credential|user account|password|signing|scripting|forge|delegation,0.5500425100326538
sign user differ devic sign use email password first devic without anonym user creat user need save email password devic access email password need sign user first link account facebook see fb consol 1 account email address set prevent creation multipl account email address account creat user alreadi sign email address 2.if user choos email address first login user account firebas look 4 devic user decid login facebook differ provid sign user facebook fb token usual insid function listen notif sign user firebas facebook token sinc user alreadi account email address tri sign facebook error occur see step 4 need sign user link account facebook func linkaccountwihtfacebook{ follow result firebas consol firebas document https://firebase.google.com/docs/auth/ios/account-link link auth provid credenti user account link auth provid credenti exist user account 1 sign user use authent provid method complet sign-in flow new authent provid includ call one firauth.signinwith method exampl user googl id token facebook access token email password firauthcredenti new authent provid,2016-12-29 07:39:51.237 UTC,312,41375219,pleas help find correct solut follow situat develop ios app swift firebas backend user abl login firebas email/password or/and facebook mayb googl ad later import one firebas account real user user reward point make sens one devisewith email login x point devicewith facebook differ point code use login email code use login facebook method work fine creat two separ account allow multipl user email set end follow result obvious want two account merg automat document describ link auth provid user log one method possibl link account method use alreadi oauth credenti case user creat one devic email wont work decid login devic facebook loggin way servic show second view control work databas overrid func viewdidload { super.viewdidload } let say loggin facebook mayb possibl find uid user email run updates? good idea case lot user idea email id sure good option? thank repli,0.11538461538461539,36,firebase firebase-authentication ios swift swift3,manag user differ authent firebas,7,authentication|login|password|oauth|credential|signing|user account,0.5326036214828491
cron job timer period execut code exampl hourli weekli daili configur cron-styl schedul per-item basi simpli execut singl schedul specifi absolut must lock data time defin per-item secur rule get better howev rule allow user list item locat mean give uncondit read access entir node list done deni access children locat secur rule work someon read access locat read children regardless child rule,2018-02-21 01:19:41.307 UTC,147,48896798,term secur speed order expir data firebas data secur cron job delet data expir secur rule order allow certain item read post certain time period? secur rule furthermor user retriev post time stamp less day old howev problem post display tabl view list post expir user app disappear app queri data better cron job add timer post ad delet child entri post older 24 hour term secur speed feasibl timer everi child firebas databas,0.061224489795918366,9,cron firebase firebase-realtime-database firebase-security-rules swift,cron job vs secur rule,1,security,0.5306145548820496
firebas secur rule cannot use filter data check certain read oper allow without check individu node attach listen server check current user read permiss sinc nobodi permiss level read oper reject known rule filter document previou question last year firebas ad support valid queri secur rule exampl allow queri filter type properti see document queri base rule work use-cas either sinc read oper alway return full node bring us back fact secur rule use filter data separ public privat data two separ top-level node one mani reason firebas document recommend keep data structur flat see creat public/priv user profil firebas secur rules? firebas structur public/priv user data,2019-07-30 04:39:56.673 UTC,200,57264393,issu firebas secur rule want user abl creat account use ios app time establish account want two node one privat one public want public access anyon includ user self user creat account access privat node tri lot thing none work seem work want fetch public node valu link without know uid user 1- anyon creat account2- user access privat node3- link fetch user public node thank you!!!! exampl fetch user https://id.firebaseio.com/ireland.json work swift code everi time try creat account say permiss deni,0.035,7,firebase firebase-realtime-database firebase-security swift,creat hidden user node use firebas realtim,2,security|validate,0.4923587739467621
noth built firebas approv queue definit build app top firebas essenti creat so-cal moder queue user post end two top-level node user regular app see data creat separ app moder app show post moder queue give option approv reject approv post ad actual list post user regular app see app moder run trust environ consid use admin sdk ignor secur rule alway full access databas case rule simpl allow anyon read post administr write hand anyon write moder queue long overwrit exist data administr read,2018-04-08 12:27:44.467 UTC,130,49717813,manual approv post post firebas databas rules? current rule meant allow user post databas admin control post either approv reject post firebas consol possibl rules? manual approv / reject user registr admin use firebas,0.023076923076923078,3,firebase firebase-realtime-database firebase-security-rules ios swift,googl firebas manual databas post approv,2,security|trust,0.45210614800453186
appear locat contain given user post i.e expect secur rule post age act filter allow user recent post return queri old post exclud secur rule filter locat either abl read data includ children none rule allow read queri locat fail see answer firebas team-memb idea implement want search firebas rule filter see relat question answer,2018-01-08 18:33:14.437 UTC,139,48156112,"issu compar time interv save firebas db firebas secur rule rule write intend prevent user read post certain time save timestamp databas secur rule write prevent read certain time databas schema use store post -follower-fe { user_uid_1 { note alreadi account fact millisecond divid 1,000 two number time valu second stifl firebas document noth help solv run simul test determin request read pass say pass howev app data read code attempt read data firebas",0.04316546762589928,6,firebase firebase-security swift,unabl compar databas timestamp firebas secur rule,1,security,0.4324624240398407
want unauthent user abl read part databas need modifi secur rule allow temporarili specif app instanc sinc requir app instanc identifi - user know two approach sign user anonym authent first store user name unprotect part tree sign user anonym authent first altern initi sign user anonym authent partial secur data access sinc user prove ident rel easi anyon still access data recommend limit data access by. store user name unprotect part tree approach quit common want usernam publicli readabl store separ part databas secur rule rule anyon read usernam authent user read user profil sign user modifi user profil,2017-07-12 12:12:00.73 UTC,179,45057380,problem current user want creat account app use firebas follow error occur 2017-07-12 21:57:05.958 generalmessage[8525] [firebase/database][i-rdb038012] listen /user fail permission_deni realis error occur user attempt read databas without sign account authent problem user never authent time test name taken make account know edit realtim databas rule allow unauthent user access databas read secur hazard use test idea temporarili authent user click creat account button unsur thank help,0.15083798882681565,27,firebase firebase-authentication firebase-realtime-database ios swift,test databas usernam without authent [firebase/swift 3,6,authentication|username|signing|security|user name|protect,0.4280829429626465
normal uid user id document right tell firestor assign random id document secur rule work expect id assign fireba auth never match document id assign firestor instead specifi uid fireba auth document id write,2020-02-26 16:51:24,102,60418788,hi littl bit confu fireba user uid firestor document id userid???. look help :- creat user uid write databa uniqu document-id mark green thought userid well thing want achiev user read write document green document red therefor follow rule uid document id userid??? connect they? realli it?! app want retriev document id user later http-trigger uid idea complet wrong,0.049019607843137254,5,swift google-cloud-firestore firebase-security,fireba uid vs document-id firestor rule,2,security|signing,0.4278427064418793
none,2020-01-19 15:57:39,76,59811760,app automat sign user anonym account launch user option link anonym account email later sign exist account user attempt sign exist account problem sign current anonym user even pass credenti incorrect result data link anonym user lost recov sinc call gener new user id question check email/password user enter correct without sign current anonym user? note result anonym user sign,0.13157894736842105,10,ios swift firebase firebase-authentication,fireba ios check user email exist without sign current anonym user,4,authentication|signing|credential|password,0.40424844622612
coupl thing consid real answer question detail happili edit request put code exampl objective-c still learn swift first go lot script app worth switch script bridg script bridg cocoa interfac applescript app steal exampl found elsewher want name current track itun someth want specif code spotifi instal app let know second want keystrok look quartz event servic qes allow creat send captur input event want send ⌘c someth run code sandbox app think problem go main advantag approach avoid switch context done cocoa need invok shell creat applescript environ avoid translat problem involv fix got secur &amp privaci -> privaci tab -> access -> add osascript /usr/bin/osascript,2019-08-24 16:46:15.31 UTC,382,57639834,tri run applescript maco app mojav xcode 10.3 howev applescript run app error base post made sure app control comput system prefer > secur &amp privaci > privaci > access control system event system prefer > secur &amp privaci > privaci > autom applescript script work run script editor give script editor access system prefer > secur &amp privaci > privaci > access code use run appl script app via code work perfectli run simpl applescript display notif make applescript run maco app run script editor? edit context command tab case exampl tri find generaliz approach simul keyboard shortcut click button app e.g user click cut button app act user press command + x better approach use applescript know possibl want use applescript edit case clear origin question simpl applescript display notif alreadi work within app problem aris try run applescript simul user input keyboard edit code work temporarili longer work chang code simpli ran app edit problem current stand base suggest ad spotifi applescript consist work call via nsapplescript seem problem applescript system event despit make sure app allow control comput via secur &amp privaci > privaci > access error 1002 use app allow control system event secur &amp privaci > privaci > autom error print consol xcode uncov error code use code @ibact button code caus appear dialog box app run prompt give control system event alway app sandbox believ work stop work ran app despit made chang code almost posit know inform clue go keep check uncheck script editor permiss run applescript tell script editor allow send keystrok,0.13350785340314136,51,applescript keystroke macos permissions swift,error 1002 applescript use key code call maco app,6,scripting|security|privacy|access control|sandbox|steal,0.3933873474597931
two thing wrong one easi fix one difficult 1 order skip level miss level json data call order appli id child properti child node fix add level user json 2 rule filter second problem tri execut queri user read access mean firebas immedi reject oper attach see reject user abl read specif record even specif record abl queri list record common misunderstand firebas secur rule cover document rule cascad rule filter unfortun mean typic pick differ structur data store user common solut store user uid user access profil direct lookup see grant read access data specif valu firebase? firebas rule - cannot access node show item userid child,2015-12-03 13:55:56.54 UTC,174,34067876,start today firebas try creat sampl ios app.at moment stuck secur data let say demo data rule file log user uid 1234 log code try data code never data back firebas remov rule add .read true parent everyth work sure miss someth moment littl bit lost mayb one point right direct,0.017241379310344827,3,firebase ios security swift,firebas .read auth != null && auth.uid == $uid work expect,1,security,0.3747337758541107
tri secur rule filter list possibl one common pitfal develop come firebas sql background commonli refer rule filter learn firebas document answer new video seri firebas sql develop mani previou question mention rule filter solut almost alway keep separ list key post user access type list often refer index sinc contain refer actual post find structur firebas document structur data,2016-12-14 07:47:12.077 UTC,118,41137284,use want save node multipl children type child uniqu identifi tri access help follow code current user log app user access list want child whose owner i.e &amp ignor child valu applic achiev via firebas secur rules? current rule definit rule give success idea achiev desir result,0.025423728813559324,3,firebase firebase-realtime-database firebase-security ios swift,firebas rule access specif child valu,1,security,0.37235525250434875
check usernam store snapshot return closur exist usernam fred exist current investig thing issu want persist enabl need awar access offlin use persist recommend disallow particular oper check usernam exist client offlin listen .info/connect detail https://firebase.google.com/docs/database/ios/offline-capabilities#section-connection-st person workflow follow login user account check user alreadi usernam check firebas databas see user detail includ usernam usernam prompt usernam usernam check usernam exist exist write usernam userid two databas locat check eg user.uid = wewe32323 usernam = scuba_stev db/usernam refer check quickli see anyon usernam alreadi db/users/ quickli find usernam given user say fool-proof still concern around concurr request current issu investig let say delet usernam associ particular user user depend local copi databas incorrectli assert still assign usernam look databas write rule disallow anyon modifi exist data enforc write db/usernam directori exist data prevent overrid whoever set usernam first think import step worth investig transact https://firebase.google.com/docs/database/ios/save-data#save_data_as_transact believ correct write rule mention paragraph allow depend write,2016-05-29 03:54:36.187 UTC,210,37506003,newbi firebas hint appreci right use firebas login &amp auth handl authent want store user data usernam dob created_at. creat user node append children node user use uniqu id sign login howev want ensur duplic usernam system check usernam alreadi exist write server,0.14285714285714285,30,firebase firebase-authentication firebase-realtime-database ios swift,ensur uniqu usernam creat new user firebas swift,5,authentication|username|login|signing|user account,0.3722679615020752
,2017-08-21 21:12:29.687 UTC,74,45805590,"multiplay game 2 player play user creat room ok howev 2 user join room time big problem try prevent situat code function code firebas tree final join game code user join room room usercount valu 1 firebas function code updat usercount valu 2 user join creat room however,if 2 user click join time join room want limit room capac 2 firebas cloud function block situat",0.013513513513513514,1,firebase firebase-realtime-database firebase-security swift,limit join children firebas function,1,security,0.35447195172309875
abl work updat createaccount code allow sign without valid usernam separ usernam screen show event partial registr defin secur rule check non-nul usernam allow write part databas,2016-05-10 00:14:24.583 UTC,133,37127364,build app use firebas email password login featur user regist usernam email password struggl stop user creat usernam uniqu read question specif firebase-android-make-username-uniqu how-prevent-username-from-duplicate-signup-infirebas still gotten fulli work follow instruct first link data structur secur rule setup try creat new user usernam alreadi exist stop user ad data structur code call print user data save usernam duplic stuck creat account method call two method createus authus call need uid problem user still get creat regist user secur rule keep user inform ad data structur need figur stop user creat duplic usernam edit updat createaccount method solv issu,0.15037593984962405,20,firebase ios swift,firebas ios swift prevent duplic usernam,6,username|password|login|signing|security|validate,0.3508765697479248
write path rule give write permiss path want write data use someth,2016-03-22 17:22:19.86 UTC,71,36161137,tri let author current user read write data firebas databas secur data look autoid gotten method uid uniqu user id valu certain featur secur rule write firebas rule permiss deni featur part 2016-03-22 17:51:27.077 herodus[884:228445] [firebase] setvalu removevalu /features/-kdueez4z-fcaouci-rw fail permission_deni new featur ad code snippet somebodi clue wrong,0.07042253521126761,5,firebase firebase-realtime-database firebase-security ios swift,firebas secur rule current user,2,security|authorise,0.34943804144859314
accord doc fail alreadi account email address creat email password authent updateemail succeed error api fall email/pw auth case uid consid anoth authent abl sign method probabl good sign 1 uid 2 sign-in method email/pw applesignin usual offer email updat user regist email/pw unless explan make sen plea correct >_&lt,2020-04-21 00:09:46,154,61334077,app allow user chang email api updateemail fireba auth ios swift sign appl option avail confu user appl id email email fireba appl id email fireba ident login fireba auth sign appl user goe app chang email done updateemail api note user 1 account appl sign appl user never creat 2nd account email switch happen account log appl basic user sign appl log chang email fireba fireba good what’ confu user login still regular appl email sign appl option email fireba login error api howev allow user chang email case? ok expect user experience? confu,0.12337662337662338,19,ios swift firebase authentication firebase-authentication,chang email sign appl,5,authentication|signing|availability|login|password,0.34711575508117676
well answer question anyon data rule true yes queri everyth everi user regist unless test write databas rule firebas databas access everi data check uniqu name simpl exampl error code word write fail know usernam taken,2017-08-17 23:09:07.5 UTC,119,45746198,user sign uniqu usernam password rather email + password everyth work sign check provid usernam alreadi exist store usernam db email e.g user qzqfzwxpdmfc0xmyiq5idar1bzr2 credenti email myemail@gmail.com usernam myusernam rjasdfasfasdad3dadaewdsdkdq3dk credenti email another@gmail.com usernam anoth sign queri db user associ usernam email address log approach work wonder work firebas permissions? order email address associ usernam go let user access email address / usernam data e.g mean hacker email address user regist app? secur,0.20168067226890757,24,firebase firebase-authentication firebase-security ios swift,firebas permiss sign usernam password,7,authentication|security|signing|username|password|credential|hack,0.3452615737915039
possibl handl within secur rule chang databas structur littl bit instead somth secur rule look reason chang databas structur 1 wildcard key secur rule certain posit,2016-09-22 02:24:11.29 UTC,101,39629276,"develop turn base game use firebas game game room room includ max 3 child node player1,player2 current user count case player1 creat room 2 child nodesplayer1 id current user count player 1 wait 1 enemi howev 2 player click join time room 3 player avoid situat use secur rule ? relat databas part text } creat room code block join room code block",0.0594059405940594,6,firebase firebase-security ios swift,limit child node use secur rule firebas swift,1,security,0.3443453311920166
,2017-11-16 09:44:52.51 UTC,72,47326297,face problem firebas link authentication! success sign facebook account firebas shown facebook authent sign facebook account sign googl account link account code work total fine! howev revers sign googl account firebas shown googl authent sign googl account sign facebook account got error follow account alreadi exist email address differ sign-in credenti sign use provid associ email address solut,0.2361111111111111,17,authentication facebook-login firebase google-signin swift,link facebook authent googl authent alreadi exist firebas swift,4,authentication|login|signing|credential,0.34338870644569397
