answers,creation_date,len,postid,question,ratio,raw,tags,title,uniq,words,probability
need write secur rule anyon see url secur rule dictat access piec data rule act annot data structur specifi constraint must satisfi allow read write let say want secur databas authent user access databas default rule realtim databas variabl server side valu store current authent user rule check see variabl valu therefor contain log user expect firebas dashboard allow gener api key emb app seem case firebas consol give secret key give full access regardless rule emb app longer secur authent creat token secret key specif log user,2016-06-21 15:50:54.987 UTC,136,37949097,swift ios app use firebas anonym login concern secur firebas databas appar anyon access delet data browser etc? secur db ios app access it? expect firebas dashboard allow gener api key emb app seem case,0.08088235294117647,11,anonymous firebase ios security swift,swift firebas ensur one access db except app,3,security|login|authentication,0.34322530031204224
simplifi rule first grant authent user write access root data subsequ say user write data current locat work grant permiss certain level cannot take permiss away lower level firebas document describ read write rule cascad child rule grant addit privileg parent node alreadi declar cannot revok read write privileg,2017-03-28 06:04:56.793 UTC,124,43061726,want stop signup process usernam exist want creat email\password authent info usernam exist databas rule ad .write still duplic usernames.and ad make usernam atleast 3 charact see signup process gonna fail longer creat email\password stuff wrote data databas root\users\ regist new user email\password got error mean usernam 3 charact stop signup process show alert messag situation? [firebase/database][i-rdb03812] setvalu removevalu /users/jt94arqooodtu3kyp3w1mtluz4m1 fail permission_deni pleas help fix problem,0.13709677419354838,17,firebase firebase-authentication firebase-realtime-database swift3,swift firebas stop signup process,5,authentication|signing|username|password|privilege,0.3398166298866272
never actual abl permiss valid work found code valid document tri write exist final solut @ibact func savebutton_ sender { } logic works. quit satisfi still chuggin,2018-01-22 04:04:54.123 UTC,99,48374520,project work take data written follow statement swift 4 written firestor success problem ad data easi overwrit exist document firestor think best go fix implement specif permiss restrict overwrit data hope try allow overwrit user authent document name alreadi present databas firestor permiss config point deni write period misunderstand file structur firestor someth els wrong? edit think got closer still cigar,0.04040404040404041,4,firebase firebase-security google-cloud-firestore swift,set googl firestor permiss avoid overwrit data,3,security|authentication|validate,0.33826881647109985
array better object firebase-gener key see propos databas structur code ios follow exampl javascript databas structur add user group read group user,2016-11-20 17:22:25.807 UTC,73,40707006,tri creat chat app group player join multipl group problem face know add multipl group player player join 1 group group key group name valu multipl group possibl creat multipl group key uniqu mayb array valu group ? think possibl hope someon help thank,0.0273972602739726,2,firebase firebase-realtime-database firebase-security ios swift,multipl group,2,security|scripting,0.33207932114601135
insid help log occur event queri made end databas return follow json hmm. seem right run simulator? run firebas app simul know simul firebas queri work 20-30% time never problem phone done lot project firebas everi time simul databas stop work least day pocket time hope help person alreadi list,2016-09-05 17:11:48.833 UTC,130,39335109,dummi user ad firebas db test purpos tri see check user db first wrote method work perfectli exist queri purpos wrote method run multipl time return method call actual firebas queri perform decid make simpl queri data henc surpris work even though use similar queri approach anoth app work fine none three approach print anyth structur firebas db current rule error thrown whatsoev report auth problem help greatli appreci,0.007692307692307693,1,firebase firebase-realtime-database firebase-security ios swift,firebas databas - check exist user,1,security,0.32866594195365906
go databas -> rule -> chang allow read write fals true,2019-11-18 23:36:16,103,58924510,play around firebas use authent framework plu firestor databas databas model quit simpl want keep collect user hold document -identifi user uid- regist user user document hold collect document repres user expenses.follow document rule firebas consol shown beneath ios app user log want retriev user expens follow code thing call getdocu print error line error retriev expens error domain=firfirestoreerrordomain code=7 miss insuffici permiss check print loggedinuser.uid one see firebas consol authent section user tab guidanc tip fail secur retriev data greatli appreci,0.04854368932038835,5,firebase firebase-security ios swift,retriev authent user data firestor ios,2,security|authentication,0.3285333514213562
enough mean anyon authent read/writ anoth user data probabl want add someth nodes.to allow authent user access data anoth user rule default rule accord firebas document allow full read write access authent user app use want data open user app want open world essenti configur rule correctli launch app ensur user access data suppos exampl rule grant write access authent user /users// id user obtain firebas authent,2018-07-10 23:28:40.973 UTC,92,51275219,receiv email firebas advis secur rule insecur cite user read/writ databas specifi rule missing? help much appreci,0.09782608695652174,9,firebase firebase-realtime-database firebase-security-rules swift,firebas say rule insecur,3,security|insecure|authentication,0.32851317524909973
realli good idea prefix collect name work well secur rule usual structur per-us data collect document whose ids user ids organ data subcollect document id write secur rule use user uid easili,2019-06-12 23:22:42.207 UTC,71,56571518,creat app use firebas cloud firestor databas structur seem collection/document/field think either use user id prefix collect name simpli field userid current use chang prefix event userid current read everyth use,0.04225352112676056,3,firebase firebase-security-rules google-cloud-firestore swift,segreg user data firebas,1,security,0.3268074095249176
mani potenti solut top head allow anybodi read document noth sensit make sens allow though probabl right requir user least authent solut look user sign email facebook something? let authent authent ask pick usernam point allow queri document valid usernam need sampl code wait user authent call function question function work point need updat key user document maintain separ document track use usernam make document readabl unauthent user check usernam access portion firebas databas one creat new document let call everi time user success authent add document add usernam document permiss first exampl,2018-01-10 22:45:01.29 UTC,163,48197313,current ios app util firebas current tri make user uniqu usernam sign stage function seem trick check usernam exist howev try run function creation user signup screen give error reach conclus rule current default question is...i anyway chang rule work function want authent user check usernam uniqu potenti add thousand peopl auth event mani usernam taken.ani help greatli appreci,0.13496932515337423,22,firebase firebase-authentication firebase-realtime-database ios swift,uniqu usernam prevent due firebas rule,4,authentication|username|signing|validate,0.3257220387458801
delet currentus need take care two things:- delet user data firebas databas delet auth credenti e.g :- email-password facebook login twitter etc delet current user function first sign user cmd+click delet function take document :- delet user account sign user current user complet option block invok request delet account complet fail invok asynchron main thread futur possibl error code - @c firautherrorcoderequiresrecentlogin - updat email secur sensit oper requir recent login user error indic user sign recent enough resolv reauthent user invok reauthenticatewithcredential:complet firus see @c firautherror list error code common firus oper */ long stori short err receiv nil current user account delet sign automat need handl firautherror state document,2016-10-22 08:46:58.097 UTC,146,40190126,know delet account firebas automat log user out? mean want show delet login screen present vc? ask crash think user exist anymor point right? code explen,0.11643835616438356,17,firebase firebase-authentication swift,delet account firebas automat log user,7,authentication|login|credential|password|signing|user account|security,0.32481256127357483
,2019-02-25 11:24:34.71 UTC,95,54865142,done passwordless email authent got link redirect app need updat user firebas authent success allow go insid app time need current log userid code use logic consid new user login email consid alreadi log gmail account authent alreadi firebas use email address error expect fresh login signin auth email id need authent firebas current user id need go insid app ii alreadi signedin gmail account login password less auth email need abl auth firebas login insid app current userid achiev codec func verifylinkus { error follow https://medium.com/@huzaifa.ameen229/firebase-email-link-authentication-ac2504068562 https://github.com/firebase/quickstart-ios/blob/master/authentication/authenticationexampleswift/passwordlessviewcontroller.swift,0.17894736842105263,17,firebase firebase-authentication ios swift,passworless email auth,4,authentication|password|login|signing,0.32070493698120117
possibl creat segu ctrl drag login uibutton? yes segu perform regardless whether authent success need make sure creat segu storyboard ctrl+drag view control think yellow button top view control uibutton check whether log user valid email address author rememb differ authent author handl firebas realtim databas rule,2016-09-01 20:11:16.4 UTC,188,39280146,applic build firebas essenti tri build authent system allow user sign-up use e-mail/password e-mail/password log creat user authent system work fine along reset password system send password reset link design e-mail address reason anoth login authent system seem allow anyon e-mail address sign sign-in essenti authent summar upon enter e-mail password loginviewcontrol immedi segu next viewcontrol regardless whether account previous creat pod use code loginviewcontrol e-mail/password authent databas rule firebas consol use exact code except migrat syntax firebas 2.5.1 firebas 3.5.2 anoth applic built use firebas 2.5.1 legaci consol work exactli log-in account creat beforehand sign-up updat fix firebas version 3.6.0 releas date 9/14/16 improv behavior firebas authent test app use ios 10 simul fix issu error report user provid invalid email address sign email address password see newest releas note,0.16489361702127658,31,firebase firebase-authentication ios swift,firebas e-mail authent system logs-in account,6,authentication|signing|password|login|validate|authorise,0.31558045744895935
solut rule allow everyon read write entir firebas node ok test pleas leav total insecur note code eras playlist node time overwrit go right direct updat code creat new node time run result -y.. key creat childbyautoid gener creat children key within node,2017-01-22 13:30:33.567 UTC,82,41791494,enabl email custom authent firebas follow rule tri test firebas use follow code sure what wrong give setvalu removevalu permiss deni error unabl understand what wrong new firebas,0.036585365853658534,3,firebase firebase-realtime-database firebase-security ios swift,unabl write valu firebas swift 3,3,security|authentication|insecure,0.31528472900390625
default databas permiss fals link tri write data give permiss deni error updat databas rule follow whenev write data new sibl path updat rule accordingli,2019-12-18 11:09:45,68,59390749,tri databas inform read anyon written user sign test read write oper public permiss problem connect databas app permiss error messag run authtest return correct email test class consist pleas help miss,0.029411764705882353,2,firebase firebase-realtime-database firebase-security swift,unabl link user id write databas firebas,2,security|signing,0.3151501715183258
solv it! thing realiz code question print snapshot success ad appropri index definit /user issu realiz need loop snapshot want access data usernam snapshot queri accordingli look someth thank frank guid confirm right track happi learn someth new super effici whenev need grab data,2019-05-02 17:44:04.327 UTC,121,55957680,read practic everi stackoverflow answer none work scenario sinc frequent issu xcode consol give common warn queri data firebas warn tri first read firebas document understand exactli along answer state firebas &quot;.indexon&quot work? provid secur rule exactli messag prompt ad indexon /user success provid databas user node one function firebas databas /user json format function swift sure els turn insight even correct format queri want great,0.03305785123966942,4,firebase firebase-realtime-database firebase-security firebase-security-rules swift,annoy issu regard indexon firebas rule,2,security|username,0.3136439025402069
firebas support confirm bug relat evalu estim given fix exist bug demonstr follow rule although rule alway evalu true attempt creat citi fail permiss deni seem problem affect rule appear rule path rule shown attempt updat exist citi fail permiss deni,2018-08-01 12:46:34.14 UTC,100,51633681,post question yesterday creat new one detail firestor .setdata block updat rule creat run simul rule work creat document chang swift code code work appear fail creat document catch remov rule simpli chang setdata seen creat rule execut properli clue what go know tool get better insight } data,0.02,2,firebase firebase-security-rules google-cloud-firestore swift,firestor secur rule break updat rule,1,security,0.31354179978370667
call properti specifi updat see firebas document updat specif field rule work sinc cannot take away permiss given higher level tree see firebas document cascad permiss ensur user alway certain properti rule user node,2017-04-25 11:52:58.273 UTC,69,43609945,add user tabl user author add user valu want overrid rule remov old data put new want write rule server side ignor set valu alreadi exist,0.043478260869565216,3,firebase firebase-authentication firebase-realtime-database firebase-security swift,forbid rewrit data exist,3,authentication|security|authorise,0.30967554450035095
possibl add field user node name exampl default 0 new user ad databas admin receiv notif check registr accept chang valu 1 els delet user data,2017-07-05 16:46:43.357 UTC,103,44931874,current design applic swift 3.0 use small group 100 user user regist simpl registr form use email id password admin approv reject user registr request manual workflow think user regist admin notif email new user registr request admin approv reject user registr request user email registr approv reject possibl firebas tri read firebas document cannot find anyth help case help idea much appreci,0.038834951456310676,4,firebase firebase-authentication firebase-realtime-database firebase-security swift3,manual approv / reject user registr admin use firebas,4,authentication|security|signing|password,0.3081529140472412
firebas document wrong firebas consol open rule simul password option time think bug multipl authent multipl authent matter project dont provid rule otherwis test rule password authent,2016-10-04 18:25:42.57 UTC,106,39859283,two user creat firebas consol differ usernam email address want abl store score onlin databas structur access valu keep sync use want test whether two user access inform anoth user chang line includ reason output chang valu databas automat updat valu one put wrong user reason abl access rule app allow one user read anoth user data restrict access user access data userid? @m_g suggest took parent rule output,0.07547169811320754,8,firebase firebase-realtime-database firebase-security ios swift,swift + firebas secur work,4,security|username|password|authentication,0.3040674328804016
possibl anonym authent creat user account without requir sign-in,2020-04-04 16:52:56,108,61031528,found previou question similar mine howev developp need write fireba don’t henc near duplic question simpl databa 150 document user don’t need authent app authent don’t make sen app user read databa don’t write current rule read allow cour trigger fireba rule warn daili 1 rule similar “onli request come app access it” given app link fireba one think it’ possible? 2 must authentif behind scene user unawar that? mayb uuid identifi user password someth want avoid show log screen cost think ask log check gas prices. ** ios app,0.09259259259259259,10,swift firebase firebase-authentication firebase-security,read fireba rule without authentif,5,authentication|security|password|user account|signing,0.30166754126548767
zassx point inde use method firebas ios sdk method instead signin use email password info https://firebase.google.com/docs/auth/ios/password-auth check list regist user firebas authent dashboard https://console.firebase.google.com good print error descript error object,2017-10-25 14:34:34.593 UTC,79,46935213,tri login user updat firebas trace error follow error error domain=firautherrordomain code=17007 email address alreadi anoth account userinfo={nslocalizeddescription=th email address alreadi anoth account error_name=error_email_already_in_use} look seem firebas user alreadi sure fix believ never sign user close app unabl login user code,0.12658227848101267,10,firebase firebase-authentication ios swift,firebas email alreadi error,5,authentication|login|scripting|signing|password,0.300666868686676
authent user go tab firebas consol default secur rule firebas someth :- mean authent usersthos user sign either gmail facebook gitter email..etc read write data...clearli authent user retriev data default secur rule good practic allow authent user access db secure.if want read data anyway modifi secur rule this:- warn :- recommend make app privat db better altern :- sign userstart email-password firebas email- password auth access db read secur rule,2016-09-09 11:38:11.7 UTC,106,39410732,"tri simpl task valu firebas ad imag relev screen least one print command print messag consol work tri fix 1,5 day still idea work code tri viewdidappear succ",0.12264150943396226,13,firebase firebase-realtime-database ios swift,"firebase,swift abl retriev data",4,authentication|security|signing|password,0.29971176385879517
doug comment possibl requir time user write post write timestamp known locat say valid write locat valid write new post current valu least one day ago need someth along line rule new post,2019-01-28 11:58:48.27 UTC,123,54401530,want limit non premium user post one post per day premium user limit unclear databas rule moment valid user post databas note want write addpost node databas json look rule solutionso use frank guidanc abl string rule togeth base rule everi user must verifi put valid condit common denomin write first check see user premium return fals check last time stamp one store last post howev first condit fail mean user infact premium allow post new databas rule,0.04065040650406504,5,firebase firebase-realtime-database firebase-security swift,limit non premium user write firebas databas day,2,security|validate,0.29848286509513855
work,2018-05-26 03:37:58.433 UTC,65,50539113,tl;dr perform queri secur firestor collection? firestor follow secur rule current document id userid field document userid find document go straight specif document use document id howev perform queri tell bring back document userid field current log user fail miss insuffici permiss secur error ask firestor secur find document whose userid field match log user userid? thank,0.09230769230769231,6,firebase-security-rules google-cloud-firestore swift,firestor queri secur swift,1,security,0.2974073886871338
kato comment point super new firebas bit daunt idea cannot login &amp authent want function allow creat user access firebas want user creat /user node contain stuff tell us frank two friend kato bill accomplish task firebas need notifi app new user sign ad user node observ user node .childad display new user user add friend list post handl similar fashion structur post refer creat autoid msg post allow view case user uid_1 kato save data retriev data critic read simpli go well-written firebas guid star must hope provid direct futur craft code creat firebas structur realli stuck post text pleas help us help,2016-03-15 21:59:47.767 UTC,191,36023038,research around web creat friend list system use firebas far luck given resourc quit look premis app use user login &amp authent creat accountcomplet user account add peopl regist firbas user compar friend list user add anoth user option creat post friend see user group chat side post problem know start creat friend list use firebas custom user login &amp authent peopl add user friend list see content post p.s look guidanc subject anyth resourc to/ tip,0.05235602094240838,10,firebase firebase-authentication firebase-security ios swift,creat friend list use firebas,5,authentication|security|login|user account|signing,0.2973549962043762
none,2020-01-23 20:59:42,105,59886947,problem user previou sign either googl sign-in email app cannot sign account appl sign even email hidden even though auth token handl separ appl google/fireba email user collect cannot merg keep exist user account new token exist account result 2 account exist new problemat new appl sign anyon run problem ios app upcom spring appl sign requir handl 2 token merg new old accounts? abl reproduc result appl test app https://developer.apple.com/documentation/authenticationservices/implementing_user_authentication_with_sign_in_with_appl user sign appl share email address time abl receiv user email user log abl receiv email seem appl oversight,0.1523809523809524,16,ios swift firebase-authentication apple-sign-in,new appl sign conflict googl login gener 2 user account,4,authentication|signing|login|user account,0.2950807213783264
question pretti vagu definit answer possibl thought firebas pars two differ compani therefor requir separ authent user username/password type authent pars data firebas authent code i.e user creat new account pars account creat firebas via code user authent pars authent firebas via code lot design element consid go rout creat firebas user code without app authent super user? hard code credentials? secur issu go keep two set user data? one pars one firebase? user need reset password account see control rather quickli want consid stick one platform simplifi entir process sound least one requir firebas much pars give real-tim updat need,2015-09-27 21:05:06.747 UTC,144,32812826,build ios swift app need realtim chat part function pars work well push data storag etc. support realtim firebas realtim support need help authent firebas use pars user realli know start help greatli appreci,0.10416666666666667,15,firebase firebase-security ios parse-platform swift,firebas authent pars user,6,security|authentication|username|password|signing|credential,0.2938776910305023
guess sinc authent firebas authent servic request lack auth inform firebas document authent one common secur rule pattern control access base user authent state exampl app want allow signed-in user write data https://firebase.google.com/docs/firestore/security/rules-condit try rule authent via firebas authent servic check pass rule use authent app go work ad firebas authent app ad return permissiondeni method method secur anyon chang whole databas firebas recommend develop mode creat databas go product need chang either authent app hope help understand better,2018-09-20 09:39:48.27 UTC,145,52422047,know question frequent ask howev solut propos solv tri set-up basic ios firestor app write document insid collection.i follow standard procedur ad googleservice-info.plist project call `firebaseapp.configur launch firestor rule look try save someth insid collect firebas return permiss deni error howev rule write accept obvious request seem contain auth inform find addit document miss something? thank help,0.09655172413793103,14,firebase firebase-security google-cloud-firestore ios swift,ios firebase/firestor permiss deni,3,security|authentication|signing,0.29325100779533386
key immedi user look firebas auth uid look realtim databas push ids actual uid rule go work,2019-06-13 02:45:42.327 UTC,59,56572710,read googl document still seem work set firebas rule use follow problem read/writ accordingli user authent howev follow permiss deni databas read queri swift appreci help provid tell gone wrong folk,0.05084745762711865,3,firebase firebase-realtime-database firebase-security-rules swift,firebas rule - restrict specif user author,3,security|authorise|authentication,0.29297783970832825
