answers,creation_date,len,postid,question,ratio,raw,tags,title,uniq,words,probability
rule say error say chatroomid chatroomid,2016-09-08 13:16:25.763 UTC,42,39392017,rule still get [firebasedatabase] use unspecifi index consid ad .indexon chatroomid /recent secur rule better perform properly? tri last 20 minut right help appreci,0.047619047619047616,2,firebase firebase-realtime-database firebase-security ios swift,firebas rule / [firebasedatabase] use unspecifi index,1,security,0.195026695728302
code current log usernam refer pleas go link https://firebase.google.com/docs/database/ios/read-and-writ,2017-02-28 05:48:06.527 UTC,58,42501107,access databas data put string variabl swift? access usernam current user log in? exampl retriev current user usernam json tree make new rule add current messag exampl chat room repres messag sent? add current rule without affect user rest data,0.06896551724137931,4,firebase firebase-realtime-database firebase-security ios swift,firebas databas data swift,2,security|username,0.1946343630552292
,2019-07-30 06:10:15.413 UTC,50,57265300,current develop ios app use firebas backend problem come .write permiss try regist user applic log tell fail save user info databas error domain=com.firebas code=1 permiss deni userinfo={nslocalizeddescription=permiss denied} secur rule firebas swift code signup page,0.08,4,backend firebase firebase-security-rules ios swift,regist user use firebas .write permiss must user log,3,security|scripting|signing,0.19416308403015137
use firebas perfectli fine make sure app need log test user appstor review put usernam password box test account submit put demo data let know app feel end user,2016-02-27 16:07:35.8 UTC,93,35671986,"creat iphon app guid local event app show schedul event use firebas retriev latest version schedul text display tabl view done app! submit app store day want know 1 appl problem reject app use firebase? 2 special code add app firebas code make secure? ps firebas rule read first app realli grate hear answer best,a",0.043010752688172046,4,firebase firebase-security ios iphone swift,ios - appl firebas,3,security|username|password,0.19398267567157745
,2017-10-02 21:36:58.09 UTC,60,46534089,best approach creat custom auth firebas user login use usernam password?i notic common approach actual mask usernam login email queri usernam login feel look work-around feel better better everyon use work-around? problem take email mask approach howev concern approach expos user email address best data structur approach? data structur,0.2,12,authentication custom-authentication firebase firebase-authentication swift3,custom auth firebas use usernam password,4,authentication|username|password|login,0.19153614342212677
none,2020-02-07 14:38:57,47,60115557,help solv firestor rule configur problem record array firestor uphon - phonenumb firebaseauth rule check record plea help write rule test. size array document giftslistselect + request.auth.token.phone_numb ad thu request larger 10 whatev giftid repeat giftslistselect struct firestor,0.0425531914893617,2,swift firebase google-cloud-firestore firebase-security,fireba firestor secur rule,1,security,0.18800102174282074
try appdeleg firebas login facebook &amp googl auth step step swift 4.1 version :- firebas + fb + googl environ insid projectignor alreadi :- fire base up:- https://firebase.google.com/docs/ios/setup facebook :- https://developers.facebook.com/docs/facebook-login/io googl :- https://developers.google.com/identity/sign-in/ios/start-integr go project appdelegate.swift file relat firebas + fb + googl :- 3.implement fb+google+logout action uiviewcontrol :- note:- alway logout login anoth social option log facebook logout first login anoth uniqu email address happi coding!!,2017-08-18 11:03:02.98 UTC,111,45755126,want implement login use googl login use facebook view use firebas auth appdelegate.swift follow class appdeleg uirespond uiapplicationdeleg { } viewcontroller.swift class viewcontrol uiviewcontrol gidsignindeleg gidsigninuideleg { } //there,0.1981981981981982,22,facebook-login firebase-authentication google-login ios swift,googl facebook firebas login authent use swift 3 ios,5,login|authentication|delegation|signing|integrity,0.18392717838287354
data path valid rule cater last rule work probabl updat data structur remov node sinc add valu,2016-08-01 01:53:39.387 UTC,59,38690000,use firebas &amp ios tri valid user tri submit comment rule databas structur comment post success delet portion tri put outsid block still result failur regardless error simul try add comment working? miss,0.06779661016949153,4,database firebase firebase-security ios swift,firebas valid rule work,2,security|validate,0.18309056758880615
none,2020-01-11 21:21:32,62,59698737,premise:th rule current run rule user imag display know user 1 phone test logout log rin repeat doubt someth rule specif auth! nil part make imag return.i say rule user imag albeit alway one upload rule allow anyth nevertheless show code fetch imag user fireba code fetch imag fireba ... .... .,0.016129032258064516,1,swift firebase firebase-storage firebase-security,tweak storag rule fit app,1,security,0.18275272846221924
,2019-05-23 22:16:12.79 UTC,45,56283588,want make littl social media app page fetch regist user firabs databas tableview follow video 14.23 code give error https://www.youtube.com/watch?v=qd582zfxlgo listen /user fail permission_deni firebas databas rule look swift code solv permiss error? allow access show data databas,0.022222222222222223,1,firebase firebase-security-rules swift,swift firebas fetch user,1,security,0.1776726394891739
none,2020-04-11 17:29:37,99,61160928,implement fireba googl sign-in ios/swift whole everyth work except sign googl account sign back in. even error messag sign-in function execut happen age sudden log back sign sign back notic fireba chang document someth it? fail work fireba doc https://firebase.google.com/docs/auth/ios/google-signin help greatli appreciated! googl sign-in implement app deleg - view control login user implement googl sign-in extend view control gidsignindeleg - - call gidsignin deleg present control well check user current sign in. log user automat app load final view control signs-out user look - thank much,0.21212121212121213,21,ios swift firebase firebase-authentication google-signin,ios fireba - sign sign back,4,authentication|signing|delegation|login,0.17346231639385223
good hear solv read comment section want anyway write answer similar problem past default firebas databas readable/writ authent usersif take look rule insid firebas consol find follow let non authent user read/ write data chang rule follow solut,2017-05-03 15:17:28.137 UTC,93,43764053,problem search web found realli one answer work app user post imag feed post imag load one problem keep get error permission_deni output quit confus look answer got try ref.removeallobserv code alreadi code check pleas let know answer output 2017-05-03 08:06:31.771 postflur[21064] [firebase/database][i-rdb03812] listen /post fail permission_deni,0.03225806451612903,3,firebase firebase-realtime-database firebase-security swift,firebas permission_deni run program,2,security|authentication,0.16938571631908417
pretti sure need specifi user allow access document collect shown document basic read/writ rule differ,2018-06-28 02:29:54.007 UTC,44,51073866,keep receiv error current permiss let anyon anyth ideal test code tri run get error message? run latest version june 27 2018,0.022727272727272728,1,firebase firebase-security-rules google-cloud-firestore swift,firestor insuffici permiss,1,security,0.16732317209243774
turn work expect deploy even though work simul replac trick simul rule great step toward usabl product hello googl debug rule ??? work simul live deployment. rewrit,2018-06-26 12:19:59.373 UTC,82,51042797,problem cloud firestor secur rule code tri updat field exist document non-authent user dictionari valu firestor log show request request fail miss insuffici permiss simul simul data simul allow updat code swift project/io use method exist document refer paramet pass array idea wrong? thank,0.04878048780487805,4,firebase-security-rules google-cloud-firestore ios swift,firestor secur rule work simul fail app,2,security|authentication,0.16623112559318542
,2016-10-04 16:38:49.887 UTC,100,39857602,ok unsur thing firebas secur hope guy help clear thing great topic noob question clear 1 firauth.auth manag token connections? simpl code project need do? connect firebase? mean data sent via get/post encrypted? gener token authent check that? 2 suffici rule stop access db? defin rule databas want achiev abil save score valu db howev databas access user log entri abl access anoth player score 3 test rules? dummi user privileg consol test these? how? 4 possibl sql inject sql database? method tri stop exampl stop mitm attack etc.? appreci answer,0.09,9,firebase firebase-realtime-database firebase-security ios swift,question firebas secur swift,7,security|encrypt|authentication|privilege|sql injection|mitm|attack,0.16485381126403809
user data public pars directli queri user need queri user explicitli add queri,2015-12-08 06:27:18.417 UTC,82,34149389,current work ios app witch use parse.com backend model bit concern privaci user sinc need function user search user send invit need user class public want email address public learn stackoverflow request year first idea add anoth class privat data point class privat class acl secur object level lose function reset user password anyon found solut keep reset function? someth cloud code,0.04878048780487805,4,parse-platform pfuser security swift,privat data pfuser,3,security|privacy|password,0.16458651423454285
answer api document initi password reset given email address see firautherror list error code common api method swift 3.x firebas 3.x look edit firebas 4 chang firebas function align name convent swift,2016-03-05 00:15:55.933 UTC,55,35808352,wonder guy show setup reset password swift current use firebas backend servic need code,0.07272727272727272,4,firebase ios passwords reset swift,firebas reset password swift,1,password,0.16356757283210754
ask email password function retriev email/password firebas retriev password class user email retriev need redesign code allow app save password local use simpli make user reenter,2019-08-04 07:10:25.183 UTC,71,57344589,tri allow user chang email password research authent work question answer howev creat grab user email / password section? sure enter field take look quick help tab explain paramet emailth user email address.passwordth user password code,0.18309859154929578,13,firebase firebase-authentication swift,grab credenti valu authentication? question updat,4,authentication|credential|password|signing,0.16273370385169983
configur firebas authent rule password strength see password requir make account firrebas firebas password valid allow regex restrict code prevent malici user bypass call api directli password strength hard requir app consid implement custom authent exampl custom usernam instead email password authent help function includ rang 6-15 i.e minimum 6 maximum 15 characters.on capit letter one number respect func return true valid password string,2017-07-27 08:05:00.683 UTC,99,45344777,applic link firebas databas authent user creat account requir password 6 charact anyway make password complex make capit letter number firebas directli need code,0.20202020202020202,20,firebase firebase-authentication firebase-realtime-database swift,firebas authent password must contain capit letter,6,authentication|password|validate|malicious|bypass|username,0.16250748932361603
solv it! scheme basic correct add,2017-01-05 14:55:56.723 UTC,99,41488062,problem tri wishlist member authent ios swift applic goal retriev current user email address i’v tri interpret info http://codex.wishlistproducts.com/tutorial-authenticating-with-the-wishlist-member-api-from-a-non-php-application-ios-android-netetc/ keep get success :0 error_cod :65537 error access deni - invalid authentication” first step work i.e i’m abl “lock” cooki i’m use swifthash md5 1 run auth command order “lock” cooki work fine lock cooki 2 run follow request use api key “lock” cooki gener error success :0 error_cod :65537 error access deni - invalid authent 3 run request url run yet,0.1414141414141414,14,authentication ios swift wordpress,wishlist member authent wordpress site non php applic,5,authentication|validate|cookie|hash|md5,0.15719623863697052
understand correctli want allow write new document still contain valu field array secur rule want check ad compar someth,2020-02-29 11:33:17,50,60464680,remov map element test field remov myid key test key item remov secur rules? work although rule work record,0.08,4,swift firebase google-cloud-firestore firebase-security,fireba cloud firestor secur rule updatedata fieldvalue.delet [swift,1,security,0.15705859661102295
addit comment good luck edit better someth creat user firebas auth someth exampl useritem struct check exampl code hope help,2017-03-19 11:47:50.127 UTC,62,42886226,still new swift code xcode use firebas abl creat sign login page firebas authent wonder allow peopl creat custom uniqu usernam search web find much want learn implement usernam app user creat uniqu usernam profil,0.12903225806451613,8,firebase firebase-authentication ios swift,creat usernam firebas,4,authentication|username|signing|login,0.15495902299880981
code refer look,2017-07-06 00:04:24.91 UTC,36,44937797,attempt creat firebas login/signup matter enter email textfield print error email address badli format even valid email beginn so...sorri format code,0.1388888888888889,5,email firebase firebase-authentication ios swift,firebas email authent ios email badli format,4,authentication|login|signing|validate,0.15467198193073273
function look ? call firebas instance.then go app dashboard custom email send user upon password chang,2016-04-08 15:31:31.063 UTC,67,36503603,troubl understand firebas document login viewcontrol button allow user reset password user press button open alert control user input email sent password reset/ recoveri firebas backend server automat gener code send user reset email? provid code? sendpasswordresetforemail? . firebas backend servic handl here?,0.13432835820895522,9,firebase firebase-authentication firebase-security firebasesimplelogin swift,password recovery/ reset,4,authentication|security|login|password,0.150689959526062
guess found reason workaround / solut problem embed even cach one easili hide accord valu without observ anoth node server rule edit seem line mark overrid child rules. use caus effect cach data display,2016-10-02 19:12:14.447 UTC,122,39820643,let assum user store privat data either share other decis store kind user set valu other abl read privat data enabl tri solv server rule work fine unfortun chang rais event observ user observ path chang privaci still see data cach persist data store case data hidden other this? edit found data read observ alway return cach data matter happen app get restart edit 2 think came conclus problem easili solv callback gave back permiss deni error,0.02459016393442623,3,firebase firebase-realtime-database firebase-security ios swift,firebas enabl user decid privaci data,2,security|privacy,0.14999566972255707
altern,2016-06-05 17:39:19.267 UTC,57,37644874,swift app sign user user prompt select usernam usernam store firebas realtim databas usernam respons valu enter user happen part sign method firauth.auth?.createuserwithemailemail password passwordultim { user error // . error != nil { verifi usernam avail set valu kind queri check duplicates? databas sampl data qwerty12345 uid,0.21052631578947367,12,firebase firebase-authentication firebase-realtime-database swift,verifi usernam firebas avail,5,authentication|username|availability|signing|password,0.14617228507995605
updat swift 3 firebas 4.8 forc unwrap nil line caus crash remov,2016-07-04 19:30:14.567 UTC,77,38191190,work new app use firebas manag backend stuff user login etc creat login/signup screen user load app tri load homescreenvc user alreadi log user direct login/regist vc kind work sens work user alreadi currentus issu user never load app crash detect currentus code appdeleg error help great! use latest version firebas swift 2,0.11688311688311688,9,firebase firebase-authentication ios login swift,firebas + swift bypass user login screen,5,authentication|login|bypass|signing|delegation,0.14579792320728302
first check variabl name properli swift camelcas second tri assign textfield object password insid dictionari third tri print segu outsid login action.consid edit code,2018-11-19 12:18:41.153 UTC,87,53374479,new ios develop learn go use cloud firestor authent user via email/password tri simpl email &amp password authent use one db rule document think creat collect document rule alreadi test connect db issu either code far error cannot invok setdata argument list type [string any] complet error? -> void? someth doing? someon help email/password authent,0.12643678160919541,11,firebase-authentication google-cloud-firestore ios swift,cloud firestor authent ios,4,authentication|password|signing|login,0.1433689445257187
like googl login enabl firebas dashboard enabl go firebas dashboard click project tap authent sign-in method find googl hit enabl need import app deleg podfil appdeleg step miss offici googl instruct,2018-05-02 16:01:35.403 UTC,71,50138922,follow instruct offici firebas channel https://firebase.google.com/docs/auth/ios/google-signin?hl=en-419 subscrib app use googl authent problem appear function resolv identifi googleauthprovid auth command i.e unresolv identifi googleauthprovid import viewer appdeleg podfil look work swift 4,0.14084507042253522,10,firebase firebase-authentication google-authentication ios swift4,googleauth use firebas ios,4,authentication|signing|delegation|login,0.14181341230869293
creat multipl token use singl sign-in firebas,2018-05-26 20:15:32.527 UTC,36,50546661,want creat login page use sign method multipl token paramet register id &amp password function ? yes how? firebas document,0.16666666666666666,6,firebase firebase-authentication ios swift,multipl token sign-in use firebas,4,authentication|signing|login|password,0.1414797008037567
try someth compil without warn,2016-04-15 04:20:50.09 UTC,58,36638211,abl success authent login facebook use basic sdk procedur confus tri authent firebas read document copi past code still get warn read 1 warn mean fix it? 2 email password sign see regist user creat know see user regist facebook authent firebas db? thank help direct,0.1724137931034483,10,facebook-login firebase firebase-authentication swift,facebooklogin.loginwithreadpermiss firebas issu,4,login|authentication|password|signing,0.14015726745128632
,2017-10-22 18:30:17.963 UTC,22,46877730,2017-10-22 18:18:02.498 studycook[17238] [firebase/database][i-rdb038012] setvalu removevalu /users/user_id/test/abc fail permission_deni secur set /users/$uid follow wrong?mi code,0.09090909090909091,2,firebase firebase-realtime-database firebase-security swift,firebas permiss deni,1,security,0.13997825980186462
unless server-sid check password expos password firebas rule reason order check user input correct password must check actual password check actual password read begin goe encrypt everyth done client side possibl someon revers process,2017-02-26 21:19:49.477 UTC,99,42474376,make room channel user join creat howev want user give option add password channel creat wonder possibl add password firebas encrypt one option cours upload password string firebas normal valu readabl anyon sinc .read rule say true anyon see password want question possibl yes how? code help creat channel ibact function channel.swift select cell function,0.1414141414141414,14,firebase firebase-authentication firebase-realtime-database firebase-security swift,possibl add password child firebas,4,authentication|security|password|encrypt,0.13874629139900208
,2018-06-14 08:45:35.86 UTC,65,50853305,use structur save user friend realtim databas rule look within ios app access friend other although abl so.also seem mainli issu one singl view sinc chang still read data specif view.in view howev although code nearli except observ instead i´m call time take load friend callback long take even >5 second 5 friend happen? best regard,0.015384615384615385,1,firebase firebase-realtime-database firebase-security-rules ios swift,firebas rule work consist,1,security,0.13634556531906128
none,2020-02-12 06:02:48,55,60182057,applic launch privileg xpc similar swiftprivilegedhelp run privileg task first authorizationref launch authent alert need enter user name password return receiv pass xpc launch xpc via xpc run privileg task want run applic silent mode without ui termin skip authent alert without ui via termin shell script,0.21818181818181817,12,swift shell privileges xpc,authorizationref via termin,6,privilege|authorise|authentication|user name|password|scripting,0.13444723188877106
recommend creat object provid firebas sdk error receiv use see fit rememb correctli enum case etc simpl pseudocod exampl feel pain found swift sdk document lag quit bit chang come along,2018-06-07 03:28:50.383 UTC,92,50732505,whenev sign sign user print gener warn label instead actual issu print error receiv verbos show user error domain=firautherrordomain code=17009 password invalid user password userinfo={nslocalizeddescription=th password invalid user password error_name=error_wrong_password} error domain=firautherrordomain code=17008 email address badli format userinfo={nslocalizeddescription=th email address badli format error_name=error_invalid_email} fetch error code specif error messages? look document unsuccess come anyth,0.14130434782608695,13,firebase firebase-authentication swift,fetch error code firebas,5,authentication|signing|password|validate|scripting,0.13182733952999115
,2018-11-09 23:53:04.127 UTC,42,53234735,abl app user regist email password abl make post integr facebook login abl make post write firebas look permiss necessari user wasnt abl find anyth follow code post firebas sure els put,0.11904761904761904,5,facebook-login firebase-authentication firebase-realtime-database ios swift,enabl facebook user make post,4,login|authentication|password|integrity,0.13094128668308258
dont know help add addstatedidchangelisten appdeleg check whether current user log ad code appdeleg skip viewcontrol user log,2017-07-03 15:30:07.677 UTC,57,44889320,issu ios app use firebas sign follow code although app ui reflect signout get follow consol messag [firebase/database][i-rdb03812] listen /media fail permission_deniedalso sign differ user credenti app sign old user idea,0.15789473684210525,9,firebase firebase-authentication ios swift,firebas signout perform expect,4,authentication|signing|credential|delegation,0.12939327955245972
type error cast try,2017-08-15 17:15:55.863 UTC,42,45698017,code servic sign-in user error domain=firautherrordomain code=17008 email address badli format userinfo={nslocalizeddescription=th email address badli format error_name=error_invalid_email} valu 17008 abl custom behaviour ? note previou version simpli last version,0.11904761904761904,5,firebase firebase-authentication ios swift,firebas sign fail error code,4,authentication|signing|scripting|validate,0.12532781064510345
fairli opinion base yes standalon db store user usernam sign requir quick web request php file queri row return usernam firebas sign method feedback asynchron callback sign yet error print,2016-08-09 02:44:34.85 UTC,91,38841240,built custom authent system use firebaseauthent token signup / login flow work user press login button server gener authent token send client check user alreadi exist auth tabl database? sign use show form enter custom inform name etc. sign use save custom inform databas question find user alreadi sign up?would publicli access databas go,0.17582417582417584,16,firebase firebase-authentication swift,check user alreadi sign,4,authentication|signing|login|username,0.12368177622556686
none,2020-04-10 20:09:28,69,61147939,implement usernam check firestor applic validatetextfield function return boolean valu text field valid passes/fail implement checkusernam function asynchron fireba call firestor check usernam uniqu handl return within function neither work wonder function properli less hacki accomplish unless misunderstand function exactli need end goal check usernam alreadi taken firestor return fal allow sign function execut display error messag user,0.11594202898550725,8,google-cloud-firestore swift5,swift5 - wait escap firestor asynchron function return,4,username|validate|hack|signing,0.12329872697591782
encount exact problem build mail app creat simpl ios framework allow login multipl googl account oauth hope help https://github.com/thywis/multiaccountoauth,2016-11-16 03:39:53.29 UTC,66,40623664,follow link googl start integr googl sign-in ios app need log multipl googl offic 365 salesforc account login one googl account option seem logout account allow anoth login miss allow log via multipl account simultan,0.15151515151515152,10,google-signin ios iphone oauth swift,oauth 2 differ googl account ios app,4,signing|oauth|integrity|login,0.12074746936559677
solved! ad check,2017-12-09 11:56:47.953 UTC,68,47728342,firebas googl login app.th rule allow login compani domain @mydomain.com mail user log correctly.when try sign anoth mail messag consol app remain login view control noth appen intercept messag show alert screen? code app deleg didfinishlaunchingwithopt login error gmail login firebas login work error never invoked.th error write/read error due restrict compani domain.wher handl read/writ error,0.14705882352941177,10,firebase firebase-authentication swift,intercept firebas login event fail permission_deni,4,authentication|login|signing|delegation,0.11778127402067184
