answers,creation_date,len,postid,question,ratio,raw,tags,title,uniq,words,probability
authent fireba - object return therefor see statu new exist user,2020-01-25 08:17:28,106,59907526,current work signup/login app fireba authentication.i custom button facebook signup/login googl signup/login exampl code facebook signup/login button take user anoth view control add addit inform account yet creat account app facebook account howev find determin whether facebook account previou account app case want log user take main screen this? method hope return error account app credenti facebook account work end creat new account facebook account previou creat account edit desir flow 1.sign facebook/googl → 2.enter addit info → 3.creat account fireba authent,0.1320754716981132,14,ios swift facebook firebase firebase-authentication,check google/facebook account alreadi creat account fireba auth,4,authentication|signing|login|credential,0.29202109575271606
queri whether one given key valu note type data structur string boolean -- someth look for! want creat secur rule path import note rule declar wildcard key repres autogener ids indic rather index child properti structur anoth layer nest want index immedi leaf node valu,2016-05-31 17:19:51.44 UTC,79,37551951,structur want .indexon auto-gener uniqu groupmemb ids tri still get error consid ad .indexon groupmember/-khfhehfwdb1213 /post add .indexon uniqu id? updat queri swift,0.0379746835443038,3,firebase firebase-realtime-database firebase-security ios swift,firebas secur rule .indexon uniqu ids,1,security,0.2905762791633606
,2017-08-28 11:21:12.483 UTC,125,45917791,app retriev array user within certain radiu use geofir howev app need dismiss user applic therefor two array array 1 user within radiu array 2 user dismiss question sorri long winded effici remov array 2 1? array hundr item filter array sure ineffici &amp slow get final array lightbulb moment stumbl across firebas databas rule exampl possibl creat child firebas databas non-applic user rule != .read? read doc rule state rule filter howev see effici filter array alway help appreci ad current data structur log user yhgezlxjhuxkmbnk1erwkc4xmo83 run queri .keyent geofir key search user databas use self.getresultskey key howev user decid user result applic come back result must referenc somewher i.e array 2 mention,0.008,1,arrays data-structures firebase-realtime-database firebase-security swift,firebas databas data structur use rule,1,security,0.2905533015727997
best approach creat cloud function check usernam taken simpli return true fals rule true mean anyon read write databas insecur use cloud function allow abstract code use platform android web check cloud function document setup call cloud function admin sdk function full access databas queri databas etc rid messag chang rule tell firebas server add index allow perform ordering/filt server instead client,2019-08-01 00:25:37.277 UTC,147,57300395,tri check usernam alreadi exist databas code written far work howev inconsist sometim enter usernam alreadi exist print statement appear clearli alreadi taken sometim let know alreadi taken notic statement consol use unspecifi index data download filter client consid ad .indexon usernam /activeusernam secur rule better perform sure caus inconsist check howev quit sure chang edit secur rule effici data struct activ usernam help display user uid usernam associ uid secur rule,0.09523809523809523,14,firebase firebase-realtime-database firebase-security-rules swift,realtim databas - chang secur rule check usernam exist,3,security|username|insecure,0.2885584533214569
none,2020-02-23 13:54:06,60,60362903,restrict user access high-level node want give user abil read subnod data structur rule code access data look swift one one unfortun realli understand idea behind differ approach want give access company1 user profil deni everyon els rule seem rel straightforward obviou someth wrong even user read compani inform permiss deni,0.016666666666666666,1,swift firebase firebase-realtime-database firebase-security,fireba rule permiss deni,1,security,0.2837839722633362
see secur &amp rule quickstart secur firebas rule use determin read write access databas well ensur structur data found secur tab app dashboard come three flavor answer question add secur rule uniqu key use togeth exampl help,2016-03-04 04:55:24.307 UTC,100,35788264,seen sever question place specif secur rule firebas figur case save inform authdata.uid get info.. add secur rule uniqu key how?? query. insight welcome!! * updat * yeah forgot add currentus is. queri actual give back relev inform includ specifi warn try second answer time updat post work anyon els idea pleas post,0.09,9,firebase firebase-security swift,firebas secur rule .indexon uniqu uid ios/swift,2,security|forge,0.28356069326400757
code remov singl valu rule reject write delet entir databas write delet singl schedul id want disallow add rule correct path someth,2018-11-05 16:44:03.37 UTC,49,53158635,secur rule follow still abl delet record wrong? code swift attempt remov entri accord secur rule fail succe,0.08163265306122448,4,firebase firebase-realtime-database firebase-security-rules swift,firebas secur rule prevent removevalu,1,security,0.28293249011039734
,2018-08-17 11:43:37.357 UTC,92,51894717,use firebas authent servic ios applic want sign-in app use email googl sign-in provid appli firebas instract login email password sign-out firebas signout method later sign signout googl success re-authenticait email password messag return password invalid user password sign-in email firebas consol user account symbol chang mail googl sign googl sign-in provid email solv problem wrong? code part addit reset password firebas consol sign-in two two imag appear consol togeth solv trouble? thanks! appdelegate.swift logout button action,0.30434782608695654,28,firebase firebase-authentication google-signin ios swift,firebas sign-in email googl sign-in error password invalid user password,7,authentication|signing|password|validate|login|user account|delegation,0.2821294367313385
,2018-07-18 22:12:56.733 UTC,89,51411711,user sign app load data databas follow structur -- --- --- read trigger standard auth state chang handler rule node follow everyth work fine start app user alreadi authent user sign runtim data consol give follow messag almost look databas rule auth know user authent new credenti abl queri node strang enough try refresh token wrap subscript code still error messag consol data arriv user alreadi authent rule know read allowed? wrong,0.11235955056179775,10,firebase firebase-realtime-database firebase-security-rules ios swift,firebas realtim databas queri fail due secur rule user authent work otherwis,5,security|authentication|signing|credential|scripting,0.28139257431030273
tri prevent duplic firebas usernam done right createus stage assum dialog present new user ask creat account desir usernam password send createus error alreadi exist notifi ask differ usernam user creat probabl add info /user node well,2016-04-28 13:00:09.28 UTC,115,36915473,want prevent duplic usernam signup form user enter creat email login firtli createus auth setvalu user dictionari stack firebas secur set check handl situat handl alway respons error secur rule fix everyth prevent duplic user? updat frank answer know need signup new user swift situat need add user uid time two differ nodes? someon explain swift great add new user inform usernam parent node need anoth secur rule,0.1391304347826087,16,firebase firebase-authentication firebase-security ios swift,prevent usernam duplic signup firebas,6,authentication|security|username|signing|login|password,0.280811071395874
rule show suggest id document match uid user obtain firebas authent standard practic code write document rule work expect uid user id document,2019-03-25 03:43:04.95 UTC,58,55330996,firestor doc one recommend write secur rule howev creat user userid differ auth.uid random string total random make match automat new user creat,0.05172413793103448,3,firebase firebase-security-rules google-cloud-firestore ios swift,make cloud firestor auth uid match userid,2,security|authentication,0.28034085035324097
@frank van puffelen suggest obfusc data encrypt prevent unwant eye view inform add workload sinc need perform encrypt decrypt either end app client server believ take advantag firebas cloud code minimis amount code execut perform devic never tri unabl confirm far encrypt key option user password one ensur encrypt without reveal key admin sinc password firebas alreadi obfusc viewer issu user lock password chang prevent decrypt store local store key local devic mean user enter key one auto-gener upon launch app first time store app storag retriev requir whilst believ safest mean app use across icloud devic sinc key store local final allow store data cloud privat access user cloud devic realis code exampl current desk sorri anyon els edit code exampl grate hope help featur exist admin access consol admin sdk abl read collect document time,2018-04-06 10:18:54.987 UTC,178,49690562,current use cloud firestor ios app allow user store expens databas order secur privaci make sure read data input databas queri still work admin abl see user put databas,0.08426966292134831,15,firebase firebase-security-rules google-cloud-firestore privacy swift,restrict read access admin firebas firestor databas,7,security|privacy|obfuscate|encrypt|crypt|password|safe,0.27935847640037537
aws document quit confus much trial error abl success cognito sign authent log un-authent sign quit honest fulli understand call certain thing best abil explain cognito work first assum user alreadi log authent check see true reason entri point storyboard view control user see log done code run appdeleg launch need fix user log startpasswordauthent call code defin extens appdeleg protocol awscognitoidentityinteractiveauthenticationdeleg furthermor startpasswordauthent call everi time user need log user alreadi log app start call anoth note question - getdetail call launch user sign launch user sign call call sign sign make sure entri point storyboard logged-in screen statement follow entir sure feel free correct aws automat access entri point upon success log-in everyth go @objc func loginus look correct make sure entri point log-in screen rather show success log pictur storyboard try ad follow quit sure exactli work result proper authent appdeleg right variabl storyboard add boolean isiniti add code cognito configur right return statement didfinishlaunchingwithopt replac return statement current didfinishlaunch follow make sure deleg viewdidload method login screen note import awsauthcor implement protocol log-in vc add variabl class variabl view control user see log referenc final make sure check user attribut initi screen viewwillappear exampl call function fetchuserattribut method final code sign hope help understand realli confus honest quit confus write good luck feel free messag question,2018-06-22 12:59:45.78 UTC,272,50988499,integr cognito xcode project sign up/password updat featur work correctli howev seem sign process work turn log follow error implement awscognitoidentityinteractiveauthenticationdeleg deleg appdeleg script appdeleg code loginvc code one thing note getdetail never get call didcompletestepwitherror method click sign button noth happen,0.1323529411764706,36,amazon-cognito amazon-web-services aws-cognito ios swift,aws cognito sign work swift-io,7,signing|integrity|password|authentication|delegation|scripting|login,0.27910903096199036
,2017-11-19 10:26:26 UTC,105,47375812,tri linkwithcredenti function firebas auth sure whether use understand correctli login page 3 button app login email login facebook login googl user login one provid everyth work great everi provid sign-in method user want login app differ provid firebase.auth.logout function properli log firebas appear must need user still logged-in order link account differ provid sinc user logged-in anymor cannot firebase.currentus sinc null need current user provid email sign-in silent credenti link new provider? clear whether need allow multipl account email address enabl firebas consol possibl linkwithcredenti without option enabled? help exampl android ios realli help,0.12380952380952381,13,android firebase-authentication ios swift,firebas account link email/password facebook googl,5,authentication|password|credential|login|signing,0.2767469584941864
nativ cloud firestor ensur uniqu data neither rule sdk although believ follow link help achiev appli similar case accept answercredit frank van puffelen stackoverflow post explain achiev want workaround check articl approach quit simpl gener order check uniqu make collect x everi document correspond x valu need uniqu documentid document collect name valu want uniqu thu try save search result firestor check x collect see documentid fit search result add everi time documentid exist add search result collect misconvi case documentid document contain messag name order work let know help,2019-12-15 23:30:52,105,59348998,rule data firestore:how prevent data duplic user,0.009523809523809525,1,firebase firebase-security google-cloud-firestore swift,prevent duplic firestor swift,1,security,0.2725364565849304
swift 5 authent code extens extens file decod default valu credenti signin try follow format cloud firestor realtim databas // check auth uid equal databas node uid // word user access data,2018-11-16 12:26:22.607 UTC,64,53337904,implement log-in registr view authent via firebas authent database? chang rule put wrote code obtain user uid say databas authenticated? ps need exampl swift,0.140625,9,firebase firebase-realtime-database firebase-security-rules swift,firebas databas authent swift,5,security|authentication|decode|credential|signing,0.27232152223587036
first store user passwords? store plain text? certainli secur recommend firebas store user password store hash password proper store password cannot convert plain text addit api get user password due secur concern event want listen one potenti option allow updat password app howev requir theuser know current password reset password know howev sinc password save databas perhap design work around password authent user updat password ask user updat password next time sign updat password re-authent updat password make sure accur recommend take look link inform authent user password email manag user firebas verifi user current password,2017-10-26 13:57:35.523 UTC,162,46956337,actual devellop ios app swift firebas onlin database.so concept user sign firebas authentif email password write email password database.but want implement reset mail password firebas auth send password reset.thi function work well want updat password databas too.i know it.her code code send reset email user user chang password link send mail recov password,0.2222222222222222,36,firebase firebase-authentication ios swift,recov password firebas auth reset password mail firebas databas,5,authentication|password|signing|security|hash,0.2678127884864807
anyon get similar secur warn jsqmessag / firebas tri add index array possibl firebas error messag tell surprisingli accur need add index mean need add index user ineffici denorm recommend altern recommend answer last question creat custom index process known denorm data structur look group user without even need queri want current authent user,2016-02-21 18:25:14.113 UTC,89,35540080,get error xcode use unspecifi index consid ad .indexon members/rsenov /group secur rule better perform json data structur done far secur rule code trigger error,0.06741573033707865,6,firebase firebase-realtime-database firebase-security swift,firebas indexon secur & rule work,2,security|authentication,0.26764169335365295
know noth firebas know someth appear alert print see least two execut path end alert print miss find level effort adequ answer s.o question pure theoret broken problem secur rule queri user authent queri fail rule state user authent order queri databas auth != null need creat anoth child call usernam make readabl anyon without authent check usernam taken claim new user auth call creat user user child firebas allow duplic user name look error try creat user 4 error return,2016-11-15 20:48:58.263 UTC,127,40619433,tri check usernam uniqu regist user know ton question went howev problem anyth print usernam exist even regist usernam wrong? seem find answer thing wrong nest struct code even tri differ secur rule make differ use thing wrong,0.10236220472440945,13,firebase firebase-realtime-database firebase-security swift,firebas usernam uniqu swift,4,security|username|authentication|user name,0.26746025681495667
,2018-06-19 21:51:30.36 UTC,118,50937416,absolut love firebas far except send email everi time go consol reset one user password click authent tab left go one user click right side user click reset password send email person email say messag deliv billybob123@email.com reason unsaf charact length usernam know issu usernam idea app user sign sign email firebas must think usernam failur email show email server tri send email show password reset link exampl link https://greenbananatech-jbs.firebaseapp.com/__/auth/action?mode=resetpassword&amp;oobcode=chubw2ckiyybjvauvipyuevyhtr-kkyljfrhabglpfkaaafkgfcgkw&amp;apikey=aizasydyrckvfznww2v_bubstfv85s2lsww8ho4&amp;lang=en see think issu lie empti space .com think usernam suppos go know usernam user alreadi chang display name user xcode project anyth click faulti link faulti work perfectly! pictur failur email thank much top email bottom email,0.1271186440677966,15,firebase firebase-authentication swift,firebas swift password reset email attempt send user,5,authentication|password|unsafe|username|signing,0.2662416994571686
,2017-05-19 19:44:25.433 UTC,77,44077937,within firebas implement rule restrict access node user current log node look creat follow rule base onlin firebas document mean log user see data i.e user data client environ swift made simpl test routin run code first print consol test a_really_long_uid_str second print statement chang rule restrict access log user print statement xcode consol anyon know troubleshoot this? wonder either auth.uid $uid nil someth server reason access deni,0.03896103896103896,3,firebase firebase-authentication firebase-realtime-database firebase-security swift,debug firebas authent rule,2,authentication|security,0.26598599553108215
overrid problem store intern databas currentid open app currentid consequ info user problem facebook login solv issu good job try sign user silent make sure wether properti alreadi avail - idtoken accesstoken ..etc call assum paramet type look - void signinsil :- googl doc accord firebas offici document add follow function appdeleg want work ios 8 less add function alreadi try ad function suggest firebsa see fix error sure gonna solv least improv gid featur edit sourc https://firebase.google.com/docs/auth/ios/google-signin success googl sign-in authent firebas user work use follow code believ work intend issu sign user test app googl sign-in librari make assumpt user explicitli sign app ask user permiss sign user explicitli sign user call call succeed without display kind sign-in screen entir sure ask want check user alreadi sign googl account,2016-08-20 09:55:34.667 UTC,179,39052766,implement googl signin firebas ios app follow firebas guid problem everi time test login alway ask permiss code appdeleg involv googl signin code view control gidsigninbutton search lot web found nothing. prevent ask permiss everi time,0.12849162011173185,23,firebase firebase-authentication google-signin ios swift,firebas googl signin ask everi time permiss,5,authentication|signing|login|delegation|availability,0.2659233510494232
link email password user account creat via phone authent firebas auth enforc 2 factor authent next time user sign user abl log either email/password phone without requir both.you need implement custom solut this.pleas file request via firebas support offici firebas googl group 2 factor auth wish verifi phone number link account requir next sign-in creat user email password ask user phone number call resolv verificationid initi phone auth credenti get sms code final call currentus use phone credenti add phone number email/password user consid verifi next time sign email/password access via user.phonenumb,2017-05-19 00:08:27.797 UTC,125,44059519,look swift make user sign his/her phone number add his/her email password user log he/sh log email password phone number secur reason,0.152,19,firebase firebase-authentication firebase-realtime-database ios swift3,possibl email phone number authent firebas,6,authentication|signing|password|security|user account|credential,0.2651461362838745
turn token refresh mention updat solv issu first refresh auth token success refresh user issu thought reload user refresh token imagin thing sync check email verifi got firestor databas need refresh token know email verifi,2018-06-17 08:14:52.037 UTC,182,50894869,secur rule setup firestor consol firebas auto logs-in new user therefor recent user non verifi email address user verifi email get result app make request firestor get error back say user enough permiss access data sign user sign back everyth work fine initi thought mayb token refresh ? seem extrem confus alreadi refresh current user attempt make request firestor feel miss someth user forc logged-in signup email verif statu updat accordingli ? request-reauthent ? point forc log-in ? get extrem frustrat know suppos manag user sign unverifi user someth ? lead secur concern user make fake account spam applic updat read non swift respons re-enforc suspicion go test solut tomorrow swift version doc method retriev firebas authent token possibl refresh expir remark authent token refresh make network request expir yes guess case forc refresh token expir,0.06593406593406594,12,firebase firebase-authentication firebase-security-rules google-cloud-firestore swift,firebas firestor updat email verif statu,4,authentication|security|signing|spam,0.261918306350708
,2017-12-09 17:14:55 UTC,64,47731077,db firebas structur code try chat member user chat show warn use unspecifi index data download filter client consid ad .indexon chats/-l-hpbtk51xfwjnpjz3x /user secur rule better perform use unspecifi index data download filter client consid ad .indexon users/ol0xhkbksfcrymf4mzs3vbodvt83 /chat secur rule better perform found lot solut anyth work fine want defin indexon rule db help,0.046875,3,firebase firebase-realtime-database firebase-security json swift,.indexon dynam key firebas,1,security,0.2618522346019745
error happen creat new account email authent user try merg document call linkwithcredential:complet fail credenti alreadi link anoth user account i.e tri credenti two differ account delet upon success login user email provid unlink social provid,2018-07-20 19:38:41.047 UTC,107,51449343,new appl guidelin state user abl opt-out social login switch email login facebook twitter login ad email login set view want add option social login opt-out realli firebas work case view creat new account imagin success account creation need delet unlink old provid code far error user alreadi use provid somebodi pleas point right direction? updat manag make work differ order,0.12149532710280374,13,firebase firebase-authentication swift,firebas auth new appl opt-out social login,4,authentication|login|credential|user account,0.2614957094192505
face problem found user success sign facebook need access token signed-in exchang firebas credenti final authent firebas use firebas credenti exampl forget import librari screen shot consol facebook login firebas store list email+password user store data user app sign social provid facebook noth show firebas dashboard user want store inform facebook user databas see section store user data,2016-03-15 08:08:49.4 UTC,108,36005620,implement email facebook login app use firebas code fb login email signup helper class code problem sign email user see user data dashboard firebas sign fb user data display dashboard let know issu anyth miss? show fb signup success,0.14814814814814814,16,facebook firebase ios swift,facebook login user data display firebas consol,6,login|signing|credential|authentication|forge|password,0.260907381772995
imag databas show capit want rule test coupl rule found case sensit pleas studi comment know problem solv try capit rule well queri jen suggest try instead,2017-09-22 20:28:59.217 UTC,91,46372756,use firebas swift read data firebas realtim databas one project firebas panel work fine ad anoth project today got error 2017-09-23 00:15:18.360 afgdate[2816] [firebase/database][i-rdb034028] use unspecifi index data download filter client consid ad .indexon date /data secur rule better perform databas structur role chang role one time cant read data see error consol code swift,0.02197802197802198,2,firebase firebase-realtime-database firebase-security swift,firebas error consid ad .indexon,1,security,0.2600972354412079
