postid,links,tags,title,question,answers,uniq,raw,words,len,ratio,probability
105,https://api.github.com/repos/Swinject/Swinject/issues/105,issue,inject subclass uiview,need inject depend subclass uitableviewcel inject subclass uiview ib,hi follow exampl project help investig swinject thank answer look previous look typhoon objc inject class view see swinject cours inject viewcontrol somewher els exampl project controllerviewmodel inject cellviewmodel clear inject assembl featur typhoon document give link abl answer correspond featur swinject workaround document exampl section circular inject depend compon view thank link swinject support circular depend let take time answer someth good case think still understand question link circular depend demonstr necess inject view exampl inject deleg jobexecutionview subclass uiview topic inject depend insid uiview subclass swinject see wrote ib storyboard xib sorri catch point question nib xib issu help storyboard help sorri try write question detail exampl useravatar uiview useravatar xib profilecontrol use useravatar add storyboard ui class useravatar depend userservic method downloadavatar want resolv depend use swinject see one inject userservic useravatar profilecontrol viewmodel want configur depend ui class assembl typhoon objc thank ad exampl never tri swinjectstoryboard contain view defin xib need investig answer issu find solut yet side sorri still take time investig issu first prioriti implement featur swinject v issu go take time understand problem write code without di make understand requir correctli think requir achiev swinject mayb provid implement xib storyboard see issu write simpl project show ui depend problem case similar think complex easi depend protocol need inject implement insid next relat implement thank make sampl project go check answer shortli hi issu solv creat regist viewfactori creat regist myview follow code pass contain viewfactori wrong probabl architectur correct pass instanc resolv one code instead contain mean know resolv factori strictli speak need full fledg contain function make sens yes right pass instanc correctli thank work want insid creat view code want cell depend sorri take long time answer question problem instanti made swinject contain creat instanc method use swinject contain depend inject automat configur contain problem solv method swizzl method swinjectstoryboard project swizzl write code pleas feel free reopen issu issu resolv hi guy updat resolv depend view load storyboard xib updat,2,27,inject|delegation,344,0.07848837209302326,0.3153839409351349
30,https://api.github.com/repos/watson-developer-cloud/swift-sdk/issues/30,issue,submit request updat bluemix secur,bluemix support standard requir appl app transport secur ios result need modifi app transport secur exampl applic instead submit request updat bluemix secur standard sdk client make except disabl app transport secur inform app transport secur see blog error produc applic app transport secur disabl modifi,help us request submit watson lab team collect feedback platform level issu one yesterday ad nsexceptionminimumtlsvers tlsv allow access gateway watsonplatform net today see suddenli support tls remov parm excel thank realli great know run test verifi see behavior look remov app transport secur except quick start document ok site grade b yesterday ssllab morn chang miss perfect forward secur need except ah okay know touch watson lab team note requir perfect forward secreci hi team still experi problem team use alchemyapi log enabl ats pleas let know find contact watson lab team want know process issu thank lin zhao hi problem experienc bluemix secur requir add watsonplatform net domain except app transport secur complet step quickstart secur requir inconveni affect actual oper applic reach number folk awar work enhanc secur standard use bluemix hope longer need add except app transport secur near futur sure follow instruct laid quickstart guid bypass app transport secur requir watson platform thank glenn repli realli help best regard hi team updat request file thank hi thank follow issu seem bluemix team upgrad secur standard work tutori app need enter except bluemix domain away offic week write test next week confirm case remov instruct readm quick start guid around app transport secur except great news thank much prompt respons thank confirm app transport secur except longer need commit bbeda bac c aaa f dcd fd remov step document appreci follow,4,33,security|transport|tls|bypass,287,0.11498257839721254,0.3086607754230499
287,https://api.github.com/repos/hkellaway/Gloss/issues/287,pr,add doubl decod,first great librari realli appreci work done use project suggest decod valu return exampl follow model try decod json produc model gloss return object unabl decod valu think due fact recognis valu solut problem ad specif decod allow key decod even underli valu use api send back instead,hi sure notic code review request test need ad pr sorri forgot test add soon possibl back time good complement updat chanc updat includ complement furthermor chang test new decod ad case cast experi write test pleas feel free give feedback need chang accordingli hey guy thank work pr trip issu well idea think pull thank sorri one got away rebas merg manual see releas,2,8,decode|forge,117,0.06837606837606838,0.3053482174873352
4137,https://api.github.com/repos/signalapp/Signal-iOS/issues/4137,pr,add public keyword fix compil framework integr,first time contributor checklist x read document x sign contributor licenc contributor checklist x follow code ui style x commit rebas latest master branch x commit nice logic chunk x contribut fulli bake readi merg test contribut devic integr privat project get compil descript describ briefli pull request propos fix especi one commit help give summari contribut whole tri solv syntax refer specif issu either commit messag pleas describ shortli test fix actual work fix error integr signalservicekit third parti applic sinc swift class function var declar public usag signalservicekit outsid signal ios work signal ios run signalservicekit part ios app therefor class var intern visibl,thank,4,11,public key|integrity|signing|scripting,115,0.09565217391304348,0.30111730098724365
214,https://api.github.com/repos/OAuthSwift/OAuthSwift/issues/214,issue,fix unit test improv trust librari,want librari quit big project effort migrat network stack swift oauth custom build oauth lib written object c sinc oauthswift big essenti part app need high reliabl function qualiti unfortun unit test project current fail comment ignor increas trust librari nice run unit test good coverag automat run pull request e g via travi,yes unit test travi roadmap ask author travi organis owner must accept run unit test sinc previou releas mani chang signatur oauth imo follow task done x fix exist unit test look test comment fix delet setup travi ci repo let check prs test previous untest stuff x multipart request x nsdate categori string categori x util sha hmac access token renew x conveni request method oauthswiftcli unit test ad,6,11,trust|oauth|authorise|signature|sha|hmac,131,0.08396946564885496,0.2999095022678375
1077,https://api.github.com/repos/signalapp/Signal-iOS/issues/1077,pr,problem instal openssl pod fix,exisitng anymor sign work ad last part version signatur remov last part fix problem freebi,problem travi verif modifi commit check help everyth fine close pull request add new make mess git histori,3,3,openssl|signing|signature,39,0.07692307692307693,0.29162171483039856
721,https://api.github.com/repos/apple/swift-package-manager/issues/721,pr,strerror thread safe,see posix target allow use differ function differ thread error report facil thread safe sinc strerror r avail differ signatur depend system necessari implement multipl time,swift ci right wait test merg regard comment libc sure yet whether platform realli signatur strerror r suggest leav compil issu aris signatur signatur seem one check whether result string contain end detect truncat pleas test pleas test build fail pleas test pleas test pleas test oh pleas oh pleas pleas test work,3,7,safe|availability|signature,83,0.08433734939759036,0.2891400158405304
12,https://api.github.com/repos/TakeScoop/SwiftyRSA/issues/12,issue,sha support digest signatur,plan add support sha messag digest signatur,good idea creat pull request add try mean time took long thank featur repositori,2,4,sha|signature,26,0.15384615384615385,0.28741562366485596
1117,https://api.github.com/repos/apollographql/apollo-ios/issues/1117,issue,sqlitenormalizedcach encrypt,got pretti fragil data cach persit via grapqhl sqlitenormalizedcach secur measur sqlitenormalizedcach kind encrypt possibl inject middlewar ecrypt decrypt think integr ios sqlcipher howev find inform handl handl right,anyth provid provid depend look abil integr sinc heard back week function cover go go ahead close pleas let know question thank mess around sqlcipher howev fail integr addit suggest handl exampl valid place encrypt decrypt data unfortun recommend around gener kind secur handl databas level rather deal stuff come databas gone suggest manual everi singl read write transact like break bunch stuff queri watcher work ok trade off strongli recommend find someth level databas handl ok figur sth integr actual possibl requir small depend modif podspec sqlcipher instead pure sqlite think possibl integr painless current apollo sqlite implement one idea introduc addit initi directli db instead filepath public init db connect shouldvacuumonclear bool fals think kind chang possibl prepar podspec sqlitenormalizedcach chang introduc sqliteencryptednormalizedcach implement howev exactli current implement addit line passphras unlock thought thought share pr basic look sqlcipher requir overli complic integr stori realli bandwidth support recommend creat implement use encrypt databas rather tri glue encrypt onto alreadi got,7,23,encrypt|crypt|security|inject|integrity|cipher|validate,194,0.11855670103092783,0.281809002161026
58,https://api.github.com/repos/ipraba/EPSignature/issues/58,issue,limit signatureview draw space,chang size draw space signatur control size signatur drawn,possibl need size want need chang uiview drag drop uiview code custom forget add,2,4,signature|forge,28,0.14285714285714285,0.28027382493019104
37,https://api.github.com/repos/apollographql/apollo-ios/issues/37,issue,provid pattern dynam reconfigur network transport auth header,clear api implement login logout requir us reconfigur header need dynam configur reconfigur client instanc provid differ auth header perhap transport option well,fyi share apollo client instanc time session chang login logout expir etc configur new apollo client replac worth solut brought pretti much well handl queri fail invalid expir token catch complet handler apollo client refresh token request still fail next request go token refresh success prefer deleg method incom url request closur take anoth url request refresh token updat header request call closur authent header request consum apollo client prefer network transport deleg rather mayb authent deleg client current network transport custom point see discuss implement transport implement authent case authent mechan abl handl long term inject mean authent oper sent network transport block outgo oper sent network transport unauthor authent oper sent token etc need refresh option handl unauthor respons either fail authent handl applic thank write case think realiz take effort right probabl think conjunct one idea implement someth akin alamofir fairli low level callback offer quit bit flexibl perform authent plug someth perform exponenti backoff connect failur etc first thought put callback tie everi network transport entir happi provid inform graphql oper want decid authent retri polici pass oper well although requir make method gener associ type mention tie one particular network transport altern consid abstract allow implement use differ network stack main issu seem mean authent actual network transport specif hard gener web socket transport exampl allow perform authent per request basi connect whole work done still allow network oper tie specif network task want introduc subclass point wonder somehow take advantag oper depend simplifi think compar network stack current use wow know alamofir exactli want authent process work whether put network client realli matter pro con use alway sound promis first often felt complic wrap oper sinc use oper queue hood anyway felt duplic overcompl thing depend limit number concurr oper huge benefit use oper gener think make sens gener callback base authent retri polici base queri oper better solut found add anoth initi inject instead configur one handl authent challeng url session deleg method updat hey sorri preoccupi new store cach api taken much longer expect land better posit redesign network layer think websocket transport subscript cool stick fork nice work store cach hi bump person think networktransport protocol give enough customis opportun without make apollo opinion handl request exampl use alamofir sessionmanag control sessionmanag add requestadapt requestretri background session etc etc hi good work sqllite persist use beta need network layer custom updat auth header think avail network layer alreadi customiz provid implement see code exampl still spend time make auth easier box howev hope next week thank repli tri code got crash investig look forward box solut hi enhanc avail releas saw thread anyon chanc work quit import updat folk hi solut base origin httpnetworktransport form apollo make custom httpnetworktransport dynam custom header need add header line base local set author header client creation origin share apollocli instanc request share singl instanc request ad dynam header perform request client share case realli love see support use oauth author via network request sent server token need refresh asynchron oper apollo need ask app addit header asynchron oper exampl apollo pass complet block app call token refresh pass addit header paramet complet block right use modifi version need wrap apollo call token refresh pass apollo good solut play around implement allow deleg asynchron modifi request sent biggest issu almost everi function return need instead return likewis instanc variabl need chang accordingli sure accept thought came design need make pull request coupl day great sorri realli busi graphql summit go middlewar pattern apollo link use solv yes think make sens want take stab design discuss time think sinc last convers much time right either afraid work around particular problem right use case need manual insert authent per request look apollo think context pass middlewar concept work ios client awar apollo link briefli look sure understand benefit design yet submit pull request propos solv issu meantim alamofir librari app mind depend publish packag solv problem need chang authent header chang properti instanc newtoken headersnetworktransportnetworktransportgraphql communityalamofirensurlsessionhttpnetworktransportretrydelegategraphqlresult errorsbodi error bodi error httpnetworktransportretrydelegatehandleerrororretri method hit retrier exist retrier determin retri done actual return origin error,11,59,transport|login|validate|delegation|authentication|inject|authorise|signing|scripting|availability|oauth,718,0.08217270194986072,0.28023335337638855
174,https://api.github.com/repos/OAuthSwift/OAuthSwift/issues/174,issue,incorrect signatur paramet includ,use aweb public api discov pass paramet oauthswift request includ brace actual encod thu signatur properli creat server attempt verifi signatur base encod valu brace thu match client provid creat fix let know think,exact duplic introduc bracket chang one pr fix bug oop bad total miss matter one merg long one close mine need chang avail via cocoapod asap thank see anyth relat brace fix comment alreadi close pr keep issu open know project owner merg cocoapod local repo chang someth point podspec remot one repo ok thank news merg troubl bracket well reason yet merg fix signatur pr one issu comment enough unit test prevent regress signatur littl scare p one oauth provid work differ other instanc help welcom pr must fix one,4,10,signature|oauth|encode|availability,130,0.07692307692307693,0.2766960859298706
920,https://api.github.com/repos/stephencelis/SQLite.swift/issues/920,issue,unsaferawbufferpoint convert unsafepoint,use integr report error xcode swift tri pod version issu still exist want updat xcode yet due sdk use project,hello downgrad xcode well face problem instal sqlite manual download version copi xcproject project said readm work hope help question hehe issu seem mark swift requir swift support seem possibl replac implement follow possibl solut continu support version unclear safe chang actual make chang chang swift version test seem pass xcode least try add code podfil,3,6,unsafe|safe|integrity,80,0.075,0.27367138862609863
153,https://api.github.com/repos/facebookarchive/facebook-swift-sdk/issues/153,issue,unresolv loginmanag,hi im work facebook sdk swift frist int pod target procio pod moca pod toast swift pod amtooltip pod firebas pod firebas core pod firebas auth pod firebas databas pod facebookcor pod facebooklogin framework end second header import import third appdeleg final app show unresolv identifi loginmanag,still face issu yeah resolv clean pod updat remov work issu idea let loginmanag fbsdkloginmanag issu idea resolv issu loginmanag sdkapplicationdeleg accesstoken everyth work fine pod updat got facebookcor facebooklogin v error appear decid rollback previou version fix pleas comment decis close issu,2,9,login|delegation,93,0.0967741935483871,0.2730138599872589
336,https://api.github.com/repos/hkellaway/Gloss/issues/336,issue,decod anonym valu,hi know call issu sorri problem decod struct mytest json model inde type mytest test string string mytest decod work type mytest test string string anyobject decod work fine write code data someth want idea realli realli realli appreci regard alexandr,type gloss handl automat includ imagin ton variant gloss minimum typic one want stay semant pattern gloss consid ad decod encod special valu new oper definit even necessari model consist usag oper thank answer mind give sampl code pleas regard alexandr psuedocod know work place start tri,2,6,decode|encode,92,0.06521739130434782,0.26894035935401917
338,https://api.github.com/repos/SwifterSwift/SwifterSwift/issues/338,issue,add extens creat md hash string,read understood done best follow contribut open issu expect happen add someth md,that nice extens pleas submit pull request make sure review merg soon found stackoverflow suggest think swifterswift littl limit come extens accept project think avoid ad cryptographi extens healthi limit agre let cryptographi thank bring tabl think swifterswift good fit cryptographi extens moment take care,2,4,hash|crypt,65,0.06153846153846154,0.2666456997394562
2166,https://api.github.com/repos/vapor/vapor/issues/2166,pr,migrat crypto librari swift crypto,migrat vapor opencrypto librari appl new swift crypto librari reduc burden vapor maintain crypto librari complet remov openssl depend downsid vapor requir maco tradeoff worth,one altern approach make opencrypto fallback support platform leav openssl escap hatch open maco issu still end maintain crypto librari one realli want one realli want upgrad either nice work requir big deal sinc alway latest os version ultim need make call sinc one maintain open crypto forum post remov support chang avail,4,11,crypt|encrypt|openssl|availability,84,0.13095238095238096,0.26565489172935486
1321,https://api.github.com/repos/Alamofire/Alamofire/issues/1321,issue,oauth signatur,creat hmac sh signatur add request url header alamofir thank,question best suit stackoverflow creat question tag whole commun take look gener though add header use function see,3,4,oauth|signature|hmac,31,0.12903225806451613,0.2646246552467346
235,https://api.github.com/repos/pkluz/PKHUD/issues/235,pr,switch podspec resourc bundl asset catalog,cocoapod integr asset catalog pod resourc bundl app current slightli broken unnecessarili increas build time cocoapod essenti recompil app main asset catalog includ asset catalog pod process reliabl done everi build even noth chang pr switch pkhud use resourc bundl instead test chang demo project carthag cocoapod use dynam static framework find issu,,2,5,asset|integrity,60,0.08333333333333333,0.26293089985847473
97,https://api.github.com/repos/TakeScoop/SwiftyRSA/issues/97,issue,app store ecrypt,first thank alot great librari made app use librari want know whether option select question ask secur whether select yes,nal short depend case swiftyrsa rsa encrypt whether need ern depend encrypt suggest read itun connect faq info applic exempt swiftyrsa maintain abl give advic answer question let us know need anyth els,4,7,crypt|security|rsa|encrypt,57,0.12280701754385964,0.26047903299331665
110,https://api.github.com/repos/daltoniam/Starscream/issues/110,pr,properti enabl certain cipher suit wss connect,option enabl certain cipher suit improv secur wss connect ad enabledsslciphersuit properti array sslciphersuit disabl simpli nil select cipher suit must valid platform error occur enabl cipher suit stream fail connect,cool thank pr three thing remov statement call know secur stuff line think unnecessari remov return failur case probabl want start runloop part connect properli anyway thank question pleas let know yes sure updat pr chang sound reason chang probabl make one set tls protocol pr come later correct code respect review comment pleas review look good thank,4,10,cipher|security|validate|tls,97,0.10309278350515463,0.25997602939605713
708,https://api.github.com/repos/daltoniam/Starscream/issues/708,issue,sha replac sha sha,found function use websocket exploit secur manner plan replac crypto method sha sha,sha defin rfc cannot swap sha standard chang thank,4,10,sha|exploit|security|crypt,27,0.37037037037037035,0.25659385323524475
922,https://api.github.com/repos/raywenderlich/swift-algorithm-club/issues/922,pr,updat depric hashabl valu hash method,checklist x look contribut x pull request complet readi review descript pr resolv updat structur mani instanc warn need address believ updat case case basi help keep pr small concis possibl chang vetex edg,thank updat look good,2,3,hash|scripting,45,0.06666666666666667,0.2565688192844391
390,https://api.github.com/repos/OAuthSwift/OAuthSwift/issues/390,pr,refactor auth swift credenti,refactor oauthswiftcredenti flexibl extend underli implement chang use protocol base approach base class implement common function concret subclass specif credenti approach allow easi adjust enhanc lay ground rsa support follow next pr oauthswiftcredenti broken protocol oauthswiftcredenti oauthswiftsignaturemethod oauthswiftvers base class respect implement common aspect protocol concret class oauth oauth hmac sha implement specif part next pr add rsa sha signaturemethod extend function,thank contribut support rsa sha welcom think chang need mayb miss someth sign rsa sha messag data encod look final code mayb understand uncom case call code insid enum encod ok close pr open new pr instead one refactor includ full code rsa support jira exampl side note still believ refactor new design make much sens term flexibl encapsul recogn break current api still urg consid happi help work deprec strategi former java developp agre interfac protocol flexibl swift developp prefer clean swift featur featur imposs implement clean swift version api break realli need protocol heart swift consid clean swift featur possibl agre swift good opportun api break chang ping nbaronwhen chanc love chat question,8,28,credential|oauth|rsa|signing|signature|hmac|sha|encode,182,0.15384615384615385,0.2562839090824127
145,https://api.github.com/repos/zvonicek/ImageSlideshow/issues/145,issue,open access control uiscrollviewdeleg method,want subclass make minor view modif anim particular overwrit order make anim slideshow stop given imag current class implement follow three method implement done access control prevent overrid subclass propos chang three method implement access control level instead,hi thank issu pull request seem reason merg master,2,4,access control|delegation,53,0.07547169811320754,0.25580474734306335
7,https://api.github.com/repos/honghaoz/Ji/issues/7,issue,code sign error code sign ident found valid sign ident e certif privat key pair match team id null found codesign error code sign requir product type framework sdk ios,idea,hi project tri compil code sign error relat project relat xcode set think tri deploy devic right simpli run xcode simul forgot mention got error try instal ji carthag frame work fine hi try see whether work everyth good merg mean cartfil still result send build log follow consol log pleas past log file see problem behind try got know carthag need ios develop code sign setup correctli project work comput exampl try oh fail buid swiftjson carthag realli new develop ios idea solv choos tool instead carthag fail tool know succeed found one relat articl search ios code sign googl good luck sent mailbox sun sep pm pezhin notificationswrot oh fail buid swiftjson carthag realli new develop ios idea solv repli email directli view github,5,12,signing|validate|certificate|private key|forge,158,0.0759493670886076,0.25482988357543945
